name,institution,publish_date,doi,cite,abstract,introduction,Title,Url,Time,Year,Type,Unnamed: 0
"Burro Giovanni,Castagnetti Alessandro","Bocconi University Department of Finance IGIER BIDSA, Italy,University of Warwick, United Kingdom","Received 9 August 2021, Revised 2 June 2022, Accepted 19 July 2022, Available online 25 July 2022, Version of Record 3 August 2022.",https://doi.org/10.1016/j.socec.2022.101920,Cited by (0),"We investigate whether individuals’ deception rates differ by whether the messages they send to others are about the latter’s relative ability or not. We also study whether they are more likely to deceive when it is in their interest to make others believe that they are either of high ability or low ability. In the experiment, participants play a sender–receiver game. The experiment features a 2 × 2 factorial design. First, we vary whether the state is determined by the receiver’s relative performance in an IQ test or it is about a randomly drawn number. Second, monetary incentives, which are common knowledge, are such that the sender is better off (worse off) when the receiver’s action is about him being of high (low) relative ability, while the receiver benefits from selecting the action that matches his true ability. We do not find systematic differences in the deception rates due to the ego-relevance of the condition. However, we find that senders believe they are more likely to move the beliefs of the receivers when they send a deceiving message saying that the receiver is of high ability.",None,Will I tell you that you are smart (dumb)? Deceiving Others about their IQ or about a Random Draw,https://www.sciencedirect.com/science/article/pii/S2214804322000921,25 July 2022,2022,Research Article,65.0
"Cornée Simon,Masclet David","CREM (CNRS University Rennes 1) and CERMi, Faculté des Sciences Economiques, 7 place Hoche, Rennes 35065, France,CREM (CNRS University Rennes 1) and CIRANO (Montreal), 7 place Hoche, Rennes 35065, France","Received 9 November 2021, Revised 1 July 2022, Accepted 22 July 2022, Available online 24 July 2022, Version of Record 29 July 2022.",https://doi.org/10.1016/j.socec.2022.101921,Cited by (1),"Microfinance is generally associated with high repayment rates. However, it is not clear what drives such high repayment rates? Does the success of microfinance results only from the use of group lending, peer sanctioning or long-term relationships that typically characterize microfinance contracts? In this paper, we aim to contribute to the existing literature by using a laboratory experiment to disentangle the effect of these different potential mechanisms. Our experiment involves both students and real bankers in the role of lenders. We find that group lending alone, in absence of peer sanctioning mechanisms induces free riding and is not sufficient to mitigate the problems of ==== and ==== moral hazard. In sharp contrast, we find that individualized long-term relationships perform significantly better than either form of group lending with or without peer sanctioning. Consequently, borrowers’ final payoffs are lower in the group lending schemes than in the individual lending scheme due to the fact that borrowers receive on average fewer loans from lenders in the group lending schemes. Our study also sheds light on the social cost of peer pressure mechanisms.",None,"Long-term relationships, group lending, and peer monitoring in microfinance: Experimental evidence",https://www.sciencedirect.com/science/article/pii/S2214804322000933,24 July 2022,2022,Research Article,66.0
"Shichman Ruslan,Weiss Avi","Earnix, Givatayim, Israel,Department of Economics, Bar-Ilan University, Ramat-Gan 52900, Israel, Taub Center for Social Policy Studies in Israel, IZA","Received 25 April 2021, Revised 14 July 2022, Accepted 15 July 2022, Available online 22 July 2022, Version of Record 25 July 2022.",https://doi.org/10.1016/j.socec.2022.101918,Cited by (0),"Two prevailing theories exist to explain why people engage in costly punishment in one-shot interactions when they cannot expect to gain from the punishment or to affect future behavior: to achieve balance or to send a message. In this paper we constructed new versions of the Dictator, Public Good, and Power-to-Take games, designed specifically to allow us to differentiate between these explanations. The results lend some support to each of the hypotheses; on the one hand, subjects punish even when the punisher knows that the offender will never learn that he was punished, and, on the other hand, there is more punishment when the punisher knows that the offender will be informed that he is being punished than when the punisher knows that the offender will remain oblivious to the punishment. Thus, punishers seek both ""retributive justice"" and to ""send a message"" to the offending party.",None,Sending a message or seeking retributive justice? An experimental investigation of why people punish,https://www.sciencedirect.com/science/article/pii/S221480432200091X,22 July 2022,2022,Research Article,67.0
Mograbi Eli,"Coller School of Management, Tel Aviv University, Sderot Henry Gildred, Tel Aviv-Yafo, Israel","Received 6 October 2021, Revised 2 July 2022, Accepted 5 July 2022, Available online 8 July 2022, Version of Record 6 August 2022.",https://doi.org/10.1016/j.socec.2022.101916,Cited by (0),"As the use of smartphones becomes increasingly pervasive, the question arises as to whether the smartphone platform induces different choices than the computer platform. An incentivized-choice lab experiment is carried out to examine the effect of the smartphone environment on intertemporal decision-making and risky choices. In addition, a novel approach is introduced in order to study costly information search. While no significant differences are found between the platforms in the case of risky choices, there was significantly more present bias in the case of the smartphone platform than in the case of the computer platform. Furthermore, smartphone users were significantly less willing to invest time in order to obtain information that may increase their payoff. Overall, the findings suggest that decision makers exhibit more impulsive behavior on the smartphone platform relative to the computer platform.",None,Decision-makers are more impulsive on smartphones than on computers,https://www.sciencedirect.com/science/article/pii/S2214804322000891,8 July 2022,2022,Research Article,68.0
"Rieger Marc Oliver,Wang Mei,Huang Po-Kai,Hsu Yuan-Lin","University of Trier, Department IV, Trier 54286, Germany,WHU – Otto Beisheim School of Management, Burgplatz 2, Vallendar, Germany,Department of Finance, Shih Hsin University, Taipei 11645, Taiwan","Received 10 November 2020, Revised 7 June 2022, Accepted 20 June 2022, Available online 25 June 2022, Version of Record 4 July 2022.",https://doi.org/10.1016/j.socec.2022.101912,Cited by (2),"In the past decades, a multitude of behavioral biases with regard to financial decision-making have been found. We show that nine common judgment and decision biases can be reduced to three main latent factors that are related to belief-updating, self-judgment, and valuation. The three-factor solution can be replicated in both Taiwanese and German samples. We find some tentative evidence that cognitive reflection decreases the propensity for belief-updating biases, whereas affect, especially negative affect, increases self-judgment biases.",None,Survey evidence on core factors of behavioral biases,https://www.sciencedirect.com/science/article/pii/S2214804322000866,25 June 2022,2022,Research Article,69.0
"Prissé Benjamin,Jorrat Diego",", Universidad Loyola Andalucía, Calle Escritor Castilla Aguayo, 4, Córdoba 14004, Spain","Received 22 October 2021, Revised 12 June 2022, Accepted 13 June 2022, Available online 19 June 2022, Version of Record 30 June 2022.",https://doi.org/10.1016/j.socec.2022.101910,Cited by (7),"We ran an experiment to study whether not controlling, or the lack of control, of the experimental environment has an effect on experimental results. Subjects were recruited following standard procedures and randomly assigned to complete the experiment online or in the laboratory. The experimental design is otherwise identical between conditions. The results suggest that there are no differences between conditions, except for a larger percentage of online subjects who donate nothing in the Dictator Game.",None,Lab vs online experiments: No differences,https://www.sciencedirect.com/science/article/pii/S2214804322000842,19 June 2022,2022,Research Article,70.0
"Chadimová Kateřina,Cahlíková Jana,Cingl Lubomír","Institute of Economic Studies, Faculty of Social Sciences, Charles University, Opletalova 26, Prague 110 00, Czech Republic,Department of Public Economics, Max Planck Institute for Tax Law and Public Finance, Germany,Department of Economics, Faculty of Economics, University of Economics in Prague, Czech Republic","Received 8 November 2021, Revised 3 May 2022, Accepted 7 June 2022, Available online 15 June 2022, Version of Record 28 June 2022.",https://doi.org/10.1016/j.socec.2022.101902,Cited by (0),"Forecasts of research results can aid evaluation of their novelty and credibility by indicating whether the results should be regarded as surprising, and by helping to mitigate publication bias against null results. Further, surprising differences between predictions and field results might help identify candidates for replication studies, an important task in ensuring research transparency. We run a laboratory experiment in which non-experts forecast the results of two large field experiments on TV license fee collection, to evaluate the degree to which they can successfully predict these results. In our setting, forecasters successfully identified the most effective treatments applying a deterrence motive but struggled to forecast the results of “soft” ==== compared to the baseline. However, they were mostly correct when forecasting same effectiveness of the “soft” treatments compared to each other. Our results suggest that, despite the artificiality of the laboratory environment, forecasts generated there can improve the informativeness and interpretation of research results to some extent.",None,Foretelling what makes people pay: Predicting the results of field experiments on TV fee enforcement,https://www.sciencedirect.com/science/article/pii/S2214804322000763,15 June 2022,2022,Research Article,71.0
"Du Ninghua,Song Fei,Cadsby C. Bram","School of Economics, Shanghai University of Finance and Economics, Shanghai 200433, PR China,Ted Rogers School of Management, Toronto Metropolitan University, 350 Victoria Street, Toronto, ON M5B 2K3, Canada,Department of Economics and Finance, Gordon S. Lang School of Business and Economics, University of Guelph, 50 Stone Road East, Guelph, ON N1G 2W1, Canada","Received 29 June 2021, Revised 3 June 2022, Accepted 13 June 2022, Available online 14 June 2022, Version of Record 18 June 2022.",https://doi.org/10.1016/j.socec.2022.101909,Cited by (0),"People form first impressions of others and may make judgments about their social traits and character on the basis of facial perceptions. We implement a controlled laboratory experiment to investigate whether people can glean information about another person's other-regarding preferences from uncropped photographs of their face. To do so, we conduct a dictator game with an allocator and a recipient, and then present pairs of allocator photos to observers. Each pair portrays one relatively generous allocator and another who has demonstrated less generosity. The experimental results show that the observers cannot accurately recognize more generous allocators, but instead make systematic errors. In particular, the observers believe that allocators who are rated more attractive by others are more generous, despite there being no actual relationship between physical attractiveness and generosity.",None,You cannot judge a book by its cover: Evidence from a laboratory experiment on recognizing generosity from facial information,https://www.sciencedirect.com/science/article/pii/S2214804322000830,14 June 2022,2022,Research Article,72.0
"Kosmopoulou Georgia,Nedelescu Daniel M.","Department of Economics, University of Oklahoma, University of Oklahoma Norman Campus, 308 Cate Center Drive, Room 434, Norman, OK 73072, United States","Received 11 October 2021, Revised 1 June 2022, Accepted 6 June 2022, Available online 14 June 2022, Version of Record 9 July 2022.",https://doi.org/10.1016/j.socec.2022.101901,Cited by (0),"In the arbitration literature there is no common agreement about the nature of the relationship between the size of the contract zone and agreement rates. The results from our experiment show that, when the size of the contract zone increases there are two prevailing effects: one effect is attributed to changes in the range of possible outcomes, and the other to coordination issues. While more room for negotiation leads to higher agreement rates, coordination problems largely impede agreement among rational subjects. The overall effect of an increase in the contract zone depends on the relative magnitude of these opposing effects.",None,The effect of a larger contract zone on agreement rates under arbitration,https://www.sciencedirect.com/science/article/pii/S2214804322000751,14 June 2022,2022,Research Article,73.0
"Boto-García David,Bucciol Alessandro,Manfrè Martina","University of Oviedo, Spain,Department of Economics, University of Verona, Via Cantarane 24, Verona 37129, Italy","Received 3 May 2021, Revised 6 June 2022, Accepted 8 June 2022, Available online 9 June 2022, Version of Record 12 June 2022.",https://doi.org/10.1016/j.socec.2022.101903,Cited by (2),"Using novel US household survey data, we examine the role of financial socialization, meant as the exposure to financial concepts while growing up, and self-control in explaining saving behavior. We pay special attention to the potential existence of gender differences in the influence of parental teachings received early in life and self-control skills on saving habits. In addition, we analyze the relationship between financial socialization, self-control and the ownership of different financial products. Results indicate that financial socialization received early in life and self-control are positively associated with general saving habits. However, their contribution differs depending on the type of financial product being analyzed. Furthermore, the gender gap in saving propensity in the favor of males is mainly due to differences in characteristics rather than differences in coefficients.",None,The role of financial socialization and self-control on saving habits,https://www.sciencedirect.com/science/article/pii/S2214804322000775,9 June 2022,2022,Research Article,74.0
"Appelbaum Elie,Katz Eliakim","Department of Economics, York University, Toronto, ON M3J 1P3, Canada,JK Economics Inc., Toronto, ON, Canada","Received 4 December 2020, Revised 27 May 2022, Accepted 28 May 2022, Available online 1 June 2022, Version of Record 15 June 2022.",https://doi.org/10.1016/j.socec.2022.101899,Cited by (0),"This paper proposes an intuitive, guilt-based dynamic resolution of the prisoners’ dilemma with a finite horizon by viewing cooperation as generating a “stock of potential guilt” (SPG) that actuates upon defection, turning into realized guilt-cost. A player’s SPG is a state variable that increases with each cooperative interaction and moves according to a motion equation, converting the standard prisoners’ dilemma into one with a dynamic payoff matrix. We show that cooperation equilibria are possible for a wide range of parameter values within our guilt-based dynamic model, even if we do not exogenously assume that players necessarily cooperate in the first period of the game. We examine the likelihood of cooperation and find that higher guilt retention or discount factors, a longer time horizon, and greater SPG-responsiveness to cooperation in each period all increase the likelihood of equilibrium cooperation.",None,Bonding by guilt: A resolution of the finite horizon prisoners’ dilemma,https://www.sciencedirect.com/science/article/pii/S2214804322000738,1 June 2022,2022,Research Article,75.0
"Dong Sarah Xue,Sinning Mathias","ANU Crawford School of Public Policy, Australia,ANU Crawford School of Public Policy, RWI, IZA, Australia","Received 20 July 2021, Revised 19 May 2022, Accepted 30 May 2022, Available online 1 June 2022, Version of Record 18 June 2022.",https://doi.org/10.1016/j.socec.2022.101900,Cited by (0),"Very little is known about the compliance behavior of first-time taxpayers although their tax paying habits may affect the long-run functioning of a tax system. This paper studies the compliance behavior of new entrants to the tax system using data from a large-scale natural field experiment that was implemented in collaboration with the Australian Taxation Office (ATO). We examine the effectiveness of a welcome letter from the tax authority that aims to nudge first-time taxpayers to lodge their first income tax return. We compare this letter to a standard letter that emphasizes the possibility of penalties and interest charges. We find that both letters have surprisingly similar effects on tax compliance, suggesting that the main channel through which the letters affect individual behavior is by providing information. By contrast, the type of messaging and the way in which information is presented to first-time taxpayers appear to be relatively unimportant. Our analysis of heterogeneous ==== indicates that both letters are most effective for young entrants to the tax system and, within this group, more effective for Australian citizens than for visa holders.",None,Trying to Make a Good First Impression: A Natural Field Experiment to Engage New Entrants to the Tax System,https://www.sciencedirect.com/science/article/pii/S221480432200074X,1 June 2022,2022,Research Article,76.0
"Isaak Andrew,Schwieren Christiane,Iida Yoshio","Manchot Graduate School WEJU, Faculty of Business Administration and Economics, Heinrich-Heine University of Düsseldorf, Universitätsstr. 1, Düsseldorf 40225, Germany,University of Heidelberg, Alfred Weber Institute for Economics, Bergheimer Str. 58, Heidelberg 69221, Germany,Department of Public Economics, Kyoto Sangyo University, Motoyama, Kamigamo, Kita-ku, Kyoto 603-8555, Japan","Received 29 October 2021, Revised 14 May 2022, Accepted 16 May 2022, Available online 29 May 2022, Version of Record 9 June 2022.",https://doi.org/10.1016/j.socec.2022.101894,Cited by (0),"We discuss the results of an experimental public good game with group representatives in Germany and Japan, societies with varying levels of individualism. Representatives are permitted to communicate with their constituencies, but not with other representatives. We focus on accountability between representative and his constituency and on the risk taken in the interaction between representatives. We find that in Germany, subjects more readily trust a stranger's cooperativeness, groups reach agreement faster and are quicker to discuss and formulate a strategy in pre-play communication vis-a-vis Japanese subjects, where group formation takes longer. Further, we find a stronger end effect in Germany than in Japan, where the period of play explains much less variance in contribution behavior.====Our study contributes to our understanding of intercultural differences in group formation and behavior when small group representatives invest in the public good, with implications for cross-cultural management, negotiation and leadership. Our evidence on between-country differences seems to empirically validate Yuki's (2003) framework for group behavior. We hope that our findings will stimulate further enquiry into human group behavior from a cross-cultural perspective.",None,Reaching agreement on contribution behavior in different cultures-a public goods game with representatives in Japan and Germany,https://www.sciencedirect.com/science/article/pii/S2214804322000684,29 May 2022,2022,Research Article,77.0
"Chugunova Marina,Sele Daniela","Max Planck Institute for Innovation and Competition, Munich 80539, Germany,Center for Law & Economics, ETH Zurich, Zurich 8092, Switzerland","Received 9 August 2021, Revised 16 May 2022, Accepted 19 May 2022, Available online 21 May 2022, Version of Record 25 May 2022.",https://doi.org/10.1016/j.socec.2022.101897,Cited by (2),"Today, humans interact with automation frequently and in a variety of settings ranging from private to professional. Their behavior in these interactions has attracted considerable research interest across several fields, with sometimes little exchange among them and seemingly inconsistent findings. In this article, we review 138 experimental studies on how people interact with automated agents, that can assume different roles. We synthesize the evidence, suggest ways to reconcile inconsistencies between studies and disciplines, and discuss organizational and societal implications. The reviewed studies show that people react to automated agents differently than they do to humans: In general, they behave more rationally, and seem less prone to emotional and social responses, though this may be mediated by the agents’ design. Task context, performance expectations and the distribution of decision authority between humans and automated agents are all factors that systematically impact the willingness to accept automated agents in decision-making - that is, humans seem willing to (over-)rely on algorithmic support, yet averse to fully ceding their decision authority. The impact of these behavioral regularities for the deliberation of the benefits and risks of automation in organizations and society is discussed.",None,We and It: An interdisciplinary review of the experimental evidence on how humans interact with machines,https://www.sciencedirect.com/science/article/pii/S2214804322000714,21 May 2022,2022,Research Article,78.0
"Klein Miriam,Wiens Marcus,Schultmann Frank","French-German Institute for Environmental Research (DFIU), Karlsruhe Institute of Technology, Hertzstr. 16, 76187 Karlsruhe, Germany,Chair for Innovation and Risk Management, Faculty for Business and Economics, Technical University Bergakademie Freiberg, Schlossplatz 1, 09599 Freiberg, Germany","Received 29 July 2021, Revised 4 April 2022, Accepted 19 May 2022, Available online 20 May 2022, Version of Record 9 June 2022.",https://doi.org/10.1016/j.socec.2022.101898,Cited by (0),"Border regions between different countries are of special interest in studying international relationships, which is a current topic in today’s globalized and interconnected world. To strengthen their disaster resilience, it is important for local decision-makers to understand the spontaneous willingness of the population to help affected people in their region. This article presents a novel framework based on ==== and Weiners’ Motivational Theory of Mutual Help to quantify peoples’ willingness to help (WTH) surveyed for the hypothetical case of a natural disaster. We compared the potential helping behavior between neighbored regions and neighbored countries in France and Germany, and also in the border area between the two countries. We found a significant correlation between trust and WTH in a neighboring region and identified determinants of WTH in a neighboring country. Implications for today’s world in terms of globalization and disaster response as the Covid-19 pandemic are discussed.",None,"Borderland resilience, willingness to help and trust–An empirical study of the French-German border area",https://www.sciencedirect.com/science/article/pii/S2214804322000726,20 May 2022,2022,Research Article,79.0
Nguyen Cuong Viet,"International School, Vietnam National University, Hanoi, Vietnam,Thang Long Institute of Mathematics and Applied Sciences (TIMAS), Thang Long University, Hanoi, Vietnam","Received 6 August 2021, Revised 3 May 2022, Accepted 5 May 2022, Available online 7 May 2022, Version of Record 23 May 2022.",https://doi.org/10.1016/j.socec.2022.101886,Cited by (0),"We designed dictator and ultimatum games, in which students shared not only money but also bonus points of a course in a university in Vietnam. Students attended experiments and were told that additional bonus points of a course were used as the endowment in the game. We find that dictators were generous in money games but remarkably more selfish in score games. However, dictators still expressed ==== and fairness in the score games. Students with a high score were more likely to share bonus points, especially for recipients with a lower score. In ultimatum games, responders were considerably more willing to accept a small number of offered points rather than a small amount of offered money. Behavior of the responder is not correlated with their score.",None,Money vs Score: Evidences of payoff stakes in the dictator and ultimatum games,https://www.sciencedirect.com/science/article/pii/S221480432200060X,7 May 2022,2022,Research Article,80.0
