name,institution,publish_date,doi,cite,abstract,introduction,Title,Url,Time,Year,Type,Unnamed: 0
Tran Dai Binh,"Faculty of Economics and Management, Vietnamese-German University, Thu Dau Mot City, Binh Duong Province, Vietnam","Received 11 November 2019, Revised 2 September 2021, Accepted 3 September 2021, Available online 9 September 2021, Version of Record 29 September 2021.",https://doi.org/10.1016/j.socec.2021.101771,Cited by (3),"This paper investigates the relationship between locus of control and job satisfaction and its domains, using the Household, Income and Labor Dynamics in Australia (HILDA) Survey. Using fixed effects (FE) panel data estimation to control for unobserved individual characteristics, the results first show that internal locus of control is associated with a higher level of overall job satisfaction and other aspects of satisfaction at the workplace. Moreover, the study examines whether perceptions of one's job mediate the association between locus of control and job satisfaction. The findings indicate that internal locus of control correlates with more positive perceptions of aspects of their job, such as a higher level of job security and less stress-related illness, improving job satisfaction. Therefore, this research highlights the role of locus of control in promoting higher job satisfaction, underlining that personality characteristics are a potential asset in the workplace.",None,Locus of Control and Job Satisfaction in Australia: The Mediating Role of Job Perception,https://www.sciencedirect.com/science/article/pii/S2214804321001117,9 September 2021,2021,Research Article,157.0
Hwang In Do,"Economic Research Institute, Bank of Korea, Sogong Annex, 55 Namdaemunno Jung-Gu, Seoul 04531, South Korea","Received 9 March 2021, Revised 24 August 2021, Accepted 31 August 2021, Available online 4 September 2021, Version of Record 13 September 2021.",https://doi.org/10.1016/j.socec.2021.101764,Cited by (5),"This paper empirically tests if prospect theory's loss aversion can explain an individual's real-world insurance take-up behavior. Using American Life Panel data, this paper shows that loss-averse individuals have a significantly lower ownership rate of private long-term care insurance and supplemental disability insurance than other sample populations==== The results are consistent with the prospect theory, which predicts that loss-aversion may decrease insurance demand if an individual's reference points are “the status quo wealth level when they do not engage in insurance contracts.” This paper also provides suggestive evidence that reference points are important in determining the relationship between loss-aversion and insurance ownership by showing that the negative association is not observed in the take-up of auto insurance, which is one of the most widely held insurance products and often regarded as a basic necessity.",None,Prospect theory and insurance demand: Empirical evidence on the role of loss aversion,https://www.sciencedirect.com/science/article/pii/S221480432100104X,4 September 2021,2021,Research Article,158.0
"Swee Eik Leong,Zhan Haikun,Powdthavee Nattavudh","Department of Economics, University of Melbourne, Australia,Warwick Business School","Received 17 December 2020, Revised 30 August 2021, Accepted 1 September 2021, Available online 3 September 2021, Version of Record 9 September 2021.",https://doi.org/10.1016/j.socec.2021.101765,Cited by (1),"While material deprivation is an important determinant of civil conflict, psychological factors can also explain the incentives for warfare. This paper considers whether and to what extent civilian perception of individual economic well-being, possibly influenced by hearts-and-minds tactics that are employed by insurgents, predicts war and peace onset. Using unique micro data bracketing the onset of the Nepalese Civil War, we find that perceived income inadequacy is associated with earlier war onset during periods of rebel recruitment, and with later peace onset in general. These results are mainly driven by the effect of perceived deprivation among marginalised communities on rebel-initiated violence, and hold regardless of whether we account for actual economic circumstance. Our results suggest that civilian perception of economic well-being ought to be considered seriously as a determinant of war and peace.",None,Do perceptions of economic well-being predict the onset of war and peace?,https://www.sciencedirect.com/science/article/pii/S2214804321001051,3 September 2021,2021,Research Article,159.0
"McKinney C. Nicholas,Van Huyck John B.","Robert D. McCallum Distinguished Professor of Economics, Rhodes College, Department of Economics, Memphis, TN 38112,Former Rex B Grey Professor of Economics, Texas A&M university","Received 9 September 2020, Revised 25 August 2021, Accepted 27 August 2021, Available online 29 August 2021, Version of Record 8 September 2021.",https://doi.org/10.1016/j.socec.2021.101763,Cited by (0),"When learning to play a game well, does it help to play against an opponent who makes the same sort of mistakes one tends to make or is it better to play against a procedurally rational algorithm, which never makes mistakes? This paper investigates subject performance in the game of Nim. We find evidence that subject performance improves more when playing against a human opponent than against a procedurally rational algorithm. We also find that subjects learn to recognize certain heuristics that improve their overall performance in more complex games.",None,Does Playing Against An Error Prone Opponent Influence Learning in Nim?,https://www.sciencedirect.com/science/article/pii/S2214804321001038,29 August 2021,2021,Research Article,160.0
Santoro Fabrizio,"Institute of Development Studies and International Centre for Tax and Development, University of Sussex, Library Road, Brighton BN1 9RE, UK","Received 12 February 2021, Revised 17 August 2021, Accepted 25 August 2021, Available online 27 August 2021, Version of Record 6 September 2021.",https://doi.org/10.1016/j.socec.2021.101760,Cited by (6),"Non-filing, the failure to submit a tax declaration, is a widespread phenomenon in sub-Saharan Africa and produces detrimental fiscal effects, from impaired revenue mobilisation to ",None,To file or not to file? Another dimension of tax compliance - the Eswatini Taxpayers’ survey,https://www.sciencedirect.com/science/article/pii/S2214804321001002,27 August 2021,2021,Research Article,161.0
"Bezalel Jonathan,Mugerman Yevgeny,Winter Eyal","School of Business, University of Leicester and The Hebrew University of Jerusalem,Graduate School of Business Administration, Bar-Ilan University,Department of Economics, Lancaster University","Received 31 January 2021, Revised 2 July 2021, Accepted 11 August 2021, Available online 19 August 2021, Version of Record 25 August 2021.",https://doi.org/10.1016/j.socec.2021.101757,Cited by (3),"This study utilizes the crowdfunding setting, and examines gender differences with regard to the perceived meaning of donations. The crowdfunding mechanism creates a singular reciprocal interaction where motivations can be examined and compared. We show that women's perceived meaning is more sensitive to the existence of gift rewards than that of men. When the gift incentive is nonexistent, women attribute a greater sense of meaning to their contribution, whereas this effect is largely absent or even reversed in men. Our findings have far-reaching implications in all aspects of donor retention strategies. Specifically, our findings indicate that women are more aligned with the Kantian doctrine of rejecting self-interest considerations of altruistic behavior than men.",None,Meaning and gender differences,https://www.sciencedirect.com/science/article/pii/S2214804321000975,19 August 2021,2021,Research Article,162.0
"Blacklow Paul,Corman Amy Beth,Sibly Hugh","Tasmanian School of Business and Economics, University of Tasmania, Hobart 7000 TAS Australia,Department of Economics, University of Melbourne, Parkville 3010 VIC Australia,Tasmanian School of Business and Economics, University of Tasmania, Hobart 7000 TAS Australia","Received 17 October 2019, Revised 11 August 2021, Accepted 12 August 2021, Available online 14 August 2021, Version of Record 25 August 2021.",https://doi.org/10.1016/j.socec.2021.101759,Cited by (0),"We use a laboratory experiment to identify some determinants of variation across individuals in the demand and supply of esteem. Some participants can choose, at a cost, buy ‘credits’ so as to appear to others to have a better performance on a real effort task than they really do: this purchase reflects esteem seeking. The provision of esteem, via a partner's feedback on performance, is also recorded. We find: (i) those with a low willingness to supply effort have a lower probability of purchasing credits, (ii) participants matched with low scoring partners buy more credits (iii) feedback is improved for those purchasing credits.",None,The Demand and Supply of Esteem: An experimental analysis,https://www.sciencedirect.com/science/article/pii/S2214804321000999,14 August 2021,2021,Research Article,163.0
"Bucciol Alessandro,Zarri Luca",University of Verona,"Received 25 January 2021, Revised 7 August 2021, Accepted 11 August 2021, Available online 14 August 2021, Version of Record 6 September 2021.",https://doi.org/10.1016/j.socec.2021.101758,Cited by (0),"Even though a large experimental literature explored the links between personality and honesty, available evidence is inconclusive. In this study, we provide large-scale evidence on the influence of the “Big Five” personality traits on civic honesty, by also considering the roles played by individuals’ socioeconomic status and the gender dimension. To this aim, we rely on survey data from the Health and Retirement Study (HRS), which is representative of the US population aged 50 or more. We show that most “Big Five” traits significantly affect civic honesty, with Agreeableness being the strongest predictor. We view our findings as complementing and extending to civic-minded behavior the results of prior work on cheating based on small samples and non-representative subject pools.",None,The Non-Cognitive Roots of Civic Honesty: Evidence from the US,https://www.sciencedirect.com/science/article/pii/S2214804321000987,14 August 2021,2021,Research Article,164.0
"Fraser Iain,Balcombe Kelvin,Williams Louis,McSorley Eugene","University of Kent, UK","Received 1 December 2020, Revised 28 July 2021, Accepted 29 July 2021, Available online 11 August 2021, Version of Record 13 August 2021.",https://doi.org/10.1016/j.socec.2021.101753,Cited by (3),"We investigate the relationship between the extent of visual attention and preference stability in a discrete choice experiment using eye-tracking to investigate country of origin information for meat in the UK. By preference stability, we mean the extent to which choice task responses differ for an identical set of tasks for an individual. Our results reveal that the degree of visual attention, counter to our initial expectations, is positively related to the degree of preference instability. This means that preference instability does not necessarily indicate low levels of respondent engagement. We also find that those respondents’ exhibiting preference instability do not substantively differ from the rest of the sample in terms of their underlying preferences. Rather, these respondents spend longer looking at tasks that are similar in terms of utility, suggesting these respondents find these choices more difficult.",None,Preference stability in discrete choice experiments. Some evidence using eye-tracking,https://www.sciencedirect.com/science/article/pii/S2214804321000938,11 August 2021,2021,Research Article,165.0
"Lohse Tim,Simon Sven A.","Berlin School of Economics and Law, Badensche Straße 52, Berlin 10825, Germany,Max Planck Institute for Tax Law and Public Finance, Marstallplatz 1, Munich 80539, Germany,CESifo, Munich, Germany","Received 15 June 2020, Revised 25 June 2021, Accepted 30 June 2021, Available online 8 August 2021, Version of Record 26 August 2021.",https://doi.org/10.1016/j.socec.2021.101745,Cited by (5),"Are teams more prone toward non-compliance with laws and regulations than single individuals? We investigate into two key determinants of teams’ compliance behavior: Deciding jointly as a dyad, which allows deferring one’s own moral responsibility onto the team partner, from sharing the liability for gains and losses of collusive behavior. In our laboratory tax compliance experiment, teams are substantially less compliant than individuals are. Shared, as opposed to individual, liability leads to a large drop in compliance. In contrast, whether subjects make their decisions alone or together does hardly influence the overall compliance rate. When coordinating their compliance decision teams predominately discuss the risk of being caught in an audit but hardly moral concerns.",None,Compliance in teams – Implications of joint decisions and shared consequences,https://www.sciencedirect.com/science/article/pii/S2214804321000859,8 August 2021,2021,Research Article,166.0
"Hurwitz Abigail,Lahav Eyal,Mugerman Yevgeny","Environmental Economics and Management, Robert H. Smith Faculty of Agriculture, Food and Environment, The Hebrew University of Jerusalem Israel,Department of Management and Economics, the Open University of Israel, 1 University Road Raanana, Israel,Graduate School of Business Administration, Bar-Ilan University, Ramat-Gan 52100, Israel","Received 11 April 2021, Revised 3 August 2021, Accepted 6 August 2021, Available online 8 August 2021, Version of Record 18 August 2021.",https://doi.org/10.1016/j.socec.2021.101756,Cited by (5),"Past research has demonstrated that many individuals are not well equipped to make financial decisions and hence depend greatly on the flow and quality of financial information. Various governments are implementing reforms aimed at improving the quality of pension financial communication. Certain countries are requiring a move to short-form pension reporting, and some are requiring digital reporting instead of (or in some cases, in addition to) paper reporting. In a series of experiments, we show that the ability to locate information in financial reports is sensitive to the length of the report and to the communication form.",None,“Financial less is more”: An experimental study of financial communication,https://www.sciencedirect.com/science/article/pii/S2214804321000963,8 August 2021,2021,Research Article,167.0
"Koutout Kristine,Dustan Andrew,Van der Linden Martin,Wooders Myrna","Stanford University, Graduate School of Business, 655 Knight Way, Stanford, CA 94305, United States,Department of Economics, Vanderbilt University, 2201 West End Avenue, Nashville, Tennessee, United States,Department of Quantitative Theory and Methods, Emory University, 36 Eagle Row, 5th Floor, Atlanta, Georgia","Received 6 November 2020, Revised 1 August 2021, Accepted 4 August 2021, Available online 5 August 2021, Version of Record 20 August 2021.",https://doi.org/10.1016/j.socec.2021.101755,Cited by (0),"We implement a laboratory experiment to study how strategy advice affects participant decisions in a school choice game. In the Deferred Acceptance (DA) mechanism, advice to choose the dominant strategy of truth-telling induces participants to do so. In the Immediate Acceptance (IA) mechanism, advice to implement one of two heuristic strategies induces participants to choose one of those strategies. We develop a new partially-ordered typology of DA strategies to study the sub-optimal strategies chosen by participants under advice versus no advice. Then, using the varying proportions of participants choosing sub-optimal strategies in our data, we perform exploratory analyses on mechanism performance. We find that DA outperforms IA in efficiency, stability, and proportion of participants assigned their most preferred school. These performance differences are larger under strategy advice. (school choice, experiment, strategy advice, mechanism design, sub-optimal play)",None,Mechanism performance under strategy advice and sub-optimal play: A school choice experiment,https://www.sciencedirect.com/science/article/pii/S2214804321000951,5 August 2021,2021,Research Article,168.0
"Chhatwani Malvika,Mishra Sushanta Kumar","Jindal School of Banking & Finance, OP Jindal Global University, Sonepat-131001, Haryana, India,Indian Institute of Management Indore, Indore-453556, Madhya Pradesh, India","Received 1 November 2020, Revised 16 July 2021, Accepted 19 July 2021, Available online 25 July 2021, Version of Record 1 August 2021.",https://doi.org/10.1016/j.socec.2021.101751,Cited by (8),. The findings of the study provide implications to increase financial optimism during the pandemic.,"The COVID-19 pandemic has shaken the global economy. Unemployment in America peaked at 15% in 2020, and there are around 14 million unemployed individuals as of August 2020 (====). The US GDP has declined by 5% during the first quarter of 2020 (====). The pandemic has caused a substantial economic crisis; there is uncertainty about when the crisis would end though vaccines are now available (====). Further, all individuals are not equally affected by the pandemic. Low-income individuals have faced severe adverse consequences, whereas the well-to-do individuals have benefitted from this crisis. However, overall negative sentiment and the economic crisis due to the pandemic are likely to reduce peoples’ optimistic future expectations (====; ====). According to the Michigan Consumer Sentiment index, a delay in expenditure occurs when at the same time individuals’ pessimistic view dominates their optimism about the economic prospects (====). Hence, restricting the decline in optimism has substantial implications for both individuals and society. Financial optimism is different from trait optimism (a generalized view of life) and focuses on a specific situation, which is the financial situation in the present study (====). Optimists put higher weights on desirable outcomes and least weight on unwanted results. Financial optimism helps prepare for the desirable distant future and motivates to act favourably for one's future financial self (Puri and Robinson, 2007). Financial optimism drives household consumption, saving, and investment decisions and helps one achieve financial well-being (====). Hence, financial optimism plays an essential role in economic recovery caused due to the pandemic.====The economic fallout has severely affected the financial conditions of individuals. People are more financially vulnerable (====), less tolerant of financial risk (====), and unprepared to withstand financial shocks (====). As a result, individuals may become financially fragile and not have an ability to meet heavy future expenses (====). Financially fragile individuals are less resilient in the present economic crisis (====). During financial difficulties, financially fragile people are more likely to indulge in ruminating about the misfortune to explain bad experiences and build negative future expectations (====). We argue that individuals currently facing financial difficulty or experiencing financial fragility would have lesser optimistic future expectations. In other words, financial fragility during COVID-19 would reduce financial optimism.====Prior studies are inconsistent: scholars found a negative correlation (Hasler et al., 2018) or no correlation (====) between financial fragility and financial literacy. Hence, there may be other factors that moderate the above linkage. In the present study we considered financial literacy as an important moderating factor. To produce accurate financial forecasts, individuals need to minimize their uncertainty in an unbiased manner (Nofsinger, 2005). Therefore, in the absence of domain-specific knowledge such as literacy in financial matters, it is possible to indulge in the unwarranted extrapolation of recent (unfavorable) trends (====; ====). Therefore, we argue that financial literacy would help regulate the adverse impact of negative sentiments on financial optimism during the pandemic. Moreover, financially literate people save more for retirement (====), better portfolio diversification and returns (====), low debt (====), and lower cost of borrowings (====). As a result, they are prepared to meet future uncertainty, such as the COVID-19.====Scholars agree that women, in general, are less optimistic as compared to men. For example, women are less optimistic about the presidential elections (====), online shopping experience (====), marriage expectations (====), and economic conditions and personal finances (====). The difference between men's and women's optimism lies in the different explanatory styles (====). In general, women attribute their problems to internal, pervasive, and permanent reasons, which is a more pessimistic explanatory style (====). Scholars agree that women are more likely to experience depression than men (====In the present study, we used nationally representative data of more than 2500 American respondents to examine the above hypotheses after controlling for predictors that may potentially explain financial optimism, such as socioeconomic status and trait optimism (====; Puri and Robinson, 2007). We contribute to the literature and find that financially fragile individuals have 7% lower chances of being financially optimistic than financially non-fragile individuals during the pandemic. Further, we find that financial literacy mitigates this negative impact of fragility on optimism. In a gender-based sub-sample analysis, we found that the adverse effect of financial fragility on financial optimism is significant only among women. Our findings have practical implications because financial literacy and gender-based differences explain an individual's future financial expectations, especially in a situation when financial fragility is high.====Appendix A.1 reports a detailed description of all the variables used in the study and their source of respective UAS survey waves.",Financial fragility and financial optimism linkage during COVID-19: Does financial literacy matter?,https://www.sciencedirect.com/science/article/pii/S2214804321000914,25 July 2021,2021,Research Article,169.0
Goff Sandra H.,"Skidmore College, Department of Economics, 815 N. Broadway, Saratoga Springs, NY 12866, United States","Received 13 August 2020, Revised 15 May 2021, Accepted 30 June 2021, Available online 17 July 2021, Version of Record 3 August 2021.",https://doi.org/10.1016/j.socec.2021.101744,Cited by (0),"This work uses an experimental design with random assignment to test the effect of guilt on demand for ethical product attributes, with a focus on goods produced by monasteries and other religiously affiliated organizations. On average, individuals assigned a positive premium to organic and local attributes, but only those with a religious affiliation assigned a positive value to the monastic attribute. Induction of reactive guilt was found to increase non-religious participants’ product ratings, but to decrease ratings among those with a religious affiliation. These findings suggest that the monastic attribute is not universally desirable despite that monastic, organic, and local producers share many of the same ethical principles. These results also underscore potentially important heterogeneity in moral cleansing behaviors by religious identity. The potential for religious identity to affect moral balancing has important implications for the study of pro-social and pro-environmental behavior, broadly, and ethical consumption, more specifically. Together, these findings contribute to the literature on the effect of moral emotions on economic behavior and provide the first analysis of willingness to pay for monastic goods.",None,A test of willingness to pay as penance in the demand for ethical consumption,https://www.sciencedirect.com/science/article/pii/S2214804321000847,17 July 2021,2021,Research Article,170.0
"Yang Xiaojun,Carlsson Fredrik","School of Public Policy and Administration, Xi'an Jiaotong University, Xi'an, Shaanxi 710049, P.R. China,Department of Economics, University of Gothenburg, Box 640, SE-405 30 Gothenburg, Sweden","Received 24 March 2018, Revised 2 April 2021, Accepted 5 July 2021, Available online 16 July 2021, Version of Record 21 July 2021.",https://doi.org/10.1016/j.socec.2021.101749,Cited by (1),"We study how partners in a household make decisions for themselves and for their spouses regarding intertemporal choices in a field experiment in rural China. We find that men, but not women, make decisions that are more patient for their spouses compared with their predictions of their spouses’ decisions, in particular when choices involved two delayed options. Instead the decisions for their spouse are close to the decisions they made for themselves. At the same time, we find evidence of sorting of preferences within households, i.e. that the preferences of husband and wife are correlated. We also find that spousal control and financial conflict to some extent affect the difference between decision made for the spouse and the predictions of the spouse decisions.",None,Are People More Patient with Their Spouse's Money? An Experimental Study,https://www.sciencedirect.com/science/article/pii/S2214804321000896,16 July 2021,2021,Research Article,171.0
