name,institution,publish_date,doi,cite,abstract,introduction,Title,Url,Time,Year,Type,Unnamed: 0
"Cochard François,Le Gallo Julie,Georgantzis Nikolaos,Tisserand Jean-Christian","CRESE, Université de Bourgogne Franche-Comté, F-25000 Besançon, France,CESAER, INRAE, Agrosup Dijon, Université de Bourgogne Franche-Comté, F-21000 Dijon, France,CEREN, EA 7477, Burgundy School of Business - Université Bourgogne Franche-Comté France,CEREN, EA 7477, Burgundy School of Business - Université Bourgogne Franche-Comté; Swiss Distance Learning University (UniDistance), Überlandstrasse 12, Postfach 265 CH-3900 BrigueFrance","Received 28 April 2020, Revised 16 August 2020, Accepted 7 September 2020, Available online 22 September 2020, Version of Record 6 October 2020.",https://doi.org/10.1016/j.socec.2020.101613,Cited by (13),"We perform meta-regressions on a single database containing 96 observations of simple ultimatum games and 144 observations of simple dictator games to disentangle the fairness hypothesis based on the degree ==== of a country. According to the fairness hypothesis, offers in the two games should not differ if they were motivated by a subject’s fairness concerns. Using the difference across countries between offers in ultimatum and dictator games, we address the effect of being exposed to the market mechanism on pure fairness concerns and other-regarding, expectations-driven fairness. Our results show in particular that the lower the level of economic development in a country, the less likely the rejection of the fairness hypothesis.",None,Social preferences across different populations: Meta-analyses on the ultimatum game and dictator game,https://www.sciencedirect.com/science/article/pii/S2214804320302895,22 September 2020,2020,Research Article,250.0
"Heap Shaun P. Hargreaves,Ramalingam Abhijit,Stoddard Brock V.","Department of Political Economy, King's College London, The Strand, London WC2, UK,Department of Economics, Walker College of Business, Appalachian State University, Peacock Hall, Boone, NC 28608, USA","Received 24 January 2020, Revised 10 August 2020, Accepted 8 September 2020, Available online 19 September 2020, Version of Record 30 September 2020.",https://doi.org/10.1016/j.socec.2020.101614,Cited by (1),"In experiments, contributions to a team public good increase when the team competes with another team for a prize. In our experiment, this insight generalises to internally unequal teams. Indeed, in some cases the boost to public goods contributions is bigger with unequal teams than equal ones. We also find that the boost to contributions is most significant among the ‘rich’ in the team. Hence, competition not only promotes efficiency, it also reduces inequality in our experiment.",None,Team competition when there is within-team inequality,https://www.sciencedirect.com/science/article/pii/S2214804320300574,19 September 2020,2020,Research Article,251.0
"Graff Frederik,Grund Christian,Harbring Christine",RWTH Aachen University,"Received 31 December 2019, Revised 25 May 2020, Accepted 20 August 2020, Available online 1 September 2020, Version of Record 2 October 2020.",https://doi.org/10.1016/j.socec.2020.101596,Cited by (0),"We propose experiments in virtual reality (VR) as a new approach to examining economic behavior: in the present case, the topic of heterogeneity in dynamic tournaments. We simulate a realistic working situation in an immersive VR environment. Implementing a tournament in VR, we are able to mitigate the reflection problem, which usually undermines research on dynamic interaction. Moreover, VR allows us to control for the performance of the virtual peer – a humanoid avatar – and thus to get an understanding of the reaction of the subject to the avatar in a dynamic setting, as the subject is constantly able to observe the avatar's performance. We observe that the subjects’ performance is highest in a homogeneous tournament, i.e., when they compete against an avatar performing exactly as well as they themselves did in the preceding phase. This result is driven by peer effects rather than by tournament incentives. We track the behavior of each subject in each situation, and we examine the role that intermediate information about score differences play.",None,Competing on the Holodeck - The effect of virtual peers and heterogeneity in dynamic tournaments,https://www.sciencedirect.com/science/article/pii/S2214804319306561,1 September 2020,2020,Research Article,252.0
"Chetty Rinelle,Hofmeyr Andre,Kincaid Harold,Monroe Brian","School of Economics, University of Cape Town, South Africa","Received 23 May 2019, Revised 31 October 2019, Accepted 20 January 2020, Available online 22 January 2020, Version of Record 29 January 2021.",https://doi.org/10.1016/j.socec.2020.101520,Cited by (16),"The trust game has become the behavioral measure of choice in social science investigations of trust. This measure is often used uncritically to compare levels of trust across people and cultures even though those levels may be affected by people's attitudes to risk. We evaluate an incentive-compatible experiment designed to investigate the potential for a risk-trust confound using a sample of 202 students at the University of Cape Town in 2016. We depart from the earlier risk-trust literature by using a risk preference task that incorporates a wide range of prizes and probabilities. This allows us to investigate whether earlier ambiguous results concerning risk-trust interactions simply reflect weak measurement instruments, and facilitates the estimation of structural econometric risk preference models. We find that amounts sent in the trust game are indeed associated with attitudes to risk, that the magnitude of this relationship is economically significant, and that it is robust across statistical models. In addition, we find that most previous studies of the risk-trust confound use preference elicitation mechanisms that are underpowered for identifying risk-trust relationships. Our results caution against the widespread use of the trust game to measure and compare levels of trust without careful adjustments for risk attitudes.",None,The Trust Game Does Not (Only) Measure Trust: The Risk-Trust Confound Revisited,https://www.sciencedirect.com/science/article/pii/S2214804319302290,22 January 2020,2020,Research Article,253.0
"Lynne Gary D,Bromley Daniel W","Professor Emeritus, University of Nebraska-Lincoln, 11304 E Pampa Avenue, Mesa, AZ, 85212, USA","Received 29 September 2021, Accepted 8 October 2021, Available online 19 October 2021, Version of Record 19 November 2021.",https://doi.org/10.1016/j.socec.2021.101784,Cited by (0),None,None,Possessive individualism: A crisis of capitalism,https://www.sciencedirect.com/science/article/pii/S2214804321001245,19 October 2021,2021,Research Article,255.0
Ramalingam Abhijit,"Department of Economics, Appalachian State University, 416 Howard Street, Peacock Hall 3101, Boone, NC 28608, United States","Received 18 September 2021, Accepted 20 September 2021, Available online 22 September 2021, Version of Record 3 October 2021.",https://doi.org/10.1016/j.socec.2021.101777,Cited by (0),None,None,Book review of “A Research Agenda for Experimental Economics”,https://www.sciencedirect.com/science/article/pii/S2214804321001178,22 September 2021,2021,Research Article,256.0
Huynh Toan Luu Duc,"WHU, Otto Beisheim School of Management, Burgplatz 2, D-56179 Vallendar, Germany,University of Economics Ho Chi Minh City, 59C Nguyen Dinh Chieu, 70000 Ho Chi Minh City, Vietnam,IPAG Business School, 184 Boulevard Saint Germain, 75006 Paris, France","Received 23 May 2021, Revised 22 June 2021, Accepted 7 July 2021, Available online 11 July 2021, Version of Record 19 July 2021.",https://doi.org/10.1016/j.socec.2021.101750,Cited by (0),None,None,Review on Katy Milkman's ,https://www.sciencedirect.com/science/article/pii/S2214804321000902,11 July 2021,2021,Research Article,258.0
Chaudhuri Ananish,"Department of Economics, University of Auckland, Private Bag 92019, Auckland, New Zealand","Received 17 March 2021, Accepted 2 April 2021, Available online 21 April 2021, Version of Record 21 April 2021.",https://doi.org/10.1016/j.socec.2021.101701,Cited by (0),None,None,"“The Economics of Small Things” by Sudipta Sarangi; Penguin Random House India, Paperback INR 299.00. ISBN13: 9780143450375. Ebook ASIN: B08MV138KZ Available on Kindle US $17.59.",https://www.sciencedirect.com/science/article/pii/S2214804321000410,21 April 2021,2021,Research Article,261.0
Miettinen Topi,"Hanken School of Economics & Helsinki GSE, Arkadiankatu 7, P.O. Box 479, Fi-00101 Helsinki, Finland","Received 26 January 2021, Revised 5 February 2021, Accepted 5 February 2021, Available online 12 February 2021, Version of Record 12 February 2021.",https://doi.org/10.1016/j.socec.2021.101683,Cited by (0),None,None,"Review on Robert Sugden's “The Community of Advantage: A Behavioural Economist's Defence of the Market”. Oxford, July 17",https://www.sciencedirect.com/science/article/pii/S2214804321000239,12 February 2021,2021,Research Article,263.0
"Lynne Gary D.,Lester David","Palgrave Macmillan, New York, Published 2020, pp. 315, eBook $89; hardcover $120, ISBN number: 978-3-030-50601-8,Psychology Program, 270 Sierra Circle, Stockton University, Felton, 101 Vera King Farris Drive, Delaware 19943-4088, Galloway, New Jersey 08205-9441","Received 7 January 2021, Accepted 10 January 2021, Available online 3 February 2021, Version of Record 3 February 2021.",https://doi.org/10.1016/j.socec.2021.101663,Cited by (0),None,None,Metaeconomics: tempering excessive greed,https://www.sciencedirect.com/science/article/pii/S2214804321000033,3 February 2021,2021,Research Article,264.0
Hample Kelsey C,"Economics at Furman University, 3300 Poinsett Highway Greenville, South Carolina, 29613, USA","Received 10 June 2020, Revised 3 August 2020, Accepted 7 September 2020, Available online 8 September 2020, Version of Record 12 September 2020.",https://doi.org/10.1016/j.socec.2020.101610,Cited by (1),"Learning how to create prosocial groups in the lab will allow for the application of laboratory methods to a broader set of empirical questions. I created an experiment to test the effect of group membership on individuals’ social behavior by comparing three group assignment mechanisms: exogenous, quasi-endogenous, and endogenous. The exogenous mechanism, the standard in ====, was to randomly match participants. The quasi-endogenous mechanism, following previous literature, was to group individuals based on their preferences over paintings. The endogenous mechanism was to anonymously group individuals based on membership in a campus group from which they were recruited. I tested these groups in an experiment of risky investment decisions made in conjunction with decisions to reduce risk exposure. Participants could informally share with fellow group members and/or buy insurance that reduced risk. Group type had significant effects. Exogenous groups were the least prosocial, informally sharing the least and adopting significantly more costly insurance than the other group types. These findings highlight the importance of group assignment mechanisms in the lab and suggest that the strength of those social networks can be manipulated in a predictable way.",None,Experimental methodology: Assigning pro-social groups in the lab,https://www.sciencedirect.com/science/article/pii/S2214804320304006,8 September 2020,2020,Research Article,266.0
Bregu Klajdi,Indiana University South Bend,"Received 7 October 2019, Revised 18 August 2020, Accepted 25 August 2020, Available online 30 August 2020, Version of Record 4 September 2020.",https://doi.org/10.1016/j.socec.2020.101598,Cited by (7)," is linked to higher levels of trading and lower profits in financial markets. This paper explores overconfidence and trading in a laboratory setting to determine whether overconfidence in the accuracy of one's information is a driver of this situation. In a laboratory experiment, I design an environment such that being overconfident in one's own accuracy of information creates incentives to overtrade. Across treatments, I exogenously vary the type of feedback participants receive, such that some groups receive no feedback and other groups receive varying feedback about the accuracy of information, limiting the likelihood that they remain overconfident. The results show that the accuracy of information mediates the overconfidence effects on trading, and indicate that overconfidence leads to higher trading volume and weakly damages profits.",None,Overconfidence and (Over)Trading: The Effect of Feedback on Trading Behavior,https://www.sciencedirect.com/science/article/pii/S2214804319304768,30 August 2020,2020,Research Article,267.0
"Jia Z. Tingting,McMahon Matthew J.","The Department of Economics and Finance, The University of Arkansas at Little Rock, United States,The Department of Economics and Finance, West Chester University, 411 Business and Public Management Center, 50 Sharpless St., West Chester, PA, 19383, USA","Received 7 August 2019, Revised 8 July 2020, Accepted 7 August 2020, Available online 12 August 2020, Version of Record 28 August 2020.",https://doi.org/10.1016/j.socec.2020.101593,Cited by (1),"We design a laboratory experiment to test for behavioral differences due to observation within a novel arena: investment games. We find that fund managers are more risk-averse when investors can observe their investment allocations. This effect is more pronounced when investors, in addition to observing the allocations, can also observe the investment outcomes. Interestingly, allowing investors to observe how their investment is allocated does not impact how much they invest. Last, when the outcome of the risky investment is public knowledge, disclosing managers’ allocations leads them to return more tokens to investors and to expropriate fewer tokens for themselves at the end of the game, ceteris paribus. We discuss potential causes of these effects.",None,Being watched in an investment game setting: Behavioral changes when making risky decisions,https://www.sciencedirect.com/science/article/pii/S2214804319303714,12 August 2020,2020,Research Article,268.0
"Shastry Gauri Kartini,Shurchkov Olga,Xia Lingjun Lotus","Department of Economics, Wellesley College, 106 Central St., Wellesley, MA, United States,Massachusetts Institute of Technology, Harvard University, MA, United States","Received 26 February 2020, Revised 18 June 2020, Accepted 6 August 2020, Available online 10 August 2020, Version of Record 14 August 2020.",https://doi.org/10.1016/j.socec.2020.101592,Cited by (11),"We design an experiment that sheds light on the asymmetry in how men and women interpret noisy feedback about relative standing and how this gender difference can affect tournament entry. Women attribute negative feedback to lack of ability, even when the feedback is due to bad luck. High-ability men who receive negative feedback correctly attribute it to luck. Men attribute negative feedback to lack of ability only when it confirms prior beliefs. We find consistent gender differences in tournament entry: noisy feedback eliminates the gender gap but primarily because low-performing men opt out of tournament. High-performing women who receive surprising negative feedback reduce tournament entry, generating a gender gap in performance and earnings relative to the setting without feedback.",None,Luck or skill: How women and men react to noisy feedback,https://www.sciencedirect.com/science/article/pii/S2214804320301403,10 August 2020,2020,Research Article,269.0
"Finigan Duncan,Mills Brian M.,Stone Daniel F.","Associate Professor, Department of Kinesiology and Health Education, University of Texas at Austin,Associate Professor, Department of Economics, Bowdoin College,Independent","Received 18 January 2020, Revised 3 August 2020, Accepted 3 August 2020, Available online 6 August 2020, Version of Record 13 November 2020.",https://doi.org/10.1016/j.socec.2020.101591,Cited by (1),"We theoretically and empirically study a fundamental strategic decision in baseball: when to make the “call to the bullpen” and pull th=e starting pitcher. The limited previous literature on this topic found that pulling starters tends to reduce runs allowed in the current inning. We show with a simple model that this result is consistent with win maximization, and does not necessarily imply that starters should typically be pulled sooner. We then use detailed pitch-level data from the 2008–2017 seasons to estimate the effects of pulling the starter on both runs allowed in the current inning and on win probability. We argue that whether or not the starter is pulled is plausibly “as good as random” conditional on the large set of included covariates, but acknowledge the lack of true randomization. We find that the estimated effect of pulling the starter on runs allowed in the current inning is indeed negative, but the effect on win probability is a precise zero. We examine a variety of game situations and recent events, and find only scattered and limited evidence of biases, but note that statistical power is limited for these analyses. We interpret the results to imply that, at least on average, decisions for when to pull starters were approximately Bayesian-optimal in between plate appearances due to a period of institutional learning that occurred over decades. However, starters were very rarely pulled within-plate appearances, so we cannot analyze the optimality of these decisions.",None,Pulling starters,https://www.sciencedirect.com/science/article/pii/S2214804320300409,6 August 2020,2020,Research Article,270.0
"Bülow Catharina Wolff von,Liu Xiufeng","Department of Technology, Management and Economics Technical University of Denmark 2800 Kgs. Lyngby, Denmark","Received 18 February 2020, Revised 22 July 2020, Accepted 23 July 2020, Available online 24 July 2020, Version of Record 29 July 2020.",https://doi.org/10.1016/j.socec.2020.101590,Cited by (2),"Adaptation to climate change is an intricate decision-making process that requires balancing costs and uncertain benefits in a setting with high stakes and low probabilities. Risk preferences then shape the way individuals or groups adapt to these settings, dependent or independent of public policy. With the aim of shedding light on these preferences and aid policy efficiency, we develop a set of Climate Change Adaptation Applications based on oTree (CAT). The set consists of eight discrete apps that correspond to different risk perception biases and corrective treatments. From a scientific perspective CAT can be used to better understand adaptation decision constraints at the individual and community level, while from a policy perspective it can help policy makers plan or improve existing adaptation strategies. A ==== experiment with 75 subjects was conducted to evaluate CAT functionality and the decision-making process. The experiment examined adaptation decisions under different risk levels in a home flood context. It successfully explored the impact of unknown risks, various time horizons, framing conditions, and group dynamics. The results show that adaptation decisions are strongly correlated with risk levels, and adaptation rate increases when uncertainty is introduced. Collective adaptation increases in group dynamics, although polarization is observed, and uncertainty reinforces this through collective inaction. In addition, typical subject characteristics, including age, gender and home ownership, have a significant impact on adaptation.",None,Ready-made oTree applications for the study of climate change adaptation behavior,https://www.sciencedirect.com/science/article/pii/S2214804320301257,24 July 2020,2020,Research Article,271.0
"Morone Andrea,Caferra Rocco","Universita degli Studi di Bari Aldo Moro, Dipartimento di Economia, Management e Diritto dell’Impresa Universit degli Studi di Bari Aldo Moro Largo Abbazia Santa Scolastica, 5370124 Bari (Italy)","Received 21 April 2020, Revised 16 July 2020, Accepted 16 July 2020, Available online 17 July 2020, Version of Record 22 July 2020.",https://doi.org/10.1016/j.socec.2020.101584,Cited by (4),"The purpose of this paper is to examine the effects on welfare distribution of quality and quantity of information among traders in laboratory financial markets. Results lead us to conclude that signal accuracy matters in underpinning inequality distribution. Generally, there is evidence that high quality signals produce lower inequality. However, by analyzing tail behavior, there seems to be cases of ==== in high quality signals generating ""extra"" level of inequality.",None,Inequalities in financial markets: Evidences from a laboratory experiment,https://www.sciencedirect.com/science/article/pii/S2214804320302809,17 July 2020,2020,Research Article,272.0
Jie Yun,"School of Business, Sun Yat-sen University, No.135, Xinggang Xi Road, 510275 Guangzhou, Guangdong, China","Received 13 July 2020, Accepted 13 July 2020, Available online 16 July 2020, Version of Record 20 July 2020.",https://doi.org/10.1016/j.socec.2020.101582,Cited by (0),"How do people react to different payment levels when asked to help a stranger perform a mundane task? The literature suggests a U-shaped relationship between a person’s willingness to help and how much payment they are offered for the help, such that a small payment reduces willingness to help as compared to no payment or medium-sized payment. We report seven studies showing that when people are aware of the existence of distinct rewards for the same helping behavior, (1) most people behave as if they use a cutoff strategy; (2) individual response patterns are predictably heterogeneous; (3) people with lower household incomes are more likely to follow the pattern predicted by standard economic theory; and (4) joint evaluation of multiple payment levels (vs. separate evaluation) steers people toward the pattern predicted by standard economic theory. Subjective utility and reinforcements are discussed as potential sources of this heterogeneity. Our research contributes to understanding of how monetary payments affect helping behavior in prosocial contexts with small monetary units.",None,Responding to requests for help: Effects of payoff schemes with small monetary units,https://www.sciencedirect.com/science/article/pii/S2214804320304882,16 July 2020,2020,Research Article,273.0
"Bucciol Alessandro,Castagnetti Alessandro","University of Verona, Italy,University of Warwick, England","Received 31 January 2020, Revised 29 June 2020, Accepted 2 July 2020, Available online 3 July 2020, Version of Record 13 November 2020.",https://doi.org/10.1016/j.socec.2020.101581,Cited by (7),"In high pressure situations, individuals may perform well below expectations. This is called “choking under pressure” and we study it in the context of a competitive sports environment. We construct a unique dataset on archery to study whether performance deteriorates at the end of a match, when two players compete in a tiebreak. Our results suggest that pressure plays a key role: overall performance deteriorates in the tiebreak. This effect is even more pronounced in the tiebreak of the most important tournaments, but only for women.",None,Choking under pressure in archery,https://www.sciencedirect.com/science/article/pii/S221480432030080X,3 July 2020,2020,Research Article,274.0
"Ploner Matteo,Saredi Viola","Department of Economics and Management, University of Trento, Via Inama 5, Trento 38122, Italy,Enterprise Strategy, Global Business Services, IBM Italia, Piazza Gae Aulenti 10, Milano 20124, Italy","Received 9 August 2019, Revised 11 May 2020, Accepted 25 June 2020, Available online 26 June 2020, Version of Record 1 August 2020.",https://doi.org/10.1016/j.socec.2020.101580,Cited by (0),"We experimentally investigate delegation in risky choices in a principal-agent framework. Agents are asked to build a portfolio for their principals by selecting among prospects that are presented either in a conventional descriptive way or are experienced through sampling (i.e., clicking paradigm). Principals are, however, offered the opportunity to avoid delegation and build their portfolio by paying a fee. We find that portfolios built by principals are more efficient in terms of mean-variance ratio and more ambitious in terms of expected returns (and risk) than those built by the delegated agents. The higher quality of the principal’s portfolios is associated with higher effort exerted in the experience framework by principals than by agents. Principals anticipate differences in portfolio’s performance but pay a large premium that negatively impacts on their final earnings.",None,Exploration and delegation in risky choices,https://www.sciencedirect.com/science/article/pii/S2214804319303738,26 June 2020,2020,Research Article,275.0
