name,institution,publish_date,doi,cite,abstract,introduction,Title,Url,Time,Year,Type,Unnamed: 0
"Schwartz S.,Choumert-Nkolo J.,Combes J.-L.,Combes-Motel P.,Kere E.","Université Clermont Auvergne, CNRS, IRD, CERDI, F-63000 Clermont-Ferrand, France,EDI Global, London, United Kingdom, CERDI, Chaire Energie et Prospérité,African Development Bank (AfDB), Abidjan, Côte d’Ivoire","Received 15 July 2020, Revised 9 December 2021, Accepted 4 January 2022, Available online 13 January 2022, Version of Record 7 February 2022.",https://doi.org/10.1016/j.reseneeco.2022.101284,Cited by (1),"This paper determines the best political implementation level of protected areas in the presence of two ====, the infrastructure and scarcity effects. We show that decentralized regulation always leads to an overall decrease in deforestation under the infrastructure effect but not under the scarcity effect. Centralized regulation always leads to a larger protected area than decentralized regulation under the scarcity effect, which is not always true under the infrastructure effect. Finally, we conduct a case study of the Brazilian Legal Amazônia and find that spillover effects matter in the size of protected area design.",None,Optimal protected area implementation under spillover effects,https://www.sciencedirect.com/science/article/pii/S092876552200001X,13 January 2022,2022,Research Article,39.0
Kuroda Yuta,"Graduate School of Economics and Management, Tohoku University, Sendai-Shi, Aoba-Ku, Kawauchi, 27-1, 980-8576, Japan","Received 18 January 2021, Revised 4 November 2021, Accepted 16 December 2021, Available online 27 December 2021, Version of Record 31 December 2021.",https://doi.org/10.1016/j.reseneeco.2021.101282,Cited by (0),"Although seasonal allergies caused by airborne pollen are detrimental to physical and mental health and impair daily activities, their social cost is rarely discussed in the economics literature. Large amounts of airborne pollen can increase healthcare costs, reduce worker productivity, and force people to stay at home, thereby stagnating economic activity. This study uses daily purchase records from scanner data to investigate the effect of pollen exposure on consumption behavior. Exploiting the daily variation in the pollen counts at 120 observation stations in ====, I find that consumption expenditure decreases by about 2% on days when airborne pollen is unusually high. Estimates using lagged consumption expenditures show that the reduction in consumption due to high pollen exposure lasts for more than a week. Furthermore, estimates using weekly and monthly panel data also indicate a pollen-induced decrease in consumption. This finding suggests that exposure to pollen may reduce total expenditure as opposed to merely delaying spending. It highlights the overlooked economic burden of pollen and seasonal allergies. Hence, urban planning to reduce airborne pollen and health policies to address seasonal allergies are crucial.",None,The effect of pollen exposure on consumption behaviors: Evidence from home scanner data,https://www.sciencedirect.com/science/article/pii/S0928765521000671,27 December 2021,2021,Research Article,40.0
"Ino Hiroaki,Matsueda Norimichi,Matsumura Toshihiro","School of Economics, Kwansei Gakuin University, 1-1-155 Uegahara, Nishinomiya, Hyogo 662-8501, Japan,Institute of Social Science, The University of Tokyo, 7-3-1 Hongo, Bunkyo-ku, Tokyo 113-0033, Japan","Received 26 January 2021, Revised 30 October 2021, Accepted 14 December 2021, Available online 22 December 2021, Version of Record 14 January 2022.",https://doi.org/10.1016/j.reseneeco.2021.101280,Cited by (0),"This study investigates the effects of the introduction of a competitor on the behavior of an incumbent electricity producer who used to be a local monopolist. We especially focus on its implications for the incumbent's decision of capacity choice between two different electric power sources: one with a relatively high production cost (peak-load technology), which is represented by gas-fired power generation, and the other with a relatively high capacity-building cost (base-load technology), which is represented by nuclear power generation. We assume that the entrant does not have access to the latter technology, and also that demand fluctuates over time, as is typically the case with any electricity market. We show that the introduction of a competitor increases the capacity of nuclear power generation if and only if the nuclear power capacity is sufficiently ==== to establish, in comparison with the marginal production cost of a gas-fired plant. This result also implies that the competition tends to decrease the nuclear capacity when the level of carbon tax, which raises the relative production cost of gas-fired power generation, is sufficiently ====.",None,Market competition and strategic choices of electric power sources under fluctuating demand,https://www.sciencedirect.com/science/article/pii/S0928765521000658,22 December 2021,2021,Research Article,41.0
"Guan Jin,He Dongwei,Zhu Qigui","Antai College of Economics and Management, Shanghai Jiao Tong University, 1954 Huashan Road, Shanghai, 200030, China,School of Finance and Business, Shanghai Normal University, 100 Guilin Road, Shanghai, 200234, China,School of Finance, Shanghai University of Finance and Economics, 100 Wudong Road, Shanghai, 200433, China,Shanghai Advanced Institute of Finance, Shanghai Jiao Tong University, 211 Huaihai West Road, Shanghai, 200030, China","Received 10 August 2021, Revised 16 November 2021, Accepted 17 December 2021, Available online 18 December 2021, Version of Record 24 December 2021.",https://doi.org/10.1016/j.reseneeco.2021.101283,Cited by (5),This paper sheds light on the effectiveness of a target-based performance evaluation system (TPES) on strenghening local environmental enforcement in China. We conduct a difference-in-differences (DiD) specification and then exploit unique firm-level data to examine whether the TPES reform facilitates SO==== reductions in local firms. The results indicate that SO,None,"More incentive, less pollution: The influence of official appraisal system reform on environmental enforcement",https://www.sciencedirect.com/science/article/pii/S0928765521000683,18 December 2021,2021,Research Article,42.0
"Chakraborti Lopamudra,Shimshack Jay P.","Loyola University Chicago, School of Environmental Sustainability & Quinlan School of Business, 1032 W. Sheridan Road, BVM Hall 411, Chicago, IL 60660, United States,University of Virginia, Frank Batten School, 235 McCormick Road, PO Box 400893, Charlottesville, VA 22904-4893. United States","Received 29 October 2020, Revised 14 December 2021, Accepted 15 December 2021, Available online 17 December 2021, Version of Record 30 December 2021.",https://doi.org/10.1016/j.reseneeco.2021.101281,Cited by (7),"All else equal, disparities in environmental exposure are associated with disparities in health and economic well-being. Here, we combine 9 years of data on toxic water pollution discharges from more than 1600 industrial facilities across urban Mexico with geographic, economic, and sociodemographic data from ≈ 50,000 Mexican urban block groups. We first show that industrial facilities pollute more in marginalized neighborhoods and in neighborhoods that are becoming more marginalized over time. In contrast, we find no evidence for relationships between toxic water pollution and indigenous race. We then explore channels driving observed exposure disparities. We find evidence that environmental disparities in urban Mexico are associated with collective action, community pressure, and Coasian bargaining. We do not find evidence consistent with political economic or amenity-based sorting mechanisms.",None,Environmental disparities in urban Mexico: Evidence from toxic water pollution,https://www.sciencedirect.com/science/article/pii/S092876552100066X,17 December 2021,2021,Research Article,43.0
"Delacote Philippe,Le Velly Gwenolé,Simonet Gabriela","Université de Lorraine, AgroParisTech-INRAe, BETA, 14 rue Girardet – CS 14216, Nancy Cedex 54042, France,Climate Economics Chair, Palais Brongniart, 28 Place de la Bourse, Paris 75002, France,CEE-M, Univ Montpellier, CNRS, INRAe, Institut Agro, 2 Place Pierre Viala, Montpellier 34060, France,Independent Researcher, France","Received 3 November 2020, Revised 8 October 2021, Accepted 3 November 2021, Available online 27 November 2021, Version of Record 4 December 2021.",https://doi.org/10.1016/j.reseneeco.2021.101277,Cited by (3),"Since the establishment of REDD+, hundreds of projects have emerged around the globe. Much attention has been given to REDD+ projects in the literature, but the conditions under which they are likely to be effective are still not well known. In particular, the location bias concept states that projects are more likely to be implemented in remote areas, where development pressure is low, hence questioning the additionality of these projects. In this article, we examine this concept, assessing how the status of REDD+ project proponents and the project certification influence the choice of location and the project's additionality. Using a sample of six REDD+ projects in Brazil, we show that these two dimensions can impact location choice toward areas with higher or lower opportunity costs and that this choice can impact additionality. We also show that the selection of an area with low opportunity costs, which is frequently presented as a location bias, does not necessarily preclude additionality.",None,Revisiting the location bias and additionality of REDD+ projects: the role of project proponents status and certification,https://www.sciencedirect.com/science/article/pii/S0928765521000622,27 November 2021,2021,Research Article,44.0
"Lafforgue Gilles,Lorang Etienne","Toulouse Business School, 1 Place Alphonse Jourdain – CS 66810, 31068 Toulouse Cedex 7, France,Université de Lorraine, Université de Strasbourg, Agro Paris Tech, CNRS, INRAE, BETA, 54000 Nancy, France,Climate Economics Chair, Univ. Paris Dauphine, Paris, France","Received 21 June 2021, Revised 12 November 2021, Accepted 16 November 2021, Available online 25 November 2021, Version of Record 6 December 2021.",https://doi.org/10.1016/j.reseneeco.2021.101278,Cited by (8),"This paper investigates the recycling opportunities of an industrial sector constrained by resource, climate, and waste capacities. To do this, we model the full lifecycle of a good to consider the waste and greenhouse gas (GHG) emissions coming from both its production — from virgin or recycled materials — and consumption. We identify the optimal trajectories of resources use, mainly depending on the relative scarcity of the resources and on their emissions. Although recycling is usually, and correctly, noted as an opportunity to reduce the impact of consumption on primary resources and waste, we also consider the possible negative environmental consequences of recycling and we discuss the resulting arbitrations. We characterize the optimal recycling strategy and we show that, in some cases, the recycling rate through time is an inverted U-shape, and there can be a catch-up phase of consumption at the end of the social planner program. Finally, we discuss the policy implications of our model by identifying and analyzing the set of optimal tax-subsidy schemes, and we highlight the existence of standard environmental externalities as well as a positive externality linked to the absence of a market for waste.",None,"Recycling under environmental, climate and resource constraints",https://www.sciencedirect.com/science/article/pii/S0928765521000634,25 November 2021,2021,Research Article,45.0
Neill Jon R.,"Department of Economics, Western Michigan University, Kalamazoo, MI, 49008, United States","Received 24 February 2021, Revised 1 November 2021, Accepted 2 November 2021, Available online 11 November 2021, Version of Record 25 November 2021.",https://doi.org/10.1016/j.reseneeco.2021.101276,Cited by (1),"Measuring willingness to pay for non-market goods continues to be problematic for the benefit-cost analyst. This note presents a new procedure for placing a lower bound on that value. The measure identified herein offers the advantage of not requiring any assumptions that are not empirically verifiable, and can be taken using the market demand schedule for any good that has the quantity of the non-market good consumed as an argument.",None,Using consumer’s surplus to bound willingness to pay for non-market goods,https://www.sciencedirect.com/science/article/pii/S0928765521000610,11 November 2021,2021,Research Article,46.0
"Qiu Yueming Lucy,Wang Yi David,Iseki Hiroyuki,Shen Xingchi,Xing Bo,Zhang Huiming","School of Public Policy, University of Maryland, College Park, MD, 20742, USA,University of International Business and Economics, School of Banking and Finance, China,School of Architecture, Planning, and Preservation, University of Maryland, College Park, MD, 20742, USA,Department of Forecasting, Resource Planning and Development, Salt River Project, Tempe, AZ, 85281, USA,China Institute of Manufacturing Development, Nanjing University of Information Science & Technology, Nanjing, 210044, China","Received 14 April 2021, Revised 3 November 2021, Accepted 3 November 2021, Available online 9 November 2021, Version of Record 17 November 2021.",https://doi.org/10.1016/j.reseneeco.2021.101275,Cited by (9),"Accurate assessment of the impact of electric vehicle (EV) charging on the electric grid is critical for energy policymakers to design efficient EV subsidy programs as well as to provide reliable electricity infrastructure. Despite the fact that 80 % of EV charging is conducted with residential in-home chargers, very few empirical studies have examined the load and environmental impact of residential EV charging based on actual electricity consumption data. Our paper fills this critical gap in the literature, applying a difference-in-differences approach to high frequency smart meter data of about 1600 EV homes from 2014 to 2019 in Arizona, United States. First, we find that the electricity demand during the system peak hours from 6 to 8 pm in summer can increase by 7–14 % at an average household with in-home EV charging. Second, EV households respond to electricity pricing signals by increasing their charging in lower-priced off-peak hours within the EV-specific time-of-use (TOU) pricing. Third, we find evidence of rebound effects in driving that lead to a reduction in home-electricity consumption in certain hours of the day. Lastly, we show that our empirical estimation of the grid impact due to in-home EV charging is different from that predicted by existing simulation models due to factors such as consumer behaviors. Such deviations between predicted and actual behaviors imply potential adjustment of relevant policy interventions.",None,Empirical grid impact of in-home electric vehicle charging differs from predictions,https://www.sciencedirect.com/science/article/pii/S0928765521000609,9 November 2021,2021,Research Article,47.0
"Choi Pak-Sing,Espínola-Arredondo Ana,Muñoz-García Félix","Graduate Institute of Industrial Economics, National Central University, Taiwan. No. 300 Zhongda Road, Zhongli District, Taoyuan City 32001 Taiwan,101B Hulbert Hall, School of Economic Sciences,Washington State University, Pullman, WA 99164-6210, USA,103H Hulbert Hall, School of Economic Sciences, Washington State University, Pullman, WA 99164-6210, USA","Received 18 August 2020, Revised 6 August 2021, Accepted 27 October 2021, Available online 30 October 2021, Version of Record 9 November 2021.",https://doi.org/10.1016/j.reseneeco.2021.101267,Cited by (1),"This paper considers firms’ incentives to merge under imperfect competition, where we allow for product differentiation, cost asymmetries, and pollution intensities (green and brown goods). We first analyze mergers in the absence of environmental regulation, showing that mergers induce an output shift towards the lowest cost firm. When emission fees are introduced, however, firms also consider their relative pollution intensities, potentially reverting the above output shift. We show that socially excessive mergers can arise when firms shift output to the more cost-efficient firm which may cause more pollution. In contrast, socially insufficient mergers can arise if output shifts reduce pollution.",None,Environmental policy helping antitrust decisions: Socially excessive and insufficient merger approvals,https://www.sciencedirect.com/science/article/pii/S092876552100052X,30 October 2021,2021,Research Article,48.0
"Ki Hyoshin,Kim Jeong-Yoo","Department of Economics, Kyung Hee University, 1 Hoegidong, Dongdaemunku, Seoul 130-701, South Korea","Received 7 February 2021, Revised 12 September 2021, Accepted 20 October 2021, Available online 29 October 2021, Version of Record 10 November 2021.",https://doi.org/10.1016/j.reseneeco.2021.101266,Cited by (6),"In this paper, we reconsider the information problem of consumers who are concerned about the environment that was first identified by ====, ====. We obtain the result that Intuitive Criterion selects the unique equilibrium in which a seller producing eco-friendly products separates itself from the seller producing eco-unfriendly products by distorting its price from its first-best price upwards to the least costly degree. That is, a high price signals environmental friendliness. This is contrasted with the result of ==== who obtains the pooling equilibrium as the unique outcome (if the product is very likely to be eco-friendly) by using the concept of the undefeated equilibrium. We also examine the effect of the subsidy policy to promote consumptions of environmentally-friendly products by using Intuitive Criterion. Interestingly, a selective subsidy scheme can separate the high type from the low type but cannot provide the seller a strong enough incentive to invest in the environmental-friendly technology. We also show that if the motive of the monopolist, whether it is solely profit-maximizing or involves concerns for the environment, is its private information, a high price can signal the monopolist's environmental concerns and its voluntary choice of the eco-friendly technology.",None,Sell green and buy green: A signaling theory of green products,https://www.sciencedirect.com/science/article/pii/S0928765521000518,29 October 2021,2021,Research Article,49.0
"Schueftan Alejandra,Aravena Claudia,Reyes René","Instituto de Arquitectura y Urbanismo, Facultad de Arquitectura y Artes, Universidad Austral de Chile, Helena Haverbeck S/N, Campus Isla Teja, Valdivia, Chile,Instituto Forestal, sede Valdivia, Fundo Teja Norte S/N, Valdivia, Chile,Department of Economics, Edinburgh Business School, Heriot-Watt University, Edinburgh, EH14 3AS, United Kingdom,Instituto de Economía Agraria, Facultad de Cs. Agrarías y Alimentarias, Universidad Austral de Chile, Campus Isla Teja, Valdivia, Chile","Received 18 February 2020, Revised 26 July 2021, Accepted 4 October 2021, Available online 6 October 2021, Version of Record 29 October 2021.",https://doi.org/10.1016/j.reseneeco.2021.101265,Cited by (8),"High firewood consumption for heating produces high levels of pollution in cities in central and southern Chile, with serious consequences for health and quality of life. Energy efficiency measures (EEMs) have been identified as the best strategy to reduce air pollution and maximize social benefits. However, their adoption has been slow. The objective of this article is to investigate household preferences for financial incentives needed to promote private investments in EEMs in Central-Southern Chilean households and study the role of energy savings and the uncertainty about potential savings in the investment decision, with the aim of finding solutions to increase the adoption of these technologies. We use a choice experiment to explore the trade-off between the investment costs, financial instruments, energy savings, and the uncertainty about achieving the theoretical savings provided by engineering and architectural models. The results show that financial instruments play the most important role in this decision, followed by the savings achieved by the retrofit. Householders prefer to finance their investments with a mix of their personal resources and medium-term credits, trying to avoid long-term commitments. Although uncertainty was found to be a significant variable, it seems to play a small role in the investment decision.",None,"Financing energy efficiency retrofits in Chilean households: The role of financial instruments, savings and uncertainty in energy transition",https://www.sciencedirect.com/science/article/pii/S0928765521000506,6 October 2021,2021,Research Article,54.0
Jin Wei,"Ma Yinchu School of Economics, Tianjin University, Tianjin, China","Received 11 June 2020, Revised 20 March 2021, Accepted 29 August 2021, Available online 31 August 2021, Version of Record 28 September 2021.",https://doi.org/10.1016/j.reseneeco.2021.101263,Cited by (9),"Growing under the incumbent dirty regime might generate inertia against switching to a clean alternative and lead to the carbon lock-in. I analyze the economics of carbon lock-in through the lens of path dependence and self-fulfilling expectation. The incumbent dirty regime, as the first mover, accumulates an installed base of household users during early lead periods. The installed base generates an effect of path dependence that incentives upcoming households to keep on joining the incumbent dirty regime rather than switch to the clean alternative. Switching could be an expectation-driven selection outcome if expectations are formed about an expanding clean regime which outweighs the path dependence effect. Switching is a welfare-improving outcome if welfare gains by upcoming households switching to the clean regime offset welfare losses by installed-base households locked in the dirty one.",None,"Path dependence, self-fulfilling expectations, and carbon lock-in",https://www.sciencedirect.com/science/article/pii/S0928765521000488,31 August 2021,2021,Research Article,55.0
Sinclair-Desgagné Bernard,"Skema Business School and Université Côte d'Azur (GREDEG), France","Received 6 March 2020, Revised 29 June 2021, Accepted 18 August 2021, Available online 26 August 2021, Version of Record 2 September 2021.",https://doi.org/10.1016/j.reseneeco.2021.101261,Cited by (4),"The Stern-Stiglitz Report on carbon pricing emphasizes that environmental policy must not only cope with market failures, but also with government and organizational failures. Focusing on the latter, this paper investigates how some practices central to human resource management – employee selection and training, performance appraisal and rewards, employee discretion and empowerment – can be jointly deployed to direct managerial attention adequately. Using a static multi-task principal-agent model and standard monotone comparative statics tools, I derive predictions/prescriptions on how these practices should adjust as the firm's stakes in sustainability increase. These prescriptions notably include some qualifications concerning the outsourcing of environmental services and employee training, and some implications for public policy.",None,Green human resource management – A personnel economics perspective,https://www.sciencedirect.com/science/article/pii/S0928765521000464,26 August 2021,2021,Research Article,56.0
"Lin Jing,Mou Dunguo","School of Economics and Management, Shanghai Institute of Technology, Shanghai, 200235, China,The Development Research Center of Xiamen Municipal People’s Government, Fujian, 361012, China,School of Economics, Xiamen University, Xiamen, 361005, China","Received 26 November 2019, Revised 2 August 2021, Accepted 10 August 2021, Available online 20 August 2021, Version of Record 24 August 2021.",https://doi.org/10.1016/j.reseneeco.2021.101259,Cited by (12),"China has been attempting to realise green sustainable economic development. Thus, China has proposed and begun to implement the ‘switching from coal to gas’ policy to realise the energy structure transition but neglected to consider seasonal natural gas demand fluctuations, gas supply shortages, the backward gas transportation and storage infrastructure. This paper constructs a model of China’s natural gas distribution system by incorporating these four factors: ① supply factors including domestic ==== pipeline systems in the country, and ④ the pricing mechanism of natural gas. Optimal spatial natural gas distribution with maximum social welfare under the three conditions are simulated, respectively: the ① fixed price system, ② market pricing mechanism, and ③ seasonal fluctuations. The simulation results indicate substantial changes would occur in China’s natural gas system during the switch from coal to gas, and the natural gas infrastructure requires further improvement. This paper also provides references for the ==== facility location selection in China.",None,Analysis of the optimal spatial distribution of natural gas under ‘transition from coal to gas’ in China,https://www.sciencedirect.com/science/article/pii/S0928765521000440,20 August 2021,2021,Research Article,57.0
