name,institution,publish_date,doi,cite,abstract,introduction,Title,Url,Time,Year,Type,Unnamed: 0
Nkuiya Bruno,"University of Alberta, Edmonton, AB T6C 4G9, Canada","Received 22 March 2019, Revised 2 October 2019, Accepted 25 October 2019, Available online 15 November 2019, Version of Record 16 January 2020.",https://doi.org/10.1016/j.reseneeco.2019.101128,Cited by (2),"There is now a growing consensus that ratifying International Environmental Agreements (IEAs) is the most effective way to tackle transboundary pollution problems. While the social benefit function (SBF) critically affects emission choices as well as decisions to ratify IEAs, the related economic literature has mainly concentrated on scenarios where the marginal SBF is linear. Using climatic data, I find that the linear marginal SBF case does not match data and isoelastic SBFs fit data better. In the more realistic, but not yet explored, context of isoelastic SBFs, I reconsider incentives to ratify IEAs. My analysis gives rise to novel conclusions. For instance, changes in the scale of damages do not affect the level of cooperation. When the scale of damages is small, variations of the SBF parameter reveal that large coalitions including the coalition of all countries are stable, but only when the potential gain from cooperation is sufficiently high.",None,Stability of international environmental agreements under isoelastic utility,https://www.sciencedirect.com/science/article/pii/S0928765519301095,15 November 2019,2019,Research Article,128.0
Lappi Pauli,"CMCC Foundation – Euro-Mediterranean Center on Climate Change and Ca’ Foscari University of Venice, CMCC@Ca’Foscari – Edificio Porta dell’Innovazione, 2nd floor – Via della Libertà, 12, 30175 Venice, Italy","Received 10 January 2019, Revised 3 July 2019, Accepted 4 October 2019, Available online 15 November 2019, Version of Record 9 December 2019.",https://doi.org/10.1016/j.reseneeco.2019.101126,Cited by (11),"Environmental issues during and after extraction are a major problem in contemporary exhaustible resource production. Production operation deteriorates the state of the environment and is a source of possibly harmful emissions. After the extraction has ceased, the site is in need of reclamation and clean-up. This paper analyses the last two stages of exhaustible resource production: extraction and site reclamation decisions. The socially optimal regulation is investigated, and it is found that a pollution tax, a shut-down date and a requirement for the firm to deposit funds for costly reclamation can be used to incentivize socially optimal extraction of the resource. It is also found that the firm can be required to pay the monies to a reclamation trust at the beginning of the extraction operation, which protects the tax payers from the possible insolvency of the firm who tries to avoid paying for the reclamation.",None,A model of optimal extraction and site reclamation,https://www.sciencedirect.com/science/article/pii/S0928765519300120,15 November 2019,2019,Research Article,129.0
"Jaime Mónica M.,Chávez Carlos,Gómez Walter","Escuela de Administración y Negocios, Universidad de Concepción, Research Nucleus on Environmental and Natural Resource Economics (NENRE EfD-Chile), and Center of Applied Ecology and Sustainability (CAPES), Avenida Vicente Méndez 595, Casilla 537, Chillán, Región de Ñuble, Chile,Facultad de Economía y Negocios, Universidad de Talca, Research Nucleus on Environmental and Natural Resource Economics (NENRE EfD-Chile), Chile,Department of Mathematical Engineering, Universidad de La Frontera, Research Nucleus on Environmental and Natural Resource Economics (NENRE EfD-Chile), Chile","Received 25 May 2017, Revised 14 May 2019, Accepted 3 October 2019, Available online 6 November 2019, Version of Record 30 January 2020.",https://doi.org/10.1016/j.reseneeco.2019.101125,Cited by (16),"This paper empirically analyzes the determinants of fuel choices and intensity of fuelwood use for residential heating and cooking in central-southern Chile. By using information from a sample of 2761 households in nine urban areas, we first investigate households’ choices of the main fuel used for heating by means of multinomial models. Then we examine the intensity of fuelwood use through fractional probit models. These models allow analyzing the interdependence of fuel use by households, while taking into account households’ individual heterogeneity. Our results indicate that households’ fuel choices are mainly driven by socioeconomic and dwelling characteristics. Moreover, while there is a component of fuelwood use that cannot be influenced by energy policies, such as meteorological conditions across the country, there are a number of characteristics that influence the share of the households’ energy production which is generated by fuelwood. These factors range from socioeconomic characteristics to the households’ perceptions regarding the link between air pollution and use of fuelwood, which presents an opportunity for designing future policy interventions aimed at incentivizing the adoption of cleaner devices.",None,"Fuel choices and fuelwood use for residential heating and cooking in urban areas of central-southern Chile: The role of prices, income, and the availability of energy sources and technology",https://www.sciencedirect.com/science/article/pii/S0928765517301574,6 November 2019,2019,Research Article,130.0
"Finus Michael,Schneider Raoul,Pintassilgo Pedro","University of Graz, Austria and University of Bath, Bath, UK,Department of Economics, Ulm University, Ulm, Germany,Faculty of Economics and CEFAGE, University of Algarve, Faro, Portugal","Received 22 August 2017, Revised 30 August 2019, Accepted 17 September 2019, Available online 29 September 2019, Version of Record 18 December 2019.",https://doi.org/10.1016/j.reseneeco.2019.101122,Cited by (5),"We argue that international fisheries are a prime example to study the incentive structure of forming ==== public good and common pool agreements. We consider a fully integrated multiple zone model, in which zones are linked through density-dependent migration. The incentive to accede to Regional Fishery Management Organizations (RFMOs) is related to multiple characteristics. Firstly, the relative patch sizes of the high seas, which is the internationally (publicly) accessible domain, compared to exclusive economic zones, which are state-owned (privately owned). This can be related to the ====. Secondly, the intensity of fish migration between various zones, which can be related to the ====. Thirdly, the growth rate of the resource, which can be interpreted as the ====, with a low (high) degree of rivalry approximating public good (common pool) features. We show that, generally, excludability reduces free-riding incentives but also the need for cooperation, a variant of the “paradox of cooperation”. Moreover, we show that the benefit-cost duality between public goods and common pool resources generally holds except for some extreme parameter values for which a low degree of rivalry fosters the success of cooperation. Finally, through a variation of the diffusion matrix, we can also analyze a closed as well as a sink-source system.",None,The role of social and technical excludability for the success of impure public good and common pool agreements: The case of international fisheries,https://www.sciencedirect.com/science/article/pii/S0928765517302580,29 September 2019,2019,Research Article,131.0
"Catalano Michele,Forni Lorenzo,Pezzolla Emilia","Prometeia Associazione, Via Marconi 43, 40122 Bologna, Italy,Università degli Studi di Padova, Via del Santo 33, 35123 Padova, Italy","Received 16 July 2018, Revised 10 July 2019, Accepted 19 July 2019, Available online 24 July 2019, Version of Record 13 December 2019.",https://doi.org/10.1016/j.reseneeco.2019.07.005,Cited by (24),", i.e. post-disaster relief and reconstruction. Through model simulations we assess the costs and benefits of both remedial and preventive actions. We find that preventive intervention leads to higher GDP growth rates than either taking no action or waiting until remedial action is necessary. However, the evidence shows that, due to high costs of early adaptation and budgetary constraints, countries tend to focus on late corrective actions, also relying on international assistance. Given the expected increase in climate-related risks, a comprehensive strategy including both preventive and corrective actions would be desirable to strengthen resilience to shocks and alleviate the financial constraints, which particularly affect small countries.",None,Climate-change adaptation: The role of fiscal policy,https://www.sciencedirect.com/science/article/pii/S0928765518302306,24 July 2019,2019,Research Article,132.0
"Ishimura Yuichi,Takeuchi Kenji","Faculty of Management Information, Kyoto College of Economics, Nishikyo-ku, Kyoto, 610-1195, Japan,Graduate School of Economics, Kobe University, Rokko, Kobe, 657-8501, Japan","Received 19 November 2018, Revised 30 August 2019, Accepted 9 September 2019, Available online 20 September 2019, Version of Record 27 September 2019.",https://doi.org/10.1016/j.reseneeco.2019.101121,Cited by (5),"This study investigates the spatial concentration of waste landfill sites in ==== over two decades. Using a unique dataset of 2164 industrial-waste landfill sites from 1992 to 2012, we find robust evidence of a persistent spatial concentration of sites managed by private companies. The empirical results show that economic factors and the existence of other waste-related facilities have a positive effect on the private landfill site location. Interestingly, this relationship has been fairly stable for twenty years despite a significant decline in the number of sites in operation. In addition, we find that prefectural-level policies tend to decrease the opening of new landfill sites in the area. These results highlight the role of public intervention in mitigating a concentration of facilities that might be undesirable to neighbors.",None,The spatial concentration of waste landfill sites in Japan,https://www.sciencedirect.com/science/article/pii/S0928765518304214,20 September 2019,2019,Research Article,137.0
"van der Meijden Gerard,Withagen Cees","Vrije Universiteit Amsterdam, Tinbergen Institute, The Netherlands,IPAG Business School, Vrije Universiteit Amsterdam, Tinbergen Institute, France","Received 16 June 2018, Revised 7 August 2019, Accepted 12 August 2019, Available online 29 August 2019, Version of Record 7 September 2019.",https://doi.org/10.1016/j.reseneeco.2019.101118,Cited by (12),"The effects of climate policies are often studied under perfect competition and constant marginal extraction costs. In this paper, we allow for monopolistic fossil fuel supply and more general cost functions, which, in the presence of perfectly substitutable renewables, gives rise to limit-pricing behavior. Four phases of supply may exist in equilibrium: sole supply of fossil fuels below the limit price, sole supply of fossil fuels at the limit price, simultaneous supply of fossil fuels and renewables at the limit price, and sole supply of renewables at the limit price. The consequences of climate policies for initial extraction depend on the initial phase: in case of sole supply of fossil fuels at the limit price, a renewables subsidy increases initial extraction, whereas a carbon tax leaves initial extraction unaffected. With simultaneous supply at the limit price or with sole supply of fossil fuels below the limit price, a renewables subsidy and a carbon tax ",None,"Limit pricing, climate policies, and imperfect substitution",https://www.sciencedirect.com/science/article/pii/S0928765518301982,29 August 2019,2019,Research Article,138.0
"Sampson Gabriel S.,Hendricks Nathan P.,Taylor Mykel R.","Department of Agricultural Economics, Kansas State University, 346 Waters Hall, United States,Department of Agricultural Economics, Kansas State University, 326 Waters Hall, United States,Department of Agricultural Economics, Kansas State University, 331D Waters Hall, United States","Received 22 October 2018, Revised 26 July 2019, Accepted 20 August 2019, Available online 25 August 2019, Version of Record 31 August 2019.",https://doi.org/10.1016/j.reseneeco.2019.101120,Cited by (14),We estimate irrigation premiums and implicit marginal valuations of water in-storage using parcel-level transaction data for land sales in the Kansas portion of the High Plains Aquifer. We find that agricultural land values are 53% higher for irrigated parcels than non-irrigated parcels on average and that the irrigation premium has increased at an average rate of 1.0 percentage points per year over the sample period (1988–2015). Spatial heterogeneity in irrigation premiums is explained by differences in saturated thickness of the aquifer. Water in-storage is capitalized into land prices at average marginal values ranging from $3.42/acre-ft to $15.86/acre-ft.,None,Land market valuation of groundwater,https://www.sciencedirect.com/science/article/pii/S0928765518303749,25 August 2019,2019,Research Article,139.0
"Slunge Daniel,Sterner Thomas,Adamowicz Wiktor","Gothenburg Centre for Sustainable Development, University of Gothenburg, Box 170, 405 30, Gothenburg, Sweden,Department of Economics, University of Gothenburg, Box 640, 405 30, Gothenburg, Sweden,Department of Resource Economics and Environmental Sociology, University of Alberta, Edmonton, AB, T6G-2H1, Canada","Received 21 November 2018, Revised 6 August 2019, Accepted 15 August 2019, Available online 24 August 2019, Version of Record 3 September 2019.",https://doi.org/10.1016/j.reseneeco.2019.101119,Cited by (1),"Understanding how changes in baseline risk influence preferences for risk reduction is important when valuing the welfare effects of environmental change, including the spread of disease. We conduct a survey-based choice experiment among respondents residing in areas with different prevalence of ticks and incidence of Lyme borreliosis (LB) and tick-borne encephalitis (TBE) in Sweden. Respondents face a trade-off between risk and travel cost when choosing between visiting recreational areas differing in prevalence of ticks and disease incidence. Our study indicates that the presence of ticks and the associated risk of tick-borne diseases significantly influence the choice of recreational area and have substantial welfare effects. The mean willingness to pay (WTP) per trip to avoid areas with different levels of ticks, LB risk and TBE risk ranges from 12 to 78 EUR. The WTP for risk reduction is significantly lower among respondents residing in risk areas compared to respondents in emerging risk areas. Explanations for these differences in WTP for risk reduction between groups with different baseline risks include differences in reference point utility, knowledge and learning, leading to adaptation of behaviour and preferences.",None,Valuation when baselines are changing: Tick-borne disease risk and recreational choice,https://www.sciencedirect.com/science/article/pii/S0928765518303981,24 August 2019,2019,Research Article,140.0
Boyce John R.,"Professor of Economics, Department of Economics, University of Calgary, 2500 University Drive NW, Calgary, Alberta, T2N 1N4, Canada","Received 24 July 2018, Revised 27 May 2019, Accepted 1 August 2019, Available online 12 August 2019, Version of Record 23 September 2019.",https://doi.org/10.1016/j.reseneeco.2019.101114,Cited by (5),"Classical economists used the “paradox of value” that water is essential to life yet cheap, while diamonds were inessential to life yet dear, to explain how long-run supply is affected by relative abundance. This paper expands upon this theory by developing and estimating a directed technological change (DTC) model to analyze the relative abundance correlations of relative prices, world production, and R&D, as well as their growth rates, for the 87 chemical elements present in the Earth's crust. We show that these imply that the elasticity of substitution between resources and the elasticity of R&D with respect to industry revenues are such that more abundant resources have had larger markets, causing R&D to be biased towards more abundant resources. This explains why the paradox that water has been cheap while diamonds dear has held for centuries, and possibly even for millenia, even though prices have been falling relative to per capita income and per capita production has been rising for nearly all resources.",None,"The paradox of value, directed technical change, and the relative abundance of the chemical elements",https://www.sciencedirect.com/science/article/pii/S0928765518302513,12 August 2019,2019,Research Article,142.0
"Zuo Alec,Qiu Feng,Wheeler Sarah Ann","Centre for Global Food and Resources, The University of Adelaide, Adelaide, SA, 5005, Australia,Department of Resource Economics and Environmental Sociology, Faculty of Agricultural, Life and Environmental Sciences, 509 General Services Building, University of Alberta, Edmonton, Alberta, T6G 2H1, Canada","Received 18 December 2018, Revised 4 July 2019, Accepted 31 July 2019, Available online 11 August 2019, Version of Record 17 September 2019.",https://doi.org/10.1016/j.reseneeco.2019.101113,Cited by (15)," related, while permanent prices were most significantly influenced by previous permanent water prices and current temporary water market prices. A statistically significant negative impact on temporary volume-traded from government water recovery (e.g. a 1% increase in water recovery resulted in a 0.14% reduction in water volume-traded) was found, but no significant impact from government recovery was found on temporary water prices, nor on permanent market prices and volumes. However, government water recovery increased the volatility of temporary market prices and volumes, signaling potential increased issues of risk and uncertainty for irrigators engaging in temporary water markets.",None,"Examining volatility dynamics, spillovers and government water recovery in Murray-Darling Basin water markets",https://www.sciencedirect.com/science/article/pii/S0928765518304585,11 August 2019,2019,Research Article,143.0
"Annicchiarico Barbara,Diluiso Francesca","Università degli Studi di Roma “Tor Vergata”, Dipartimento di Economia e Finanza, Via Columbia 2, 00133 Roma, Italy,Mercator Research Institute on Global Commons and Climate Change (MCC), Torgauer Str. 12-15, 10829 Berlin, Germany","Received 28 February 2019, Revised 19 June 2019, Accepted 21 July 2019, Available online 24 July 2019, Version of Record 22 August 2019.",https://doi.org/10.1016/j.reseneeco.2019.07.006,Cited by (32),This paper presents a dynamic stochastic general equilibrium (DSGE) model of environmental policy for a two-country economy and studies the international transmission of asymmetric shocks considering two different economy-wide greenhouse gases (GHG) emission regulations: a carbon tax and a cap-and-trade system allowing for cross-border exchange of emission permits. We find that international spillovers of shocks are strongly influenced by the environmental regime put in place. The cross-border reaction to shocks is found to be magnified under a carbon tax. The pattern of trade and the underlying monetary regime influence the international transmission channels interacting with the environmental policy adopted.,None,International transmission of the business cycle and environmental policy,https://www.sciencedirect.com/science/article/pii/S0928765519300740,24 July 2019,2019,Research Article,144.0
"Amir Rabah,Gama Adriana,Maret Isabelle","Department of Economics, University of Iowa, IA, United States and School of Business and Economics, Universidad de los Andes, Chile,Centro de Estudios Económicos, El Colegio de México, Mexico,Université de Strasbourg, Université de Lorraine, CNRS, BETA UMR 7522, France","Received 13 July 2018, Revised 29 March 2019, Accepted 11 July 2019, Available online 23 July 2019, Version of Record 14 September 2019.",https://doi.org/10.1016/j.reseneeco.2019.07.003,Cited by (7),"This paper investigates various aspects of a monopolist's pricing and environmental quality choice, as two simultaneous decisions and with each as a separate decision, the other variable being exogenously fixed. Green quality is modeled as in ====, and the present analysis builds on his pioneering work. We contrast the private and the first-best socially optimal solutions. While the latter follows the intuitive property of assigning a higher price to higher quality, the former solution does so under a natural condition of log-supermodular demand. This condition is studied in some detail, and related to properties of an underlying utility function. We complete this characterization of optimal pricing by providing a counter-intuitive example where the two-dimensional interaction is such that the monopolist ends up charging a lower optimal price than the social planner, as well as producing a lower quality. Finally, we investigate respective sufficient conditions under which (i) the private and first-best solutions coincide, and (ii) either one is larger than the other.",None,Environmental quality and monopoly pricing,https://www.sciencedirect.com/science/article/pii/S0928765518302288,23 July 2019,2019,Research Article,145.0
Brehm Paul,"Oberlin College, 233 Rice Hall, 10 N. Professor Street, Oberlin, OH 44074, United States","Received 8 September 2018, Revised 18 June 2019, Accepted 21 June 2019, Available online 18 July 2019, Version of Record 24 September 2019.",https://doi.org/10.1016/j.reseneeco.2019.06.003,Cited by (12),"Between 2007 and 2013 the natural gas price dramatically declined, in large part due to hydraulic fracturing. These lower natural gas prices induced switching from coal generation to natural gas generation. I find that switching caused 2013 carbon emissions to fall by 14,700 tons/h. Lower gas prices also incentivized new investment in natural gas capacity. This less carbon-intensive capital stock led to an additional decrease of 2,100 tons/h in 2013. Using three approaches, I estimate that 65–85% of new capacity was constructed because of lower gas prices. A social cost of carbon of $35/ton values the estimated total decrease in 2013 emissions at roughly $5.1 billion.",None,"Natural gas prices, electric generation investment, and greenhouse gas emissions",https://www.sciencedirect.com/science/article/pii/S0928765518303270,18 July 2019,2019,Research Article,146.0
"Zagórska Katarzyna,Hanley Nick","University of Warsaw, Faculty of Economic Sciences, Dluga 44/50, 00-241, Warsaw, Poland,Charles University, Environment Centre, Prague, Czech Republic,University of Glasgow, Institute of Biodiversity, Animal Health & Comparative Medicine, Glasgow, G12 8QQ, Scotland, UK","Received 9 November 2018, Revised 10 July 2019, Accepted 14 July 2019, Available online 18 July 2019, Version of Record 14 August 2019.",https://doi.org/10.1016/j.reseneeco.2019.07.004,Cited by (39),"Previous research on pro-environmental behaviours has shown that nudges can be effective in changing behaviour in some settings. However, to be a useful policy tool, nudges should have stable, predictable impacts on targeted behaviours. In this paper, we use a randomized experiment to test one specific nudge, namely the communication of a descriptive social norm. The paper examines whether the effects of such a nudge on stated preferences for household recycling are indeed stable and predictable in terms of household willingness to pay for waste collection contracts requiring more recycling effort by households. Three aspects of the social norm are varied: its absolute level, the geographic proximity, and whether relative performance information is included. We find that while respondents generally respond positively to social norm information, the effect is not necessarily monotonic, with the highest social norm levels not necessarily being the most effective, in fact discouraging some respondents from sorting. In addition, whether and how respondents react to the social norm information strongly depends on their current engagement level, with respondents who sort a lot reacting in a negative manner.",None,Social norm nudging and preferences for household recycling,https://www.sciencedirect.com/science/article/pii/S0928765518303993,18 July 2019,2019,Research Article,147.0
"Caplan Arthur J.,Acharya Ramjee","Department of Applied Economics, Utah State University, 4835 Old Main Hill, Logan, UT 84322-4835, United States","Received 15 October 2018, Revised 18 June 2019, Accepted 18 June 2019, Available online 22 June 2019, Version of Record 27 June 2019.",https://doi.org/10.1016/j.reseneeco.2019.06.001,Cited by (3), concentrations along with their corresponding time paths. Our dataset includes a host of pertinent weather variables that determine ,None,Optimal vehicle use in the presence of episodic mobile-source air pollution,https://www.sciencedirect.com/science/article/pii/S0928765518303695,22 June 2019,2019,Research Article,148.0
