name,institution,publish_date,doi,cite,abstract,introduction,Title,Url,Time,Year,Type,Unnamed: 0
"Ahmadiani Mona,Ferreira Susana","Eudaimonia Institute, Wake Forest University, United States,Department of Agricultural and Applied Economics, University of Georgia, United States","Received 24 June 2019, Revised 1 December 2020, Accepted 8 December 2020, Available online 14 December 2020, Version of Record 9 February 2021.",https://doi.org/10.1016/j.reseneeco.2020.101213,Cited by (7),"The increase in weather and climate disasters in recent years has prompted an interest in analyzing their consequences and the mitigation and adaptation measures that can help minimize their potentially large impacts on individuals’ welfare. We match thirty-one billion-dollar disasters with individual survey data from the Behavioral Risk Factor Surveillance System to estimate the effect of extreme weather events on the subjective well-being of U.S. residents. Our results indicate that natural disasters have a negative and robust impact on subjective well-being in the affected communities, and that, on average, this impact peaks 6 months after the event, and then decays over time. We then investigate the attenuating impact of health care access, ====, and governmental assistance programs and find a partial compensating role for risk-transfer and relief measures. We also find that stronger emotional and social support mitigates the negative impact of natural disasters.",None,Well-being effects of extreme weather events in the United States,https://www.sciencedirect.com/science/article/pii/S092876552030422X,14 December 2020,2020,Research Article,75.0
"Wesley Burnett J.,Mothorpe Christopher","Economic Research Service, U.S. Department of Agriculture, 805 Pennsylvania Ave., Kansas City, MO, 64105 United States,Department of Economics, College of Charleston, 5 Liberty Street, 412 Beatty Center, Charleston, SC, 29401, United States","Received 15 April 2020, Revised 3 December 2020, Accepted 4 December 2020, Available online 10 December 2020, Version of Record 3 January 2021.",https://doi.org/10.1016/j.reseneeco.2020.101212,Cited by (6),"Oklahoma’s households have recently faced several thousand higher-probability but low-impact earthquakes induced by nearby shale gas development. This type of seismic activity is different from natural-occurring earthquakes, which are generally constituted by one, high-loss event. We investigate the mechanisms through which earthquakes may influence household perceptions of risk by modeling changes to property values in and out of seismically-active zones. We estimate that the induced earthquakes are spatially concentrated, which is partially influenced by governmental limits placed on natural gas production and wastewater injections. Additionally, we explore the underlying measure of earthquake intensity and identify its importance in modeling seismic impacts. Controlling for the stock-flow dynamics of seismicity through time, we estimate that Oklahoma County’s cumulative experience of earthquakes led to a diminution of property values. The impacts are further exacerbated by risk-saliency effects, as reflected in declining values associated with nearby wastewater injections and natural gas production.",None,"Human-induced earthquakes, risk salience, and housing values",https://www.sciencedirect.com/science/article/pii/S0928765520304218,10 December 2020,2020,Research Article,76.0
"Wang Yiwei,Miao Qing","Department of Economics, Rochester Institute of Technology, One Lomb Memorial Drive, Rochester, NY 14623-5604, United States,Department of Public Policy, Rochester Institute of Technology, One Lomb Memorial Drive, Rochester, NY 14623-5604, United States","Received 10 December 2017, Revised 20 November 2020, Accepted 23 November 2020, Available online 25 November 2020, Version of Record 8 December 2020.",https://doi.org/10.1016/j.reseneeco.2020.101211,Cited by (7),"This paper empirically examines the effect of the U.S. Corporate Average Fuel Economy (CAFE) standards on the technological progress in automobile fuel efficiency. Using detailed vehicle attributes data from 1978 through 2018, we find that more stringent fuel economy standards increase the rate of technological improvements in new passenger cars, and this effect is primarily driven by the response of U.S. automakers. We do not find evidence that CAFE standards have a similar effect on the technical change in light-duty trucks. Our results also indicate that higher gasoline prices have a significant and positive effect on the improvement of fuel-saving technology in both passenger cars and light trucks. Using our empirical estimates, we project that the recent rollback of Obama-era CAFE standards would forego an approximately 2-percent increase in cars’ fuel economy over the 2021–2025 period as a result of technological progress.",None,The impact of the corporate average fuel economy standards on technological changes in automobile fuel efficiency,https://www.sciencedirect.com/science/article/pii/S0928765520304206,25 November 2020,2020,Research Article,77.0
"Fischbacher Urs,Schudy Simeon,Teyssier Sabrina","University of Konstanz, Post Box 131, 78457, Konstanz, Germany,Thurgau Institute of Economics, Hafenstrasse 6, 8280, Kreuzlingen, Switzerland,Department of Economics, LMU Munich, Geschwister-Scholl-Platz 1, D-80539, Munich, Germany,Univ. Grenoble Alpes, INRAE, CNRS, Grenoble INP, GAEL, 38000, Grenoble, France","Received 28 November 2019, Revised 4 July 2020, Accepted 8 September 2020, Available online 10 October 2020, Version of Record 7 November 2020.",https://doi.org/10.1016/j.reseneeco.2020.101202,Cited by (14),"We investigate whether risk, time, environmental, and social preferences affect single-family homeowners’ investments in the energy efficiency of their house using established experimental measures and questionnaires. We find that homeowners who report to be more risk taking are more likely to have renovated their house. Pro-environmental and future-oriented renovators, i.e. renovators with lower discount factors, live in homes with higher energy efficiency. Pro-social preferences as measured in a dictator game relates positively to the energy quality of renovated houses. Controlling for the energy efficiency of houses, we further find that energy consumption as measured by heating and electricity costs is lower for future-oriented and pro-environmental individuals.",None,Heterogeneous preferences and investments in energy saving measures,https://www.sciencedirect.com/science/article/pii/S0928765520304115,10 October 2020,2020,Research Article,78.0
"He Xiaoyang,Poe Gregory L.","Department of Agricultural Economics, Purdue University, United States,Dyson School of Applied Economics and Management, Cornell University, United States","Received 31 August 2018, Revised 15 August 2019, Accepted 20 September 2019, Available online 13 July 2020, Version of Record 1 February 2021.",https://doi.org/10.1016/j.reseneeco.2019.101123,Cited by (2),"This study tests the stability of willingness to pay (WTP) for recreational fishing over two decades based on three rounds of a representative angler survey conducted in New York State in 1988, 1996, and 2007. We employ the travel cost method (TCM) by using the repeated conditional logit and mixed logit models to estimate demand for daily fishing trips. Our estimates suggest that anglers’ WTP for fishing in 1988 and 1996 were similar, with values per trip at $35.2 and $36.4, respectively. However, there was a noticeable decrease in WTP, to $30.6, in 2007. This decrease is consistent with two salient features of the 2007 survey: (1) long-distance trips, such as those to the Great Lakes were less frequent, and (2) anglers were, on average, older than in previous surveys.",None,Exploring the shelf-life of travel cost methods of valuing recreation for benefits transfer,https://www.sciencedirect.com/science/article/pii/S0928765518303130,13 July 2020,2020,Research Article,79.0
"Wu Shang,Palm-Forster Leah H.,Messer Kent D.","Citibank, Wilmington, DE, United States,Department of Applied Economics & Statistics, University of Delaware, Newark, DE, United States","Received 31 August 2018, Revised 1 July 2019, Accepted 2 December 2019, Available online 18 January 2020, Version of Record 1 February 2021.",https://doi.org/10.1016/j.reseneeco.2019.101142,Cited by (5),Greg Poe was a pioneer in using ,None,Impact of peer comparisons and firm heterogeneity on nonpoint source water pollution: An experimental study,https://www.sciencedirect.com/science/article/pii/S092876551830318X,18 January 2020,2020,Research Article,80.0
"Bertone Oehninger Ernst,Lin Lawell C.-Y. Cynthia","University of California at Davis, United States,Cornell University, United States","Received 24 August 2018, Revised 30 July 2019, Accepted 8 December 2019, Available online 31 December 2019, Version of Record 1 February 2021.",https://doi.org/10.1016/j.reseneeco.2019.101147,Cited by (2),"Groundwater is an important natural resource that needs to be managed dynamically. Ideally, institutions governing property rights to the groundwater of low-recharge aquifers should not discourage or disincentivize groundwater users from dynamic management. We develop an empirical model to examine whether agricultural groundwater users faced with prior appropriation property rights to groundwater in western Kansas exhibit dynamic, forward-looking behavior consistent with dynamic management. We find that although farmers are allotted a time-invariant maximum amount of groundwater that they can extract each year, they still behave in a manner consistent with dynamic management. Their groundwater extraction decisions are not significantly affected by the quantity they are authorized to extract, but are instead affected by expected ==== prices, expected future energy prices, and groundwater extraction by neighbors. Our results provide evidence that farmers manage their groundwater resource dynamically, even if their property rights do not necessarily encourage or incentivize them to do so.",None,Property rights and groundwater management in the High Plains Aquifer,https://www.sciencedirect.com/science/article/pii/S0928765518303026,31 December 2019,2019,Research Article,81.0
"Suter Jordan F.,Rouhi Rad Mani,Manning Dale T.,Goemans Chris,Sanderson Matthew R.","Department of Agricultural and Resource Economics, Colorado State University, Fort Collins, CO 80526-1172, USA,Department of Sociology, Anthropology, and Social Work, Kansas State University, Manhattan, KS 66506, USA","Received 15 September 2018, Revised 25 April 2019, Accepted 2 December 2019, Available online 20 December 2019, Version of Record 1 February 2021.",https://doi.org/10.1016/j.reseneeco.2019.101143,Cited by (7),"Groundwater provides vital inputs to crop production and contributes to rural economies throughout the world. Research on the economic benefits associated with groundwater resources has typically focused on the impacts of groundwater availability on the profitability of agricultural production or on the non-market benefits associated with groundwater quality for human consumption. In this research, we use stated-preference methods to investigate the total economic value to agricultural producers of an increase in groundwater availability in the Ogallala Aquifer region. The contingent valuation method allows for estimation of values beyond agricultural profitability, including non-market values such as the ability to leave additional groundwater to future generations. We find a median willingness to pay (WTP) for an additional 100 gallons per minute of well capacity of $77 per well, and that this estimate depends strongly on current well capacity and climate conditions. For counties in hotter and drier regions of the aquifer with low well capacity, median WTP is significantly higher. These results are then used in conjunction with projections of future climate and groundwater availability to generate predicted changes in the WTP for additional groundwater across the aquifer. This research provides important feedback on how the benefits of additional groundwater availability are predicted to change as groundwater resources are diminished in a changing climate.",None,"Depletion, climate, and the incremental value of groundwater",https://www.sciencedirect.com/science/article/pii/S0928765518303403,20 December 2019,2019,Research Article,82.0
"Choi Dong Soon,Ready Richard","Department of Agricultural Economics, Sociology and Education, Pennsylvania State University, United States,Department of Agricultural Economics and Economics and Montana Institute on Ecosystems, Montana State University, United States","Received 23 July 2018, Revised 12 April 2019, Accepted 10 July 2019, Available online 6 September 2019, Version of Record 1 February 2021.",https://doi.org/10.1016/j.reseneeco.2019.07.002,Cited by (6),"Programs to improve water quality do not improve all water bodies equally. Evaluation of the benefits of such programs must account for where improvements occur and the relative magnitude of improvements that occur in different places. This study uses a choice experiment survey to explore how the value to a household of a surface water quality improvement varies as a function of (i) the distance between the household and the affected streams and rivers, (ii) the degree to which the quality of the water has been improved, (iii) how many stream and river miles have been improved, and (iv) the sizes of the affected streams and rivers. Results show evidence that value declines with distance in an approximately linear way, weak evidence that large rivers are worth more than small rivers, and no evidence that willingness-to-pay is nonlinear in either the degree of water quality improvement or the number of stream miles improved. These results indicate that it may be defensible in applied work to value small, spatially-explicit water ==== independently and then sum over projects.",None,"Measuring benefits from spatially-explicit surface water quality improvements: The roles of distance, scope, scale, and size",https://www.sciencedirect.com/science/article/pii/S0928765518302458,6 September 2019,2019,Research Article,83.0
"Li Tongzhe,Fooks Jacob R.,Messer Kent D.,Ferraro Paul J.","Department of Food, Agricultural and Resource Economics, University of Guelph, 50 Stone Road East, Guelph, Ontario N1G 2W1, Canada,Dipodomys Insight, 314 W Summit Ave., Wilmington, DE 19804, Formerly US Department of Agriculture, Economic Research Service, United States,Department of Applied Economics and Statistics, University of Delaware, United States,Carey Business School and the Department of Environmental Health and Engineering, a joint department of the Bloomberg School of Public Health and the Whiting School of Engineering, Johns Hopkins University, United States","Received 31 August 2018, Revised 30 April 2019, Accepted 10 July 2019, Available online 17 August 2019, Version of Record 1 February 2021.",https://doi.org/10.1016/j.reseneeco.2019.07.001,Cited by (6),"Watersheds throughout the world have been severely polluted by nutrient-laden runoff that comes from industrial, agricultural, and residential sources. Efforts to reduce this runoff have focused on industrial and agricultural sources, while little attention has been paid to encouraging residents to reduce runoff from their properties. To study residents’ willingness to adopt landscaping practices that reduce runoff, we conducted a field experiment in the Delaware River watershed. In the experiment, over three hundred adults participated in a series of random-price auctions that revealed their willingness to pay (WTP) for five products that reduce nutrient runoff. To study how WTP can be influenced by attributes of the choice architecture, we randomized the starting bid values (anchors) and the way in which the external benefits of the five practices were framed. Compared to a neutral framing, a positive framing (using the product can improve water quality) increased average WTP by about one-third, while the estimated effect of a negative framing (failing to use the product can worsen water quality) was also positive, but smaller and not statistically different from zero. The estimated effect on average WTP from the anchor depends on how bids of $0 are modeled, but the results imply that higher anchors lead to higher WTP. Although we believe the magnitudes of our results should be considered suggestive and we recommend replications with higher statistical power, the results add to the evidence base that environmental programs can achieve policy-relevant gains in program performance through a series of small changes to the decision environment.",None,A field experiment to estimate the effects of anchoring and framing on residents’ willingness to purchase water runoff management technologies,https://www.sciencedirect.com/science/article/pii/S0928765518303129,17 August 2019,2019,Research Article,85.0
"Wesley Burnett J.,Mothorpe Christopher","Economic Research Service, U.S. Department of Agriculture, United States,Department of Economics, College of Charleston, United States","Available online 2 June 2021, Version of Record 18 August 2021.",https://doi.org/10.1016/j.reseneeco.2021.101247,Cited by (0),None,None,"Corrigendum to “Human-induced earthquakes, risk salience, and housing values” [Resource Energy Econ. 63 (2021) 101212]",https://www.sciencedirect.com/science/article/pii/S0928765521000324,2 June 2021,2021,Research Article,87.0
"Lee David R.,Li Shanjun,Segerson Kathleen,Vossler Christian A.","Dyson School of Applied Economics and Management, SC Johnson College of Business, Cornell University, United States,Department of Economics, University of Connecticut, United States,Department of Economics, University of Tennessee, United States","Available online 8 July 2020, Version of Record 1 February 2021.",https://doi.org/10.1016/j.reseneeco.2020.101190,Cited by (0),None,None,Introduction to valuing and managing the environment: A special issue in honor of Gregory L. Poe,https://www.sciencedirect.com/science/article/pii/S0928765520303158,8 July 2020,2020,Research Article,90.0
"Nasim Sanval,Helfand Steven,Dinar Ariel","Department of Economics, Lahore University of Management Sciences, Khayaban-e-Jinnah, Phase 5 DHA, Lahore, Pakistan,Department of Economics, University of California, Riverside, 900 University Avenue, Riverside, CA 92521, USA,School of Public Policy, University of California, Riverside, 900 University Avenue, Riverside, CA 92521, USA","Received 14 July 2019, Revised 13 August 2020, Accepted 12 October 2020, Available online 16 October 2020, Version of Record 29 October 2020.",https://doi.org/10.1016/j.reseneeco.2020.101203,Cited by (0),"We develop a groundwater extraction model that considers the Marshallian inefficiency associated with sharecropping and use data from Pakistan to simulate the impact of an open access regime and of optimal management on groundwater extractions, the state of the aquifer, and annual net benefits through time. We also evaluate a price instrument as a mechanism of inducing optimal extractions. Under both open access and optimal management, we observe notable differences in groundwater extractions and the water table level between the tenure model (which considers the behavior of both owner cultivators and sharecroppers) and the baseline model (which includes the behavior of only owner cultivators). We also find a modest difference in the aggregate net benefits generated by the two models. The results offer new insights—vis-à-vis ==== heterogeneity—into the evaluation of more effective policies for groundwater management and aquifer sustainability.",None,Groundwater management under heterogeneous land tenure arrangements,https://www.sciencedirect.com/science/article/pii/S0928765520304127,16 October 2020,2020,Research Article,91.0
"Guettabi Mouhcine,James Alexander","Institute of Social and Economic Research and Department of Economics, University of Alaska Anchorage, Anchorage, AK, 99508, United State,Department of Economics & Public Policy, University of Alaska Anchorage, Anchorage, AK 99508, United States","Received 24 March 2019, Revised 23 July 2020, Accepted 24 August 2020, Available online 26 August 2020, Version of Record 18 September 2020.",https://doi.org/10.1016/j.reseneeco.2020.101200,Cited by (3),"Oil booms have been shown to increase local employment and wages. But these effects reflect the aggregated experience of residents, commuters, and recent migrants alike. This paper takes advantage of a unique data set that identifies a rich set of labor market outcomes by place of residence, rather than by place of work. Exploiting this feature of the data, we examine the effect of a major oil boom on employment and wage outcomes in the North Slope Borough of Alaska. This analysis is juxtaposed with a more conventional one that uses place-of-work data collected from the Bureau of Economic Analysis. Using the Synthetic Control Method, we find that the oil boom of the late 2000s significantly increased non-residential employment. While the boom caused residential employment to shift from the public to the private sector, total residential employment was unaffected. There is weak evidence that residential wages increased in response to the boom. These results are important as drilling decisions are often negotiated locally by interest groups that might be less concerned with ==== effects.",None,Who benefits from an oil boom? Evidence from a unique Alaskan data set,https://www.sciencedirect.com/science/article/pii/S0928765519301113,26 August 2020,2020,Research Article,92.0
"Liu Tie-Ying,Lee Chien-Chiang","School of Economics and Management, Beijing Jiaotong University, Beijing, China,Research Center of the Central China for Economic and Social Development, Nanchang University, China,School of Economics and Management, Nanchang University, China","Received 29 January 2019, Revised 7 June 2020, Accepted 4 August 2020, Available online 9 August 2020, Version of Record 19 August 2020.",https://doi.org/10.1016/j.reseneeco.2020.101199,Cited by (38),"This paper uses the sequential panel selection method to examine the convergence of the energy use of 107 countries. It contributes by analyzing the order of convergence and the factors affecting the difference in convergence using improved methods. We provide robust evidence to indicate that seven out of ten countries have been convergent during the period examined, and strong decoupling across countries does not exist. Additionally, high-income and upper-middle-income countries show convergence characteristics earlier than lower middle-income and low-income countries. This means that high-income and upper-middle-income countries are the first to achieve steady-state levels by adjusting their industrial structure and adopting new technologies, and energy exporters have dominant control over energy use. We find that energy-exporting countries converge before energy importers do. These results mean that the energy use of most countries is in accordance with the convergence theory. It also shows that GDP per capita, industrialization level and latitude have great impacts on convergence, especially for industrialization. Our research provides a reference for countries around the world to adjust their energy use policies and to realize a rational flow of energy resources.",None,Convergence of the world’s energy use,https://www.sciencedirect.com/science/article/pii/S0928765519300417,9 August 2020,2020,Research Article,93.0
"Sim Seung-Gyu,Hong Sungwan","Aoyama Gakuin University, 4-4-25 Shibuya, Shibuya-ku, Tokyo 150-8366, Japan,Department of Economics, Pennsylvania State University, United States","Received 2 October 2018, Revised 29 March 2020, Accepted 19 June 2020, Available online 13 July 2020, Version of Record 21 July 2020.",https://doi.org/10.1016/j.reseneeco.2020.101187,Cited by (4),This paper analyzes the welfare implications of abatement technology licensing under taxation and ====. We demonstrate that a firm with a better abatement technology optimally sells a per-unit royalty license to a competitor under both schemes but offers a higher royalty rate under the latter. The emission trading scheme may outperform the taxation scheme regarding social surplus by inducing more production by the licensor and less production by the licensee. These are reversals of the welfare implications suggested by the literature that adopts a partial equilibrium approach or omits either the market for the advanced technology or the final goods.,None,Technology licensing and environmental policy instruments: Price control versus quantity control,https://www.sciencedirect.com/science/article/pii/S0928765518303592,13 July 2020,2020,Research Article,94.0
