name,institution,publish_date,doi,cite,abstract,introduction,Title,Url,Time,Year,Type,Unnamed: 0
"Bruno August,Weber Paige,Yates Andrew J.",University of North Carolinaat Chapel Hill,"Received 28 October 2022, Revised 17 May 2023, Accepted 30 May 2023, Available online 3 June 2023.",https://doi.org/10.1016/j.reseneeco.2023.101376,Cited by (0),"Proponents of Bitcoin argue that demand for electricity from Bitcoin miners can lead to an increase in renewable electricity capacity. We rigorously evaluate this claim by estimating a Bitcoin electricity demand curve and include this demand curve in a long-run model of the Texas electricity market. We find that while Bitcoin mining can indeed increase renewable capacity, it also increases carbon emissions. When Bitcoin miners provide grid management services in the form of demand response, their emissions impact is largely mitigated.",None,Can Bitcoin mining increase renewable electricity capacity,https://www.sciencedirect.com/science/article/pii/S0928765523000313,Available online 3 June 2023,2023,Research Article,0.0
Becker Jonathon M.,"Division of Economics and Business, 816 15th St. Colorado School of Mines Golden, CO 80401, USA","Received 17 May 2022, Revised 26 March 2023, Accepted 13 May 2023, Available online 18 May 2023, Version of Record 30 May 2023.",https://doi.org/10.1016/j.reseneeco.2023.101373,Cited by (0),"Many sectors of the economy that are targets of emissions reduction policy exhibit price-responsive demand, long-lived capital, capacity constraints, and foresighted decision-making. I explore how these features affect the efficiency and dynamics of tradable performance standards (TPS) using analytical and numerical equilibrium models. While I show these dynamic considerations alone do not lead to conflicts with existing theory on the overall efficiency and cost-effectiveness of the TPS relative to a first-best policy, they do affect the transition path and steady state. Most notably, under all but the smallest discount rates, the TPS can lead to a more cost-effective post-transition steady state than the equivalent emissions cap. Given the intergenerational transition that comes with ====, this result suggests some classes of present and future consumers may prefer a TPS to an emissions cap.",None,Tradable performance standards in a dynamic context,https://www.sciencedirect.com/science/article/pii/S0928765523000283,18 May 2023,2023,Research Article,1.0
"Benkhodja Mohamed Tahar,Ma Xiaofei,Razafindrabe Tovonony","ESSCA School of Management, France,University of Rennes, CNRS, CREM UMR6211, F-35000 Rennes, France","Received 24 June 2022, Revised 20 April 2023, Accepted 20 April 2023, Available online 29 April 2023, Version of Record 4 May 2023.",https://doi.org/10.1016/j.reseneeco.2023.101370,Cited by (0),We establish a two-sector model to simulate the potential effects of green fiscal poli- cies and unconventional green ,None,Green monetary and fiscal policies: The role of consumer preferences,https://www.sciencedirect.com/science/article/pii/S0928765523000258,29 April 2023,2023,Research Article,2.0
"Asheim Geir B.,Hartwick John M.,Yamaguchi Rintaro","Department of Economics, University of Oslo, P.O. Box 1095 Blindern, 0317 Oslo, Norway,Department of Economics, Queen’s University, Kingston, Ontario K7L 3N6, Canada,National Institute for Environmental Studies (NIES), 16-2 Onogawa, Tsukuba 305-8506, Japan","Received 22 June 2021, Revised 23 March 2023, Accepted 31 March 2023, Available online 3 April 2023, Version of Record 11 May 2023.",https://doi.org/10.1016/j.reseneeco.2023.101363,Cited by (0),", and the Stollery–d’Autume–Schubert model in which natural capital provides amenities. Application to recent empirical evidence indicates that actual genuine savings might be insufficient to sustain per capita consumption, when future population growth is combined with a large per capita consumption-wage gap.",None,Sustainable per capita consumption under population growth,https://www.sciencedirect.com/science/article/pii/S0928765523000180,3 April 2023,2023,Research Article,3.0
Jones Benjamin A.,"Department of Economics, University of New Mexico, MSC 05 3060, Albuquerque 87131, NM, USA","Received 7 November 2022, Revised 2 March 2023, Accepted 29 March 2023, Available online 31 March 2023, Version of Record 4 April 2023.",https://doi.org/10.1016/j.reseneeco.2023.101362,Cited by (0),"Dust storms are extreme weather events that can lead to sharp short-duration reductions in ====. Is the US and elsewhere, dust storms are becoming more frequent due to climate change and altered land-use patterns. However, our present understanding of their impacts to social welfare is limited. To address this gap, I undertake the first nationwide US study of dust storm impacts on subjective well-being using life satisfaction (LS) data from the CDC Behavioral Risk Factor Surveillance System (BRFSS) over 2005–2010. I find that LS is lower by 0.008 points on a 4-point scale on days when a dust storm occurred in a respondent’s county-of-residence, as identified by the National Weather Service. The observed LS impact is precisely estimated; occurring only on a dust storm event day and not the days immediately before or after. I calculate that individuals are willing-to-pay $111 to avoid a single dust storm event day, on the basis of the estimated well-being externality. I also show that public dust storm alerts on event days can offset more than 50% of the negative LS effect, suggestive of an important role for public risk communication.",None,Dust storms and human well-being,https://www.sciencedirect.com/science/article/pii/S0928765523000179,31 March 2023,2023,Research Article,4.0
"Ambec Stefan,Nauges Céline,Pattanayak Subhrendu K.","Toulouse School of Economics, INRAE, University of Toulouse, France,Sanford School of Public Policy, Duke University and SANDEE (South Asian Network of Development and Environmental Economics), USA","Available online 24 March 2023, Version of Record 5 April 2023.",https://doi.org/10.1016/j.reseneeco.2023.101361,Cited by (0),None,None,Introduction to the SETI special issue,https://www.sciencedirect.com/science/article/pii/S0928765523000167,24 March 2023,2023,Research Article,5.0
"Hoarau Quentin,Meunier Guy","Université Paris-Saclay, INRAE, AgroParisTech, PSAE,EconomiX, UPL, Université Paris-Nanterre, CNRS, France,CREST, Ecole Polytechnique, France","Received 20 January 2022, Revised 25 February 2023, Accepted 28 February 2023, Available online 11 March 2023, Version of Record 24 March 2023.",https://doi.org/10.1016/j.reseneeco.2023.101359,Cited by (0)," linkages. For instance, the carbon footprint of electric vehicles depends on the electricity mix. This issue has received large attention in the literature on ==== (LCA). This paper analyzes how life cycle considerations should be integrated into policy design. We model a partial equilibrium with two vertically connected sectors, an upstream (e.g. electricity) and a downstream (e.g. transportation) one. In each sector, a dirty and a clean technology are available. The clean downstream technology consumes the upstream good and may thus shift emissions to the upstream sector. Our main contribution is to detail how optimal subsidies on clean technologies should incorporate life cycle emissions when carbon pricing is limited. The optimal downstream subsidy should be corrected for all external costs generated in the upstream sector, not only unpriced pollution but also the fiscal externality due to the subsidy to the clean upstream technology. We also analyze the ==== optimization of upstream and downstream policies. The upstream subsidy should not incorporate features of the downstream sector, whereas the downstream optimal subsidy depends upon the upstream sector characteristics. All results are illustrated using a calibrated example of the electrification of passenger cars.",None,Coordination of sectoral climate policies and life cycle emissions,https://www.sciencedirect.com/science/article/pii/S0928765523000143,11 March 2023,2023,Research Article,6.0
Li Wenbo,"Ma Yinchu School of Economics, Tianjin University, 92 Weijin Road, Tianjin 300072, China","Received 12 September 2022, Revised 6 March 2023, Accepted 7 March 2023, Available online 11 March 2023, Version of Record 15 March 2023.",https://doi.org/10.1016/j.reseneeco.2023.101360,Cited by (0)," in exchange for a low transit time and not to choose non-compliance, two behavioral changes with the potential to further reduce air pollution. Thus, managing the duration of a policy and people’s expectations of its duration can matter crucially for the policy’s effectiveness.",None,The effect of China's driving restrictions on air pollution: The role of a policy announcement without a stated expiration,https://www.sciencedirect.com/science/article/pii/S0928765523000155,11 March 2023,2023,Research Article,7.0
"Ba Bocar Samba,Soubeyran Raphael","Center for Research on the Economics of the Environment, Agri-food, Transports and Energy (CREATE), Department of Agricultural Economics and Consumer Sciences, Laval University, 2425, rue de l′Agriculture, Quebec G1V 0A6, Canada,CEE-M, Univ. Montpellier, CNRS, INRAe, Institut Agro, Montpellier, France","Received 14 January 2022, Revised 15 February 2023, Accepted 23 February 2023, Available online 28 February 2023, Version of Record 11 March 2023.",https://doi.org/10.1016/j.reseneeco.2023.101358,Cited by (0),We study the exploitation of recyclable ,None,Hotelling and recycling,https://www.sciencedirect.com/science/article/pii/S0928765523000131,28 February 2023,2023,Research Article,8.0
"Chazel Simon,Bernard Sophie,Benchekroun Hassan","Polytechnique Montreal, Department of Mathematics and Industrial Engineering, Canada and Ecole Polytechnique, France,Polytechnique Montreal, department of Mathematics and Industrial Engineering, and CIRANO, Canada,McGill University, Department of Economics, and CIREQ, Canada","Received 31 March 2022, Revised 23 January 2023, Accepted 26 January 2023, Available online 9 February 2023, Version of Record 18 February 2023.",https://doi.org/10.1016/j.reseneeco.2023.101356,Cited by (0),"What are the implications of primary mineral constraints for the energy transition? Low-carbon energy production uses ====, which requires primary minerals. We build on the seminal framework for the transition from a dirty to a clean energy in Golosov ====. (2014) to incorporate the role played by primary minerals and their potential recycling. We characterize the optimal paths of the energy transition under various mineral constraint scenarios. Mineral constraints limit the development of green energy in the long run: Low-carbon energy production eventually reaches a plateau. We run our simulations using copper as the limiting mineral and we allow for its full recycling. Even in the limiting case of a 100% recycling rate, after five to six decades green energy production is 50% lower than in the scenario with unlimited primary copper, and after 30 decades, GDP is 3–8% lower. In extension scenarios, we confirm that a longer life duration of green capital delays copper extraction and the green energy peak, whereas reduced recycling caps moves the peak in green energy production forward.",None,Energy transition under mineral constraints and recycling: A low-carbon supply peak,https://www.sciencedirect.com/science/article/pii/S0928765523000118,9 February 2023,2023,Research Article,9.0
"Nie Liang,Zhang ZhongXiang","Ma Yinchu School of Economics, Tianjin University, Tianjin, China,China Academy of Energy, Environmental and Industrial Economics, China","Received 23 December 2021, Revised 17 December 2022, Accepted 23 January 2023, Available online 24 January 2023, Version of Record 2 February 2023.",https://doi.org/10.1016/j.reseneeco.2023.101355,Cited by (0),"Existing studies have investigated the environmental dividends of substituting high-speed rail (HSR) for other energy-intensive vehicles from an engineering standpoint, but they have yet to explore the economic effects of HSR and the associated ==== reduction benefits. To fill the research gap, we use panel data from 285 Chinese cities between 2004 and 2014, and employ a spatial difference-in-differences model to empirically examine the impact of HSR opening on industrial CO==== emissions. After controlling for ==== from neighboring HSR cities, our results show that cities offering HSR services significantly reduce their own industrial CO==== emissions. This finding is robust and is unaffected by outliers, control group selection, time trends, geography and expectation factors, or endogeneity. The mechanism test reveals that the structural transformation effect, technological innovation effect, and investment ==== effect are three intermediate influence channels. Further research finds that the emissions reduction benefit increases as the spatial and temporal intensities of HSR openings ascend the ladder, and HSR services have a spillover effect within a 300-kilometer radius. Moreover, the carbon benefit of China’s HSR far surpasses its carbon footprint, indicating that China’s HSR is green after accounting for economic emissions reductions that were often neglected in prior research. Based on these findings, we recommend that China accelerate HSR expansion in order to reduce carbon emissions in a scientific and responsible manner.",None,Is high-speed rail heading towards a low-carbon industry? Evidence from a quasi-natural experiment in China,https://www.sciencedirect.com/science/article/pii/S0928765523000106,24 January 2023,2023,Research Article,10.0
"Holzer Jorge,McConnell Kenneth","Department of Agricultural and Resource Economics, University of Maryland, 2200 Symons Hall, College Park, MD 20742, USA","Received 27 June 2022, Revised 25 October 2022, Accepted 18 December 2022, Available online 21 December 2022, Version of Record 4 January 2023.",https://doi.org/10.1016/j.reseneeco.2022.101345,Cited by (0),"We study the optimal allocation of a resource in a second-best world in which parties may be liquidity-constrained due to credit frictions and capital market imperfections. In this setting, common to various natural resource ====, agents are unable to bid more than their budget regardless of their valuation. While auction markets are widely used mechanisms for allocating natural resource extraction rights and conservation contracts, we show that in these circumstances the competitive market –which allocates items based on rank order of bids– fails to achieve the first-best allocation. The market outcome is welfare-dominated by a hybrid mechanism consisting of random assignment followed by resale in a secondary market. Via the initial lottery, the hybrid-mechanism allocates the items with positive probability to high-valuation low-wealth individuals who would not have been able to afford them in a competitive market. High-valuation high-wealth agents, on the other hand, acquire the items in the secondary market if they do not receive them in the initial lottery. Therefore, equity in the allocation of access to the resource may be justified not only by distributional concerns but also by economic efficiency. We illustrate our model using data from buybacks of harvesting rights in the seafood industry.",None,Extraction rights allocation with liquidity constraints,https://www.sciencedirect.com/science/article/pii/S0928765522000628,21 December 2022,2022,Research Article,11.0
"Sugiyama Yasuyuki,Weng Yungho,Abe Kenzo","Faculty of Economics, Fukui Prefectural University, Japan,Department of Economics, National Chengchi University, Taiwan,Faculty of Economics, Chuo University, Japan","Received 2 December 2020, Revised 10 November 2022, Accepted 28 November 2022, Available online 29 November 2022, Version of Record 8 December 2022.",https://doi.org/10.1016/j.reseneeco.2022.101343,Cited by (0)," level may be positive when the country implements the first best policy combination in a closed economy regarding the environmental tax and the subsidy. (III) The optimal subsidy level may be positive, and then the subsidy may be substitutive for the import tariff on EGs.",None,Optimal policy for environmental goods trade in asymmetric oligopolistic eco-industries,https://www.sciencedirect.com/science/article/pii/S0928765522000604,29 November 2022,2022,Research Article,12.0
"Borghesi Simone,Di Maria Corrado","European University Institute, Florence, and University of Siena, Siena, Italy,School of Economics, University of East Anglia, Norwich, United Kingdom","Available online 15 May 2023, Version of Record 25 May 2023.",https://doi.org/10.1016/j.reseneeco.2023.101372,Cited by (0),None,None,"An environmental Decameron: Introducing the special issue on ‘Carbon pricing, energy efficiency and renewable policies for a decarbonised future’",https://www.sciencedirect.com/science/article/pii/S0928765523000271,15 May 2023,2023,Research Article,14.0
"He Xiaoyang,Khan Muhammad Jawad,Spink Elizabeth M.,Poe Gregory L.","Department of Agricultural Economics, Purdue University, United States,Department of Natural Resources & the Environment, University of New Hampshire, United States,Tufts University, Department of Economics, United States,Dyson School of Applied Economics and Management, Cornell University, United States","Available online 26 October 2022, Version of Record 18 January 2023.",https://doi.org/10.1016/j.reseneeco.2022.101335,Cited by (0),None,None,Corrigendum to “Exploring the shelf-life of travel cost methods of valuing recreation for benefits transfer” [Resour. Energy Econ. 63 (2021) 101123],https://www.sciencedirect.com/science/article/pii/S0928765522000525,26 October 2022,2022,Research Article,17.0
Hill Alexander,"Department of Economics, Arizona State University, Tempe, AZ 85281, United States","Received 7 October 2021, Revised 13 July 2022, Accepted 10 August 2022, Available online 24 August 2022, Version of Record 27 August 2022.",https://doi.org/10.1016/j.reseneeco.2022.101328,Cited by (1),"Using electrification to decarbonize the energy sector potentially alters the pattern of electricity demand. This paper leverages a unique RTO-level, hourly dataset to identify the impact of exogenous changes in load on electricity supply costs. An increase in load variation of 5 % is associated with a 7.35 % increase in the cost of electricity supply. Higher solar and wind generation in a region is found to lower the cost of load variation, with solar having a more significant effect. (JEL Q41, Q49, L94).",None,Smoothing the curve: An estimation of the cost of demand variation and the impact of solar and wind,https://www.sciencedirect.com/science/article/pii/S0928765522000458,24 August 2022,2022,Research Article,18.0
"Adom Philip Kofi,Nsabimana Aimable","Department of Development Policy, School of Public Service and Governance, Ghana Institute of Management and Public Administration (GIMPA), Accra, Ghana,Deputy Vice Chancellor of Administration and Finance, Rwanda Polytechnic (RP), Rwanda & Universsity of Rwanda, Department of Economics, Rwanda","Received 2 July 2020, Revised 12 December 2021, Accepted 19 August 2022, Available online 23 August 2022, Version of Record 27 August 2022.",https://doi.org/10.1016/j.reseneeco.2022.101333,Cited by (1),"The literature on the impact of electricity access are generally inconclusive. Potential causes include geographical differences, limited external validity (due to the focus on small-scale projects) and self-selection bias (due to not accounting for observed and unobserved heterogeneities) of some studies. Moreover, a large part of the literature on energy-gender nexus addresses between-gender instead of within-gender disparity, which is considered relevant because socio-economic characteristics do differ within a particular gender group. We address some of these concerns in the literature, using the endogenous switching regression (as identifying strategy) and the Rwanda national fifth Integrated Household Living Conditions Survey data of 2016/2017 to examine electricity adoption decision and impact of electrification on welfare outcomes in rural Rwanda. We find that having access to electricity impacts positively on equivalised consumption and labour force participation by 3.097 percent and 22 more days, respectively. We find significant positive transitional ====, suggesting that unobserved factors do inflate the estimated impacts. Further, the result reveals significant male – female gap (both in terms of vertical and horizontal changes) in the impact of electrification on labour force participation and equivalised consumption expenditure. We discuss the policy implications.",None,Rural access to electricity and welfare outcomes in Rwanda: Addressing issues of transitional heterogeneities and between and within gender disparities,https://www.sciencedirect.com/science/article/pii/S0928765522000501,23 August 2022,2022,Research Article,19.0
Groh Elke D.,"University of Kassel, Institute of Economics, Nora-Platiel-Str. 5, 34109 Kassel, Germany","Received 14 July 2021, Revised 16 August 2022, Accepted 18 August 2022, Available online 22 August 2022, Version of Record 6 September 2022.",https://doi.org/10.1016/j.reseneeco.2022.101332,Cited by (2)," are installed raise local opposition. A promising way to promote the installation of regional energy plants is the use of regional electricity labels. This paper examines if there is a willingness to pay for regionally produced electricity and whether the willingness to pay is related to exposure to wind turbines or causally affected by regional identity. To that end, this study is based on a large-scale survey among more than 1800 individuals in ==== including a combined priming and stated choice experiment on electricity contracts in combination with official data on wind turbines. The results of the ==== reveal a highly significant willingness to pay a price premium for regional electricity contract attributes. In addition, we find no empirical evidence for a relationship between the exposure to wind turbines and the willingness to pay for regionally produced electricity. Furthermore, the estimation results provide evidence that regional identity reduces the willingness to pay for regionally produced electricity. The results have implications for public policy as well as commercial enterprises.",None,"Exposure to wind turbines, regional identity and the willingness to pay for regionally produced electricity",https://www.sciencedirect.com/science/article/pii/S0928765522000495,22 August 2022,2022,Research Article,20.0
"Abdul Baki Ghina,Marrouch Walid","Department of Economics, University of Ottawa, Canada,Department of Economics, Lebanese American University, Beirut, Lebanon","Received 12 July 2021, Revised 8 August 2022, Accepted 16 August 2022, Available online 18 August 2022, Version of Record 24 August 2022.",https://doi.org/10.1016/j.reseneeco.2022.101329,Cited by (1),"We derive an optimal emission ==== under ==== among polluters, while taking into account the significance of the spatial dimension for non-uniformly mixed pollutants. This setup reflects a large number of pollution scenarios across developed and developing countries. We build a partial equilibrium model that is based on Hotelling’s location model, and that is further generalized to include the polluters’ abatement levels. First, the firms’ locations are considered to be exogenous, but later we relax this assumption. Our results shed light on a trade-off between the environmental externality and the distortions resulting from the ====. This trade-off is modulated by the locations of the two producers as well as preferences for a clean environment. Our results also indicate that, in the presence of more than one market failure, the principle of maximal differentiation is not always guaranteed. We further stress that designing a spatial emission tax is not too demanding in terms of regulator information. Lastly, we reveal that when environmental awareness is well-promoted, the green preference would be a cheaper anti-pollution instrument than emission taxes.",None,Environmental taxation in the Bertrand differentiated duopoly: New insights,https://www.sciencedirect.com/science/article/pii/S092876552200046X,18 August 2022,2022,Research Article,21.0
