,Unnamed: 0,Title,Url,Time,Year,Type
147,147,Non-parametric analysis of serial dependence in time series using ordinal patterns,https://www.sciencedirect.com/science/article/pii/S0167947321002152,8 November 2021,2021,Research Article
148,148,Surrogate space based dimension reduction for nonignorable nonresponse,https://www.sciencedirect.com/science/article/pii/S0167947321002085,4 November 2021,2021,Research Article
149,149,Correcting for sample selection bias in Bayesian distributional regression models,https://www.sciencedirect.com/science/article/pii/S0167947321002164,29 October 2021,2021,Research Article
150,150,Fourier transform sparse inverse regression estimators for sufficient variable selection,https://www.sciencedirect.com/science/article/pii/S0167947321002140,29 October 2021,2021,Research Article
151,151,The general goodness-of-fit tests for correlated data,https://www.sciencedirect.com/science/article/pii/S0167947321002139,29 October 2021,2021,Research Article
152,152,Clustering multivariate functional data using unsupervised binary trees,https://www.sciencedirect.com/science/article/pii/S0167947321002103,28 October 2021,2021,Research Article
153,153,A new normal reference test for linear hypothesis testing in high-dimensional heteroscedastic one-way MANOVA,https://www.sciencedirect.com/science/article/pii/S016794732100219X,27 October 2021,2021,Research Article
154,154,Improving performances of MCMC for Nearest Neighbor Gaussian Process models with full data augmentation,https://www.sciencedirect.com/science/article/pii/S0167947321002024,26 October 2021,2021,Research Article
155,155,A Wilcoxon-Mann-Whitney spatial scan statistic for functional data,https://www.sciencedirect.com/science/article/pii/S0167947321002127,26 October 2021,2021,Research Article
156,156,Confidence intervals for parameters in high-dimensional sparse vector autoregression,https://www.sciencedirect.com/science/article/pii/S0167947321002176,25 October 2021,2021,Research Article
157,157,Uncertainty quantification for honest regression trees,https://www.sciencedirect.com/science/article/pii/S0167947321002115,21 October 2021,2021,Research Article
158,158,Adaptive quantile computation for Brownian bridge in change-point analysis,https://www.sciencedirect.com/science/article/pii/S0167947321002097,21 October 2021,2021,Research Article
159,159,Fast selection of nonlinear mixed effect models using penalized likelihood,https://www.sciencedirect.com/science/article/pii/S0167947321002073,21 October 2021,2021,Research Article
160,160,Collaboration mechanisms and community detection of statisticians based on ERGMs and ,https://www.sciencedirect.com/science/article/pii/S0167947321002061,20 October 2021,2021,Research Article
161,161,K-bMOM: A robust Lloyd-type clustering algorithm based on bootstrap median-of-means,https://www.sciencedirect.com/science/article/pii/S0167947321002048,15 October 2021,2021,Research Article
162,162,Projection quantile correlation and its use in high-dimensional grouped variable screening,https://www.sciencedirect.com/science/article/pii/S0167947321002036,14 October 2021,2021,Research Article
163,163,Parameter estimation and computation of the Fisher information matrix for functions of phase type random variables,https://www.sciencedirect.com/science/article/pii/S0167947321001961,12 October 2021,2021,Research Article
164,164,Mixture additive hazards cure model with latent variables: Application to corporate default data,https://www.sciencedirect.com/science/article/pii/S0167947321001997,11 October 2021,2021,Research Article
165,165,A group comparison in fMRI data using a semiparametric model under shape invariance,https://www.sciencedirect.com/science/article/pii/S016794732100195X,8 October 2021,2021,Research Article
166,166,A study of longitudinal trends in time-frequency transformations of EEG data during a learning experiment,https://www.sciencedirect.com/science/article/pii/S0167947321002012,8 October 2021,2021,Research Article
167,167,Polymatching algorithm in observational studies with multiple treatment groups,https://www.sciencedirect.com/science/article/pii/S0167947321001985,6 October 2021,2021,Research Article
168,168,Oracle-efficient estimation for functional data error distribution with simultaneous confidence band,https://www.sciencedirect.com/science/article/pii/S0167947321001973,4 October 2021,2021,Research Article
169,169,The Wasserstein Impact Measure (WIM): A practical tool for quantifying prior impact in Bayesian statistics,https://www.sciencedirect.com/science/article/pii/S0167947321001869,4 October 2021,2021,Research Article
170,170,Efficient unequal probability resampling from finite populations,https://www.sciencedirect.com/science/article/pii/S0167947321002000,2 October 2021,2021,Research Article
171,171,Model averaging for linear mixed models via augmented Lagrangian,https://www.sciencedirect.com/science/article/pii/S0167947321001857,29 September 2021,2021,Research Article
172,172,Dimension reduction for block-missing data based on sparse sliced inverse regression,https://www.sciencedirect.com/science/article/pii/S0167947321001821,23 September 2021,2021,Research Article
173,173,Hierarchical Bayesian modeling of spatio-temporal area-interaction processes,https://www.sciencedirect.com/science/article/pii/S0167947321001833,20 September 2021,2021,Research Article
174,174,Selective inference for additive and linear mixed models,https://www.sciencedirect.com/science/article/pii/S0167947321001845,17 September 2021,2021,Research Article
175,175,Bayesian beta regression for bounded responses with unknown supports,https://www.sciencedirect.com/science/article/pii/S0167947321001791,10 September 2021,2021,Research Article
176,176,Inference for monotone single-index conditional means: A Lorenz regression approach,https://www.sciencedirect.com/science/article/pii/S016794732100181X,9 September 2021,2021,Research Article
177,177,Model-based sparse coding beyond Gaussian independent model,https://www.sciencedirect.com/science/article/pii/S0167947321001705,9 September 2021,2021,Research Article
178,178,Joint estimation of monotone curves via functional principal component analysis,https://www.sciencedirect.com/science/article/pii/S0167947321001778,9 September 2021,2021,Research Article
179,179,Local logarithm partial likelihood estimation of panel count data model with an unknown link function,https://www.sciencedirect.com/science/article/pii/S0167947321001808,9 September 2021,2021,Research Article
180,180,On principal graphical models with application to gene network,https://www.sciencedirect.com/science/article/pii/S016794732100178X,8 September 2021,2021,Research Article
181,181,Bayesian inference for generalized linear model with linear inequality constraints,https://www.sciencedirect.com/science/article/pii/S0167947321001699,25 August 2021,2021,Research Article
182,182,Power analysis and type I and type II error rates of Bayesian nonparametric two-sample tests for location-shifts based on the Bayes factor under Cauchy priors,https://www.sciencedirect.com/science/article/pii/S0167947321001602,3 August 2021,2021,Research Article
183,183,Bootstrapping multivariate portmanteau tests for vector autoregressive models with weak assumptions on errors,https://www.sciencedirect.com/science/article/pii/S0167947321001559,27 July 2021,2021,Research Article
184,184,Deep learning for quantile regression under right censoring: DeepQuantreg,https://www.sciencedirect.com/science/article/pii/S0167947321001572,27 July 2021,2021,Research Article
185,185,A new classification tree method with interaction detection capability,https://www.sciencedirect.com/science/article/pii/S0167947321001584,27 July 2021,2021,Research Article
186,186,"Bayesian model selection for high-dimensional Ising models, with applications to educational data",https://www.sciencedirect.com/science/article/pii/S0167947321001596,27 July 2021,2021,Research Article
187,187,Efficient estimation in a partially specified nonignorable propensity score model,https://www.sciencedirect.com/science/article/pii/S0167947321001560,21 July 2021,2021,Research Article
188,188,Optimal designs for order-of-addition experiments,https://www.sciencedirect.com/science/article/pii/S0167947321001547,15 July 2021,2021,Research Article
201,201,A more powerful test of equality of high-dimensional two-sample means,https://www.sciencedirect.com/science/article/pii/S0167947321001523,12 July 2021,2021,Research Article
202,202,Inference for partially observed epidemic dynamics guided by Kalman filtering techniques,https://www.sciencedirect.com/science/article/pii/S0167947321001535,12 July 2021,2021,Research Article
203,203,Correlation for tree-shaped datasets and its Bayesian estimation,https://www.sciencedirect.com/science/article/pii/S0167947321001419,5 July 2021,2021,Research Article
204,204,Graph informed sliced inverse regression,https://www.sciencedirect.com/science/article/pii/S0167947321001365,29 June 2021,2021,Research Article
205,205,Outlier detection in networks with missing links,https://www.sciencedirect.com/science/article/pii/S0167947321001420,25 June 2021,2021,Research Article
206,206,Semiparametric least-squares regression with doubly-censored data,https://www.sciencedirect.com/science/article/pii/S0167947321001407,24 June 2021,2021,Research Article
207,207,On efficient exact experimental designs for ordered treatments,https://www.sciencedirect.com/science/article/pii/S0167947321001390,23 June 2021,2021,Research Article
208,208,Projection-averaging-based cumulative covariance and its use in goodness-of-fit testing for single-index models,https://www.sciencedirect.com/science/article/pii/S0167947321001353,18 June 2021,2021,Research Article
209,209,Equivalence class selection of categorical graphical models,https://www.sciencedirect.com/science/article/pii/S0167947321001389,18 June 2021,2021,Research Article
210,210,Covariate balancing functional propensity score for functional treatments in cross-sectional observational studies,https://www.sciencedirect.com/science/article/pii/S0167947321001377,11 June 2021,2021,Research Article
211,211,Categorical CVA biplots,https://www.sciencedirect.com/science/article/pii/S016794732100133X,9 June 2021,2021,Research Article
212,212,Multimodal Bayesian registration of noisy functions using Hamiltonian Monte Carlo,https://www.sciencedirect.com/science/article/pii/S0167947321001328,8 June 2021,2021,Research Article
213,213,Two-sample high dimensional mean test based on prepivots,https://www.sciencedirect.com/science/article/pii/S0167947321001183,2 June 2021,2021,Research Article
214,214,Feature filter for estimating central mean subspace and its sparse solution,https://www.sciencedirect.com/science/article/pii/S0167947321001195,26 May 2021,2021,Research Article
215,215,Assessing the effective sample size for large spatial datasets: A block likelihood approach,https://www.sciencedirect.com/science/article/pii/S016794732100116X,21 May 2021,2021,Research Article
216,216,Fitting jump additive models,https://www.sciencedirect.com/science/article/pii/S0167947321001006,13 May 2021,2021,Research Article
217,217,Distributed one-step upgraded estimation for non-uniformly and non-randomly distributed data,https://www.sciencedirect.com/science/article/pii/S0167947321000992,29 April 2021,2021,Research Article
218,218,Fast and scalable computations for Gaussian hierarchical models with intrinsic conditional autoregressive spatial random effects,https://www.sciencedirect.com/science/article/pii/S0167947321000980,29 April 2021,2021,Research Article
219,219,A motif building process for simulating random networks,https://www.sciencedirect.com/science/article/pii/S0167947321000979,28 April 2021,2021,Research Article
220,220,Bayesian multivariate latent class profile analysis: Exploring the developmental progression of youth depression and substance use,https://www.sciencedirect.com/science/article/pii/S0167947321000955,24 April 2021,2021,Research Article
221,221,Robust communication-efficient distributed composite quantile regression and variable selection for massive data,https://www.sciencedirect.com/science/article/pii/S0167947321000967,22 April 2021,2021,Research Article
222,222,Bayesian subgroup analysis in regression using mixture models,https://www.sciencedirect.com/science/article/pii/S0167947321000864,21 April 2021,2021,Research Article
223,223,Harmless label noise and informative soft-labels in supervised classification,https://www.sciencedirect.com/science/article/pii/S0167947321000876,19 April 2021,2021,Research Article
224,224,Communication-efficient distributed ,https://www.sciencedirect.com/science/article/pii/S0167947321000852,16 April 2021,2021,Research Article
225,225,A Bayesian semiparametric vector Multiplicative Error Model,https://www.sciencedirect.com/science/article/pii/S0167947321000761,15 April 2021,2021,Research Article
226,226,Generalized accelerated hazards mixture cure models with interval-censored data,https://www.sciencedirect.com/science/article/pii/S0167947321000827,14 April 2021,2021,Research Article
227,227,Fast Bayesian inference using Laplace approximations in nonparametric double additive location-scale models with right- and interval-censored data,https://www.sciencedirect.com/science/article/pii/S0167947321000840,14 April 2021,2021,Research Article
228,228,A class of Birnbaum–Saunders type kernel density estimators for nonnegative data,https://www.sciencedirect.com/science/article/pii/S0167947321000839,13 April 2021,2021,Research Article
229,229,A kernel-based measure for conditional mean dependence,https://www.sciencedirect.com/science/article/pii/S0167947321000803,9 April 2021,2021,Research Article
230,230,An ensemble of inverse moment estimators for sufficient dimension reduction,https://www.sciencedirect.com/science/article/pii/S016794732100075X,8 April 2021,2021,Research Article
231,231,Robust MAVE through nonconvex penalized regression,https://www.sciencedirect.com/science/article/pii/S0167947321000815,8 April 2021,2021,Research Article
232,232,Parallel integrative learning for large-scale multi-response regression with incomplete outcomes,https://www.sciencedirect.com/science/article/pii/S0167947321000773,7 April 2021,2021,Research Article
233,233,In the pursuit of sparseness: A new rank-preserving penalty for a finite mixture of factor analyzers,https://www.sciencedirect.com/science/article/pii/S0167947321000785,6 April 2021,2021,Research Article
234,234,Copula Particle Filters,https://www.sciencedirect.com/science/article/pii/S0167947321000645,3 April 2021,2021,Research Article
235,235,Marginal false discovery rate for a penalized transformation survival model,https://www.sciencedirect.com/science/article/pii/S0167947321000669,2 April 2021,2021,Research Article
236,236,Bias-corrected Kullback–Leibler distance criterion based model selection with covariables missing at random,https://www.sciencedirect.com/science/article/pii/S016794732100058X,31 March 2021,2021,Research Article
237,237,Testing error heterogeneity in censored linear regression,https://www.sciencedirect.com/science/article/pii/S0167947321000414,31 March 2021,2021,Research Article
238,238,Composite quantile regression for ultra-high dimensional semiparametric model averaging,https://www.sciencedirect.com/science/article/pii/S0167947321000657,30 March 2021,2021,Research Article
239,239,Latent association graph inference for binary transaction data,https://www.sciencedirect.com/science/article/pii/S0167947321000633,27 March 2021,2021,Research Article
240,240,Bayes linear analysis for ordinary differential equations,https://www.sciencedirect.com/science/article/pii/S0167947321000621,24 March 2021,2021,Research Article
241,241,Frequentist delta-variance approximations with mixed-effects models and TMB,https://www.sciencedirect.com/science/article/pii/S016794732100061X,23 March 2021,2021,Research Article
242,242,Time stable empirical best predictors under a unit-level model,https://www.sciencedirect.com/science/article/pii/S0167947321000608,22 March 2021,2021,Research Article
243,243,FunCC: A new bi-clustering algorithm for functional data with misalignment,https://www.sciencedirect.com/science/article/pii/S0167947321000530,22 March 2021,2021,Research Article
244,244,Robust tests for time series comparison based on Laplace periodograms,https://www.sciencedirect.com/science/article/pii/S0167947321000578,18 March 2021,2021,Research Article
245,245,Robust distributed modal regression for massive data,https://www.sciencedirect.com/science/article/pii/S0167947321000591,18 March 2021,2021,Research Article
246,246,Two-sample test in high dimensions through random selection,https://www.sciencedirect.com/science/article/pii/S0167947321000529,16 March 2021,2021,Research Article
247,247,Ensemble sparse estimation of covariance structure for exploring genetic disease data,https://www.sciencedirect.com/science/article/pii/S0167947321000542,15 March 2021,2021,Research Article
248,248,Generalized ,https://www.sciencedirect.com/science/article/pii/S0167947321000517,10 March 2021,2021,Research Article
249,249,Tests for differential Gaussian Bayesian networks based on quadratic inference functions,https://www.sciencedirect.com/science/article/pii/S0167947321000438,8 March 2021,2021,Research Article
250,250,Nonparametric density estimation and bandwidth selection with B-spline bases: A novel Galerkin method,https://www.sciencedirect.com/science/article/pii/S0167947321000360,5 March 2021,2021,Research Article
251,251,Hypothesis testing of varying coefficients for regional quantiles,https://www.sciencedirect.com/science/article/pii/S0167947321000384,4 March 2021,2021,Research Article
252,252,Promote sign consistency in the joint estimation of precision matrices,https://www.sciencedirect.com/science/article/pii/S016794732100044X,4 March 2021,2021,Research Article
253,253,Tuning-free ridge estimators for high-dimensional generalized linear models,https://www.sciencedirect.com/science/article/pii/S0167947321000396,28 February 2021,2021,Research Article
254,254,Censored mean variance sure independence screening for ultrahigh dimensional survival data,https://www.sciencedirect.com/science/article/pii/S0167947321000402,24 February 2021,2021,Research Article
255,255,Subgroup causal effect identification and estimation via matching tree,https://www.sciencedirect.com/science/article/pii/S0167947321000220,23 February 2021,2021,Research Article
256,256,Deep distribution regression,https://www.sciencedirect.com/science/article/pii/S0167947321000372,22 February 2021,2021,Research Article
257,257,Clusterwise functional linear regression models,https://www.sciencedirect.com/science/article/pii/S0167947321000268,14 February 2021,2021,Research Article
258,258,Confidence intervals for spatial scan statistic,https://www.sciencedirect.com/science/article/pii/S0167947321000190,12 February 2021,2021,Research Article
259,259,Estimating robot strengths with application to selection of alliance members in FIRST robotics competitions,https://www.sciencedirect.com/science/article/pii/S0167947321000153,12 February 2021,2021,Research Article
260,260,High dimensional regression for regenerative time-series: An application to road traffic modeling,https://www.sciencedirect.com/science/article/pii/S0167947321000256,11 February 2021,2021,Research Article
261,261,Explicit-duration Hidden Markov Models for quantum state estimation,https://www.sciencedirect.com/science/article/pii/S0167947321000177,10 February 2021,2021,Research Article
262,262,Clustering with the Average Silhouette Width,https://www.sciencedirect.com/science/article/pii/S0167947321000244,10 February 2021,2021,Research Article
263,263,Robust designs for dose–response studies: Model and labelling robustness,https://www.sciencedirect.com/science/article/pii/S0167947321000232,5 February 2021,2021,Research Article
264,264,Computation of projection regression depth and its induced median,https://www.sciencedirect.com/science/article/pii/S0167947321000189,27 January 2021,2021,Research Article
265,265,Robust variable selection for model-based learning in presence of adulteration,https://www.sciencedirect.com/science/article/pii/S0167947321000207,26 January 2021,2021,Research Article
266,266,A stochastic block model approach for the analysis of multilevel networks: An application to the sociology of organizations,https://www.sciencedirect.com/science/article/pii/S016794732100013X,26 January 2021,2021,Research Article
267,267,Variable selection in finite mixture of regression models with an unknown number of components,https://www.sciencedirect.com/science/article/pii/S0167947321000141,26 January 2021,2021,Research Article
268,268,Mixture of linear experts model for censored data: A novel approach with scale-mixture of normal distributions,https://www.sciencedirect.com/science/article/pii/S0167947321000165,24 January 2021,2021,Research Article
269,269,Unsupervised image segmentation with Gaussian Pairwise Markov Fields,https://www.sciencedirect.com/science/article/pii/S0167947321000128,21 January 2021,2021,Research Article
270,270,Testing conditional mean through regression model sequence using Yanai’s generalized coefficient of determination,https://www.sciencedirect.com/science/article/pii/S0167947321000025,19 January 2021,2021,Research Article
271,271,"Normal variance mixtures: Distribution, density and parameter estimation",https://www.sciencedirect.com/science/article/pii/S0167947321000098,15 January 2021,2021,Research Article
272,272,Partition-based feature screening for categorical data via RKHS embeddings,https://www.sciencedirect.com/science/article/pii/S0167947321000104,14 January 2021,2021,Research Article
273,273,Optimal treatment regimes for competing risk data using doubly robust outcome weighted learning with bi-level variable selection,https://www.sciencedirect.com/science/article/pii/S0167947321000013,14 January 2021,2021,Research Article
274,274,Regression analysis of asynchronous longitudinal data with informative observation processes,https://www.sciencedirect.com/science/article/pii/S0167947320302528,11 January 2021,2021,Research Article
275,275,A new class of stochastic EM algorithms. Escaping local maxima and handling intractable sampling,https://www.sciencedirect.com/science/article/pii/S0167947320302504,9 January 2021,2021,Research Article
276,276,Approximate computation of projection depths,https://www.sciencedirect.com/science/article/pii/S0167947320302577,9 January 2021,2021,Research Article
277,277,Principal component analysis using frequency components of multivariate time series,https://www.sciencedirect.com/science/article/pii/S0167947320302553,6 January 2021,2021,Research Article
278,278,Sum of Kronecker products representation and its Cholesky factorization for spatial covariance matrices from large grids,https://www.sciencedirect.com/science/article/pii/S0167947320302565,6 January 2021,2021,Research Article
279,279,Community detection via an efficient nonconvex optimization approach based on modularity,https://www.sciencedirect.com/science/article/pii/S0167947320302541,30 December 2020,2020,Research Article
280,280,Regression analysis of censored data with nonignorable missing covariates and application to Alzheimer Disease,https://www.sciencedirect.com/science/article/pii/S0167947320302486,27 December 2020,2020,Research Article
281,281,Gaussian Bayesian network comparisons with graph ordering unknown,https://www.sciencedirect.com/science/article/pii/S0167947320302474,26 December 2020,2020,Research Article
282,282,A flexible factor analysis based on the class of mean-mixture of normal distributions,https://www.sciencedirect.com/science/article/pii/S016794732030253X,19 December 2020,2020,Research Article
283,283,SIMEX estimation in parametric modal regression with measurement error,https://www.sciencedirect.com/science/article/pii/S0167947320302498,19 December 2020,2020,Research Article
284,284,Two-sample tests for multivariate functional data with applications,https://www.sciencedirect.com/science/article/pii/S0167947320302516,19 December 2020,2020,Research Article
285,285,Estimation of high dimensional factor model with multiple threshold-type regime shifts,https://www.sciencedirect.com/science/article/pii/S0167947320302449,17 December 2020,2020,Research Article
286,286,A mapping-based universal Kriging model for order-of-addition experiments in drug combination studies,https://www.sciencedirect.com/science/article/pii/S0167947320302462,14 December 2020,2020,Research Article
287,287,Communication-efficient distributed estimator for generalized linear models with a diverging number of covariates,https://www.sciencedirect.com/science/article/pii/S0167947320302450,13 December 2020,2020,Research Article
288,288,Fast Bayesian estimation of spatial count data models,https://www.sciencedirect.com/science/article/pii/S0167947320302437,13 December 2020,2020,Research Article
289,289,Compromise design for combination experiment of two drugs,https://www.sciencedirect.com/science/article/pii/S0167947320302413,28 November 2020,2020,Research Article
290,290,Embedding and learning with signatures,https://www.sciencedirect.com/science/article/pii/S0167947320302395,25 November 2020,2020,Research Article
291,291,A novel method of marginalisation using low discrepancy sequences for integrated nested Laplace approximations,https://www.sciencedirect.com/science/article/pii/S0167947320302383,21 November 2020,2020,Research Article
292,292,A non-parametric test for comparing conditional ROC curves,https://www.sciencedirect.com/science/article/pii/S0167947320302371,19 November 2020,2020,Research Article
293,293,Fast inference for semi-varying coefficient models via local averaging,https://www.sciencedirect.com/science/article/pii/S0167947320302176,18 November 2020,2020,Research Article
