,Unnamed: 0,Title,Url,Time,Year,Type
294,294,Semiparametric quantile regression using family of quantile-based asymmetric densities,https://www.sciencedirect.com/science/article/pii/S0167947320302206,18 November 2020,2020,Research Article
295,295,Analysis of multivariate longitudinal data using ARMA Cholesky and hypersphere decompositions,https://www.sciencedirect.com/science/article/pii/S0167947320302358,18 November 2020,2020,Research Article
296,296,Iterative GMM for partially linear single-index models with partly endogenous regressors,https://www.sciencedirect.com/science/article/pii/S016794732030236X,18 November 2020,2020,Research Article
297,297,Dimension-reduced semiparametric estimation of distribution functions and quantiles with nonignorable nonresponse,https://www.sciencedirect.com/science/article/pii/S0167947320302334,12 November 2020,2020,Research Article
298,298,Causal network learning with non-invertible functional relationships,https://www.sciencedirect.com/science/article/pii/S0167947320302322,12 November 2020,2020,Research Article
299,299,A nonparametric empirical Bayes approach to large-scale multivariate regression,https://www.sciencedirect.com/science/article/pii/S0167947320302218,9 November 2020,2020,Research Article
300,300,Graphical modelling and partial characteristics for multitype and multivariate-marked spatio-temporal point processes,https://www.sciencedirect.com/science/article/pii/S0167947320302309,9 November 2020,2020,Research Article
301,301,Kendall regression coefficient,https://www.sciencedirect.com/science/article/pii/S0167947320302310,9 November 2020,2020,Research Article
302,302,Dimension reduction in binary response regression: A joint modeling approach,https://www.sciencedirect.com/science/article/pii/S016794732030222X,7 November 2020,2020,Research Article
303,303,Density estimation on a network,https://www.sciencedirect.com/science/article/pii/S016794732030219X,4 November 2020,2020,Research Article
304,304,Decrement rates and a numerical method under competing risks,https://www.sciencedirect.com/science/article/pii/S0167947320302164,2 November 2020,2020,Research Article
305,305,Variable selection for generalized odds rate mixture cure models with interval-censored failure time data,https://www.sciencedirect.com/science/article/pii/S0167947320302061,26 October 2020,2020,Research Article
306,306,Clustering for time-varying relational count data,https://www.sciencedirect.com/science/article/pii/S0167947320302140,22 October 2020,2020,Research Article
307,307,Parallel cross-validation: A scalable fitting method for Gaussian process models,https://www.sciencedirect.com/science/article/pii/S0167947320302048,22 October 2020,2020,Research Article
308,308,Variable selection in high-dimensional linear model with possibly asymmetric errors,https://www.sciencedirect.com/science/article/pii/S0167947320302036,14 October 2020,2020,Research Article
309,309,"Efficient and robust estimation of regression and scale parameters, with outlier detection",https://www.sciencedirect.com/science/article/pii/S016794732030205X,14 October 2020,2020,Research Article
310,310,A beyond multiple robust approach for missing response problem,https://www.sciencedirect.com/science/article/pii/S0167947320302024,13 October 2020,2020,Research Article
311,311,Angle-based cost-sensitive multicategory classification,https://www.sciencedirect.com/science/article/pii/S0167947320301985,13 October 2020,2020,Research Article
312,312,Smooth simultaneous confidence band for the error distribution function in nonparametric regression,https://www.sciencedirect.com/science/article/pii/S0167947320301973,9 October 2020,2020,Research Article
313,313,Joint generalized estimating equations for longitudinal binary data,https://www.sciencedirect.com/science/article/pii/S0167947320302012,8 October 2020,2020,Research Article
314,314,A Bayesian goodness-of-fit test for regression,https://www.sciencedirect.com/science/article/pii/S016794732030195X,7 October 2020,2020,Research Article
315,315,Link-based survival additive models under mixed censoring to assess risks of hospital-acquired infections,https://www.sciencedirect.com/science/article/pii/S0167947320301833,6 October 2020,2020,Research Article
316,316,Functional time series model identification and diagnosis by means of auto- and partial autocorrelation analysis,https://www.sciencedirect.com/science/article/pii/S0167947320301997,5 October 2020,2020,Research Article
317,317,A self-calibrated direct approach to precision matrix estimation and linear discriminant analysis in high dimensions,https://www.sciencedirect.com/science/article/pii/S0167947320301961,30 September 2020,2020,Research Article
318,318,MM algorithms for distance covariance based sufficient dimension reduction and sufficient variable selection,https://www.sciencedirect.com/science/article/pii/S0167947320301808,28 September 2020,2020,Research Article
319,319,Simplified R-vine based forward regression,https://www.sciencedirect.com/science/article/pii/S0167947320301821,28 September 2020,2020,Research Article
320,320,Robust variable selection with exponential squared loss for the spatial autoregressive model,https://www.sciencedirect.com/science/article/pii/S0167947320301857,28 September 2020,2020,Research Article
321,321,A general robust t-process regression model,https://www.sciencedirect.com/science/article/pii/S0167947320301845,24 September 2020,2020,Research Article
322,322,Statistical inference for inter-arrival times of extreme events in bursty time series,https://www.sciencedirect.com/science/article/pii/S0167947320301870,19 September 2020,2020,Research Article
323,323,Goodness-of-fit test for latent block models,https://www.sciencedirect.com/science/article/pii/S016794732030181X,19 September 2020,2020,Research Article
324,324,Laplace approximations for fast Bayesian inference in generalized additive models based on P-splines,https://www.sciencedirect.com/science/article/pii/S0167947320301791,11 September 2020,2020,Research Article
325,325,On data-driven choice of ,https://www.sciencedirect.com/science/article/pii/S016794732030178X,9 September 2020,2020,Research Article
326,326,Learning high-dimensional Gaussian linear structural equation models with heterogeneous error variances,https://www.sciencedirect.com/science/article/pii/S0167947320301754,6 September 2020,2020,Research Article
327,327,Linearly preconditioned nonlinear conjugate gradient acceleration of the PX-EM algorithm,https://www.sciencedirect.com/science/article/pii/S016794732030147X,4 September 2020,2020,Research Article
328,328,Hierarchical copulas with Archimedean blocks and asymmetric between-block pairs,https://www.sciencedirect.com/science/article/pii/S0167947320301626,3 September 2020,2020,Research Article
329,329,Evaluating multiplicative error models: A residual-based approach,https://www.sciencedirect.com/science/article/pii/S0167947320301778,3 September 2020,2020,Research Article
330,330,Bayesian regularization of Gaussian graphical models with measurement error,https://www.sciencedirect.com/science/article/pii/S0167947320301766,3 September 2020,2020,Research Article
331,331,Prediction of non-stationary response functions using a Bayesian composite Gaussian process,https://www.sciencedirect.com/science/article/pii/S0167947320301742,1 September 2020,2020,Research Article
332,332,An adaptive decorrelation procedure for signal detection,https://www.sciencedirect.com/science/article/pii/S0167947320301730,29 August 2020,2020,Research Article
333,333,A semi-parametric estimation method for the quantile spectrum with an application to earthquake classification using convolutional neural network,https://www.sciencedirect.com/science/article/pii/S0167947320301602,29 August 2020,2020,Research Article
334,334,Vecchia–Laplace approximations of generalized Gaussian processes for big non-Gaussian spatial data,https://www.sciencedirect.com/science/article/pii/S0167947320301729,28 August 2020,2020,Research Article
335,335,Rank-based tests of cross-sectional dependence in panel data models,https://www.sciencedirect.com/science/article/pii/S0167947320301614,27 August 2020,2020,Research Article
336,336,Distributed subdata selection for big data via sampling-based approach,https://www.sciencedirect.com/science/article/pii/S0167947320301638,27 August 2020,2020,Research Article
337,337,Conditional score matching for high-dimensional partial graphical models,https://www.sciencedirect.com/science/article/pii/S0167947320301572,21 August 2020,2020,Research Article
338,338,Two sample tests for high-dimensional autocovariances,https://www.sciencedirect.com/science/article/pii/S0167947320301584,20 August 2020,2020,Research Article
339,339,Hybrid safe–strong rules for efficient optimization in lasso-type problems,https://www.sciencedirect.com/science/article/pii/S0167947320301547,19 August 2020,2020,Research Article
340,340,Penalised maximum likelihood estimation in multi-state models for interval-censored data,https://www.sciencedirect.com/science/article/pii/S0167947320301481,19 August 2020,2020,Research Article
341,341,Improved confidence regions in meta-analysis of diagnostic test accuracy,https://www.sciencedirect.com/science/article/pii/S0167947320301596,19 August 2020,2020,Research Article
342,342,Robust boosting for regression problems,https://www.sciencedirect.com/science/article/pii/S0167947320301560,18 August 2020,2020,Research Article
343,343,Fixed design local polynomial smoothing and bandwidth selection for right censored data,https://www.sciencedirect.com/science/article/pii/S0167947320301559,17 August 2020,2020,Research Article
344,344,Penalized logspline density estimation using total variation penalty,https://www.sciencedirect.com/science/article/pii/S0167947320301511,15 August 2020,2020,Research Article
345,345,An algorithm for non-parametric estimation in state–space models,https://www.sciencedirect.com/science/article/pii/S0167947320301535,13 August 2020,2020,Research Article
346,346,Weighted rank estimation for nonparametric transformation models with nonignorable missing data,https://www.sciencedirect.com/science/article/pii/S0167947320301523,12 August 2020,2020,Research Article
347,347,An algorithm for blocking regular fractional factorial 2-level designs with clear two-factor interactions,https://www.sciencedirect.com/science/article/pii/S016794732030150X,11 August 2020,2020,Research Article
348,348,Estimating scale-invariant directed dependence of bivariate distributions,https://www.sciencedirect.com/science/article/pii/S0167947320301493,9 August 2020,2020,Research Article
349,349,The impact of genetic diversity statistics on model selection between coalescents,https://www.sciencedirect.com/science/article/pii/S0167947320301468,30 July 2020,2020,Research Article
350,350,Estimation of regional transition probabilities for spatial dynamic microsimulations from survey data lacking in regional detail,https://www.sciencedirect.com/science/article/pii/S0167947320301390,18 July 2020,2020,Research Article
363,363,Estimation of the additive hazards model with case ,https://www.sciencedirect.com/science/article/pii/S0167947319302464,28 November 2019,2019,Research Article
364,364,Smoothed empirical likelihood inference and variable selection for quantile regression with nonignorable missing response,https://www.sciencedirect.com/science/article/pii/S0167947319302439,25 November 2019,2019,Research Article
365,365,A least squares-type density estimator using a polynomial function,https://www.sciencedirect.com/science/article/pii/S0167947319302373,23 November 2019,2019,Research Article
366,366,A goodness-of-fit test for zero-inflated Poisson mixed effects models in tree abundance studies,https://www.sciencedirect.com/science/article/pii/S0167947319302427,22 November 2019,2019,Research Article
367,367,A high-dimensional spatial rank test for two-sample location problems,https://www.sciencedirect.com/science/article/pii/S0167947319302440,21 November 2019,2019,Research Article
368,368,Computing confidence intervals from massive data via penalized quantile smoothing splines,https://www.sciencedirect.com/science/article/pii/S0167947319302403,20 November 2019,2019,Research Article
369,369,Bayesian inference of a directional brain network model for intracranial EEG data,https://www.sciencedirect.com/science/article/pii/S0167947319302026,15 November 2019,2019,Research Article
370,370,Efficient computation for differential network analysis with applications to quadratic discriminant analysis,https://www.sciencedirect.com/science/article/pii/S0167947319302397,15 November 2019,2019,Research Article
371,371,Structured analysis of the high-dimensional FMR model,https://www.sciencedirect.com/science/article/pii/S0167947319302385,13 November 2019,2019,Research Article
372,372,A multivariate normal regression model for survival data subject to different types of dependent censoring,https://www.sciencedirect.com/science/article/pii/S0167947319302348,4 November 2019,2019,Research Article
373,373,Structural learning of contemporaneous dependencies in graphical VAR models,https://www.sciencedirect.com/science/article/pii/S016794731930235X,2 November 2019,2019,Research Article
374,374,Semiparametric estimation for the non-mixture cure model in case-cohort and nested case-control studies,https://www.sciencedirect.com/science/article/pii/S0167947319302294,23 October 2019,2019,Research Article
375,375,Bayesian bridge-randomized penalized quantile regression,https://www.sciencedirect.com/science/article/pii/S0167947319302312,23 October 2019,2019,Research Article
376,376,Empirical likelihood for partially linear single-index models with missing observations,https://www.sciencedirect.com/science/article/pii/S0167947319302324,23 October 2019,2019,Research Article
377,377,Bootstrapping kernel intensity estimation for inhomogeneous point processes with spatial covariates,https://www.sciencedirect.com/science/article/pii/S0167947319302300,22 October 2019,2019,Research Article
378,378,Model-based co-clustering for mixed type data,https://www.sciencedirect.com/science/article/pii/S016794731930221X,18 October 2019,2019,Research Article
379,379,A two-piece normal measurement error model,https://www.sciencedirect.com/science/article/pii/S016794731930218X,14 October 2019,2019,Research Article
380,380,Motor unit number estimation via sequential Monte Carlo,https://www.sciencedirect.com/science/article/pii/S0167947319302002,14 October 2019,2019,Research Article
381,381,Bayesian analysis of spatial generalized linear mixed models with Laplace moving average random fields,https://www.sciencedirect.com/science/article/pii/S0167947319302166,11 October 2019,2019,Research Article
382,382,Single-index modal regression via outer product gradients,https://www.sciencedirect.com/science/article/pii/S0167947319302221,11 October 2019,2019,Research Article
383,383,Regression analysis of interval-censored failure time data with time-dependent covariates,https://www.sciencedirect.com/science/article/pii/S0167947319302038,11 October 2019,2019,Research Article
384,384,A comparison of general-purpose optimization algorithms for finding optimal approximate experimental designs,https://www.sciencedirect.com/science/article/pii/S0167947319301999,10 October 2019,2019,Research Article
385,385,Conditional maximum likelihood estimation for semiparametric transformation models with doubly truncated data,https://www.sciencedirect.com/science/article/pii/S0167947319302178,9 October 2019,2019,Research Article
386,386,Approximate filtering of conditional intensity process for Poisson count data: Application to urban crime,https://www.sciencedirect.com/science/article/pii/S0167947319302051,8 October 2019,2019,Research Article
387,387,Ensemble quantile classifier,https://www.sciencedirect.com/science/article/pii/S016794731930204X,5 October 2019,2019,Research Article
388,388,Bayesian modeling and computation for analyte quantification in complex mixtures using Raman spectroscopy,https://www.sciencedirect.com/science/article/pii/S0167947319302014,1 October 2019,2019,Research Article
389,389,Determining the Number of Effective Parameters in Kernel Density Estimation,https://www.sciencedirect.com/science/article/pii/S0167947319301987,30 September 2019,2019,Research Article
390,390,A Bayesian mixture model for clustering circular data,https://www.sciencedirect.com/science/article/pii/S0167947319301975,27 September 2019,2019,Research Article
391,391,Data-cloning SMC,https://www.sciencedirect.com/science/article/pii/S0167947319301963,25 September 2019,2019,Research Article
392,392,Bayesian variable selection in non-homogeneous hidden Markov models through an evolutionary Monte Carlo method,https://www.sciencedirect.com/science/article/pii/S0167947319301951,23 September 2019,2019,Research Article
393,393,The Zipf–Poisson-stopped-sum distribution with an application for modeling the degree sequence of social networks,https://www.sciencedirect.com/science/article/pii/S0167947319301938,18 September 2019,2019,Research Article
394,394,Approximate least squares estimation for spatial autoregressive models with covariates,https://www.sciencedirect.com/science/article/pii/S0167947319301884,18 September 2019,2019,Research Article
395,395,Rothman–Woodroofe symmetry test statistic revisited,https://www.sciencedirect.com/science/article/pii/S0167947319301926,16 September 2019,2019,Research Article
396,396,Variations of power-expected-posterior priors in normal regression models,https://www.sciencedirect.com/science/article/pii/S0167947319301914,12 September 2019,2019,Research Article
397,397,Robust Wald-type methods for testing equality between two populations regression parameters: A comparative study under the logistic model,https://www.sciencedirect.com/science/article/pii/S0167947319301744,7 September 2019,2019,Research Article
398,398,Generating random correlation matrices with fixed values: An application to the evaluation of multivariate surrogate endpoints,https://www.sciencedirect.com/science/article/pii/S0167947319301896,3 September 2019,2019,Research Article
399,399,Sparse principal component based high-dimensional mediation analysis,https://www.sciencedirect.com/science/article/pii/S0167947319301902,3 September 2019,2019,Research Article
400,400,Robust test for dispersion parameter change in discretely observed diffusion processes,https://www.sciencedirect.com/science/article/pii/S0167947319301872,2 September 2019,2019,Research Article
401,401,A nonparametric feature screening method for ultrahigh-dimensional missing response,https://www.sciencedirect.com/science/article/pii/S0167947319301756,28 August 2019,2019,Research Article
402,402,A multilayer exponential random graph modelling approach for weighted networks,https://www.sciencedirect.com/science/article/pii/S0167947319301720,14 August 2019,2019,Research Article
403,403,Feature screening for ultrahigh dimensional categorical data with covariates missing at random,https://www.sciencedirect.com/science/article/pii/S0167947319301719,13 August 2019,2019,Research Article
404,404,Semiparametric model of mean residual life with biased sampling data,https://www.sciencedirect.com/science/article/pii/S0167947319301732,13 August 2019,2019,Research Article
405,405,Approximate maximum likelihood estimation of a threshold diffusion process,https://www.sciencedirect.com/science/article/pii/S0167947319301707,12 August 2019,2019,Research Article
406,406,Quantile based dimension reduction in censored regression,https://www.sciencedirect.com/science/article/pii/S0167947319301653,9 August 2019,2019,Research Article
407,407,Semiparametric model for covariance regression analysis,https://www.sciencedirect.com/science/article/pii/S0167947319301628,8 August 2019,2019,Research Article
408,408,On parsimonious models for modeling matrix data,https://www.sciencedirect.com/science/article/pii/S0167947319301690,6 August 2019,2019,Research Article
409,409,Solution paths for the generalized lasso with applications to spatially varying coefficients regression,https://www.sciencedirect.com/science/article/pii/S0167947319301689,4 August 2019,2019,Research Article
410,410,Estimation of the ROC curve from the Lehmann family,https://www.sciencedirect.com/science/article/pii/S0167947319301677,31 July 2019,2019,Research Article
411,411,Variational nonparametric discriminant analysis,https://www.sciencedirect.com/science/article/pii/S0167947319301641,29 July 2019,2019,Research Article
412,412,Generalized ,https://www.sciencedirect.com/science/article/pii/S0167947319301665,28 July 2019,2019,Research Article
413,413,Uncertainty quantification using Bayesian neural networks in classification: Application to biomedical image segmentation,https://www.sciencedirect.com/science/article/pii/S016794731930163X,28 July 2019,2019,Research Article
414,414,A partial correlation vine based approach for modeling and forecasting multivariate volatility time-series,https://www.sciencedirect.com/science/article/pii/S0167947319301550,25 July 2019,2019,Research Article
415,415,Function-on-function quadratic regression models,https://www.sciencedirect.com/science/article/pii/S0167947319301616,24 July 2019,2019,Research Article
416,416,An efficient ADMM algorithm for high dimensional precision matrix estimation via penalized quadratic loss,https://www.sciencedirect.com/science/article/pii/S0167947319301574,23 July 2019,2019,Research Article
417,417,Time-dependent Poisson reduced rank models for political text data analysis,https://www.sciencedirect.com/science/article/pii/S0167947319301586,22 July 2019,2019,Research Article
418,418,f-SAEM: A fast stochastic approximation of the EM algorithm for nonlinear mixed effects models,https://www.sciencedirect.com/science/article/pii/S0167947319301483,19 July 2019,2019,Research Article
419,419,Common sampling orders of regular vines with application to model selection,https://www.sciencedirect.com/science/article/pii/S0167947319301562,18 July 2019,2019,Research Article
420,420,Detecting and testing altered brain connectivity networks with k-partite network topology,https://www.sciencedirect.com/science/article/pii/S0167947319301410,9 July 2019,2019,Research Article
421,421,Fused variable screening for massive imbalanced data,https://www.sciencedirect.com/science/article/pii/S0167947319301471,8 July 2019,2019,Research Article
422,422,High-dimensional structure learning of binary pairwise Markov networks: A comparative numerical study,https://www.sciencedirect.com/science/article/pii/S016794731930146X,5 July 2019,2019,Research Article
423,423,Conditional absolute mean calibration for partial linear multiplicative distortion measurement errors models,https://www.sciencedirect.com/science/article/pii/S0167947319301434,4 July 2019,2019,Research Article
424,424,Multiplicative bias correction for asymmetric kernel density estimators revisited,https://www.sciencedirect.com/science/article/pii/S0167947319301446,4 July 2019,2019,Research Article
425,425,Data-driven model checking for errors-in-variables varying-coefficient models with replicate measurements,https://www.sciencedirect.com/science/article/pii/S0167947319301379,2 July 2019,2019,Research Article
426,426,On bootstrap consistency of MAVE for single index models,https://www.sciencedirect.com/science/article/pii/S0167947319301367,27 June 2019,2019,Research Article
437,437,Introducing article numbering to Computational Statistics and Data Analysis,https://www.sciencedirect.com/science/article/pii/S0167947319302129,10 October 2019,2019,Research Article
440,440,Robust sufficient dimension reduction via ball covariance,https://www.sciencedirect.com/science/article/pii/S0167947319301380,27 June 2019,2019,Research Article
441,441,"LASSO-type penalization in the framework of generalized additive models for location, scale and shape",https://www.sciencedirect.com/science/article/pii/S0167947319301392,26 June 2019,2019,Research Article
442,442,Semiparametric regression analysis for left-truncated and interval-censored data without or with a cure fraction,https://www.sciencedirect.com/science/article/pii/S0167947319301409,21 June 2019,2019,Research Article
443,443,Model-based clustering of censored data via mixtures of factor analyzers,https://www.sciencedirect.com/science/article/pii/S0167947319301355,19 June 2019,2019,Research Article
444,444,A novel MM algorithm and the mode-sharing method in Bayesian computation for the analysis of general incomplete categorical data,https://www.sciencedirect.com/science/article/pii/S0167947319300969,31 May 2019,2019,Research Article
445,445,Fast multivariate log-concave density estimation,https://www.sciencedirect.com/science/article/pii/S0167947319300891,30 May 2019,2019,Research Article
446,446,Goodness-of-fit tests for the family of multivariate chi-square copulas,https://www.sciencedirect.com/science/article/pii/S0167947319300921,28 May 2019,2019,Research Article
447,447,Weighted covariance matrix estimation,https://www.sciencedirect.com/science/article/pii/S0167947319301070,23 May 2019,2019,Research Article
448,448,Regularized joint estimation of related vector autoregressive models,https://www.sciencedirect.com/science/article/pii/S0167947319301185,22 May 2019,2019,Research Article
449,449,Estimation and test of jump discontinuities in varying coefficient models with empirical applications,https://www.sciencedirect.com/science/article/pii/S0167947319301148,21 May 2019,2019,Research Article
450,450,Minimum distance estimation of locally stationary moving average processes,https://www.sciencedirect.com/science/article/pii/S0167947319301161,21 May 2019,2019,Research Article
451,451,Prediction based on conditional distributions of vine copulas,https://www.sciencedirect.com/science/article/pii/S0167947319301057,20 May 2019,2019,Research Article
