,Unnamed: 0,Title,Url,Time,Year,Type
588,588,"Products liability, consumer misperceptions, and the allocation of consumers to firms",https://www.sciencedirect.com/science/article/pii/S0165176520304183,25 November 2020,2020,Research Article
589,589,Breaking the zero lower bound period: The shift across two unconventional policies,https://www.sciencedirect.com/science/article/pii/S016517652030433X,25 November 2020,2020,Research Article
590,590,Exclusive shortlisting choice with reference,https://www.sciencedirect.com/science/article/pii/S0165176520304353,25 November 2020,2020,Research Article
591,591,"Privacy, adoption, and truthful reporting: A simple theory of contact tracing applications",https://www.sciencedirect.com/science/article/pii/S0165176520304365,25 November 2020,2020,Research Article
592,592,The role of expenditure duration in fiscal multipliers over the business cycle,https://www.sciencedirect.com/science/article/pii/S0165176520304201,24 November 2020,2020,Research Article
593,593,Testing the causes of betrayal aversion,https://www.sciencedirect.com/science/article/pii/S0165176520304237,24 November 2020,2020,Research Article
594,594,Towards a solution concept for network formation games,https://www.sciencedirect.com/science/article/pii/S0165176520304316,24 November 2020,2020,Research Article
595,595,Forecasting US economic growth in downturns using cross-country data,https://www.sciencedirect.com/science/article/pii/S0165176520304286,23 November 2020,2020,Research Article
596,596,The collateral channel: Dynamic effects of housing market on entrepreneurship,https://www.sciencedirect.com/science/article/pii/S0165176520304213,20 November 2020,2020,Research Article
597,597,MIT shocks imply market incompleteness,https://www.sciencedirect.com/science/article/pii/S0165176520304262,20 November 2020,2020,Research Article
598,598,Efficient estimation of multi-level models with strictly exogenous explanatory variables,https://www.sciencedirect.com/science/article/pii/S0165176520304274,20 November 2020,2020,Research Article
599,599,Income-based inequality of adolescent obesity in Australia,https://www.sciencedirect.com/science/article/pii/S0165176520304250,19 November 2020,2020,Research Article
600,600,Causal effects of an absent crowd on performances and refereeing decisions during Covid-19,https://www.sciencedirect.com/science/article/pii/S0165176520304249,19 November 2020,2020,Research Article
601,601,A test of symmetry based on L-moments with an application to the business cycles of the G7 economies,https://www.sciencedirect.com/science/article/pii/S0165176520304225,18 November 2020,2020,Research Article
602,602,Local institutional quality and economic growth: A panel-VAR analysis of Italian NUTS-3 regions,https://www.sciencedirect.com/science/article/pii/S0165176520304195,17 November 2020,2020,Research Article
603,603,Guilt through association: Reputational contagion and the Boeing 737-MAX disasters,https://www.sciencedirect.com/science/article/pii/S0165176520304171,12 November 2020,2020,Research Article
604,604,A panel frontier system model with good and bad outputs and endogenous treatment decision,https://www.sciencedirect.com/science/article/pii/S0165176520304092,11 November 2020,2020,Research Article
605,605,Life-cycle welfare losses from rules-of-thumb asset allocation,https://www.sciencedirect.com/science/article/pii/S0165176520304158,10 November 2020,2020,Research Article
606,606,Correlation neglect in voting decisions: An experiment,https://www.sciencedirect.com/science/article/pii/S016517652030416X,10 November 2020,2020,Research Article
607,607,Effects of Fed policy rate forecasts on real yields and inflation expectations at the zero lower bound,https://www.sciencedirect.com/science/article/pii/S0165176520304146,4 November 2020,2020,Research Article
608,608,Promoting green or restricting gray? An analysis of green portfolio standards,https://www.sciencedirect.com/science/article/pii/S0165176520304109,2 November 2020,2020,Research Article
609,609,A note on habit: Veblen and Dewey,https://www.sciencedirect.com/science/article/pii/S016517652030402X,28 October 2020,2020,Research Article
610,610,Loss aversion fails to replicate in the coronavirus pandemic: Evidence from an online experiment,https://www.sciencedirect.com/science/article/pii/S0165176520302706,24 July 2020,2020,Research Article
612,612,Corrigendum to “Smoothed LSDV estimation of functional-coefficient panel data models with two-way fixed effects” [Econom. Lett. 192 (2020) 109239],https://www.sciencedirect.com/science/article/pii/S0165176521004110,2 November 2021,2021,Research Article
614,614,Corrigendum to “Disclosure policies in research contests with stochastic entry” [Econom. Lett. 191 (2020) 109122],https://www.sciencedirect.com/science/article/pii/S0165176521003530,21 September 2021,2021,Research Article
615,615,Corrigendum to “Disclosure policies in all-pay auctions with bid caps and stochastic entry” [Econom. Lett. 186 (2020) 108805],https://www.sciencedirect.com/science/article/pii/S0165176521003542,20 September 2021,2021,Research Article
619,619,Corrigendum to “Respect for experts vs. respect for unanimity” [Econ. Lett. 151 (2017) 44–47],https://www.sciencedirect.com/science/article/pii/S016517652100241X,28 June 2021,2021,Research Article
626,626,Corrigendum to “The impact of building energy codes on household electricity expenditures” [Econom. Lett. 186 (2020) 108841],https://www.sciencedirect.com/science/article/pii/S016517652100015X,22 January 2021,2021,Research Article
628,628,A location model with an endogenous dummy variable,https://www.sciencedirect.com/science/article/pii/S0165176520302871,10 August 2020,2020,Research Article
629,629,Forecasting large covariance matrix with high-frequency data using factor approach for the correlation matrix,https://www.sciencedirect.com/science/article/pii/S016517652030286X,8 August 2020,2020,Research Article
630,630,Structural vector autoregressive models with more shocks than variables identified via heteroskedasticity,https://www.sciencedirect.com/science/article/pii/S0165176520302834,7 August 2020,2020,Research Article
631,631,Does data protection legislation increase the quality of internet services?,https://www.sciencedirect.com/science/article/pii/S0165176520302846,6 August 2020,2020,Research Article
632,632,Licensing with skill acquisition,https://www.sciencedirect.com/science/article/pii/S0165176520302822,5 August 2020,2020,Research Article
633,633,The effects of outward FDI and export on firm productivity in emerging markets: Evidence from matching approach,https://www.sciencedirect.com/science/article/pii/S0165176520302858,5 August 2020,2020,Research Article
634,634,Rare disaster concerns and economic fluctuations,https://www.sciencedirect.com/science/article/pii/S0165176520302810,3 August 2020,2020,Research Article
635,635,Inflation expectations in euro area Phillips curves,https://www.sciencedirect.com/science/article/pii/S0165176520302780,3 August 2020,2020,Research Article
636,636,Determinants of excess reserve holdings,https://www.sciencedirect.com/science/article/pii/S0165176520302731,1 August 2020,2020,Research Article
637,637,Optimal contract for outsourcing information acquisition,https://www.sciencedirect.com/science/article/pii/S0165176520302755,29 July 2020,2020,Research Article
638,638,Welfare maximizing allocation without transfers,https://www.sciencedirect.com/science/article/pii/S016517652030272X,29 July 2020,2020,Research Article
639,639,The asymmetric effects of monetary policy on the business cycle: Evidence from the panel smoothed quantile regression model,https://www.sciencedirect.com/science/article/pii/S0165176520302792,29 July 2020,2020,Research Article
640,640,An axiomatic approach to cost sharing child support,https://www.sciencedirect.com/science/article/pii/S0165176520302809,29 July 2020,2020,Research Article
641,641,Helicopter money in Europe: New evidence on the marginal propensity to consume across European households,https://www.sciencedirect.com/science/article/pii/S0165176520302603,25 July 2020,2020,Research Article
642,642,Financial crises and economic recovery: Cross-country heterogeneity and cross-sectional dependence,https://www.sciencedirect.com/science/article/pii/S0165176520302718,24 July 2020,2020,Research Article
643,643,Fixed costs matter even when the costs are sunk,https://www.sciencedirect.com/science/article/pii/S0165176520302688,23 July 2020,2020,Research Article
644,644,On the identification of joint distributions using marginals and aggregates,https://www.sciencedirect.com/science/article/pii/S016517652030269X,22 July 2020,2020,Research Article
645,645,Kolmogorov–Smirnov type test for generated variables,https://www.sciencedirect.com/science/article/pii/S0165176520302500,21 July 2020,2020,Research Article
646,646,Mobility Zones,https://www.sciencedirect.com/science/article/pii/S0165176520302664,18 July 2020,2020,Research Article
647,647,Quantile selection in non-linear GMM quantile models,https://www.sciencedirect.com/science/article/pii/S0165176520302470,16 July 2020,2020,Research Article
648,648,Communication frictions in banking organizations: Evidence from credit score lending,https://www.sciencedirect.com/science/article/pii/S0165176520302585,16 July 2020,2020,Research Article
649,649,Manipulative agendas in four-candidate elections,https://www.sciencedirect.com/science/article/pii/S0165176520302615,16 July 2020,2020,Research Article
650,650,Equal loss under separatorization and egalitarian values,https://www.sciencedirect.com/science/article/pii/S0165176520302652,15 July 2020,2020,Research Article
651,651,When does ambiguity fade away?,https://www.sciencedirect.com/science/article/pii/S0165176520302512,11 July 2020,2020,Research Article
652,652,Asymptotically efficient root estimators for spatial autoregressive models with spatial autoregressive disturbances,https://www.sciencedirect.com/science/article/pii/S0165176520302482,9 July 2020,2020,Research Article
653,653,A nonparametric maximum likelihood estimation for biased-sampling data with zero-inflated truncation,https://www.sciencedirect.com/science/article/pii/S0165176520302494,9 July 2020,2020,Research Article
654,654,Who pays for my lies? Comparing dishonesty at the expense of the experimenter and fellow subjects,https://www.sciencedirect.com/science/article/pii/S0165176520302421,8 July 2020,2020,Research Article
655,655,The global effects of Covid-19-induced uncertainty,https://www.sciencedirect.com/science/article/pii/S0165176520302457,7 July 2020,2020,Research Article
656,656,Intangibles and the UK under-investment puzzle: Evidence from firm-level panel data,https://www.sciencedirect.com/science/article/pii/S0165176520302445,7 July 2020,2020,Research Article
657,657,Decomposing the large firm wage premium in Germany,https://www.sciencedirect.com/science/article/pii/S0165176520302330,7 July 2020,2020,Research Article
658,658,Power imbalances in French food retailing: Evidence from a production function approach to estimate market power,https://www.sciencedirect.com/science/article/pii/S0165176520302433,6 July 2020,2020,Research Article
659,659,Reconsidering the role of choice and chance for predicting retirement wealth,https://www.sciencedirect.com/science/article/pii/S0165176520302408,6 July 2020,2020,Research Article
660,660,Elasticity of attention and optimal monetary policy,https://www.sciencedirect.com/science/article/pii/S0165176520302469,6 July 2020,2020,Research Article
661,661,Price dispersion in bitcoin exchanges,https://www.sciencedirect.com/science/article/pii/S0165176520302391,6 July 2020,2020,Research Article
662,662,Optimal legal standards for competition policy revisited,https://www.sciencedirect.com/science/article/pii/S0165176520302299,4 July 2020,2020,Research Article
663,663,Productivity and welfare in an overlapping generations model with housing,https://www.sciencedirect.com/science/article/pii/S0165176520302378,3 July 2020,2020,Research Article
664,664,Was the mid-2000s drop in the British job change rate genuine or a survey design effect?,https://www.sciencedirect.com/science/article/pii/S016517652030241X,3 July 2020,2020,Research Article
665,665,On the consistency of the logistic quasi-MLE under conditional symmetry,https://www.sciencedirect.com/science/article/pii/S0165176520302317,3 July 2020,2020,Research Article
666,666,Inflation and income inequality in a variety-expansion growth model with menu costs,https://www.sciencedirect.com/science/article/pii/S0165176520302366,3 July 2020,2020,Research Article
667,667,Posterior probabilities: Dominance and optimism,https://www.sciencedirect.com/science/article/pii/S0165176520302263,3 July 2020,2020,Research Article
668,668,Targeted disclosure and monetary policy flexibility: A simple model,https://www.sciencedirect.com/science/article/pii/S0165176520302354,3 July 2020,2020,Research Article
669,669,The impact of quantitative and qualitative easing on term structure: Evidence from micro-level data,https://www.sciencedirect.com/science/article/pii/S0165176520302238,2 July 2020,2020,Research Article
670,670,Unpolluted decisions: Air quality and judicial outcomes in China,https://www.sciencedirect.com/science/article/pii/S0165176520302342,2 July 2020,2020,Research Article
671,671,Financial integration in Europe through the lens of composite indicators,https://www.sciencedirect.com/science/article/pii/S0165176520302226,30 June 2020,2020,Research Article
672,672,Estimating the welfare costs of autarky: A sufficient statistics approach,https://www.sciencedirect.com/science/article/pii/S0165176520302305,30 June 2020,2020,Research Article
673,673,The silent majority?,https://www.sciencedirect.com/science/article/pii/S0165176520302251,26 June 2020,2020,Research Article
674,674,Strategic delegation in successive oligopolies with differentiated firms,https://www.sciencedirect.com/science/article/pii/S0165176520302287,26 June 2020,2020,Research Article
675,675,Cultural distance and income divergence over time,https://www.sciencedirect.com/science/article/pii/S016517652030224X,26 June 2020,2020,Research Article
676,676,A time-varying diffusion index forecasting model,https://www.sciencedirect.com/science/article/pii/S0165176520302172,25 June 2020,2020,Research Article
677,677,Distinguishing between breaks in the mean and breaks in persistence under long memory,https://www.sciencedirect.com/science/article/pii/S0165176520302196,25 June 2020,2020,Research Article
678,678,Commuting speed as a proxy for the value of time,https://www.sciencedirect.com/science/article/pii/S0165176520302214,24 June 2020,2020,Research Article
679,679,The minimum wage and DI claims,https://www.sciencedirect.com/science/article/pii/S0165176520302275,24 June 2020,2020,Research Article
680,680,(Consistently) testing strict exogeneity against the alternative of predeterminedness in linear time-series models,https://www.sciencedirect.com/science/article/pii/S0165176520302184,24 June 2020,2020,Research Article
681,681,Using externally collected vignettes to account for reporting heterogeneity in survey self-assessment,https://www.sciencedirect.com/science/article/pii/S0165176520302147,22 June 2020,2020,Research Article
682,682,Smooth coefficient estimation of stochastic frontier models,https://www.sciencedirect.com/science/article/pii/S0165176520302202,22 June 2020,2020,Research Article
683,683,Sunspot-driven fat tails: A note,https://www.sciencedirect.com/science/article/pii/S0165176520302032,20 June 2020,2020,Research Article
684,684,The adaptive investment effect: Evidence from Chinese provinces,https://www.sciencedirect.com/science/article/pii/S0165176520302160,19 June 2020,2020,Research Article
685,685,Task arrangement in team competitions,https://www.sciencedirect.com/science/article/pii/S0165176520302159,18 June 2020,2020,Research Article
686,686,Do state-owned enterprises influence technological development?,https://www.sciencedirect.com/science/article/pii/S0165176520302044,18 June 2020,2020,Research Article
687,687,An alternative test for conditional unconfoundedness using auxiliary variables,https://www.sciencedirect.com/science/article/pii/S0165176520302111,17 June 2020,2020,Research Article
688,688,Semiparametric identification and estimation of discrete choice models for bundles,https://www.sciencedirect.com/science/article/pii/S0165176520302123,15 June 2020,2020,Research Article
689,689,Diversification and bank stability,https://www.sciencedirect.com/science/article/pii/S0165176520302081,13 June 2020,2020,Research Article
690,690,Temptation-biased preferences for risk and time,https://www.sciencedirect.com/science/article/pii/S0165176520301944,13 June 2020,2020,Research Article
691,691,Overlapping efforts in the EU Emissions Trading System,https://www.sciencedirect.com/science/article/pii/S0165176520302135,12 June 2020,2020,Research Article
692,692,The Nordhaus test with many zeros,https://www.sciencedirect.com/science/article/pii/S0165176520302056,11 June 2020,2020,Research Article
693,693,Forecasting US recessions: The role of economic uncertainty,https://www.sciencedirect.com/science/article/pii/S0165176520302020,9 June 2020,2020,Research Article
694,694,Chaos control in presence of financial bubbles,https://www.sciencedirect.com/science/article/pii/S0165176520302093,8 June 2020,2020,Research Article
695,695,Testing the automation revolution hypothesis,https://www.sciencedirect.com/science/article/pii/S0165176520301919,6 June 2020,2020,Research Article
696,696,A fast and low computational memory algorithm for non-stochastic simulations in heterogeneous agent models,https://www.sciencedirect.com/science/article/pii/S0165176520301907,5 June 2020,2020,Research Article
697,697,Has consumption inequality mirrored wealth inequality in the Survey of Consumer Finances?,https://www.sciencedirect.com/science/article/pii/S0165176520301920,4 June 2020,2020,Research Article
698,698,Do changes in terms of trade impact election outcomes?,https://www.sciencedirect.com/science/article/pii/S0165176520301932,4 June 2020,2020,Research Article
699,699,"Consumer equilibrium, random choice and hemi-Bayesian revision rule",https://www.sciencedirect.com/science/article/pii/S0165176520301877,3 June 2020,2020,Research Article
700,700,Commodity price volatility and the economic uncertainty of pandemics,https://www.sciencedirect.com/science/article/pii/S0165176520301890,3 June 2020,2020,Research Article
701,701,School attendance during a pandemic,https://www.sciencedirect.com/science/article/pii/S0165176520301853,2 June 2020,2020,Research Article
702,702,"Welfare, leisure and unemployment",https://www.sciencedirect.com/science/article/pii/S0165176520301865,2 June 2020,2020,Research Article
703,703,Unpleasant arithmetic of socially responsible investment,https://www.sciencedirect.com/science/article/pii/S0165176520301889,2 June 2020,2020,Research Article
704,704,Shifting supports in Esö and Szentes (2007),https://www.sciencedirect.com/science/article/pii/S0165176520301737,30 May 2020,2020,Research Article
705,705,Employment double dividend hypothesis with the presence of a trade union,https://www.sciencedirect.com/science/article/pii/S0165176520301841,29 May 2020,2020,Research Article
706,706,Global economic activity indexes revisited,https://www.sciencedirect.com/science/article/pii/S0165176520301828,29 May 2020,2020,Research Article
707,707,A note on discontinuity and approximate equilibria in games with infinitely many players,https://www.sciencedirect.com/science/article/pii/S0165176520301816,28 May 2020,2020,Research Article
708,708,Lumpy investment and expected stock returns,https://www.sciencedirect.com/science/article/pii/S0165176520301798,28 May 2020,2020,Research Article
709,709,Production network structure and the impact of the monetary policy shocks: Evidence from the OECD,https://www.sciencedirect.com/science/article/pii/S016517652030183X,28 May 2020,2020,Research Article
710,710,Fixed income ETFs: Primary market participation and resilience of liquidity during periods of stress,https://www.sciencedirect.com/science/article/pii/S0165176520301725,28 May 2020,2020,Research Article
711,711,Music sentiment and stock returns,https://www.sciencedirect.com/science/article/pii/S0165176520301774,25 May 2020,2020,Research Article
712,712,O-SII designation and deposit funding costs,https://www.sciencedirect.com/science/article/pii/S0165176520301786,25 May 2020,2020,Research Article
713,713,Modelling errors in survey and administrative data on employment earnings: Sensitivity to the fraction assumed to have error-free earnings,https://www.sciencedirect.com/science/article/pii/S0165176520301749,25 May 2020,2020,Research Article
714,714,Equilibrium stability in a nonlinear cobweb model,https://www.sciencedirect.com/science/article/pii/S0165176520301063,25 May 2020,2020,Research Article
715,715,The state-dependence of output revisions,https://www.sciencedirect.com/science/article/pii/S0165176520301592,23 May 2020,2020,Research Article
716,716,The judiciary system as a productivity factor; the European experience,https://www.sciencedirect.com/science/article/pii/S0165176520301762,23 May 2020,2020,Research Article
717,717,Coastal amenities and income stratification,https://www.sciencedirect.com/science/article/pii/S0165176520301683,22 May 2020,2020,Research Article
718,718,The spirit of capitalism and optimal capital taxation,https://www.sciencedirect.com/science/article/pii/S0165176520301695,22 May 2020,2020,Research Article
719,719,Settling with salience-biased defendants,https://www.sciencedirect.com/science/article/pii/S0165176520301658,21 May 2020,2020,Research Article
720,720,Alternating-offer bargaining with endogenous commitment,https://www.sciencedirect.com/science/article/pii/S0165176520301713,20 May 2020,2020,Research Article
721,721,On the credit-to-GDP gap and spurious medium-term cycles,https://www.sciencedirect.com/science/article/pii/S0165176520301701,20 May 2020,2020,Research Article
722,722,From Gibrat’s law to Zipf’s law through cointegration?,https://www.sciencedirect.com/science/article/pii/S0165176520301531,19 May 2020,2020,Research Article
723,723,When does the private provision of a public good prevent conflict?,https://www.sciencedirect.com/science/article/pii/S0165176520301609,19 May 2020,2020,Research Article
724,724,Peer influence on dividend policy: Evidence from the Chinese stock market,https://www.sciencedirect.com/science/article/pii/S0165176520301622,19 May 2020,2020,Research Article
725,725,Sectoral shifts and comovements in employment,https://www.sciencedirect.com/science/article/pii/S016517652030152X,19 May 2020,2020,Research Article
726,726,Smoothed LSDV estimation of functional-coefficient panel data models with two-way fixed effects,https://www.sciencedirect.com/science/article/pii/S0165176520301671,18 May 2020,2020,Research Article
727,727,A modified Wilcoxon test for change points in long-range dependent time series,https://www.sciencedirect.com/science/article/pii/S016517652030166X,16 May 2020,2020,Research Article
728,728,Bank credit and economic growth: Short-run evidence from a dynamic threshold panel model,https://www.sciencedirect.com/science/article/pii/S0165176520301610,16 May 2020,2020,Research Article
729,729,Weighted component-wise solutions for graph games,https://www.sciencedirect.com/science/article/pii/S0165176520301646,15 May 2020,2020,Research Article
730,730,Estimating dynamic binary choice models using irregularly spaced panel data,https://www.sciencedirect.com/science/article/pii/S0165176520301567,12 May 2020,2020,Research Article
731,731,Advertising expenses and operational performance: Evidence from the global hotel industry,https://www.sciencedirect.com/science/article/pii/S0165176520301579,11 May 2020,2020,Research Article
732,732,Time-varying cointegration with an application to the UK Great Ratios,https://www.sciencedirect.com/science/article/pii/S0165176520301543,8 May 2020,2020,Research Article
733,733,What does “doing business” really measure? Evidence from trade times,https://www.sciencedirect.com/science/article/pii/S0165176520301555,8 May 2020,2020,Research Article
734,734,How important are worker gross flows between public and private sector?,https://www.sciencedirect.com/science/article/pii/S0165176520301506,7 May 2020,2020,Research Article
735,735,Social efficiency of entry in a vertically related industry revisited,https://www.sciencedirect.com/science/article/pii/S0165176520301488,7 May 2020,2020,Research Article
736,736,Optimal contracts with contingent allocation,https://www.sciencedirect.com/science/article/pii/S016517652030149X,7 May 2020,2020,Research Article
737,737,Auctions vs. negotiations in vertically related markets,https://www.sciencedirect.com/science/article/pii/S0165176520301476,7 May 2020,2020,Research Article
738,738,Voting over redistribution in the Meltzer–Richard model under interdependent labor inputs,https://www.sciencedirect.com/science/article/pii/S0165176520301518,7 May 2020,2020,Research Article
739,739,Talking to influence,https://www.sciencedirect.com/science/article/pii/S0165176520301403,5 May 2020,2020,Research Article
740,740,Demographic change and political polarization in the United States,https://www.sciencedirect.com/science/article/pii/S0165176520301385,4 May 2020,2020,Research Article
741,741,"Income, wages and household production theory",https://www.sciencedirect.com/science/article/pii/S0165176520301397,4 May 2020,2020,Research Article
742,742,Testing firm-level data quality in China against Benford’s Law,https://www.sciencedirect.com/science/article/pii/S0165176520301361,4 May 2020,2020,Research Article
743,743,Vertical integration without intrafirm trade,https://www.sciencedirect.com/science/article/pii/S016517652030135X,1 May 2020,2020,Research Article
