,Unnamed: 0,Title,Url,Time,Year,Type
0,0,The Bank of Japan’s equity purchases and stock price crash risk,https://www.sciencedirect.com/science/article/pii/S0165176523002392,Available online 9 June 2023,2023,Research Article
1,1,The greening of lending: Evidence from banks’ pricing of energy efficiency before climate-related regulation,https://www.sciencedirect.com/science/article/pii/S0165176523002379,Available online 9 June 2023,2023,Research Article
2,2,Do asset-backed stablecoins spread crypto volatility to traditional financial assets? Evidence from Tether,https://www.sciencedirect.com/science/article/pii/S0165176523002380,Available online 9 June 2023,2023,Research Article
3,3,Fertility subsidies can have ambiguous effects on birth timing,https://www.sciencedirect.com/science/article/pii/S0165176523002409,Available online 8 June 2023,2023,Research Article
4,4,Optimal policy with dispersed information and uncertain monetary transmission,https://www.sciencedirect.com/science/article/pii/S016517652300229X,Available online 7 June 2023,2023,Research Article
5,5,"Market size, competition, and entrepreneurs’ location choices",https://www.sciencedirect.com/science/article/pii/S0165176523002288,Available online 7 June 2023,2023,Research Article
6,6,The role of macroeconomic uncertainty in the determination of the natural rate of interest,https://www.sciencedirect.com/science/article/pii/S0165176523002161,Available online 1 June 2023,2023,Research Article
7,7,The effect of late payment penalties on the payment timing of owed taxes,https://www.sciencedirect.com/science/article/pii/S0165176523002252,Available online 1 June 2023,2023,Research Article
8,8,A formula for the elasticity of substitution of a large class of smooth utility functions,https://www.sciencedirect.com/science/article/pii/S0165176523002215,1 June 2023,2023,Research Article
9,9,Limits to Myopic loss aversion and learning,https://www.sciencedirect.com/science/article/pii/S016517652300215X,30 May 2023,2023,Research Article
10,10,Financial-judicial specialization and corporate misconduct: Evidence from the establishment of the Shanghai Financial Court,https://www.sciencedirect.com/science/article/pii/S0165176523002239,Available online 30 May 2023,2023,Research Article
11,11,Familiarity bias and economic decisions: Evidence from a survey experiment,https://www.sciencedirect.com/science/article/pii/S0165176523002227,30 May 2023,2023,Research Article
12,12,Variable trading hours and market reactions to earnings announcements,https://www.sciencedirect.com/science/article/pii/S0165176523002240,Available online 30 May 2023,2023,Research Article
13,13,The impact of the removal of Zero-COVID policies on subjective well-being: Evidence from a digital world,https://www.sciencedirect.com/science/article/pii/S0165176523002148,29 May 2023,2023,Research Article
14,14,"Cash holdings, ambiguity aversion, and investment puzzles",https://www.sciencedirect.com/science/article/pii/S0165176523002173,29 May 2023,2023,Research Article
15,15,Macroprudential policymakers with cautious expectations,https://www.sciencedirect.com/science/article/pii/S0165176523002197,28 May 2023,2023,Research Article
16,16,Resolving the conflict on conduct parameter estimation in homogeneous goods markets between Bresnahan (1982) and Perloff and Shen (2012),https://www.sciencedirect.com/science/article/pii/S0165176523002185,27 May 2023,2023,Research Article
17,17,Pay equality among heterogeneous agents,https://www.sciencedirect.com/science/article/pii/S0165176523002136,26 May 2023,2023,Research Article
18,18,Social identity of civil servants and online peer-to-peer lending: Evidence from China,https://www.sciencedirect.com/science/article/pii/S0165176523002094,24 May 2023,2023,Research Article
19,19,Fully modified least squares estimation and inference for systems of cointegrating polynomial regressions,https://www.sciencedirect.com/science/article/pii/S0165176523002112,23 May 2023,2023,Research Article
20,20,Lying with heterogeneous image concerns,https://www.sciencedirect.com/science/article/pii/S0165176523002021,22 May 2023,2023,Research Article
21,21,Italian local fiscal multipliers: Evidence from proxy-SVAR,https://www.sciencedirect.com/science/article/pii/S0165176523002100,22 May 2023,2023,Research Article
22,22,Do analysts anchor on public signals in forecasting the target price of disruptive technology firms?,https://www.sciencedirect.com/science/article/pii/S0165176523002082,21 May 2023,2023,Research Article
23,23,CEO narcissism and corporate misconduct,https://www.sciencedirect.com/science/article/pii/S0165176523002033,18 May 2023,2023,Research Article
24,24,A consistent nonparametric test for the structure change in quantile regression,https://www.sciencedirect.com/science/article/pii/S0165176523001866,17 May 2023,2023,Research Article
25,25,Complier and monotonicity for Fuzzy Multi-score Regression Discontinuity with partial effects,https://www.sciencedirect.com/science/article/pii/S0165176523001945,16 May 2023,2023,Research Article
26,26,Heterogeneity of probability weighting in investment decisions,https://www.sciencedirect.com/science/article/pii/S0165176523001817,16 May 2023,2023,Research Article
27,27,The economic effects of prison closures on local communities,https://www.sciencedirect.com/science/article/pii/S0165176523001805,13 May 2023,2023,Research Article
28,28,: Diverse impacts of Temporary Protected Status on Haitians and Hondurans,https://www.sciencedirect.com/science/article/pii/S016517652300188X,11 May 2023,2023,Research Article
29,29,The bureaucracy trap,https://www.sciencedirect.com/science/article/pii/S016517652300191X,11 May 2023,2023,Research Article
30,30,Gain–loss and new axiomatizations of the Shapley value,https://www.sciencedirect.com/science/article/pii/S0165176523001933,11 May 2023,2023,Research Article
31,31,Celerity of punishment and deterrence: The impacts of discounting and present bias,https://www.sciencedirect.com/science/article/pii/S0165176523001921,10 May 2023,2023,Research Article
32,32,Political ties and the yield curve,https://www.sciencedirect.com/science/article/pii/S0165176523001908,8 May 2023,2023,Research Article
33,33,Labor compliance programs in developing countries and trade flows: Evidence from Better Work,https://www.sciencedirect.com/science/article/pii/S0165176523001878,6 May 2023,2023,Research Article
34,34,The world price of macro opacity: Through the lens of nighttime satellites,https://www.sciencedirect.com/science/article/pii/S0165176523001829,6 May 2023,2023,Research Article
35,35,Does it matter where and how governments spend?,https://www.sciencedirect.com/science/article/pii/S0165176523001830,6 May 2023,2023,Research Article
36,36,Bootstrapping quantile correlations with an application for income status across generations,https://www.sciencedirect.com/science/article/pii/S0165176523001854,6 May 2023,2023,Research Article
37,37,The two-way Hausman and Taylor estimator,https://www.sciencedirect.com/science/article/pii/S0165176523001842,6 May 2023,2023,Research Article
38,38,The impact of regulation on risk and return,https://www.sciencedirect.com/science/article/pii/S0165176523001799,5 May 2023,2023,Research Article
39,39,Price discovery between Bitcoin spot markets and exchange traded products,https://www.sciencedirect.com/science/article/pii/S0165176523001775,5 May 2023,2023,Research Article
40,40,Bounding fertility elasticities,https://www.sciencedirect.com/science/article/pii/S0165176523001763,4 May 2023,2023,Research Article
41,41,The economics of satellite deorbiting performance bonds,https://www.sciencedirect.com/science/article/pii/S0165176523001751,4 May 2023,2023,Research Article
42,42,Can transparency increase adverse selection? Evidence from an electronic platform for annuities,https://www.sciencedirect.com/science/article/pii/S016517652300160X,3 May 2023,2023,Research Article
43,43,A deep analysis of the economics and finance research on cryptocurrencies,https://www.sciencedirect.com/science/article/pii/S0165176523001611,2 May 2023,2023,Research Article
44,44,Factor-based portfolio optimization,https://www.sciencedirect.com/science/article/pii/S0165176523001623,29 April 2023,2023,Research Article
45,45,Directed lexicographic rationalizability,https://www.sciencedirect.com/science/article/pii/S0165176523001593,29 April 2023,2023,Research Article
46,46,Communication and advice-taking: Evidence from a laboratory experiment,https://www.sciencedirect.com/science/article/pii/S0165176523001350,28 April 2023,2023,Research Article
47,47,Kicking the can down the road: A historical growth-at-risk perspective,https://www.sciencedirect.com/science/article/pii/S0165176523001581,28 April 2023,2023,Research Article
48,48,A protocol for repeated bargaining,https://www.sciencedirect.com/science/article/pii/S016517652300157X,26 April 2023,2023,Research Article
49,49,The source of uncertainty and optimal monetary policy,https://www.sciencedirect.com/science/article/pii/S0165176523001568,25 April 2023,2023,Research Article
50,50,Contests between two groups for a group-specific public-good/bad prize,https://www.sciencedirect.com/science/article/pii/S0165176523001556,24 April 2023,2023,Research Article
51,51,Uniform random dictatorship: A characterization without strategy-proofness,https://www.sciencedirect.com/science/article/pii/S0165176523001520,23 April 2023,2023,Research Article
52,52,A non-lexicographic rule in the preference-approval setting,https://www.sciencedirect.com/science/article/pii/S0165176523001490,23 April 2023,2023,Research Article
53,53,Being green first: Simultaneous vs. sequential abatement decisions,https://www.sciencedirect.com/science/article/pii/S0165176523001489,23 April 2023,2023,Research Article
54,54,Feasible joint posterior beliefs with binary signals,https://www.sciencedirect.com/science/article/pii/S0165176523001519,22 April 2023,2023,Research Article
55,55,Comparison of price caps and tariffs to counter a foreign monopoly,https://www.sciencedirect.com/science/article/pii/S0165176523001532,22 April 2023,2023,Research Article
56,56,Solar adoption and the decisive role of the feed-in tariff policy,https://www.sciencedirect.com/science/article/pii/S0165176523001544,20 April 2023,2023,Research Article
57,57,Pass-through effects of a temporary tax rebate on German fuel prices,https://www.sciencedirect.com/science/article/pii/S0165176523001295,18 April 2023,2023,Research Article
58,58,Forecasting national recessions of the United States with state-level climate risks: Evidence from model averaging in Markov-switching models,https://www.sciencedirect.com/science/article/pii/S0165176523001465,14 April 2023,2023,Research Article
59,59,Liquidity and asset market cycles,https://www.sciencedirect.com/science/article/pii/S0165176523001441,12 April 2023,2023,Research Article
60,60,Why reshore? Evidence from Swedish firms,https://www.sciencedirect.com/science/article/pii/S0165176523001416,11 April 2023,2023,Research Article
61,61,Stable and extremely unequal,https://www.sciencedirect.com/science/article/pii/S016517652300126X,11 April 2023,2023,Research Article
62,62,Stablecoins: Legal restrictions theory and monetary policy,https://www.sciencedirect.com/science/article/pii/S0165176523001325,10 April 2023,2023,Research Article
63,63,Coalition formation problems with externalities,https://www.sciencedirect.com/science/article/pii/S0165176523001374,8 April 2023,2023,Research Article
64,64,Paying for inattention,https://www.sciencedirect.com/science/article/pii/S0165176523001398,8 April 2023,2023,Research Article
65,65,A critical comparison between the gross substitutes and complements conditions,https://www.sciencedirect.com/science/article/pii/S0165176523001313,6 April 2023,2023,Research Article
66,66,Human capital and the diffusion of technology,https://www.sciencedirect.com/science/article/pii/S0165176523001337,6 April 2023,2023,Research Article
67,67,Measuring inequality in the joint distribution of socioeconomic status and health,https://www.sciencedirect.com/science/article/pii/S0165176523001180,6 April 2023,2023,Research Article
68,68,News and narratives: A cointegration analysis of Russian economic policy uncertainty,https://www.sciencedirect.com/science/article/pii/S0165176523001192,5 April 2023,2023,Research Article
69,69,Survival of altruistic preferences in a large population public goods game,https://www.sciencedirect.com/science/article/pii/S0165176523001386,5 April 2023,2023,Research Article
70,70,"Fertility differential, public policy, and development",https://www.sciencedirect.com/science/article/pii/S0165176523001301,5 April 2023,2023,Research Article
71,71,Can green bonds reduce the carbon emissions of cities in China?,https://www.sciencedirect.com/science/article/pii/S0165176523001246,5 April 2023,2023,Research Article
72,72,How resilient was trade to COVID-19?,https://www.sciencedirect.com/science/article/pii/S0165176523001052,Available online 3 April 2023,2023,Research Article
73,73,Macroeconomic uncertainty and firms’ investment in China,https://www.sciencedirect.com/science/article/pii/S0165176523001209,3 April 2023,2023,Research Article
74,74,Players’ dummification and the dummified egalitarian non-separable contribution value,https://www.sciencedirect.com/science/article/pii/S0165176523001271,1 April 2023,2023,Research Article
75,75,Unemployment in the euro area and unconventional monetary policy surprises,https://www.sciencedirect.com/science/article/pii/S0165176523001222,31 March 2023,2023,Research Article
76,76,Determinants of mine closures in a declining industry: The example of West German hard-coal mining after World War Two,https://www.sciencedirect.com/science/article/pii/S0165176523001210,31 March 2023,2023,Research Article
77,77,Board refreshment and director excess compensation,https://www.sciencedirect.com/science/article/pii/S0165176523001258,31 March 2023,2023,Research Article
78,78,Gender penalties and solidarity — Teaching evaluation differentials in and out of STEM,https://www.sciencedirect.com/science/article/pii/S0165176523001088,27 March 2023,2023,Research Article
79,79,A geometric Blackwell’s order,https://www.sciencedirect.com/science/article/pii/S0165176523001076,27 March 2023,2023,Research Article
80,80,The Russia–Ukraine war and global trade reallocations,https://www.sciencedirect.com/science/article/pii/S0165176523001003,27 March 2023,2023,Research Article
81,81,Efficient estimation of a triangular system of equations for quantile regression,https://www.sciencedirect.com/science/article/pii/S0165176523001106,25 March 2023,2023,Research Article
82,82,Complete subset averaging approach for high-dimensional generalized linear models,https://www.sciencedirect.com/science/article/pii/S016517652300109X,24 March 2023,2023,Research Article
83,83,Trade effects of non-economic provisions in trade agreements,https://www.sciencedirect.com/science/article/pii/S0165176523001064,23 March 2023,2023,Research Article
84,84,Growth with automation capital and declining population,https://www.sciencedirect.com/science/article/pii/S0165176522004323,9 December 2022,2022,Research Article
85,85,Tree solutions and standardness for cycle-free graph games,https://www.sciencedirect.com/science/article/pii/S0165176522004293,8 December 2022,2022,Research Article
86,86,Ethnic diversity and economic development with spatial segregation,https://www.sciencedirect.com/science/article/pii/S0165176522004256,7 December 2022,2022,Research Article
87,87,Crypto market responses to digital asset policies,https://www.sciencedirect.com/science/article/pii/S0165176522004232,7 December 2022,2022,Research Article
88,88,Your next bank is not necessarily a bank: FinTech expansion and bank branch closures,https://www.sciencedirect.com/science/article/pii/S0165176522004220,5 December 2022,2022,Research Article
89,89,Vertical differentiation with overlapping ownership,https://www.sciencedirect.com/science/article/pii/S0165176522004219,5 December 2022,2022,Research Article
90,90,Do floods scare off residents?,https://www.sciencedirect.com/science/article/pii/S0165176522004165,5 December 2022,2022,Research Article
91,91,When the Celtic Tiger relaxed its corporate tax bite: An analysis of effects on top and upper middle income shares in Ireland,https://www.sciencedirect.com/science/article/pii/S0165176522004074,25 November 2022,2022,Research Article
92,92,Equilibrium (non-)existence in games with competing principals,https://www.sciencedirect.com/science/article/pii/S0165176522004062,23 November 2022,2022,Research Article
93,93,Inflation target credibility in times of high inflation,https://www.sciencedirect.com/science/article/pii/S0165176522004049,21 November 2022,2022,Research Article
94,94,Promises or agreements? Moral commitments in bilateral communication,https://www.sciencedirect.com/science/article/pii/S0165176522004050,19 November 2022,2022,Research Article
95,95,Sex ratios and marital matching outcomes in the Chinese marriage market,https://www.sciencedirect.com/science/article/pii/S0165176522004013,19 November 2022,2022,Research Article
96,96,The effect of 1987 Ireland’s ,https://www.sciencedirect.com/science/article/pii/S0165176522004037,18 November 2022,2022,Research Article
97,97,Bank and non-bank balance sheet responses to monetary policy shocks,https://www.sciencedirect.com/science/article/pii/S0165176522003925,17 November 2022,2022,Research Article
98,98,The Holt–Winters filter and the one-sided HP filter: A close correspondence,https://www.sciencedirect.com/science/article/pii/S0165176522003998,15 November 2022,2022,Research Article
99,99,"Quality sorting, Alchian–Allen effect, and distance",https://www.sciencedirect.com/science/article/pii/S0165176522003986,12 November 2022,2022,Research Article
100,100,Vertical integration under optimal taxation: A consumer surplus detrimental result,https://www.sciencedirect.com/science/article/pii/S0165176522003937,10 November 2022,2022,Research Article
101,101,The quality of imported intermediate inputs and firms’ innovation activities in China,https://www.sciencedirect.com/science/article/pii/S0165176522003895,9 November 2022,2022,Research Article
102,102,Inflation and uncertainty in New Keynesian models: A note,https://www.sciencedirect.com/science/article/pii/S0165176522003913,5 November 2022,2022,Research Article
108,108,Corrigendum to “The financial trilemma” [Economics letters 111 (2011) 57–59],https://www.sciencedirect.com/science/article/pii/S0165176523000253,4 February 2023,2023,Research Article
111,111,Does coopetition support SMEs in turbulent contexts?,https://www.sciencedirect.com/science/article/pii/S0165176522002737,29 July 2022,2022,Research Article
112,112,Supporting SMEs during COVID-19: The case for targeted equity injections,https://www.sciencedirect.com/science/article/pii/S0165176522002476,26 July 2022,2022,Research Article
113,113,A general equilibrium model of investor sentiment,https://www.sciencedirect.com/science/article/pii/S0165176522002658,22 July 2022,2022,Research Article
114,114,Valuation of European firms during the Russia–Ukraine war,https://www.sciencedirect.com/science/article/pii/S016517652200266X,20 July 2022,2022,Research Article
115,115,Loss aversion in post-sale purchases of two close substitutes,https://www.sciencedirect.com/science/article/pii/S0165176522002671,20 July 2022,2022,Research Article
116,116,"Good luck, bad luck, and risk taking: Evidence from a natural experiment in the housing lottery",https://www.sciencedirect.com/science/article/pii/S0165176522002580,20 July 2022,2022,Research Article
117,117,A closer look at two conjectures about irregular marginal revenue,https://www.sciencedirect.com/science/article/pii/S0165176522002518,20 July 2022,2022,Research Article
118,118,The Fed’s dual shocks and the housing market,https://www.sciencedirect.com/science/article/pii/S0165176522002531,16 July 2022,2022,Research Article
119,119,Creativity and ambiguity tolerance,https://www.sciencedirect.com/science/article/pii/S0165176522002488,16 July 2022,2022,Research Article
120,120,Indicative Price Rise with synergies,https://www.sciencedirect.com/science/article/pii/S0165176522002543,16 July 2022,2022,Research Article
121,121,Time and risk preferences of children predict health behaviors but not BMI,https://www.sciencedirect.com/science/article/pii/S0165176522002506,15 July 2022,2022,Research Article
122,122,A new estimator of a jump discontinuity in regression,https://www.sciencedirect.com/science/article/pii/S0165176522002440,15 July 2022,2022,Research Article
123,123,Racial discrimination in non-fungible token (NFT) prices? CryptoPunk sales and skin tone,https://www.sciencedirect.com/science/article/pii/S016517652200252X,14 July 2022,2022,Research Article
124,124,Extensive margins of trade and firm survival,https://www.sciencedirect.com/science/article/pii/S0165176522002464,14 July 2022,2022,Research Article
125,125,Exploring nonlinearities between investment and internal funds: Evidence of the U-shaped investment curve,https://www.sciencedirect.com/science/article/pii/S0165176522002452,11 July 2022,2022,Research Article
126,126,Intertemporal variation in abnormal volume around earnings announcements: “Distraction” or “flocking-and-dispersing”?,https://www.sciencedirect.com/science/article/pii/S016517652200249X,11 July 2022,2022,Research Article
127,127,Increasing autonomy in charitable giving: The effect of choosing the number of recipients on donations,https://www.sciencedirect.com/science/article/pii/S0165176522002397,8 July 2022,2022,Research Article
128,128,The procyclicality of inflation-linked debt,https://www.sciencedirect.com/science/article/pii/S0165176522002415,6 July 2022,2022,Research Article
129,129,Social security as Markov equilibrium in OLG models: Clarifications and some new insights,https://www.sciencedirect.com/science/article/pii/S0165176522002427,6 July 2022,2022,Research Article
130,130,Input price discrimination can encourage downstream investment and increase welfare,https://www.sciencedirect.com/science/article/pii/S0165176522002373,6 July 2022,2022,Research Article
131,131,Political orientation and compensation for idiosyncratic risk,https://www.sciencedirect.com/science/article/pii/S0165176522002385,5 July 2022,2022,Research Article
132,132,In the mood for sustainable funds?,https://www.sciencedirect.com/science/article/pii/S0165176522002348,4 July 2022,2022,Research Article
133,133,Bayesian analysis of spatial dynamic panel data model with convex combinations of different spatial weight matrices: A reparameterized approach,https://www.sciencedirect.com/science/article/pii/S0165176522002361,30 June 2022,2022,Research Article
134,134,Economic policy uncertainty and government spending multipliers,https://www.sciencedirect.com/science/article/pii/S016517652200235X,28 June 2022,2022,Research Article
135,135,Artificial regression test diagnostics for impact measures in spatial models,https://www.sciencedirect.com/science/article/pii/S0165176522002336,25 June 2022,2022,Research Article
136,136,Climate uncertainty and carbon emissions prices: The relative roles of transition and physical climate risks,https://www.sciencedirect.com/science/article/pii/S0165176522002324,24 June 2022,2022,Research Article
137,137,Cross-validation for selecting the penalty factor in least squares model averaging,https://www.sciencedirect.com/science/article/pii/S0165176522002300,23 June 2022,2022,Research Article
138,138,Impacts of boycotts concerning the Shapley value and extensions,https://www.sciencedirect.com/science/article/pii/S0165176522002312,22 June 2022,2022,Research Article
139,139,Bonus for firearms seizures and police performance,https://www.sciencedirect.com/science/article/pii/S0165176522002294,21 June 2022,2022,Research Article
140,140,The effect of the COVID-19 pandemic on information disclosure: Evidence from China,https://www.sciencedirect.com/science/article/pii/S0165176522002270,20 June 2022,2022,Research Article
141,141,The production approach to markup estimation often measures input distortions,https://www.sciencedirect.com/science/article/pii/S0165176522002257,20 June 2022,2022,Research Article
142,142,Effect of financial literacy on usage of unconventional banking and non-banking financial services across countries,https://www.sciencedirect.com/science/article/pii/S0165176522002282,20 June 2022,2022,Research Article
143,143,Role of common preferences in the outcome of many-to-many matching,https://www.sciencedirect.com/science/article/pii/S016517652200221X,18 June 2022,2022,Research Article
144,144,Bound by ,https://www.sciencedirect.com/science/article/pii/S0165176522002129,11 June 2022,2022,Research Article
145,145,Bi-utility representable orderings on a countable set,https://www.sciencedirect.com/science/article/pii/S0165176522002130,10 June 2022,2022,Research Article
146,146,A look under the hood of momentum funds,https://www.sciencedirect.com/science/article/pii/S0165176522002117,8 June 2022,2022,Research Article
147,147,Asset pricing with free entry and exit of firms,https://www.sciencedirect.com/science/article/pii/S0165176522002087,7 June 2022,2022,Research Article
148,148,Corporate activism during the 2022 Russian invasion of Ukraine,https://www.sciencedirect.com/science/article/pii/S0165176522002099,7 June 2022,2022,Research Article
149,149,A top-only mechanism with reserve price for single-good allocation problem,https://www.sciencedirect.com/science/article/pii/S0165176522002075,6 June 2022,2022,Research Article
150,150,Gender sorting among economists: Evidence from the NBER,https://www.sciencedirect.com/science/article/pii/S016517652200204X,3 June 2022,2022,Research Article
151,151,Supply side effects of infrastructure spending,https://www.sciencedirect.com/science/article/pii/S0165176522002051,3 June 2022,2022,Research Article
