,Unnamed: 0,Title,Url,Time,Year,Type
886,886,The time-varying effect of fiscal policy on inflation: Evidence from historical US data,https://www.sciencedirect.com/science/article/pii/S0165176519304161,12 November 2019,2019,Research Article
887,887,The impact of building energy codes on household electricity expenditures,https://www.sciencedirect.com/science/article/pii/S0165176519304264,12 November 2019,2019,Research Article
888,888,Bubble regime identification in an attention-based model for Bitcoin and Ethereum price dynamics,https://www.sciencedirect.com/science/article/pii/S0165176519304203,9 November 2019,2019,Research Article
889,889,Products liability when consumers are salient thinkers,https://www.sciencedirect.com/science/article/pii/S0165176519304240,8 November 2019,2019,Research Article
890,890,Volatility forecasting accuracy for Bitcoin,https://www.sciencedirect.com/science/article/pii/S0165176519304239,7 November 2019,2019,Research Article
891,891,Gains from anchoring inflation expectations: Evidence from the taper tantrum shock,https://www.sciencedirect.com/science/article/pii/S016517651930415X,7 November 2019,2019,Research Article
892,892,Economic growth and under-investment: A nonparametric approach,https://www.sciencedirect.com/science/article/pii/S0165176519304173,6 November 2019,2019,Research Article
893,893,Investigating asymmetric determinants of the CNY–CNH exchange rate spreads: The role of economic policy uncertainty,https://www.sciencedirect.com/science/article/pii/S0165176519304185,6 November 2019,2019,Research Article
894,894,What’s in a name? A lot if it has “blockchain”,https://www.sciencedirect.com/science/article/pii/S0165176519304148,6 November 2019,2019,Research Article
895,895,The effect of monetary policy shocks on macroeconomic variables: Evidence from the Eurozone,https://www.sciencedirect.com/science/article/pii/S0165176519304070,5 November 2019,2019,Research Article
896,896,Zero-rating and network effects,https://www.sciencedirect.com/science/article/pii/S0165176519304124,5 November 2019,2019,Research Article
897,897,Labor market dynamics and black–white earnings gaps,https://www.sciencedirect.com/science/article/pii/S0165176519304094,2 November 2019,2019,Research Article
898,898,The even split rule for (concave) symmetric supermodular functions,https://www.sciencedirect.com/science/article/pii/S0165176519303933,31 October 2019,2019,Research Article
899,899,A simple solution to the problem of ,https://www.sciencedirect.com/science/article/pii/S0165176519303945,31 October 2019,2019,Research Article
900,900,Near-losses in insurance markets: An experiment,https://www.sciencedirect.com/science/article/pii/S0165176519303921,31 October 2019,2019,Research Article
901,901,Disclosure policies in all-pay auctions with bid caps and stochastic entry,https://www.sciencedirect.com/science/article/pii/S0165176519304082,30 October 2019,2019,Research Article
902,902,Bail-in regulation and stock market reaction,https://www.sciencedirect.com/science/article/pii/S0165176519304069,30 October 2019,2019,Research Article
903,903,Time-invariant regressors under fixed effects: Simple identification via a proxy variable,https://www.sciencedirect.com/science/article/pii/S0165176519304057,29 October 2019,2019,Research Article
904,904,Balancing tests in stratified randomized controlled trials: A cautionary note,https://www.sciencedirect.com/science/article/pii/S0165176519303878,24 October 2019,2019,Research Article
905,905,Dishonest behavior: Sin big or go home,https://www.sciencedirect.com/science/article/pii/S016517651930391X,24 October 2019,2019,Research Article
906,906,Redistributive public employment? A test for the South of Italy,https://www.sciencedirect.com/science/article/pii/S0165176519303957,23 October 2019,2019,Research Article
907,907,Optimal sin taxes in the presence of income taxes and health care,https://www.sciencedirect.com/science/article/pii/S0165176519303854,23 October 2019,2019,Research Article
908,908,What drives Bitcoin’s price crash risk?,https://www.sciencedirect.com/science/article/pii/S0165176519303908,23 October 2019,2019,Research Article
909,909,The heterogenous impact of taxation on FDI: A note on Djankov et al. (2010),https://www.sciencedirect.com/science/article/pii/S0165176519303891,23 October 2019,2019,Research Article
910,910,Populism and income redistribution,https://www.sciencedirect.com/science/article/pii/S016517651930388X,22 October 2019,2019,Research Article
911,911,The implications of automation for economic growth when investment decisions are irreversible,https://www.sciencedirect.com/science/article/pii/S0165176519303805,22 October 2019,2019,Research Article
912,912,Semiparametric quasi maximum likelihood estimation of the fractional response model,https://www.sciencedirect.com/science/article/pii/S0165176519303866,21 October 2019,2019,Research Article
913,913,Negative interest rates policy and banks’ risk-taking: Empirical evidence,https://www.sciencedirect.com/science/article/pii/S0165176519303817,19 October 2019,2019,Research Article
914,914,The impact of urban form on vehicle ownership,https://www.sciencedirect.com/science/article/pii/S0165176519303830,17 October 2019,2019,Research Article
915,915,"Economic policy uncertainty shocks, economic activity, and exchange rate adjustments",https://www.sciencedirect.com/science/article/pii/S0165176519303842,17 October 2019,2019,Research Article
916,916,A re-examination of the predictability of stock returns and cash flows via the decomposition of VIX,https://www.sciencedirect.com/science/article/pii/S0165176519303799,16 October 2019,2019,Research Article
917,917,How do capital controls affect international trade?,https://www.sciencedirect.com/science/article/pii/S0165176519303829,14 October 2019,2019,Research Article
918,918,Hong and Li meet Weyl and Fabinger: Modeling vertical structure by the conduct parameter approach,https://www.sciencedirect.com/science/article/pii/S0165176519303684,11 October 2019,2019,Research Article
919,919,The destabilising effects of cryptocurrency cybercriminality,https://www.sciencedirect.com/science/article/pii/S0165176519303714,10 October 2019,2019,Research Article
920,920,Momentum trading in cryptocurrencies: Short-term returns and diversification benefits,https://www.sciencedirect.com/science/article/pii/S0165176519303647,30 September 2019,2019,Research Article
921,921,Betting on Bitcoin: Does gambling volume on the blockchain explain Bitcoin price changes?,https://www.sciencedirect.com/science/article/pii/S0165176519303659,30 September 2019,2019,Research Article
922,922,"New trade models, different distributions, same old results?",https://www.sciencedirect.com/science/article/pii/S0165176519303532,23 September 2019,2019,Research Article
923,923,"Risk aversion, uncertainty, and monetary policy: Structural vector autoregressions identified with high-frequency external instruments",https://www.sciencedirect.com/science/article/pii/S0165176519303374,12 September 2019,2019,Research Article
924,924,Forecasting economic policy uncertainty of BRIC countries using Bayesian VARs,https://www.sciencedirect.com/science/article/pii/S0165176519303386,12 September 2019,2019,Research Article
925,925,"How do markets value stock liquidity? Comparative evidence from the UK, the US, Germany and China",https://www.sciencedirect.com/science/article/pii/S0165176519302198,24 July 2019,2019,Research Article
926,926,On responsiveness of top trading cycles mechanism to priority-based affirmative action,https://www.sciencedirect.com/science/article/pii/S0165176519302678,16 July 2019,2019,Research Article
927,927,Generalized Nash equilibrium without common belief in rationality,https://www.sciencedirect.com/science/article/pii/S0165176519302502,15 July 2019,2019,Research Article
928,928,Crude oil price volatility and short-term predictability of the real U.S. GDP growth rate,https://www.sciencedirect.com/science/article/pii/S0165176519302514,15 July 2019,2019,Research Article
929,929,Bitcoin’s energy consumption: Is it the Achilles heel to miner’s revenue?,https://www.sciencedirect.com/science/article/pii/S0165176519302526,12 July 2019,2019,Research Article
930,930,Mandatory disclosure tone and bank risk-taking: Evidence from Europe,https://www.sciencedirect.com/science/article/pii/S0165176519302538,12 July 2019,2019,Research Article
931,931,"Oil booms, bank productivity and natural resource curse in finance",https://www.sciencedirect.com/science/article/pii/S0165176519302423,11 July 2019,2019,Research Article
932,932,On the impact of quantitative easing on credit standards and systemic risk: The Japanese experience,https://www.sciencedirect.com/science/article/pii/S0165176519302459,10 July 2019,2019,Research Article
933,933,"Bounded rationality, monetary policy, and macroeconomic stability",https://www.sciencedirect.com/science/article/pii/S0165176519302472,9 July 2019,2019,Research Article
934,934,Inflation and income inequality in a Schumpeterian economy with menu costs,https://www.sciencedirect.com/science/article/pii/S0165176519302496,9 July 2019,2019,Research Article
935,935,Non-linearity in the wage Phillips curve: Euro area analysis,https://www.sciencedirect.com/science/article/pii/S0165176519302460,9 July 2019,2019,Research Article
936,936,Exploiting information from singletons in panel data analysis: A GMM approach,https://www.sciencedirect.com/science/article/pii/S0165176519302447,5 July 2019,2019,Research Article
937,937,Eductive stability may not imply evolutionary stability in the presence of information costs,https://www.sciencedirect.com/science/article/pii/S0165176519302381,5 July 2019,2019,Research Article
938,938,"Asymmetric oil price shocks, tax revenues, and the resource curse",https://www.sciencedirect.com/science/article/pii/S016517651930240X,2 July 2019,2019,Research Article
939,939,The effects of regulating benchmarks,https://www.sciencedirect.com/science/article/pii/S016517651930237X,26 June 2019,2019,Research Article
942,942,A self-normalization test for correlation change,https://www.sciencedirect.com/science/article/pii/S016517651930045X,2 March 2019,2019,Research Article
943,943,A mean-difference test based on self-normalization for alternating regime index data sets,https://www.sciencedirect.com/science/article/pii/S0165176519300072,12 February 2019,2019,Research Article
954,954,The redistributive effects of forward guidance,https://www.sciencedirect.com/science/article/pii/S0165176519302216,18 June 2019,2019,Research Article
955,955,Treasury bill auctions: Do bidders’ cost of funds and winning probability matter?,https://www.sciencedirect.com/science/article/pii/S0165176519302277,18 June 2019,2019,Research Article
956,956,Day-of-the-week effect in anomaly returns: International evidence,https://www.sciencedirect.com/science/article/pii/S0165176519302010,13 June 2019,2019,Research Article
957,957,Natural disasters and entrepreneurship activity,https://www.sciencedirect.com/science/article/pii/S016517651930223X,13 June 2019,2019,Research Article
958,958,Do NPL portfolio sales help reduce banks’ financing costs?,https://www.sciencedirect.com/science/article/pii/S0165176519302228,13 June 2019,2019,Research Article
959,959,Revisiting advance disclosure of insider trading,https://www.sciencedirect.com/science/article/pii/S0165176519302174,12 June 2019,2019,Research Article
960,960,Impairment of monetary autonomy: Case of “trilemma” vs. “duo”,https://www.sciencedirect.com/science/article/pii/S0165176519302204,10 June 2019,2019,Research Article
961,961,The Bitcoin mining breakdown: Is mining still profitable?,https://www.sciencedirect.com/science/article/pii/S0165176519302034,8 June 2019,2019,Research Article
962,962,Enhancing the predictability of crude oil markets with hybrid wavelet approaches,https://www.sciencedirect.com/science/article/pii/S0165176519302009,8 June 2019,2019,Research Article
963,963,The equal-weight tilt in managed portfolios,https://www.sciencedirect.com/science/article/pii/S0165176519302162,8 June 2019,2019,Research Article
964,964,Cost-efficient Performance-Vesting Equity,https://www.sciencedirect.com/science/article/pii/S0165176519302150,5 June 2019,2019,Research Article
965,965,Testing for no-cointegration under time-varying variance,https://www.sciencedirect.com/science/article/pii/S0165176519302149,4 June 2019,2019,Research Article
966,966,A flexible Synthetic Control Method for modeling policy evaluation,https://www.sciencedirect.com/science/article/pii/S0165176519301788,3 June 2019,2019,Research Article
967,967,A full characterization of best-response functions in the lottery Colonel Blotto game,https://www.sciencedirect.com/science/article/pii/S0165176519301995,3 June 2019,2019,Research Article
968,968,The price elasticity of warm-glow giving,https://www.sciencedirect.com/science/article/pii/S0165176519302137,3 June 2019,2019,Research Article
969,969,A new economic policy uncertainty index for Spain,https://www.sciencedirect.com/science/article/pii/S0165176519301806,30 May 2019,2019,Research Article
970,970,Job satisfaction amongst academic economists in the UK,https://www.sciencedirect.com/science/article/pii/S0165176519301843,30 May 2019,2019,Research Article
971,971,"Two centuries of global financial market integration: Equities, government bonds, treasury bills, and currencies",https://www.sciencedirect.com/science/article/pii/S0165176519302022,29 May 2019,2019,Research Article
972,972,The sound of silence: A license to be selfish,https://www.sciencedirect.com/science/article/pii/S0165176519302046,29 May 2019,2019,Research Article
973,973,Time variation in the persistence of unemployment over the past century,https://www.sciencedirect.com/science/article/pii/S0165176519301946,27 May 2019,2019,Research Article
974,974,Condorcet consistent scoring rules and single-peakedness,https://www.sciencedirect.com/science/article/pii/S0165176519301879,27 May 2019,2019,Research Article
975,975,Monetary growth and wealth inequality,https://www.sciencedirect.com/science/article/pii/S0165176519301958,27 May 2019,2019,Research Article
976,976,Strategic product variety and quality choice,https://www.sciencedirect.com/science/article/pii/S0165176519301922,24 May 2019,2019,Research Article
977,977,A complete-information partnership contest with negative productivity spillovers,https://www.sciencedirect.com/science/article/pii/S0165176519301983,24 May 2019,2019,Research Article
978,978,Credit constraints and GDP growth: Evidence from a natural experiment,https://www.sciencedirect.com/science/article/pii/S016517651930196X,23 May 2019,2019,Research Article
979,979,Quantile estimation of the stochastic frontier model,https://www.sciencedirect.com/science/article/pii/S0165176519301971,23 May 2019,2019,Research Article
980,980,The cyclical structure of the UK inflation rate: 1210–2016,https://www.sciencedirect.com/science/article/pii/S0165176519301910,21 May 2019,2019,Research Article
981,981,Nonparametric tests for strategic interaction effects with rationalizability,https://www.sciencedirect.com/science/article/pii/S0165176519301776,21 May 2019,2019,Research Article
982,982,Modelling systems with a mixture of ,https://www.sciencedirect.com/science/article/pii/S0165176519301909,21 May 2019,2019,Research Article
983,983,Refugees and ‘native flight’ from public to private schools,https://www.sciencedirect.com/science/article/pii/S0165176519301892,20 May 2019,2019,Research Article
984,984,"High frequency trading, price discovery and market efficiency in the FTSE100",https://www.sciencedirect.com/science/article/pii/S0165176519301818,20 May 2019,2019,Research Article
985,985,Who delegates? Evidence from dictator games,https://www.sciencedirect.com/science/article/pii/S0165176519301867,20 May 2019,2019,Research Article
986,986,"Effects of the Medicaid expansion on low-income, childless household savings: Evidence from the Affordable Care Act",https://www.sciencedirect.com/science/article/pii/S0165176519301880,19 May 2019,2019,Research Article
987,987,Revisiting the house money effect in the field: Evidence from casino jackpots,https://www.sciencedirect.com/science/article/pii/S0165176519301855,17 May 2019,2019,Research Article
988,988,Responsive affirmative action in school choice: A comparison study,https://www.sciencedirect.com/science/article/pii/S0165176519301831,16 May 2019,2019,Research Article
989,989,"Competition, business cycles, and price flexibility in grocery stores",https://www.sciencedirect.com/science/article/pii/S016517651930179X,15 May 2019,2019,Research Article
990,990,Multitask assignments with adverse selection,https://www.sciencedirect.com/science/article/pii/S0165176519301739,15 May 2019,2019,Research Article
991,991,Blockchain hysteria: Adding “blockchain” to company’s name,https://www.sciencedirect.com/science/article/pii/S0165176519301703,15 May 2019,2019,Research Article
992,992,A new efficiency test for ranking investments: Application to hedge fund performance,https://www.sciencedirect.com/science/article/pii/S016517651930182X,15 May 2019,2019,Research Article
993,993,Macroeconomic effects of inflation target uncertainty shocks,https://www.sciencedirect.com/science/article/pii/S0165176519301685,14 May 2019,2019,Research Article
994,994,"Fiscal disparity, institutions and asymmetric yardstick competition",https://www.sciencedirect.com/science/article/pii/S0165176519301570,14 May 2019,2019,Research Article
995,995,Sexual identity and wellbeing: A distributional analysis,https://www.sciencedirect.com/science/article/pii/S0165176519301466,13 May 2019,2019,Research Article
996,996,The asymptotic kernel in TU production market games with symmetric big players and a uniform ocean of small players,https://www.sciencedirect.com/science/article/pii/S0165176519301752,11 May 2019,2019,Research Article
997,997,"No pain, no gain? Household beliefs and stock market participation",https://www.sciencedirect.com/science/article/pii/S0165176519301600,11 May 2019,2019,Research Article
998,998,Indirect taxation and undesirable competition,https://www.sciencedirect.com/science/article/pii/S0165176519301697,11 May 2019,2019,Research Article
999,999,Updates to household inflation expectations: Signal or noise?,https://www.sciencedirect.com/science/article/pii/S0165176519301764,11 May 2019,2019,Research Article
1000,1000,"Data portability, data disclosure and data-induced switching costs: Some unintended consequences of the General Data Protection Regulation",https://www.sciencedirect.com/science/article/pii/S0165176519301740,11 May 2019,2019,Research Article
1001,1001,Inflation hedging with commodities: A wavelet analysis of seven centuries worth of data,https://www.sciencedirect.com/science/article/pii/S0165176519301612,11 May 2019,2019,Research Article
1002,1002,A closed-form solution to the risk-taking motivation of subordinated debtholders,https://www.sciencedirect.com/science/article/pii/S0165176519301624,11 May 2019,2019,Research Article
1003,1003,On the nexus of fertility and debt,https://www.sciencedirect.com/science/article/pii/S0165176519301636,10 May 2019,2019,Research Article
1004,1004,Testing for sphericity in a fixed effects panel data model with time-varying variances,https://www.sciencedirect.com/science/article/pii/S0165176519301715,9 May 2019,2019,Research Article
1005,1005,Migration and online job search: A gravity model approach,https://www.sciencedirect.com/science/article/pii/S0165176519301648,8 May 2019,2019,Research Article
1006,1006,Skill Scores and modified Lorenz domination in default forecasts,https://www.sciencedirect.com/science/article/pii/S016517651930165X,7 May 2019,2019,Research Article
1007,1007,Cursed by no coast: How regional landlockedness affects income within countries,https://www.sciencedirect.com/science/article/pii/S0165176519301582,7 May 2019,2019,Research Article
1008,1008,Disinflationary shocks and inflation target uncertainty,https://www.sciencedirect.com/science/article/pii/S0165176519301673,7 May 2019,2019,Research Article
1009,1009,Sectoral shocks and home substitution,https://www.sciencedirect.com/science/article/pii/S0165176519301429,7 May 2019,2019,Research Article
1010,1010,"Secular stagnation? Is there statistical evidence of an unprecedented, systematic decline in growth?",https://www.sciencedirect.com/science/article/pii/S0165176519301430,4 May 2019,2019,Research Article
1011,1011,The timing of the demographic transition and economic growth,https://www.sciencedirect.com/science/article/pii/S0165176519301442,4 May 2019,2019,Research Article
1012,1012,Relationship lending during a trust crisis on the interbank market: A friend in need is a friend indeed,https://www.sciencedirect.com/science/article/pii/S0165176519300989,4 May 2019,2019,Research Article
1013,1013,Contracts are not salaries in the hidden-substitutes domain,https://www.sciencedirect.com/science/article/pii/S0165176519301454,4 May 2019,2019,Research Article
1014,1014,Equivalence results when firms compete in prices/quantities and innovation effort,https://www.sciencedirect.com/science/article/pii/S0165176519301314,3 May 2019,2019,Research Article
1015,1015,Trust and age: An experiment with current and former students,https://www.sciencedirect.com/science/article/pii/S0165176519301260,2 May 2019,2019,Research Article
1016,1016,Comparing dynamic multisector models,https://www.sciencedirect.com/science/article/pii/S0165176519301508,30 April 2019,2019,Research Article
1017,1017,Wage dispersion over the business cycle,https://www.sciencedirect.com/science/article/pii/S0165176519301351,29 April 2019,2019,Research Article
1018,1018,Fraud tolerance in optimal crowdfunding,https://www.sciencedirect.com/science/article/pii/S0165176519301375,29 April 2019,2019,Research Article
1019,1019,The Romer model with monopolistic competition and general technologies,https://www.sciencedirect.com/science/article/pii/S0165176519301491,26 April 2019,2019,Research Article
1020,1020,Efficient matrix approach for classical inference in state space models,https://www.sciencedirect.com/science/article/pii/S016517651930134X,26 April 2019,2019,Research Article
1021,1021,Lognormal city size distribution and distance,https://www.sciencedirect.com/science/article/pii/S016517651930148X,25 April 2019,2019,Research Article
1022,1022,Appearance Discrimination in Grading? ,https://www.sciencedirect.com/science/article/pii/S0165176519301478,25 April 2019,2019,Research Article
1023,1023,Building sectoral job search indices for the United States,https://www.sciencedirect.com/science/article/pii/S0165176519301417,24 April 2019,2019,Research Article
1024,1024,Estimating impulse response functions when the shock series is observed,https://www.sciencedirect.com/science/article/pii/S0165176519301399,20 April 2019,2019,Research Article
1025,1025,Team production game on bipartite networks,https://www.sciencedirect.com/science/article/pii/S0165176519301302,20 April 2019,2019,Research Article
1026,1026,Earmarked paternity leave and the relative income within couples,https://www.sciencedirect.com/science/article/pii/S0165176519301405,20 April 2019,2019,Research Article
1027,1027,Readability and research impact,https://www.sciencedirect.com/science/article/pii/S016517651930062X,19 April 2019,2019,Research Article
1028,1028,Natural disasters and mental health: A quantile approach,https://www.sciencedirect.com/science/article/pii/S0165176519301387,18 April 2019,2019,Research Article
1029,1029,Social influence and economic incentives: Complements or substitutes?—The case of fighting crimes,https://www.sciencedirect.com/science/article/pii/S0165176519301363,16 April 2019,2019,Research Article
1030,1030,Is it myopia or loss aversion? A study on investment game experiments,https://www.sciencedirect.com/science/article/pii/S0165176519301284,11 April 2019,2019,Research Article
1031,1031,Readability of token whitepaper and ICO first-day return,https://www.sciencedirect.com/science/article/pii/S0165176519301326,11 April 2019,2019,Research Article
1032,1032,Information aggregation with a continuum of types,https://www.sciencedirect.com/science/article/pii/S0165176519301193,11 April 2019,2019,Research Article
1033,1033,Multiproduct price discrimination with quantity limits: An application to zero-rating,https://www.sciencedirect.com/science/article/pii/S0165176519301235,10 April 2019,2019,Research Article
1034,1034,A network social interaction model with heterogeneous links,https://www.sciencedirect.com/science/article/pii/S0165176519301296,9 April 2019,2019,Research Article
1035,1035,Should the more efficient firm expand? A bargaining perspective,https://www.sciencedirect.com/science/article/pii/S0165176519301247,8 April 2019,2019,Research Article
1036,1036,Asking for frequencies rather than percentages increases the validity of subjective probability measures: Evidence from subjective life expectancy,https://www.sciencedirect.com/science/article/pii/S0165176519301259,7 April 2019,2019,Research Article
1037,1037,The clean-up of Chinese manufacturing: Examining the role played by changing techniques of production,https://www.sciencedirect.com/science/article/pii/S0165176519301090,3 April 2019,2019,Research Article
1038,1038,The Stochastic Lower Bound,https://www.sciencedirect.com/science/article/pii/S0165176519301053,3 April 2019,2019,Research Article
1039,1039,QML estimation of the matrix exponential spatial specification panel data model with fixed effects and heteroskedasticity,https://www.sciencedirect.com/science/article/pii/S016517651930120X,1 April 2019,2019,Research Article
1040,1040,Race and gender biases in student evaluations of teachers,https://www.sciencedirect.com/science/article/pii/S0165176519301016,29 March 2019,2019,Research Article
