,Unnamed: 0,Title,Url,Time,Year,Type
375,375,Does more stringent environmental regulation induce firms' innovation? Evidence from the 11th Five-year plan in China,https://www.sciencedirect.com/science/article/pii/S0140988322002699,2 June 2022,2022,Research Article
376,376,Going beyond sustainability: The diversification benefits of green energy financial products,https://www.sciencedirect.com/science/article/pii/S0140988322002705,2 June 2022,2022,Research Article
377,377,Oil prices and fiscal policy in an oil-exporter country: Empirical evidence from Oman,https://www.sciencedirect.com/science/article/pii/S0140988322002638,31 May 2022,2022,Research Article
378,378,Understanding the haze pollution effects of China's development zone program,https://www.sciencedirect.com/science/article/pii/S0140988322002432,27 May 2022,2022,Research Article
379,379,Protestantism and energy poverty,https://www.sciencedirect.com/science/article/pii/S0140988322002511,26 May 2022,2022,Research Article
380,380,Does urbanisation induce renewable energy consumption in emerging economies? The role of education in energy switching policies,https://www.sciencedirect.com/science/article/pii/S0140988322002468,19 May 2022,2022,Research Article
381,381,How does ethnic diversity affect energy poverty? Insights from South Africa,https://www.sciencedirect.com/science/article/pii/S0140988322002444,19 May 2022,2022,Research Article
382,382,How energy prices shape OECD economic growth: Panel evidence from multiple decades,https://www.sciencedirect.com/science/article/pii/S014098832200247X,18 May 2022,2022,Research Article
383,383,How would GVCs participation affect carbon intensity in the “Belt and Road Initiative” countries?,https://www.sciencedirect.com/science/article/pii/S0140988322002419,16 May 2022,2022,Research Article
384,384,Marketisation and rural energy poverty: Evidence from provincial panel data in China,https://www.sciencedirect.com/science/article/pii/S0140988322002390,16 May 2022,2022,Research Article
385,385,"Efficient markets are more connected: An entropy-based analysis of the energy, industrial metal and financial markets",https://www.sciencedirect.com/science/article/pii/S014098832200233X,16 May 2022,2022,Research Article
386,386,Exploring the effectiveness of China's dual credit policy in a differentiated automobile market when some consumers are environmentally aware,https://www.sciencedirect.com/science/article/pii/S0140988322002420,16 May 2022,2022,Research Article
387,387,Forecasting crude oil volatility with exogenous predictors: As good as it GETS?,https://www.sciencedirect.com/science/article/pii/S0140988322002249,16 May 2022,2022,Research Article
388,388,The contribution of climate finance toward environmental sustainability: New global evidence,https://www.sciencedirect.com/science/article/pii/S0140988322002389,14 May 2022,2022,Research Article
389,389,Spillovers and hedging effectiveness of non-ferrous metals and sub-sectoral clean energy stocks in time and frequency domain,https://www.sciencedirect.com/science/article/pii/S0140988322002365,13 May 2022,2022,Research Article
390,390,Evaluating carbon tax policy: A methodological reassessment of a natural experiment,https://www.sciencedirect.com/science/article/pii/S0140988322002201,13 May 2022,2022,Research Article
391,391,Green financial system regulation shock and greenwashing behaviors: Evidence from Chinese firms,https://www.sciencedirect.com/science/article/pii/S0140988322002304,13 May 2022,2022,Research Article
392,392,Spillover effects and nonlinear correlations between carbon emissions and stock markets: An empirical analysis of China's carbon-intensive industries,https://www.sciencedirect.com/science/article/pii/S0140988322002377,12 May 2022,2022,Research Article
393,393,Does green bond issuance have an impact on climate risk concerns?,https://www.sciencedirect.com/science/article/pii/S0140988322002328,12 May 2022,2022,Research Article
394,394,The robustness of low-carbon policies during China’s electricity reform,https://www.sciencedirect.com/science/article/pii/S0140988322002067,10 May 2022,2022,Research Article
395,395,Green energy transition and sustainable development of energy firms: An assessment of renewable energy policy,https://www.sciencedirect.com/science/article/pii/S0140988322002262,6 May 2022,2022,Research Article
396,396,Earthquake and household energy consumption – Evidence from the Wenchuan earthquake in China,https://www.sciencedirect.com/science/article/pii/S0140988322002274,6 May 2022,2022,Research Article
397,397,"Forecasting renewable energy stock volatility using short and long-term Markov switching GARCH-MIDAS models: Either, neither or both?",https://www.sciencedirect.com/science/article/pii/S0140988322002237,5 May 2022,2022,Research Article
398,398,Convolutional neural network forecasting of European Union allowances futures using a novel unconstrained transformation method,https://www.sciencedirect.com/science/article/pii/S0140988322002171,3 May 2022,2022,Research Article
399,399,Extreme co-movements between infectious disease events and crude oil futures prices: From extreme value analysis perspective,https://www.sciencedirect.com/science/article/pii/S0140988322002213,2 May 2022,2022,Research Article
400,400,Capital market opening and green innovation——Evidence from Shanghai-Hong Kong stock connect and the Shenzhen-Hong Kong stock connect,https://www.sciencedirect.com/science/article/pii/S014098832200216X,30 April 2022,2022,Research Article
401,401,Fuel regulation in a developing country: An interventional perspective,https://www.sciencedirect.com/science/article/pii/S0140988322002006,28 April 2022,2022,Research Article
402,402,Global sustainability of carbon shadow pricing: The distance between observed and optimal abatement costs,https://www.sciencedirect.com/science/article/pii/S0140988322002079,28 April 2022,2022,Research Article
403,403,Strategic bidding of wind power producers in electricity markets in presence of information sharing,https://www.sciencedirect.com/science/article/pii/S0140988322002055,28 April 2022,2022,Research Article
404,404,High-quality energy development in China: Comprehensive assessment and its impact on CO,https://www.sciencedirect.com/science/article/pii/S0140988322001967,26 April 2022,2022,Research Article
405,405,How can pricing strategy for district heating help China realize cleaner residential heating?,https://www.sciencedirect.com/science/article/pii/S0140988322002043,25 April 2022,2022,Research Article
406,406,How does urban environmental legislation guide the green transition of enterprises? Based on the perspective of enterprises' green total factor productivity,https://www.sciencedirect.com/science/article/pii/S0140988322002018,23 April 2022,2022,Research Article
407,407,“Wild” tariff schemes: Evidence from the Republic of Georgia,https://www.sciencedirect.com/science/article/pii/S0140988322001992,21 April 2022,2022,Research Article
408,408,Poverty and sustainable development around the world during transition periods,https://www.sciencedirect.com/science/article/pii/S0140988322001864,21 April 2022,2022,Research Article
409,409,Geopolitical risk and dynamic connectedness between commodity markets,https://www.sciencedirect.com/science/article/pii/S0140988322001979,21 April 2022,2022,Research Article
410,410,The impact of carbon emissions trading on energy efficiency: Evidence from quasi-experiment in China's carbon emissions trading pilot,https://www.sciencedirect.com/science/article/pii/S0140988322001943,21 April 2022,2022,Research Article
411,411,Hedging IMO2020 compliant fuel price exposure using futures contracts,https://www.sciencedirect.com/science/article/pii/S0140988322001980,21 April 2022,2022,Research Article
412,412,Employment precarity and energy poverty in post-apartheid South Africa: Exploring the racial and ethnic dimensions,https://www.sciencedirect.com/science/article/pii/S0140988322001955,21 April 2022,2022,Research Article
413,413,The spatial spillover effect of low-carbon city pilot scheme on green efficiency in China's cities: Evidence from a quasi-natural experiment,https://www.sciencedirect.com/science/article/pii/S0140988322001888,20 April 2022,2022,Research Article
414,414,The impact of oil supply news shocks on corporate investments and the structure of production network,https://www.sciencedirect.com/science/article/pii/S0140988322001803,16 April 2022,2022,Research Article
415,415,China’s government spending and global inflation dynamics: The role of the oil price channel,https://www.sciencedirect.com/science/article/pii/S0140988322001633,16 April 2022,2022,Research Article
416,416,Green complexity and CO,https://www.sciencedirect.com/science/article/pii/S014098832200192X,15 April 2022,2022,Research Article
417,417,Dynamic short-term risk management strategies for the choice of electricity market based on probabilistic forecasts of profit and risk measures. The German and the Polish market case study,https://www.sciencedirect.com/science/article/pii/S0140988322001840,14 April 2022,2022,Research Article
418,418,The role of economic development for the effect of oil market shocks on oil-exporting countries. Evidence from the interacted panel VAR model,https://www.sciencedirect.com/science/article/pii/S0140988322001876,14 April 2022,2022,Research Article
419,419,Forecasting volatility of EUA futures: New evidence,https://www.sciencedirect.com/science/article/pii/S0140988322001918,14 April 2022,2022,Research Article
420,420,Heterogeneous effects of oil price fluctuations: Evidence from a nonparametric panel data model in Canada,https://www.sciencedirect.com/science/article/pii/S0140988322001839,14 April 2022,2022,Research Article
421,421,Optimal bidding in hourly and quarter-hourly electricity price auctions: Trading large volumes of power with market impact and transaction costs,https://www.sciencedirect.com/science/article/pii/S0140988322001505,10 April 2022,2022,Research Article
422,422,Oil discoveries and innovation,https://www.sciencedirect.com/science/article/pii/S0140988322001694,9 April 2022,2022,Research Article
423,423,"The relationship between day-ahead and future prices in electricity markets: An empirical analysis on Italy, France, Germany, and Switzerland",https://www.sciencedirect.com/science/article/pii/S0140988322001529,6 April 2022,2022,Research Article
424,424,Forecasting crude oil prices with shrinkage methods: Can nonconvex penalty and Huber loss help?,https://www.sciencedirect.com/science/article/pii/S0140988322001852,5 April 2022,2022,Research Article
425,425,"Re-evaluating environmental tax: An intergenerational perspective on health, education and retirement",https://www.sciencedirect.com/science/article/pii/S0140988322001712,4 April 2022,2022,Research Article
426,426,Rooftop solar PV and the peak load problem in the NEM's Queensland region,https://www.sciencedirect.com/science/article/pii/S0140988322001748,4 April 2022,2022,Research Article
427,427,Boom-bust cycles in oil consumption: The role of explosive bubbles and asymmetric adjustments,https://www.sciencedirect.com/science/article/pii/S0140988322001785,4 April 2022,2022,Research Article
428,428,"Environmental performance, green finance and green innovation: What's the long-run relationships among variables?",https://www.sciencedirect.com/science/article/pii/S0140988322001761,4 April 2022,2022,Research Article
429,429,When is the electric vehicle market self-sustaining? Evidence from Norway,https://www.sciencedirect.com/science/article/pii/S0140988322001621,4 April 2022,2022,Research Article
430,430,How inclusive financial development eradicates energy poverty in China? The role of technological innovation,https://www.sciencedirect.com/science/article/pii/S0140988322001797,4 April 2022,2022,Research Article
431,431,Internal migration and associated carbon emission changes: Evidence from cities in China,https://www.sciencedirect.com/science/article/pii/S0140988322001827,4 April 2022,2022,Research Article
432,432,Willingness to pay for regional electricity generation – A question of green values and regional product beliefs?,https://www.sciencedirect.com/science/article/pii/S014098832200175X,3 April 2022,2022,Research Article
433,433,"Is the ETS an effective environmental policy? Undesired interaction between energy-mix, fuel-switch and electricity prices",https://www.sciencedirect.com/science/article/pii/S0140988322001554,1 April 2022,2022,Research Article
434,434,Environmental tax reform and environmental investment: A quasi-natural experiment based on China's Environmental Protection Tax Law,https://www.sciencedirect.com/science/article/pii/S0140988322001724,1 April 2022,2022,Research Article
435,435,"Economic policy uncertainty, oil and stock markets in BRIC: Evidence from quantiles analysis",https://www.sciencedirect.com/science/article/pii/S0140988322001487,1 April 2022,2022,Research Article
436,436,Inter-regional coal mine competition in the US: Evidence from rail restrictions,https://www.sciencedirect.com/science/article/pii/S0140988322001700,1 April 2022,2022,Research Article
437,437,How will sectoral coverage in the carbon trading system affect the total oil consumption in China? A CGE-based analysis,https://www.sciencedirect.com/science/article/pii/S0140988322001682,31 March 2022,2022,Research Article
438,438,"Financial development, renewable energy and CO2 emission in G7 countries: New evidence from non-linear and asymmetric analysis",https://www.sciencedirect.com/science/article/pii/S0140988322001669,31 March 2022,2022,Research Article
439,439,How does carbon emission price stimulate enterprises' total factor productivity? Insights from China's emission trading scheme pilots,https://www.sciencedirect.com/science/article/pii/S0140988322001645,31 March 2022,2022,Research Article
440,440,How natural disasters affect energy innovation? The perspective of environmental sustainability,https://www.sciencedirect.com/science/article/pii/S0140988322001657,31 March 2022,2022,Research Article
441,441,Oil and renewable energy stock markets: Unique role of extreme shocks,https://www.sciencedirect.com/science/article/pii/S0140988322001670,30 March 2022,2022,Research Article
442,442,Do energy efficiency improvements reduce energy use? Empirical evidence on the economy-wide rebound effect in Europe and the United States,https://www.sciencedirect.com/science/article/pii/S014098832200113X,29 March 2022,2022,Research Article
443,443,Short-term risk management of electricity retailers under rising shares of decentralized solar generation,https://www.sciencedirect.com/science/article/pii/S0140988322001323,29 March 2022,2022,Research Article
444,444,The role of energy consumption in global carbon intensity change: A meta-frontier-based production-theoretical decomposition analysis,https://www.sciencedirect.com/science/article/pii/S014098832200144X,26 March 2022,2022,Research Article
445,445,SO,https://www.sciencedirect.com/science/article/pii/S0140988322001530,24 March 2022,2022,Research Article
446,446,National mitigation policy and the competitiveness of Chinese firms,https://www.sciencedirect.com/science/article/pii/S0140988322001475,24 March 2022,2022,Research Article
447,447,Macroeconomic outcomes of OPEC and non-OPEC oil supply shocks in the euro area,https://www.sciencedirect.com/science/article/pii/S0140988322001517,24 March 2022,2022,Research Article
448,448,Facts and fiction in oil market modeling,https://www.sciencedirect.com/science/article/pii/S0140988322001499,24 March 2022,2022,Research Article
449,449,How does information and communication technology affect energy security? International evidence,https://www.sciencedirect.com/science/article/pii/S0140988322001451,24 March 2022,2022,Research Article
450,450,Does the source of oil price shocks matter for the systemic risk?,https://www.sciencedirect.com/science/article/pii/S0140988322001347,22 March 2022,2022,Research Article
451,451,Can public debt mitigate environmental debt? Theory and empirical evidence,https://www.sciencedirect.com/science/article/pii/S0140988322000767,22 March 2022,2022,Research Article
452,452,A robust hybrid method using dynamic network analysis and Weighted Mahalanobis distance for modeling systemic risk in the international energy market,https://www.sciencedirect.com/science/article/pii/S014098832200130X,22 March 2022,2022,Research Article
453,453,"Increasing microsolar technology adoption: Efficacy of vouchers, cash transfers, and microfinance schemes",https://www.sciencedirect.com/science/article/pii/S0140988322001219,19 March 2022,2022,Research Article
454,454,Electricity market design and implementation in the presence of asymmetrically informed strategic producers and consumers: A surrogate optimization-based mechanism,https://www.sciencedirect.com/science/article/pii/S0140988322001050,19 March 2022,2022,Research Article
455,455,Efficiency in wholesale electricity markets: On the role of externalities and subsidies,https://www.sciencedirect.com/science/article/pii/S0140988322001037,19 March 2022,2022,Research Article
456,456,Spillovers between sovereign yield curve components and oil price shocks,https://www.sciencedirect.com/science/article/pii/S0140988322001396,18 March 2022,2022,Research Article
457,457,"Dynamics between global value chain participation, CO",https://www.sciencedirect.com/science/article/pii/S0140988322001414,18 March 2022,2022,Research Article
458,458,Can digital financial inclusion affect CO,https://www.sciencedirect.com/science/article/pii/S0140988322001426,17 March 2022,2022,Research Article
459,459,"Multi-scale risk contagion among international oil market, Chinese commodity market and Chinese stock market: A MODWT-Vine quantile regression approach",https://www.sciencedirect.com/science/article/pii/S0140988322001335,17 March 2022,2022,Research Article
460,460,"Dynamic spillover effects and portfolio strategies between crude oil, gold and Chinese stock markets related to new energy vehicle",https://www.sciencedirect.com/science/article/pii/S0140988322001359,17 March 2022,2022,Research Article
461,461,Oil tail risk and the tail risk of the US Dollar exchange rates,https://www.sciencedirect.com/science/article/pii/S0140988322001360,17 March 2022,2022,Research Article
462,462,Multivariate stochastic volatility for herding detection: Evidence from the energy sector,https://www.sciencedirect.com/science/article/pii/S0140988322001402,17 March 2022,2022,Research Article
463,463,"Volatility spillovers amid crude oil, natural gas, coal, stock, and currency markets in the US and China based on time and frequency domain connectedness",https://www.sciencedirect.com/science/article/pii/S0140988322001372,17 March 2022,2022,Research Article
464,464,"Impact of COVID-19 on the quantile connectedness between energy, metals and agriculture commodities",https://www.sciencedirect.com/science/article/pii/S0140988322001384,16 March 2022,2022,Research Article
465,465,Peer-to-peer energy platforms: Incentives for prosuming,https://www.sciencedirect.com/science/article/pii/S0140988322001049,12 March 2022,2022,Research Article
466,466,Joint or separate? An economic-environmental comparison of energy-consuming and carbon emissions permits trading in China,https://www.sciencedirect.com/science/article/pii/S0140988322001268,11 March 2022,2022,Research Article
467,467,Network herding of energy funds in the post-Carbon-Peak Policy era: Does it benefit profitability and stability?,https://www.sciencedirect.com/science/article/pii/S0140988322001256,11 March 2022,2022,Research Article
468,468,Can the return connectedness indices from grey energy to natural gas help to forecast the natural gas returns?,https://www.sciencedirect.com/science/article/pii/S0140988322001244,11 March 2022,2022,Research Article
469,469,The cost-benefit comparisons of China's and India's NDCs based on carbon marginal abatement cost curves,https://www.sciencedirect.com/science/article/pii/S0140988322001232,10 March 2022,2022,Research Article
470,470,Does democracy really improve environmental quality? Empirical contribution to the environmental politics debate,https://www.sciencedirect.com/science/article/pii/S0140988322001190,10 March 2022,2022,Research Article
471,471,How heterogeneous is the impact of energy efficiency on dwelling prices? Evidence from the application of the unconditional quantile hedonic model to the Portuguese residential market,https://www.sciencedirect.com/science/article/pii/S0140988322001311,10 March 2022,2022,Research Article
472,472,Coal consumption and economic growth: A Chinese city-level study,https://www.sciencedirect.com/science/article/pii/S0140988322001177,10 March 2022,2022,Research Article
473,473,Optimal energy taxes and subsidies under a cost-effective unilateral climate policy: Addressing carbon leakage,https://www.sciencedirect.com/science/article/pii/S0140988322001062,10 March 2022,2022,Research Article
474,474,"A step forward on sustainability: The nexus of environmental responsibility, green technology, clean energy and green finance",https://www.sciencedirect.com/science/article/pii/S0140988322001220,9 March 2022,2022,Research Article
475,475,The asymmetric relationship between returns and implied higher moments: Evidence from the crude oil market,https://www.sciencedirect.com/science/article/pii/S014098832200127X,9 March 2022,2022,Research Article
476,476,Operationalizing affordability criterion in energy justice: Evidence from rural West Africa,https://www.sciencedirect.com/science/article/pii/S0140988322001293,9 March 2022,2022,Research Article
477,477,Global financial cycle and the predictability of oil market volatility: Evidence from a GARCH-MIDAS model,https://www.sciencedirect.com/science/article/pii/S0140988322001128,7 March 2022,2022,Research Article
478,478,China's energy stock market jumps: To what extent does the COVID-19 pandemic play a part?,https://www.sciencedirect.com/science/article/pii/S0140988322001153,5 March 2022,2022,Research Article
479,479,"Breaks, trends and correlations in commodity prices in the very long-run",https://www.sciencedirect.com/science/article/pii/S0140988322001116,5 March 2022,2022,Research Article
480,480,Market premia for renewables in Germany: The effect on electricity prices,https://www.sciencedirect.com/science/article/pii/S0140988322000573,4 March 2022,2022,Research Article
481,481,Forecasting crude oil volatility with uncertainty indicators: New evidence,https://www.sciencedirect.com/science/article/pii/S0140988322001141,4 March 2022,2022,Research Article
482,482,Oil shocks and BRIC markets: Evidence from extreme quantile approach,https://www.sciencedirect.com/science/article/pii/S0140988322001104,4 March 2022,2022,Research Article
483,483,Race and energy poverty: Evidence from African-American households,https://www.sciencedirect.com/science/article/pii/S0140988322000883,3 March 2022,2022,Research Article
484,484,Do carbon ETS pilots improve cities' green total factor productivity? Evidence from a quasi-natural experiment in China,https://www.sciencedirect.com/science/article/pii/S0140988322001098,3 March 2022,2022,Research Article
485,485,Productivity drain or productivity gain? The effect of new technology adoption in the oilfield market,https://www.sciencedirect.com/science/article/pii/S0140988322001086,3 March 2022,2022,Research Article
486,486,The distributional implications of the impact of fuel price increases on inflation,https://www.sciencedirect.com/science/article/pii/S0140988322000895,2 March 2022,2022,Research Article
487,487,Does oil impact gold during COVID-19 and three other recent crises?,https://www.sciencedirect.com/science/article/pii/S0140988322001165,2 March 2022,2022,Research Article
488,488,The dual shocks of the COVID-19 and the oil price collapse: A spark or a setback for the circular economy?,https://www.sciencedirect.com/science/article/pii/S0140988322000937,1 March 2022,2022,Research Article
489,489,Extreme price co-movement of commodity futures and industrial production growth: An empirical evaluation,https://www.sciencedirect.com/science/article/pii/S0140988322000950,26 February 2022,2022,Research Article
490,490,Givers never lack: Nigerian oil & gas asymmetric network analyses,https://www.sciencedirect.com/science/article/pii/S0140988322000901,26 February 2022,2022,Research Article
491,491,Firm-level energy rebound effects and relative efficiency in the German manufacturing sector,https://www.sciencedirect.com/science/article/pii/S0140988322000834,25 February 2022,2022,Research Article
492,492,A multi-objective competitive-design framework for fuel procurement planning in coal-fired power plants for sustainable operations,https://www.sciencedirect.com/science/article/pii/S0140988322000949,25 February 2022,2022,Research Article
493,493,Return and volatility spillovers between Chinese and U.S. clean energy related stocks,https://www.sciencedirect.com/science/article/pii/S0140988322000913,25 February 2022,2022,Research Article
494,494,Poverty and sustainable development around the world during transition periods,https://www.sciencedirect.com/science/article/pii/S0140988322001864,21 April 2022,2022,Research Article
495,495,Geopolitical risk and dynamic connectedness between commodity markets,https://www.sciencedirect.com/science/article/pii/S0140988322001979,21 April 2022,2022,Research Article
496,496,The impact of carbon emissions trading on energy efficiency: Evidence from quasi-experiment in China's carbon emissions trading pilot,https://www.sciencedirect.com/science/article/pii/S0140988322001943,21 April 2022,2022,Research Article
497,497,Hedging IMO2020 compliant fuel price exposure using futures contracts,https://www.sciencedirect.com/science/article/pii/S0140988322001980,21 April 2022,2022,Research Article
