,Unnamed: 0,Title,Url,Time,Year,Type
0,0,Climate change and fossil fuel prices: A GARCH-MIDAS analysis,https://www.sciencedirect.com/science/article/pii/S0140988323002906,Available online 14 June 2023,2023,Research Article
1,1,"Cap-and-trade mechanisms, green technology investment, and shadow insurance in a black swan environment",https://www.sciencedirect.com/science/article/pii/S0140988323002748,Available online 10 June 2023,2023,Research Article
2,2,How to purchase carbon emission right optimally for energy-consuming enterprises? Analysis based on optimal stopping model,https://www.sciencedirect.com/science/article/pii/S0140988323002566,Available online 9 June 2023,2023,Research Article
3,3,Consumption and production of cleaner energy by prosumers,https://www.sciencedirect.com/science/article/pii/S014098832300258X,Available online 9 June 2023,2023,Research Article
4,4,Dynamic effects and driving intermediations of oil price shocks on major economies,https://www.sciencedirect.com/science/article/pii/S0140988323002773,Available online 8 June 2023,2023,Research Article
5,5,Do retail businesses have efficient incentives to invest in public charging stations for electric vehicles?,https://www.sciencedirect.com/science/article/pii/S014098832300275X,Available online 7 June 2023,2023,Research Article
6,6,Emotional or rational choice: The influence of individual personality on energy-saving behavior,https://www.sciencedirect.com/science/article/pii/S0140988323002669,7 June 2023,2023,Research Article
7,7,Exchange rate pass-through and inflation targeting regime under energy prices shocks,https://www.sciencedirect.com/science/article/pii/S0140988323002591,Available online 5 June 2023,2023,Research Article
8,8,Short- and long-run determinants of the price behavior of US clean energy stocks: A dynamic ARDL simulations approach,https://www.sciencedirect.com/science/article/pii/S0140988323002694,Available online 2 June 2023,2023,Research Article
9,9,Induced green innovation of suppliers: The “green power” from major customers,https://www.sciencedirect.com/science/article/pii/S0140988323002736,Available online 2 June 2023,2023,Research Article
10,10,The impact of China's pilot carbon ETS on the labor income share: Based on an empirical method of combining PSM with staggered DID,https://www.sciencedirect.com/science/article/pii/S0140988323002682,2 June 2023,2023,Research Article
11,11,Do pilot zones for green finance reform and innovation promote energy savings? Evidence from China,https://www.sciencedirect.com/science/article/pii/S014098832300261X,2 June 2023,2023,Research Article
12,12,Green investment and asset stranding under transition scenario uncertainty,https://www.sciencedirect.com/science/article/pii/S0140988323002712,1 June 2023,2023,Research Article
13,13,Price connectedness in U.S. ethanol terminal markets,https://www.sciencedirect.com/science/article/pii/S0140988323002578,Available online 1 June 2023,2023,Research Article
14,14,Does industrial upgrading improve eco-efficiency? Evidence from China's industrial sector,https://www.sciencedirect.com/science/article/pii/S0140988323002724,1 June 2023,2023,Research Article
15,15,The impact of producer services agglomeration on green economic development: Evidence from 278 Chinese cities,https://www.sciencedirect.com/science/article/pii/S0140988323002670,Available online 1 June 2023,2023,Research Article
16,16,A pathway to sustainable development: Digitization and green productivity,https://www.sciencedirect.com/science/article/pii/S0140988323002700,Available online 1 June 2023,2023,Research Article
17,17,An empirical analysis of the dynamic relationship between clean and dirty energy markets,https://www.sciencedirect.com/science/article/pii/S0140988323002645,Available online 30 May 2023,2023,Research Article
18,18,Role of ESG investments in achieving COP-26 targets,https://www.sciencedirect.com/science/article/pii/S0140988323002554,26 May 2023,2023,Research Article
19,19,Transregional electricity transmission and carbon emissions: Evidence from ultra-high voltage transmission projects in China,https://www.sciencedirect.com/science/article/pii/S0140988323002499,25 May 2023,2023,Research Article
20,20,Asymmetric impact of oil price on current account balance: Evidence from oil importing countries,https://www.sciencedirect.com/science/article/pii/S0140988323002475,25 May 2023,2023,Research Article
21,21,Can digital finance empowerment reduce extreme ESG hypocrisy resistance to improve green innovation?,https://www.sciencedirect.com/science/article/pii/S0140988323002542,Available online 25 May 2023,2023,Research Article
22,22,Green innovation downturn: The role of imperfect competition,https://www.sciencedirect.com/science/article/pii/S0140988323002529,24 May 2023,2023,Research Article
23,23,Oil uncertainty and the price-cost markup: Evidence from U.S. data,https://www.sciencedirect.com/science/article/pii/S0140988323002268,24 May 2023,2023,Research Article
24,24,What can be learned from the historical trend of crude oil prices? An ensemble approach for crude oil price forecasting,https://www.sciencedirect.com/science/article/pii/S0140988323002347,24 May 2023,2023,Research Article
25,25,How does green bond issuance affect total factor productivity? Evidence from Chinese listed enterprises,https://www.sciencedirect.com/science/article/pii/S0140988323002530,24 May 2023,2023,Research Article
26,26,Greening through centralization of environmental monitoring?,https://www.sciencedirect.com/science/article/pii/S0140988323002517,24 May 2023,2023,Research Article
27,27,Does new-type urbanization policy promote green energy efficiency? Evidence from a quasi-natural experiment in China,https://www.sciencedirect.com/science/article/pii/S0140988323002505,24 May 2023,2023,Research Article
28,28,The value of electricity storage arbitrage on day-ahead markets across Europe,https://www.sciencedirect.com/science/article/pii/S0140988323002190,18 May 2023,2023,Research Article
29,29,The hard road to a soft landing: Evidence from a (modestly) nonlinear structural model,https://www.sciencedirect.com/science/article/pii/S0140988323002311,18 May 2023,2023,Research Article
30,30,Impacts of weather conditions on the US commodity markets systemic interdependence across multi-timescales,https://www.sciencedirect.com/science/article/pii/S014098832300230X,18 May 2023,2023,Research Article
31,31,The time-varying effects of liquidity and market efficiency of the European Union carbon market: Evidence from the TVP-SVAR-SV approach,https://www.sciencedirect.com/science/article/pii/S0140988323002062,16 May 2023,2023,Research Article
32,32,Tracking economic fluctuations with electricity consumption in Bangladesh,https://www.sciencedirect.com/science/article/pii/S0140988323002384,16 May 2023,2023,Research Article
33,33,Does political inspection promote corporate green innovation?,https://www.sciencedirect.com/science/article/pii/S0140988323002281,16 May 2023,2023,Research Article
34,34,Does adhering to the principles of green finance matter for stock valuation? Evidence from testing for (co-)explosiveness,https://www.sciencedirect.com/science/article/pii/S014098832300227X,16 May 2023,2023,Research Article
35,35,"The relative response of Russian National Wealth Fund to oil demand, supply and risk shocks",https://www.sciencedirect.com/science/article/pii/S0140988323002220,13 May 2023,2023,Research Article
36,36,Diversification effects of China's carbon neutral bond on renewable energy stock markets: A minimum connectedness portfolio approach,https://www.sciencedirect.com/science/article/pii/S0140988323002256,12 May 2023,2023,Research Article
37,37,Environmental productivity growth across European industries,https://www.sciencedirect.com/science/article/pii/S0140988323002050,12 May 2023,2023,Research Article
38,38,Analysis of generation investments under price controls in cross-border trade of electricity,https://www.sciencedirect.com/science/article/pii/S0140988323002207,11 May 2023,2023,Research Article
39,39,EU in search of a Carbon Border Adjustment Mechanism,https://www.sciencedirect.com/science/article/pii/S0140988323001718,9 May 2023,2023,Research Article
40,40,Time-varying effects of oil price shocks on financial stress: Evidence from India,https://www.sciencedirect.com/science/article/pii/S0140988323002013,9 May 2023,2023,Research Article
41,41,Dynamic time-frequency connectedness between European emissions trading system and sustainability markets,https://www.sciencedirect.com/science/article/pii/S0140988323002244,9 May 2023,2023,Research Article
42,42,Exploring the effects of manufacturing servitization on enterprise energy conservation and emissions reduction moderated by digital transformation,https://www.sciencedirect.com/science/article/pii/S0140988323002049,9 May 2023,2023,Research Article
43,43,Green bonds markets and renewable energy development: Policy integration for achieving carbon neutrality,https://www.sciencedirect.com/science/article/pii/S0140988323002232,9 May 2023,2023,Research Article
44,44,Exquisite workmanship through net-zero emissions? The effects of carbon emission trading policy on firms' export product quality,https://www.sciencedirect.com/science/article/pii/S0140988323001998,8 May 2023,2023,Research Article
45,45,"The impact of managerial myopia on environmental, social and governance (ESG) engagement: Evidence from Chinese firms",https://www.sciencedirect.com/science/article/pii/S0140988323002037,3 May 2023,2023,Research Article
46,46,Analyzing different types of asymmetric responses in terminal gate prices of petrol and diesel across major Australian seaports: Implications for fuel price monitoring strategies,https://www.sciencedirect.com/science/article/pii/S0140988323002074,3 May 2023,2023,Research Article
47,47,Drivers and pass-through of the EU ETS price: Evidence from the power sector,https://www.sciencedirect.com/science/article/pii/S0140988323001962,2 May 2023,2023,Research Article
48,48,Combining mandatory coal power phaseout and emissions trading in China's power sector,https://www.sciencedirect.com/science/article/pii/S0140988323001925,28 April 2023,2023,Research Article
49,49,The impact of geopolitical risks on renewable energy demand in OECD countries,https://www.sciencedirect.com/science/article/pii/S0140988323001986,26 April 2023,2023,Research Article
50,50,House of the rising sun: The effect of utility-scale solar arrays on housing prices,https://www.sciencedirect.com/science/article/pii/S0140988323001974,26 April 2023,2023,Research Article
51,51,Forecasting Chinese provincial CO,https://www.sciencedirect.com/science/article/pii/S0140988323001834,25 April 2023,2023,Research Article
52,52,Does carbon price uncertainty affect stock price crash risk? Evidence from China,https://www.sciencedirect.com/science/article/pii/S0140988323001871,24 April 2023,2023,Research Article
53,53,High return and low risk: Shaping composite financial investment decision in the new energy stock market,https://www.sciencedirect.com/science/article/pii/S0140988323001810,24 April 2023,2023,Research Article
54,54,Insurer financing for borrowing producers in a supply chain under alternative carbon allowance trades,https://www.sciencedirect.com/science/article/pii/S0140988323001822,23 April 2023,2023,Research Article
55,55,Research on tail risk contagion in international energy markets—The quantile time-frequency volatility spillover perspective,https://www.sciencedirect.com/science/article/pii/S0140988323001767,21 April 2023,2023,Research Article
56,56,Does financial market participation eradicate household energy poverty?,https://www.sciencedirect.com/science/article/pii/S0140988323001858,21 April 2023,2023,Research Article
57,57,Earnings expectations of grey and green energy firms: Analysis against the background of global climate change mitigation,https://www.sciencedirect.com/science/article/pii/S0140988323001901,20 April 2023,2023,Research Article
58,58,COVID-induced sentiment and the intraday volatility spillovers between energy and other ETFs,https://www.sciencedirect.com/science/article/pii/S0140988323001755,20 April 2023,2023,Research Article
59,59,How does energy poverty eradication realize the path to carbon unlocking? The case of China,https://www.sciencedirect.com/science/article/pii/S0140988323001895,20 April 2023,2023,Research Article
60,60,Structural sources of oil market volatility and correlation dynamics,https://www.sciencedirect.com/science/article/pii/S0140988323001561,20 April 2023,2023,Research Article
61,61,Effect of weather and environmental attentions on financial system risks: Evidence from Chinese high- and low-carbon assets,https://www.sciencedirect.com/science/article/pii/S0140988323001780,20 April 2023,2023,Research Article
62,62,Analyzing the impact of low-carbon city pilot policy on enterprises' labor demand: Evidence from China,https://www.sciencedirect.com/science/article/pii/S0140988323001743,Available online 20 April 2023,2023,Research Article
63,63,The equilibrium analysis and potential modifications on the China pilot electricity spot market,https://www.sciencedirect.com/science/article/pii/S0140988323001913,19 April 2023,2023,Research Article
64,64,How does pollution heterogeneity affect the role of cleaner production regulations? Evidence from Chinese enterprises' domestic value-added in exports,https://www.sciencedirect.com/science/article/pii/S0140988323001792,19 April 2023,2023,Research Article
65,65,Does green finance really inhibit extreme hypocritical ESG risk? A greenwashing perspective exploration,https://www.sciencedirect.com/science/article/pii/S014098832300186X,18 April 2023,2023,Research Article
66,66,Towards net-zero emissions: Can green bond policy promote green innovation and green space?,https://www.sciencedirect.com/science/article/pii/S0140988323001731,18 April 2023,2023,Research Article
67,67,Low carbon and efficiency oriented day-ahead joint electrical energy and ancillary services market clearing model for generation-side in China,https://www.sciencedirect.com/science/article/pii/S0140988323001846,18 April 2023,2023,Research Article
68,68,Implications of carbon neutrality for power sector investments and stranded coal assets in China,https://www.sciencedirect.com/science/article/pii/S0140988323001809,17 April 2023,2023,Research Article
69,69,A weekly structural VAR model of the US crude oil market,https://www.sciencedirect.com/science/article/pii/S0140988323001548,14 April 2023,2023,Research Article
70,70,What derives renewable energy transition in G-7 and E-7 countries? The role of financial development and mineral markets,https://www.sciencedirect.com/science/article/pii/S0140988323001597,11 April 2023,2023,Research Article
71,71,Endogenous thresholds in energy prices: Modeling and empirical estimation,https://www.sciencedirect.com/science/article/pii/S0140988323001676,11 April 2023,2023,Research Article
72,72,Sustainability and stability: Will ESG investment reduce the return and volatility spillover effects across the Chinese financial market?,https://www.sciencedirect.com/science/article/pii/S014098832300172X,11 April 2023,2023,Research Article
73,73,The 2022 energy crisis: Fuel poverty and the impact of policy interventions in Australia's National Electricity Market,https://www.sciencedirect.com/science/article/pii/S0140988323001585,8 April 2023,2023,Research Article
74,74,Quantifying the health benefits of improving environmental efficiency: A case study from coal power plants in China,https://www.sciencedirect.com/science/article/pii/S0140988323001706,8 April 2023,2023,Research Article
75,75,The role of the COVID-19 pandemic in time-frequency connectedness between oil market shocks and green bond markets: Evidence from the wavelet-based quantile approaches,https://www.sciencedirect.com/science/article/pii/S014098832300155X,6 April 2023,2023,Research Article
76,76,Enterprise sustainable development and green fund concern: The analysis and test of R&D from listed companies in China,https://www.sciencedirect.com/science/article/pii/S0140988323001524,5 April 2023,2023,Research Article
77,77,The rise of green energy metal: Could lithium threaten the status of oil?,https://www.sciencedirect.com/science/article/pii/S0140988323001494,1 April 2023,2023,Research Article
78,78,Share of polluting input as a sufficient statistic for burden sharing,https://www.sciencedirect.com/science/article/pii/S0140988323001457,29 March 2023,2023,Research Article
79,79,"Green innovation, natural extreme events, and energy transition: Evidence from Asia-Pacific economies",https://www.sciencedirect.com/science/article/pii/S0140988323001366,24 March 2023,2023,Research Article
80,80,Oil price shocks and exchange rate dynamics: Evidence from decomposed and partial connectedness measures for oil importing and exporting economies,https://www.sciencedirect.com/science/article/pii/S0140988323001251,23 March 2023,2023,Research Article
81,81,Asymmetry and interdependence when evaluating U.S. Energy Information Administration forecasts,https://www.sciencedirect.com/science/article/pii/S0140988323001184,23 March 2023,2023,Research Article
82,82,The rebound effect of solar panel adoption: Evidence from Dutch households,https://www.sciencedirect.com/science/article/pii/S0140988323001433,23 March 2023,2023,Research Article
83,83,"Uncovering risk transmission between socially responsible investments, alternative energy investments and the implied volatility of major commodities",https://www.sciencedirect.com/science/article/pii/S0140988323001329,21 March 2023,2023,Research Article
84,84,Evaluation of Cost-at-Risk related to the procurement of resources in the ancillary services market. The case of the Italian electricity market,https://www.sciencedirect.com/science/article/pii/S0140988323001238,21 March 2023,2023,Research Article
85,85,Carbon pricing and enterprise productivity-The role of price stabilization mechanism,https://www.sciencedirect.com/science/article/pii/S0140988323001299,21 March 2023,2023,Research Article
86,86,Multilayer network analysis for measuring the inter-connectedness between the oil market and G20 stock markets,https://www.sciencedirect.com/science/article/pii/S0140988323001378,21 March 2023,2023,Research Article
87,87,Gas price expectations of Chinese households,https://www.sciencedirect.com/science/article/pii/S0140988323001202,20 March 2023,2023,Research Article
88,88,Impact of economic policy uncertainty on the volatility of China's emission trading scheme pilots,https://www.sciencedirect.com/science/article/pii/S014098832300124X,17 March 2023,2023,Research Article
89,89,"Economic policy uncertainty, jump dynamics, and oil price volatility",https://www.sciencedirect.com/science/article/pii/S0140988323001330,17 March 2023,2023,Research Article
90,90,The carrot and the stock: In search of stock-market incentives for decarbonization,https://www.sciencedirect.com/science/article/pii/S0140988323001135,16 March 2023,2023,Research Article
91,91,Natural gas and the utility sector nexus in the U.S.: Quantile connectedness and portfolio implications,https://www.sciencedirect.com/science/article/pii/S0140988323001305,15 March 2023,2023,Research Article
92,92,"Does the renovation of waste-to-energy incineration plants attenuate the housing price gradient? Evidence from a quasi-natural experiment in Shenzhen, China",https://www.sciencedirect.com/science/article/pii/S0140988323001317,15 March 2023,2023,Research Article
93,93,Does China's low-carbon city pilot intervention limit electricity consumption? An analysis of industrial energy efficiency using time-varying DID model,https://www.sciencedirect.com/science/article/pii/S0140988323001342,15 March 2023,2023,Research Article
94,94,The impact of export VAT rebate reduction on firms' pollution emissions: Evidence from Chinese enterprises,https://www.sciencedirect.com/science/article/pii/S0140988323001287,15 March 2023,2023,Research Article
95,95,A threshold effect of COVID-19 risk on oil price returns,https://www.sciencedirect.com/science/article/pii/S0140988323001160,9 March 2023,2023,Research Article
96,96,Digital finance and the low-carbon energy transition (LCET) from the perspective of capital-biased technical progress,https://www.sciencedirect.com/science/article/pii/S0140988323001214,9 March 2023,2023,Research Article
97,97,The motivational drivers behind consumer preferences for regional electricity – Results of a choice experiment in Southern Germany,https://www.sciencedirect.com/science/article/pii/S014098832300083X,9 March 2023,2023,Research Article
98,98,The effects of new energy vehicle subsidies on air quality: Evidence from China,https://www.sciencedirect.com/science/article/pii/S0140988323001226,9 March 2023,2023,Research Article
99,99,The role of China's crude oil futures in world oil futures market and China's financial market,https://www.sciencedirect.com/science/article/pii/S0140988323001172,8 March 2023,2023,Research Article
100,100,Reducing information barriers to solar adoption: Experimental evidence from India,https://www.sciencedirect.com/science/article/pii/S0140988323000981,8 March 2023,2023,Research Article
101,101,The effect of oil implied volatility and geopolitical risk on GCC stock sectors under various market conditions,https://www.sciencedirect.com/science/article/pii/S0140988323001159,8 March 2023,2023,Research Article
102,102,Modelling Australian electricity prices using indicator saturation,https://www.sciencedirect.com/science/article/pii/S0140988323001147,8 March 2023,2023,Research Article
103,103,Forecasting oil inventory changes with Google trends: A hybrid wavelet decomposer and ARDL-SVR ensemble model,https://www.sciencedirect.com/science/article/pii/S0140988323001019,5 March 2023,2023,Research Article
104,104,"The beneficial role of green bonds as a new strategic asset class: Dynamic dependencies, allocation and diversification before and during the pandemic era",https://www.sciencedirect.com/science/article/pii/S0140988323000853,4 March 2023,2023,Research Article
105,105,Sustainable debt and gas markets: A new look using the time-varying wavelet-windowed cross-correlation approach,https://www.sciencedirect.com/science/article/pii/S0140988323001044,3 March 2023,2023,Research Article
106,106,"The economics of public transport electrification: A case study from Victoria, Australia",https://www.sciencedirect.com/science/article/pii/S014098832300097X,1 March 2023,2023,Research Article
107,107,From point forecasts to multivariate probabilistic forecasts: The Schaake shuffle for day-ahead electricity price forecasting,https://www.sciencedirect.com/science/article/pii/S0140988323001007,28 February 2023,2023,Research Article
108,108,"The role of green financing in facilitating renewable energy transition in China: Perspectives from energy governance, environmental regulation, and market reforms",https://www.sciencedirect.com/science/article/pii/S0140988323000932,28 February 2023,2023,Research Article
109,109,Internal mechanism analysis of the financial vanishing effect on green growth: Evidence from China,https://www.sciencedirect.com/science/article/pii/S0140988323000774,26 February 2023,2023,Research Article
110,110,The environmental pillar of ESG and financial performance: A portfolio analysis,https://www.sciencedirect.com/science/article/pii/S0140988323000968,25 February 2023,2023,Research Article
111,111,Introduction of the carbon tax in Italy: Is there room for a quadruple-dividend effect?,https://www.sciencedirect.com/science/article/pii/S0140988323000762,24 February 2023,2023,Research Article
112,112,"Electricity production, power generation structure, and air pollution: A monthly data analysis for 279 cities in China (2015–2019)",https://www.sciencedirect.com/science/article/pii/S0140988323000956,24 February 2023,2023,Research Article
113,113,Stranded houses? The price effect of a minimum energy efficiency standard,https://www.sciencedirect.com/science/article/pii/S0140988323000531,24 February 2023,2023,Research Article
114,114,Interdependence of clean energy and green markets with cryptocurrencies,https://www.sciencedirect.com/science/article/pii/S0140988323000828,23 February 2023,2023,Research Article
115,115,Stricter energy regulations and water consumption: Firm-level evidence from China,https://www.sciencedirect.com/science/article/pii/S0140988323000889,23 February 2023,2023,Research Article
116,116,Energy-related financial literacy and retrofits of Soviet-era apartment buildings: The case of Lithuania,https://www.sciencedirect.com/science/article/pii/S0140988323000816,23 February 2023,2023,Research Article
117,117,Power shortage and firm performance: Evidence from a Chinese city power shortage index,https://www.sciencedirect.com/science/article/pii/S0140988323000919,23 February 2023,2023,Research Article
118,118,"FDI, financial market development and nonlinearities of energy and environmental efficiency in China: Evidence from both parametric and nonparametric models",https://www.sciencedirect.com/science/article/pii/S0140988323000786,23 February 2023,2023,Research Article
119,119,Who benefits from the decentralised energy system (DES)? Evidence from Nepal’s micro-hydropower (MHP),https://www.sciencedirect.com/science/article/pii/S0140988323000907,23 February 2023,2023,Research Article
120,120,"Extreme climate, innovative ability and energy efficiency",https://www.sciencedirect.com/science/article/pii/S0140988323000841,23 February 2023,2023,Research Article
121,121,Does the carbon emissions trading system reduce carbon emissions by promoting two-way FDI in developing countries? Evidence from Chinese listed companies and cities,https://www.sciencedirect.com/science/article/pii/S0140988323000798,23 February 2023,2023,Research Article
