,Unnamed: 0,Title,Url,Time,Year,Type
1155,1155,The oil-slick trade: An analysis of embodied crude oil in China's trade and consumption,https://www.sciencedirect.com/science/article/pii/S0140988320301031,26 April 2020,2020,Research Article
1156,1156,Cost of power outages for manufacturing firms in Ethiopia: A stated preference study,https://www.sciencedirect.com/science/article/pii/S014098832030092X,22 April 2020,2020,Research Article
1157,1157,Does the Brazilian policy for oil revenues distribution foster investment in human capital?,https://www.sciencedirect.com/science/article/pii/S0140988320300992,22 April 2020,2020,Research Article
1158,1158,The linkages between oil market uncertainty and Islamic stock markets: Evidence from quantile-on-quantile approach,https://www.sciencedirect.com/science/article/pii/S0140988320300980,21 April 2020,2020,Research Article
1159,1159,Renewable energy regulation and structural breaks: An empirical analysis of Spanish electricity price volatility,https://www.sciencedirect.com/science/article/pii/S0140988320300888,15 April 2020,2020,Research Article
1160,1160,Unified efficiency measurement of coal-fired power plants in China considering group heterogeneity and technological gaps,https://www.sciencedirect.com/science/article/pii/S0140988320300906,13 April 2020,2020,Research Article
1161,1161,Dynamic nonlinear impacts of oil price returns and financial uncertainties on credit risks of oil-exporting countries,https://www.sciencedirect.com/science/article/pii/S0140988320300864,5 April 2020,2020,Research Article
1162,1162,The impact of mergers and acquisitions on technology learning in the petroleum industry,https://www.sciencedirect.com/science/article/pii/S0140988320300840,3 April 2020,2020,Research Article
1163,1163,Economic determinants of oil futures volatility: A term structure perspective,https://www.sciencedirect.com/science/article/pii/S0140988320300827,21 March 2020,2020,Research Article
1164,1164,Estimation of residential electricity demand in Hong Kong under electricity charge subsidies,https://www.sciencedirect.com/science/article/pii/S0140988320300815,21 March 2020,2020,Research Article
1165,1165,Oil price uncertainty and cash holdings: Evidence from China,https://www.sciencedirect.com/science/article/pii/S0140988320300712,5 March 2020,2020,Research Article
1166,1166,European transmission grid expansion as a flexibility option in a scenario of large scale variable renewable energies integration,https://www.sciencedirect.com/science/article/pii/S0140988320300724,6 March 2020,2020,Research Article
1167,1167,How to deal with the risks of phasing out coal in Germany,https://www.sciencedirect.com/science/article/pii/S0140988320300694,5 March 2020,2020,Research Article
1168,1168,How do oil price shocks affect the output volatility of the U.S. energy mining industry? The roles of structural oil price shocks,https://www.sciencedirect.com/science/article/pii/S0140988320300761,13 March 2020,2020,Research Article
1169,1169,Towards a sustainable energy scenario? A worldwide analysis,https://www.sciencedirect.com/science/article/pii/S0140988320300773,13 March 2020,2020,Research Article
1170,1170,Mapping China's flows of emissions in the world's carbon footprint: A network approach of production layers,https://www.sciencedirect.com/science/article/pii/S0140988320300785,18 March 2020,2020,Research Article
1171,1171,The effect of oil and stock price volatility on firm level investment: The case of UK firms,https://www.sciencedirect.com/science/article/pii/S0140988320300700,7 March 2020,2020,Research Article
1172,1172,Financial development and energy consumption in emerging markets: Smooth structural shifts and causal linkages,https://www.sciencedirect.com/science/article/pii/S0140988320300682,6 March 2020,2020,Research Article
1173,1173,Objective vs. subjective fuel poverty and self-assessed health,https://www.sciencedirect.com/science/article/pii/S014098832030075X,12 March 2020,2020,Research Article
1174,1174,What drives China's natural gas consumption? Analysis of national and regional estimates,https://www.sciencedirect.com/science/article/pii/S0140988320300839,19 March 2020,2020,Research Article
1175,1175,"Identifying price bubbles in the US, European and Asian natural gas market: Evidence from a GSADF test approach",https://www.sciencedirect.com/science/article/pii/S0140988320300797,18 March 2020,2020,Research Article
1176,1176,Are big mergers welfare enhancing when there is environmental externality?,https://www.sciencedirect.com/science/article/pii/S0140988320300578,29 February 2020,2020,Research Article
1177,1177,Environmental disclosure and idiosyncratic risk in the European manufacturing sector,https://www.sciencedirect.com/science/article/pii/S0140988320300542,29 February 2020,2020,Research Article
1178,1178,Utility-scale energy storage in an imperfectly competitive power sector,https://www.sciencedirect.com/science/article/pii/S0140988320300554,27 February 2020,2020,Research Article
1179,1179,Petroleum taxation. The effect on recovery rates,https://www.sciencedirect.com/science/article/pii/S0140988320300591,27 February 2020,2020,Research Article
1180,1180,Analysis of imperfect competition in natural gas supply contracts for electric power generation: A closed-loop approach,https://www.sciencedirect.com/science/article/pii/S0140988320300566,26 February 2020,2020,Research Article
1181,1181,Can commodity prices forecast exchange rates?,https://www.sciencedirect.com/science/article/pii/S014098832030058X,26 February 2020,2020,Research Article
1182,1182,Crude oil price analysis and forecasting: A perspective of “new triangle”,https://www.sciencedirect.com/science/article/pii/S0140988320300608,26 February 2020,2020,Research Article
1183,1183,The role of underground storage in the dynamics of the US natural gas market: A threshold model analysis,https://www.sciencedirect.com/science/article/pii/S0140988320300529,20 February 2020,2020,Research Article
1184,1184,Would environmental regulation improve the greenhouse gas benefits of natural gas use? A Chinese case study,https://www.sciencedirect.com/science/article/pii/S0140988320300517,11 February 2020,2020,Research Article
1185,1185,Pricing reliability options under different electricity price regimes,https://www.sciencedirect.com/science/article/pii/S014098832030044X,11 February 2020,2020,Research Article
1186,1186,Adjusting productivity measures for CO,https://www.sciencedirect.com/science/article/pii/S0140988320300463,11 February 2020,2020,Research Article
1187,1187,Allocation of coal de-capacity quota among provinces in China: A bi-level multi-objective combinatorial optimization approach,https://www.sciencedirect.com/science/article/pii/S0140988320300487,11 February 2020,2020,Research Article
1188,1188,Analyzing time-varying volatility spillovers between the crude oil markets using a new method,https://www.sciencedirect.com/science/article/pii/S0140988320300505,11 February 2020,2020,Research Article
1189,1189,Does a small difference make a difference? Impact of feed-in tariff on renewable power generation in China,https://www.sciencedirect.com/science/article/pii/S0140988320300499,11 February 2020,2020,Research Article
1190,1190,Shining a new light on the environmental Kuznets curve for CO,https://www.sciencedirect.com/science/article/pii/S0140988320300438,7 February 2020,2020,Research Article
1191,1191,Understanding segmentation in rural electricity markets: Evidence from India,https://www.sciencedirect.com/science/article/pii/S0140988320300360,7 February 2020,2020,Research Article
1192,1192,Crude oil price and cryptocurrencies: Evidence of volatility connectedness and hedging strategy,https://www.sciencedirect.com/science/article/pii/S0140988320300426,5 February 2020,2020,Research Article
1193,1193,Understanding the ROC transfer payment in the renewable obligation with the recycling mechanism in the United Kingdom,https://www.sciencedirect.com/science/article/pii/S0140988320300402,5 February 2020,2020,Research Article
1194,1194,Energy efficiency as a credence good: A review of informational barriers to energy savings in the building sector,https://www.sciencedirect.com/science/article/pii/S0140988320300372,4 February 2020,2020,Research Article
1195,1195,Is welfare higher when utilities are owned by customers instead of investors? Evidence from electricity distribution in New Zealand,https://www.sciencedirect.com/science/article/pii/S0140988320300396,5 February 2020,2020,Research Article
1196,1196,Energy as a factor of production: Historical roots in the American institutionalist context,https://www.sciencedirect.com/science/article/pii/S0140988320300451,5 February 2020,2020,Research Article
1197,1197,Research on meta-frontier total-factor energy efficiency and its spatial convergence in Chinese provinces,https://www.sciencedirect.com/science/article/pii/S0140988320300414,5 February 2020,2020,Research Article
1198,1198,On the use of hedonic regression models to measure the effect of energy efficiency on residential property transaction prices: Evidence for Portugal and selected data issues,https://www.sciencedirect.com/science/article/pii/S0140988320300384,4 February 2020,2020,Research Article
1199,1199,The welfare and price effects of sector coupling with power-to-gas,https://www.sciencedirect.com/science/article/pii/S0140988320300475,10 February 2020,2020,Research Article
1200,1200,Efficiency distortion of the power generation sector under the dual regulation of price and quantity in China,https://www.sciencedirect.com/science/article/pii/S0140988320300141,31 January 2020,2020,Research Article
1201,1201,Using the binomial model for the valuation of real options in computing optimal subsidies for Chinese renewable energy investments,https://www.sciencedirect.com/science/article/pii/S0140988320300311,28 January 2020,2020,Research Article
1202,1202,Forecasting crude oil price volatility via a HM-EGARCH model,https://www.sciencedirect.com/science/article/pii/S0140988320300323,28 January 2020,2020,Research Article
1203,1203,Supply curves for hydro reservoirs – Estimation and usage in large-scale electricity market models,https://www.sciencedirect.com/science/article/pii/S0140988320300359,28 January 2020,2020,Research Article
1204,1204,The pass-through effects of oil price shocks on China's inflation: A time-varying analysis,https://www.sciencedirect.com/science/article/pii/S0140988320300347,28 January 2020,2020,Research Article
1205,1205,Not all sectors are alike: Differential impacts of shocks in oil prices on the sectors of the Colombian economy,https://www.sciencedirect.com/science/article/pii/S014098832030030X,27 January 2020,2020,Research Article
1206,1206,Value of technology in the U.S. electric power sector: Impacts of full portfolios and technological change on the costs of meeting decarbonization goals,https://www.sciencedirect.com/science/article/pii/S0140988320300335,25 January 2020,2020,Research Article
1207,1207,Shell shocked: The impact of foreign entry on the gasoline retail market in China,https://www.sciencedirect.com/science/article/pii/S0140988320300293,22 January 2020,2020,Research Article
1208,1208,Exploiting the heteroskedasticity in measurement error to improve volatility predictions in oil and biofuel feedstock markets,https://www.sciencedirect.com/science/article/pii/S0140988320300281,21 January 2020,2020,Research Article
1209,1209,Assessing the feasibility of deployment policies in wind energy systems. A sensitivity analysis on a multiequational econometric framework,https://www.sciencedirect.com/science/article/pii/S014098832030027X,21 January 2020,2020,Research Article
1210,1210,Self-aggravation effect of air pollution: Evidence from residential electricity consumption in China,https://www.sciencedirect.com/science/article/pii/S0140988320300232,21 January 2020,2020,Research Article
1211,1211,The impact of generator market power on the electricity hedge market,https://www.sciencedirect.com/science/article/pii/S0140988319304463,20 January 2020,2020,Research Article
1212,1212,Which risk factors drive oil futures price curves?,https://www.sciencedirect.com/science/article/pii/S0140988320300153,17 January 2020,2020,Research Article
1213,1213,Time-varying income and price elasticities for energy demand: Evidence from a middle-income panel,https://www.sciencedirect.com/science/article/pii/S0140988320300207,16 January 2020,2020,Research Article
1214,1214,On the benefits of behind-the-meter rooftop solar and energy storage: The importance of retail rate design,https://www.sciencedirect.com/science/article/pii/S0140988320300219,15 January 2020,2020,Research Article
1215,1215,Forecasting the real prices of crude oil using robust regression models with regularization constraints,https://www.sciencedirect.com/science/article/pii/S0140988320300220,11 January 2020,2020,Research Article
1216,1216,Short- and long-run asymmetric effect of oil prices and oil and gas revenues on the real GDP and economic diversification in oil-dependent economy,https://www.sciencedirect.com/science/article/pii/S0140988320300190,11 January 2020,2020,Research Article
1217,1217,Citation-based systematic literature review of energy-growth nexus: An overview of the field and content analysis of the top 50 influential papers,https://www.sciencedirect.com/science/article/pii/S0140988319304396,9 January 2020,2020,Research Article
1218,1218,Optimization of dynamic incentive for the deployment of carbon dioxide removal technology: A nonlinear dynamic approach combined with real options,https://www.sciencedirect.com/science/article/pii/S0140988319304402,8 January 2020,2020,Research Article
1219,1219,The promotion of community energy projects in Chile and Scotland: An economic approach using biform games,https://www.sciencedirect.com/science/article/pii/S0140988320300165,8 January 2020,2020,Research Article
1220,1220,Changing trends of the elasticity of China's carbon emission intensity to industry structure and energy efficiency,https://www.sciencedirect.com/science/article/pii/S0140988320300189,8 January 2020,2020,Research Article
1221,1221,Measuring market integration and estimating policy impacts on the Swiss electricity market,https://www.sciencedirect.com/science/article/pii/S0140988319304347,8 January 2020,2020,Research Article
1222,1222,Network connectedness of green bonds and asset classes,https://www.sciencedirect.com/science/article/pii/S0140988319304268,7 January 2020,2020,Research Article
1223,1223,Asymmetric preference and loss aversion for electric vehicles: The reference-dependent choice model capturing different preference directions,https://www.sciencedirect.com/science/article/pii/S0140988320300050,7 January 2020,2020,Research Article
1224,1224,Public-private partnerships investment in energy as new determinant of CO,https://www.sciencedirect.com/science/article/pii/S0140988320300037,7 January 2020,2020,Research Article
1225,1225,Modeling and forecasting the electricity clearing price: A novel BELM based pattern classification framework and a comparative analytic study on multi-layer BELM and LSTM,https://www.sciencedirect.com/science/article/pii/S0140988319304451,7 January 2020,2020,Research Article
1226,1226,Systemic risk spillovers between crude oil and stock index returns of G7 economies: Conditional value-at-risk and marginal expected shortfall approaches,https://www.sciencedirect.com/science/article/pii/S0140988319304438,7 January 2020,2020,Research Article
1227,1227,The role of feed-in tariff in the curtailment of wind power in China,https://www.sciencedirect.com/science/article/pii/S014098831930458X,7 January 2020,2020,Research Article
1228,1228,Carbon fueling complex global value chains tripled in the period 1995–2012,https://www.sciencedirect.com/science/article/pii/S0140988319304487,7 January 2020,2020,Research Article
1229,1229,U.S. equity and commodity futures markets: Hedging or financialization?,https://www.sciencedirect.com/science/article/pii/S0140988319304578,7 January 2020,2020,Research Article
1230,1230,Anchoring inflation expectations in the face of oil shocks & in the proximity of ZLB: A tale of two targeters,https://www.sciencedirect.com/science/article/pii/S0140988320300013,7 January 2020,2020,Research Article
1231,1231,On the economics of carbon pricing: Insights from econometric modeling with industry-level data,https://www.sciencedirect.com/science/article/pii/S0140988320300177,7 January 2020,2020,Research Article
1232,1232,The allocation of CO,https://www.sciencedirect.com/science/article/pii/S0140988319304499,7 January 2020,2020,Research Article
1233,1233,Dirty neighbors — Pollution in an interlinked world,https://www.sciencedirect.com/science/article/pii/S0140988319304335,7 January 2020,2020,Research Article
1234,1234,How do dynamic responses of exchange rates to oil price shocks co-move? From a time-varying perspective,https://www.sciencedirect.com/science/article/pii/S0140988319304384,7 January 2020,2020,Research Article
1235,1235,What goes up must come down? The recent economic cycles of the four most oil and gas dominated states in the US,https://www.sciencedirect.com/science/article/pii/S0140988320300049,7 January 2020,2020,Research Article
1236,1236,Forecasting volatility in the petroleum futures markets: A re-examination and extension,https://www.sciencedirect.com/science/article/pii/S0140988319304232,7 January 2020,2020,Research Article
1237,1237,Policy as a “porter” of RE component export or import? Evidence from PV/wind energy in OECD and BRICS,https://www.sciencedirect.com/science/article/pii/S014098831930427X,7 January 2020,2020,Research Article
1238,1238,The Energy-conservation and Emission-reduction Paths of Industrial sectors: Evidence from Chinas 35 industrial sectors,https://www.sciencedirect.com/science/article/pii/S0140988319304256,7 January 2020,2020,Research Article
1239,1239,An analysis of the global oil market using SVARMA models,https://www.sciencedirect.com/science/article/pii/S014098831930430X,3 January 2020,2020,Research Article
1240,1240,Assessing energy efficiency improvements and related energy security and climate benefits in Finland: An ,https://www.sciencedirect.com/science/article/pii/S0140988319304372,3 January 2020,2020,Research Article
1241,1241,"Ethnic diversity, energy poverty and the mediating role of trust: Evidence from household panel data for Australia",https://www.sciencedirect.com/science/article/pii/S0140988320300025,3 January 2020,2020,Research Article
1242,1242,Carbon congestion effects in China's industry: Evidence from provincial and sectoral levels,https://www.sciencedirect.com/science/article/pii/S0140988319304323,3 January 2020,2020,Research Article
1243,1243,"Power markets in transition: Decarbonization, energy efficiency, and short-term demand response",https://www.sciencedirect.com/science/article/pii/S0140988319304414,3 January 2020,2020,Research Article
1244,1244,CO,https://www.sciencedirect.com/science/article/pii/S0140988319304311,3 January 2020,2020,Research Article
1245,1245,Oil price shocks and EMU sovereign yield spreads,https://www.sciencedirect.com/science/article/pii/S0140988319304530,3 January 2020,2020,Research Article
1246,1246,Fuel poverty and subjective wellbeing,https://www.sciencedirect.com/science/article/pii/S0140988319304475,2 January 2020,2020,Research Article
1247,1247,Can value-added tax incentives of new energy industry increase firm's profitability? Evidence from financial data of China's listed companies,https://www.sciencedirect.com/science/article/pii/S0140988319304517,2 January 2020,2020,Research Article
1248,1248,"The asymmetric impact of oil prices, interest rates and oil price uncertainty on unemployment in the US",https://www.sciencedirect.com/science/article/pii/S0140988319304220,2 January 2020,2020,Research Article
1249,1249,Intertemporal lifestyle changes and carbon emissions: Evidence from a China household survey,https://www.sciencedirect.com/science/article/pii/S0140988319304529,2 January 2020,2020,Research Article
1250,1250,Stochastic convergence in per capita ,https://www.sciencedirect.com/science/article/pii/S0140988319304566,2 January 2020,2020,Research Article
1251,1251,Environmental expenditure spillovers: Evidence from an estimated multi-area DSGE model,https://www.sciencedirect.com/science/article/pii/S0140988319304426,2 January 2020,2020,Research Article
1252,1252,"Marginal abatement cost, air pollution and economic growth: Evidence from Chinese cities",https://www.sciencedirect.com/science/article/pii/S0140988319304554,2 January 2020,2020,Research Article
1253,1253,CO,https://www.sciencedirect.com/science/article/pii/S0140988319304505,2 January 2020,2020,Research Article
1254,1254,Carbon transfer within China: Insights from production fragmentation,https://www.sciencedirect.com/science/article/pii/S014098831930444X,2 January 2020,2020,Research Article
1255,1255,Asymmetric effects of oil price uncertainty on corporate investment,https://www.sciencedirect.com/science/article/pii/S0140988319304190,31 December 2019,2019,Research Article
1256,1256,Does stringent environmental regulation lead to a carbon haven effect? Evidence from carbon-intensive industries in China,https://www.sciencedirect.com/science/article/pii/S0140988319304281,31 December 2019,2019,Research Article
1257,1257,China's carbon emissions trading and stock returns,https://www.sciencedirect.com/science/article/pii/S0140988319304244,31 December 2019,2019,Research Article
1258,1258,Geopolitical risk uncertainty and oil future volatility: Evidence from MIDAS models,https://www.sciencedirect.com/science/article/pii/S0140988319304219,31 December 2019,2019,Research Article
1259,1259,Carbon pass-through in the electricity sector: An econometric analysis,https://www.sciencedirect.com/science/article/pii/S0140988319304189,30 December 2019,2019,Research Article
1260,1260,Coordination of electricity transmission and generation investments,https://www.sciencedirect.com/science/article/pii/S0140988319304207,30 December 2019,2019,Research Article
1261,1261,Nudging the poor and the rich – A field study on the distributional effects of green electricity defaults,https://www.sciencedirect.com/science/article/pii/S014098831930413X,30 December 2019,2019,Research Article
1262,1262,How does farmers' current usage of crop straws influence the willingness-to-accept price to sell?,https://www.sciencedirect.com/science/article/pii/S0140988319304360,30 December 2019,2019,Research Article
1263,1263,Consumption-based and territory-based carbon emissions intensity: Determinants and forecasting using club convergence across countries,https://www.sciencedirect.com/science/article/pii/S0140988319304293,30 December 2019,2019,Research Article
1264,1264,Measuring the Brazilian ethanol and gasoline market efficiency using DFA-Hurst and fractal dimension,https://www.sciencedirect.com/science/article/pii/S0140988319304098,13 December 2019,2019,Research Article
1265,1265,The effect of carbon taxation on cross-border competition and energy efficiency investments,https://www.sciencedirect.com/science/article/pii/S0140988319303974,2 December 2019,2019,Research Article
1266,1266,Monopoly power in the oil market and the macroeconomy,https://www.sciencedirect.com/science/article/pii/S0140988319303925,29 November 2019,2019,Research Article
1267,1267,Global fossil-fuel subsidy reform and Paris Agreement,https://www.sciencedirect.com/science/article/pii/S0140988319303937,28 November 2019,2019,Research Article
1268,1268,Who shapes China's carbon intensity and how? A demand-side decomposition analysis,https://www.sciencedirect.com/science/article/pii/S0140988319303950,27 November 2019,2019,Research Article
1269,1269,Exploring the effect of carbon trading mechanism on China's green development efficiency: A novel integrated approach,https://www.sciencedirect.com/science/article/pii/S0140988319303962,27 November 2019,2019,Research Article
1270,1270,An economic approach to the study of the relationship between housing hazards and health: The case of residential fuel poverty in France,https://www.sciencedirect.com/science/article/pii/S0140988319303871,27 November 2019,2019,Research Article
1271,1271,Risk appetite and oil prices,https://www.sciencedirect.com/science/article/pii/S0140988319303901,26 November 2019,2019,Research Article
1272,1272,The impact of transboundary haze pollution on household utilities consumption,https://www.sciencedirect.com/science/article/pii/S014098831930386X,26 November 2019,2019,Research Article
1273,1273,Bitcoin and its mining on the equilibrium path,https://www.sciencedirect.com/science/article/pii/S0140988319303834,23 November 2019,2019,Research Article
1274,1274,Innovation modelling and multi-factor learning in wind energy technology,https://www.sciencedirect.com/science/article/pii/S0140988319303895,21 November 2019,2019,Research Article
1275,1275,Energy commodity uncertainties and the systematic risk of US industries,https://www.sciencedirect.com/science/article/pii/S0140988319303846,20 November 2019,2019,Research Article
1276,1276,Can carbon emission trading scheme achieve energy conservation and emission reduction? Evidence from the industrial sector in China,https://www.sciencedirect.com/science/article/pii/S0140988319303858,19 November 2019,2019,Research Article
1277,1277,"Investment opportunities, uncertainty, and renewables in European electricity markets",https://www.sciencedirect.com/science/article/pii/S0140988319303706,16 November 2019,2019,Research Article
1278,1278,A dynamic conditional regime-switching GARCH CAPM for energy and financial markets,https://www.sciencedirect.com/science/article/pii/S014098831930372X,16 November 2019,2019,Research Article
