,Unnamed: 0,Title,Url,Time,Year,Type
0,0,Fiscal rules and the reliability of public investment plans: Evidence from local governments,https://www.sciencedirect.com/science/article/pii/S0176268023000599,Available online 12 June 2023,2023,Research Article
1,1,More is not always better. Effect of educational expenditures on education quality and social mobility in Switzerland,https://www.sciencedirect.com/science/article/pii/S0176268023000514,Available online 30 May 2023,2023,Research Article
2,2,Choosing not to lead: Monetary incentives and political selection in local parliamentary systems,https://www.sciencedirect.com/science/article/pii/S0176268023000502,Available online 30 May 2023,2023,Research Article
3,3,Gender differences in politician persistence and incumbency advantage,https://www.sciencedirect.com/science/article/pii/S0176268023000484,26 May 2023,2023,Research Article
4,4,Political polarization and international cooperation,https://www.sciencedirect.com/science/article/pii/S0176268023000459,3 May 2023,2023,Research Article
5,5,On the duration of empires,https://www.sciencedirect.com/science/article/pii/S0176268023000447,25 April 2023,2023,Research Article
6,6,Emigrants’ missing votes,https://www.sciencedirect.com/science/article/pii/S0176268023000423,19 April 2023,2023,Research Article
7,7,Belonging or estrangement—The European Refugee Crisis and its effects on immigrant identity,https://www.sciencedirect.com/science/article/pii/S0176268023000381,17 April 2023,2023,Research Article
8,8,Pro-growth inefficiency: Rents and moral hazard in infrastructure contests in China,https://www.sciencedirect.com/science/article/pii/S0176268023000411,Available online 15 April 2023,2023,Research Article
9,9,Determinants of compliance with fiscal rules: Misplaced efforts or hidden motivations?,https://www.sciencedirect.com/science/article/pii/S0176268023000435,14 April 2023,2023,Research Article
10,10,Fiscal decentralization and tax collection: evidence from the rural property tax in Brazil,https://www.sciencedirect.com/science/article/pii/S017626802300040X,13 April 2023,2023,Research Article
11,11,Short and long run democracy diffusion,https://www.sciencedirect.com/science/article/pii/S0176268023000393,8 April 2023,2023,Research Article
12,12,Invest one – get two extra: Public investment crowds in private investment,https://www.sciencedirect.com/science/article/pii/S0176268023000289,Available online 2 April 2023,2023,Research Article
13,13,Non-random selection into entrepreneurship in the realm of government decentralization and corruption,https://www.sciencedirect.com/science/article/pii/S0176268023000216,28 March 2023,2023,Research Article
14,14,"An experiment on donations, personal stories, and bad luck",https://www.sciencedirect.com/science/article/pii/S0176268023000253,Available online 17 March 2023,2023,Research Article
15,15,Do your tax problems make tax evasion seem more justifiable? Evidence from a survey experiment,https://www.sciencedirect.com/science/article/pii/S0176268023000095,13 March 2023,2023,Research Article
16,16,Decentralisation or patronage: What determines government's allocation of development spending in a unitary country? Evidence from Bangladesh,https://www.sciencedirect.com/science/article/pii/S0176268023000290,9 March 2023,2023,Research Article
17,17,Can internet surveys represent the entire population? A practitioners’ analysis,https://www.sciencedirect.com/science/article/pii/S0176268023000265,4 March 2023,2023,Research Article
18,18,"Institutions, assortative matching and cultural evolution",https://www.sciencedirect.com/science/article/pii/S0176268023000241,2 March 2023,2023,Research Article
19,19,COVID-19 fatalities and internal conflict: Does government economic support matter?,https://www.sciencedirect.com/science/article/pii/S0176268023000125,24 February 2023,2023,Research Article
20,20,Earthquake hazard and civic capital,https://www.sciencedirect.com/science/article/pii/S0176268023000113,23 February 2023,2023,Research Article
21,21,"Bread and the dilemmas of socialist paternalism in Israel, 1948–1977",https://www.sciencedirect.com/science/article/pii/S0176268023000101,Available online 10 February 2023,2023,Research Article
22,22,"Decentralization, social capital, and regional growth: The case of the Italian North-South divide",https://www.sciencedirect.com/science/article/pii/S0176268023000071,4 February 2023,2023,Research Article
23,23,Islamist terrorism and the status of women,https://www.sciencedirect.com/science/article/pii/S0176268023000083,2 February 2023,2023,Research Article
24,24,Do public account financial statements matter? Evidence from Japanese municipalities,https://www.sciencedirect.com/science/article/pii/S0176268023000022,25 January 2023,2023,Research Article
25,25,Measuring partisan media bias in US newscasts from 2001 to 2012,https://www.sciencedirect.com/science/article/pii/S0176268023000046,20 January 2023,2023,Research Article
26,26,Is democracy good for growth? — Development at political transition time matters,https://www.sciencedirect.com/science/article/pii/S0176268022001586,6 January 2023,2023,Research Article
27,27,Geopolitics and rare earth metals,https://www.sciencedirect.com/science/article/pii/S0176268022001598,30 December 2022,2022,Research Article
28,28,Obedience to the symbol of authority: Experimental evidence on the symbolic source of legitimate authority,https://www.sciencedirect.com/science/article/pii/S0176268022001574,28 December 2022,2022,Research Article
29,29,Stock markets and economic uncertainty: Roles of legislative sessions and coalition strength,https://www.sciencedirect.com/science/article/pii/S0176268022001562,19 December 2022,2022,Research Article
30,30,Trust and attitudes toward income inequality: Does individualism matter?,https://www.sciencedirect.com/science/article/pii/S0176268022001549,29 November 2022,2022,Research Article
31,31,A few signatures matter: Barriers to entry in Italian local politics,https://www.sciencedirect.com/science/article/pii/S0176268022001367,28 November 2022,2022,Research Article
32,32,Immigration vs. poverty: Causal impact on demand for redistribution in a survey experiment,https://www.sciencedirect.com/science/article/pii/S0176268022001513,28 November 2022,2022,Research Article
33,33,Does expert information affect citizens’ attitudes toward Corona policies? Evidence from Germany,https://www.sciencedirect.com/science/article/pii/S0176268022001537,24 November 2022,2022,Research Article
34,34,The 2020 US Presidential election and Trump’s wars on trade and health insurance,https://www.sciencedirect.com/science/article/pii/S0176268022001410,22 November 2022,2022,Research Article
35,35,Intergenerational consequences of gradual pension reforms,https://www.sciencedirect.com/science/article/pii/S0176268022001392,19 November 2022,2022,Research Article
36,36,Legislators in the crossfire: Strategic non-voting and the effect of transparency,https://www.sciencedirect.com/science/article/pii/S0176268022001276,8 November 2022,2022,Research Article
37,37,Do longer constitutions corrupt?,https://www.sciencedirect.com/science/article/pii/S0176268022001227,2 November 2022,2022,Research Article
38,38,"Environmental regulation, political incentives, and mortality in China",https://www.sciencedirect.com/science/article/pii/S0176268022001252,27 October 2022,2022,Research Article
39,39,Investment in identity in the field-Nudging refugees’ integration effort,https://www.sciencedirect.com/science/article/pii/S0176268022001240,22 October 2022,2022,Research Article
40,40,The effect of ethnic diversity on the participation in social groups: Evidence from trade unions,https://www.sciencedirect.com/science/article/pii/S0176268022001215,18 October 2022,2022,Research Article
41,41,On the optimal size of legislatures: An illustrated literature review,https://www.sciencedirect.com/science/article/pii/S0176268022001203,10 October 2022,2022,Research Article
42,42,Electoral competition with fake news,https://www.sciencedirect.com/science/article/pii/S0176268022001185,30 September 2022,2022,Research Article
43,43,Gender bias and women’s political performance,https://www.sciencedirect.com/science/article/pii/S0176268022001173,27 September 2022,2022,Research Article
44,44,Do rival political parties enforce government efficiency? Evidence from Canada 1867–2021,https://www.sciencedirect.com/science/article/pii/S0176268022001161,24 September 2022,2022,Research Article
45,45,Democracy favors access to credit of firms,https://www.sciencedirect.com/science/article/pii/S017626802200115X,20 September 2022,2022,Research Article
46,46,Farewell Anatolia: Refugees & the rise of the Greek Left,https://www.sciencedirect.com/science/article/pii/S0176268022000799,14 September 2022,2022,Research Article
47,47,Macroeconomic expectations and consumer sentiment during the COVID-19 pandemic: The role of others’ beliefs,https://www.sciencedirect.com/science/article/pii/S0176268022000921,10 September 2022,2022,Research Article
48,48,"Strategic compromise, policy bundling and interest group power: Theory and evidence on education policy",https://www.sciencedirect.com/science/article/pii/S0176268022000805,6 September 2022,2022,Research Article
49,49,Does increased credibility of elections lead to higher political competition? Evidence from India,https://www.sciencedirect.com/science/article/pii/S0176268022000763,29 August 2022,2022,Research Article
50,50,"Overconfidence, income-ability gap, and preferences for income equality",https://www.sciencedirect.com/science/article/pii/S0176268022000775,28 August 2022,2022,Research Article
51,51,Deeds or words? The local influence of anti-immigrant parties on foreigners’ flows,https://www.sciencedirect.com/science/article/pii/S0176268022000751,25 August 2022,2022,Research Article
52,52,"Competition, benchmarking, and electoral success: Evidence from 69 years of the German Bundestag",https://www.sciencedirect.com/science/article/pii/S017626802200074X,19 August 2022,2022,Research Article
53,53,Asylum recognition rates in Europe: Policies and performance,https://www.sciencedirect.com/science/article/pii/S0176268022000696,18 August 2022,2022,Research Article
55,55,Corruption and assortative matching of partners in international trade,https://www.sciencedirect.com/science/article/pii/S0176268022000738,13 August 2022,2022,Research Article
56,56,The effects of IMF conditional programs on the unemployment rate,https://www.sciencedirect.com/science/article/pii/S0176268022000726,5 August 2022,2022,Research Article
57,57,Italy’s demographic trap: Voting for childcare subsidies and fertility outcomes,https://www.sciencedirect.com/science/article/pii/S0176268022000672,22 July 2022,2022,Research Article
58,58,The effects of inter-municipal cooperation and central grant allocation on the size of the French local public sector,https://www.sciencedirect.com/science/article/pii/S0176268022000714,22 July 2022,2022,Research Article
59,59,"Social media networks, fake news, and polarization",https://www.sciencedirect.com/science/article/pii/S0176268022000623,14 July 2022,2022,Research Article
60,60,It is not easy being a Green party: Green politics as a normal good,https://www.sciencedirect.com/science/article/pii/S0176268022000684,8 July 2022,2022,Research Article
61,61,Italy: Immigration and the evolution of populism,https://www.sciencedirect.com/science/article/pii/S0176268022000647,22 June 2022,2022,Research Article
62,62,Framing of economic news and policy support during a pandemic: Evidence from a survey experiment,https://www.sciencedirect.com/science/article/pii/S017626802200057X,15 June 2022,2022,Research Article
63,63,"Firms’ efficiency, exits and government procurement contracts",https://www.sciencedirect.com/science/article/pii/S017626802200060X,11 June 2022,2022,Research Article
64,64,Politically influenced counterterrorism policy and welfare efficiency,https://www.sciencedirect.com/science/article/pii/S0176268022000581,6 June 2022,2022,Research Article
65,65,Participatory budgeting and the pattern of local government spending: Evidence from South Korea,https://www.sciencedirect.com/science/article/pii/S0176268022000465,4 May 2022,2022,Research Article
66,66,Ideological spillovers across the Atlantic? Evidence from Trump's presidential election,https://www.sciencedirect.com/science/article/pii/S017626802200043X,26 April 2022,2022,Research Article
67,67,Letting third parties who suffer from petty corruption talk: Evidence from a collusive bribery experiment,https://www.sciencedirect.com/science/article/pii/S0176268022000441,25 April 2022,2022,Research Article
68,68,Official fiscal forecasts in EU member states under the European Semester and Fiscal Compact – An empirical assessment,https://www.sciencedirect.com/science/article/pii/S0176268022000404,9 April 2022,2022,Research Article
71,71,Asymmetric technologies in contests,https://www.sciencedirect.com/science/article/pii/S0176268022001409,18 November 2022,2022,Research Article
72,72,The likelihood of the referendum paradox for a given referendum result,https://www.sciencedirect.com/science/article/pii/S0176268022000416,15 April 2022,2022,Research Article
73,73,Divided committees and strategic vagueness,https://www.sciencedirect.com/science/article/pii/S0176268022000490,1 June 2022,2022,Research Article
74,74,Strategic alliances in a veto game: An experimental study,https://www.sciencedirect.com/science/article/pii/S0176268022000349,7 May 2022,2022,Research Article
75,75,The financial market impact of ECB monetary policy press conferences — A text based approach,https://www.sciencedirect.com/science/article/pii/S0176268022000428,18 April 2022,2022,Research Article
76,76,Part-time parliamentarians? Evidence from outside earnings and parliamentary activities,https://www.sciencedirect.com/science/article/pii/S0176268022000386,18 April 2022,2022,Research Article
77,77,Ideology and monetary policy. The role of political parties’ stances in the European Central Bank’s parliamentary hearings,https://www.sciencedirect.com/science/article/pii/S0176268022000234,19 March 2022,2022,Research Article
78,78,Voting under threat: Evidence from the 2020 French local elections,https://www.sciencedirect.com/science/article/pii/S0176268022000210,18 March 2022,2022,Research Article
79,79,Labor market flexibility and exchange rate regimes,https://www.sciencedirect.com/science/article/pii/S0176268022000222,11 March 2022,2022,Research Article
80,80,Revisiting the nexus between fiscal decentralization and government size - The role of ethnic fragmentation,https://www.sciencedirect.com/science/article/pii/S0176268022000118,25 February 2022,2022,Research Article
81,81,Fear of inflation and gender representation in central banking,https://www.sciencedirect.com/science/article/pii/S0176268022000106,24 February 2022,2022,Research Article
82,82,Your vote is (no) secret! How low voter density hurts anonymity and biases elections in Italy,https://www.sciencedirect.com/science/article/pii/S017626802200009X,20 February 2022,2022,Research Article
83,83,Exploring macroeconomic imbalances through EU Alert Mechanism Reports,https://www.sciencedirect.com/science/article/pii/S0176268022000076,2 February 2022,2022,Research Article
84,84,Unbundling the effect of political instability on income redistribution,https://www.sciencedirect.com/science/article/pii/S0176268022000088,2 February 2022,2022,Research Article
85,85,Debt policies in the aftermath of COVID-19 — The SGP’s debt benchmark revisited,https://www.sciencedirect.com/science/article/pii/S0176268022000064,31 January 2022,2022,Research Article
86,86,Can gender quotas break the glass ceiling? Evidence from Italian municipal elections,https://www.sciencedirect.com/science/article/pii/S0176268021001385,22 January 2022,2022,Research Article
87,87,Sharks and minnows in a shoal of words: Measuring latent ideological positions based on text mining techniques,https://www.sciencedirect.com/science/article/pii/S0176268022000015,19 January 2022,2022,Research Article
88,88,Career incentives of local leaders and crisis response: A case study of COVID-19 lockdowns in China,https://www.sciencedirect.com/science/article/pii/S0176268022000027,15 January 2022,2022,Research Article
89,89,The political economy of firm emissions: Evidence from a quasi-natural experiment in China,https://www.sciencedirect.com/science/article/pii/S0176268022000039,12 January 2022,2022,Research Article
90,90,Religiosity and political participation - Panel data evidence from post-communist Poland,https://www.sciencedirect.com/science/article/pii/S0176268021001427,12 January 2022,2022,Research Article
91,91,Wage centralization and the political economy of budget deficits,https://www.sciencedirect.com/science/article/pii/S017626802100135X,4 January 2022,2022,Research Article
92,92,"Political tenure, term limits and corruption",https://www.sciencedirect.com/science/article/pii/S0176268021001348,4 January 2022,2022,Research Article
93,93,"Women at work: Gender quotas, municipal elections and local spending",https://www.sciencedirect.com/science/article/pii/S0176268021001415,31 December 2021,2021,Research Article
94,94,The COVID-19 pandemic’s effects on voter turnout,https://www.sciencedirect.com/science/article/pii/S0176268021001312,29 December 2021,2021,Research Article
95,95,All you need is ,https://www.sciencedirect.com/science/article/pii/S0176268021001373,28 December 2021,2021,Research Article
96,96,The causal effects of rule of law & property rights on fiscal capacity,https://www.sciencedirect.com/science/article/pii/S0176268021001361,22 December 2021,2021,Research Article
97,97,The response of taxpayer compliance to the large shock of Italian unification,https://www.sciencedirect.com/science/article/pii/S0176268021001294,11 December 2021,2021,Research Article
98,98,Fiscal federalism and economic performance new evidence from Switzerland,https://www.sciencedirect.com/science/article/pii/S0176268021001300,10 December 2021,2021,Research Article
99,99,Community forestry and its implications for land related disputes: Evidence from India,https://www.sciencedirect.com/science/article/pii/S0176268021001270,7 December 2021,2021,Research Article
100,100,The effect of international development association's (IDA) aid on conflict. A fuzzy regression discontinuity approach,https://www.sciencedirect.com/science/article/pii/S0176268021001324,7 December 2021,2021,Research Article
101,101,Why do people from wealthy countries migrate?,https://www.sciencedirect.com/science/article/pii/S0176268021001282,29 November 2021,2021,Research Article
102,102,Are social and environmental clauses a tool for favoritism? Analysis of French public procurement contracts,https://www.sciencedirect.com/science/article/pii/S0176268021001154,20 November 2021,2021,Research Article
103,103,Political voice on monetary policy: Evidence from the parliamentary hearings of the European Central Bank,https://www.sciencedirect.com/science/article/pii/S0176268021001178,20 November 2021,2021,Research Article
104,104,A corruption risk indicator for public procurement,https://www.sciencedirect.com/science/article/pii/S0176268021001166,9 November 2021,2021,Research Article
105,105,Institutional design and spatial (in)equality — The Janus face of economic integration,https://www.sciencedirect.com/science/article/pii/S0176268021001129,6 November 2021,2021,Research Article
107,107,Self-selecting candidates or compelling voters: How organized crime affects political selection,https://www.sciencedirect.com/science/article/pii/S0176268021001105,28 October 2021,2021,Research Article
108,108,Optimal favoritism and maximal revenue: A generalized result,https://www.sciencedirect.com/science/article/pii/S0176268021001130,28 October 2021,2021,Research Article
109,109,Real-time fiscal policy responses in the OECD from 1997 to 2018: Procyclical but sustainable?,https://www.sciencedirect.com/science/article/pii/S0176268021001117,24 October 2021,2021,Research Article
110,110,Intragenerational deliberation and intergenerational sustainability dilemma,https://www.sciencedirect.com/science/article/pii/S0176268021001099,23 October 2021,2021,Research Article
111,111,Other people’s money: Preferences for equality in groups,https://www.sciencedirect.com/science/article/pii/S0176268021001051,30 September 2021,2021,Research Article
112,112,The generation gap in direct democracy: Age vs. cohort effects,https://www.sciencedirect.com/science/article/pii/S0176268021001026,23 September 2021,2021,Research Article
113,113,Populism and propagation of far-right extremism,https://www.sciencedirect.com/science/article/pii/S0176268021000999,20 September 2021,2021,Research Article
114,114,Does ethnic diversity always undermine pro-social behavior? Evidence from a laboratory experiment,https://www.sciencedirect.com/science/article/pii/S0176268021001014,17 September 2021,2021,Research Article
115,115,Russian power and the state-owned enterprise,https://www.sciencedirect.com/science/article/pii/S017626802100104X,16 September 2021,2021,Research Article
116,116,"To vote, or not to vote? Electoral campaigns and the spread of COVID-19",https://www.sciencedirect.com/science/article/pii/S0176268021001002,16 September 2021,2021,Research Article
117,117,Studying more to vote less. Education and voter turnout in Italy,https://www.sciencedirect.com/science/article/pii/S0176268021000987,13 September 2021,2021,Research Article
118,118,Tax liability side equivalence and time delayed externalities,https://www.sciencedirect.com/science/article/pii/S0176268021000963,2 September 2021,2021,Research Article
119,119,Regulation and income inequality in the United States,https://www.sciencedirect.com/science/article/pii/S0176268021000872,1 September 2021,2021,Research Article
120,120,Life of the party: The polarizing effect of foreign direct investment,https://www.sciencedirect.com/science/article/pii/S0176268021000860,28 August 2021,2021,Research Article
121,121,Women and local public finance,https://www.sciencedirect.com/science/article/pii/S0176268021000835,26 August 2021,2021,Research Article
122,122,Political connections and post-disaster assistance in rural Vietnam,https://www.sciencedirect.com/science/article/pii/S0176268021000859,12 August 2021,2021,Research Article
123,123,Incumbency and expectations of fiscal rule compliance: Evidence from surveys of German policy makers,https://www.sciencedirect.com/science/article/pii/S0176268021000823,11 August 2021,2021,Research Article
124,124,"Monetary policy decision-making by committee: Why, when and how it can work",https://www.sciencedirect.com/science/article/pii/S017626802100080X,5 August 2021,2021,Research Article
125,125,"Rewarding good political behavior: US aid, democracy, and human rights",https://www.sciencedirect.com/science/article/pii/S0176268021000793,5 August 2021,2021,Research Article
126,126,"Causal factors of terrorist attacks on countries, and corresponding spill-overs between them",https://www.sciencedirect.com/science/article/pii/S0176268021000811,5 August 2021,2021,Research Article
127,127,Love on the rocks: The causal effects of separatist governments in Quebec,https://www.sciencedirect.com/science/article/pii/S0176268021000781,2 August 2021,2021,Research Article
128,128,"Financial openness, capital rents and income inequality",https://www.sciencedirect.com/science/article/pii/S0176268021000677,17 July 2021,2021,Research Article
129,129,Do dictators signal strength with electoral fraud?,https://www.sciencedirect.com/science/article/pii/S0176268021000665,12 July 2021,2021,Research Article
130,130,Upstream effects of female political reservations,https://www.sciencedirect.com/science/article/pii/S0176268021000586,8 July 2021,2021,Research Article
131,131,"Economic growth, equilibrium welfare, and public goods provision with intergenerational altruism",https://www.sciencedirect.com/science/article/pii/S0176268021000628,1 July 2021,2021,Research Article
132,132,Does a district mandate matter for the behavior of politicians? An analysis of roll-call votes and parliamentary speeches,https://www.sciencedirect.com/science/article/pii/S017626802100063X,29 June 2021,2021,Research Article
133,133,Making and breaking coalitions: Strategic sophistication and prosociality in majority decisions,https://www.sciencedirect.com/science/article/pii/S0176268021000604,24 June 2021,2021,Research Article
134,134,Politics of trade protection in an autocracy: Evidence from an EU tariff liberalization in Morocco,https://www.sciencedirect.com/science/article/pii/S0176268021000598,19 June 2021,2021,Research Article
135,135,"Reforms of collective bargaining institutions in European Union countries: Bad timing, bad outcomes?",https://www.sciencedirect.com/science/article/pii/S0176268021000616,18 June 2021,2021,Research Article
137,137,Special issue: Central banking in the 21st century - A crisis of accountability?,https://www.sciencedirect.com/science/article/pii/S017626802200091X,1 September 2022,2022,Research Article
138,138,Taxation with representation: Understanding natives’ attitudes to foreigners’ voting rights,https://www.sciencedirect.com/science/article/pii/S0176268021000574,12 June 2021,2021,Research Article
139,139,Bias and careers: Evidence from the aid effectiveness literature,https://www.sciencedirect.com/science/article/pii/S0176268021000550,9 June 2021,2021,Research Article
140,140,Corrigendum to “Incumbency and expectations of fiscal rule compliance: Evidence from surveys of German policy makers” [Eur. J. Polit. Econ. 72 (2022) 102093],https://www.sciencedirect.com/science/article/pii/S0176268022000611,31 July 2022,2022,Research Article
