,Unnamed: 0,Title,Url,Time,Year,Type
288,288,Non-discriminatory donation relief and strategic commitment under political competition,https://www.sciencedirect.com/science/article/pii/S0176268018301794,15 October 2018,2018,Research Article
289,289,Coattails and the forces that drive them: Evidence from Mexico,https://www.sciencedirect.com/science/article/pii/S0176268018302416,10 October 2018,2018,Research Article
290,290,Democratic reversals and the size of government,https://www.sciencedirect.com/science/article/pii/S0176268018300594,10 October 2018,2018,Research Article
291,291,Delay determinants of European Banking Union implementation,https://www.sciencedirect.com/science/article/pii/S0176268017305621,29 September 2018,2018,Research Article
292,292,On the determinants of long-run inflation uncertainty: Evidence from a panel of 17 developed economies,https://www.sciencedirect.com/science/article/pii/S0176268017303518,January 2019,2019,Research Article
293,293,Under threat: Rules-based fiscal policy and how to preserve it,https://www.sciencedirect.com/science/article/pii/S0176268017306092,March 2019,2019,Research Article
294,294,"Tax enforcement, tax compliance and tax morale in transition economies: A theoretical model",https://www.sciencedirect.com/science/article/pii/S0176268017304329,January 2019,2019,Research Article
295,295,"Local television, citizen knowledge and U.S. senators' roll-call voting",https://www.sciencedirect.com/science/article/pii/S0176268017304780,January 2019,2019,Research Article
296,296,Trade policy & lobbying effectiveness: Theory and evidence for India,https://www.sciencedirect.com/science/article/pii/S0176268017300575,January 2019,2019,Research Article
297,297,When and why do countries break their national fiscal rules?,https://www.sciencedirect.com/science/article/pii/S017626801730592X,March 2019,2019,Research Article
298,298,Clash of civilizations demystified,https://www.sciencedirect.com/science/article/pii/S0176268017302847,28 August 2018,2018,Research Article
299,299,The composition effects of tax-based consolidation on income inequality,https://www.sciencedirect.com/science/article/pii/S0176268017305852,March 2019,2019,Research Article
300,300,Rent-seeking with uncertain discriminatory power,https://www.sciencedirect.com/science/article/pii/S0176268017304846,January 2019,2019,Research Article
301,301,"Austerity, inequality, and private debt overhang",https://www.sciencedirect.com/science/article/pii/S0176268017305700,March 2019,2019,Research Article
302,302,Intergenerational conflict and public sector size and structure: A rationale for debt limits?,https://www.sciencedirect.com/science/article/pii/S0176268017305888,March 2019,2019,Research Article
303,303,Gender and climate change: Do female parliamentarians make difference?,https://www.sciencedirect.com/science/article/pii/S0176268017304500,January 2019,2019,Research Article
304,304,The growth effect of democracy and technology: An industry disaggregated approach,https://www.sciencedirect.com/science/article/pii/S017626801730229X,January 2019,2019,Research Article
305,305,Tactical distribution in local funding: The value of an aligned mayor,https://www.sciencedirect.com/science/article/pii/S0176268017305177,January 2019,2019,Research Article
306,306,The influence of group size on distributional fairness under voting by veto,https://www.sciencedirect.com/science/article/pii/S017626801730455X,January 2019,2019,Research Article
307,307,Sustainable fiscal strategies under changing demographics,https://www.sciencedirect.com/science/article/pii/S0176268017305499,March 2019,2019,Research Article
308,308,"Pension reserve fund, political budget cycles and fiscal illusion",https://www.sciencedirect.com/science/article/pii/S0176268017306080,January 2019,2019,Research Article
309,309,Independent fiscal councils: Recent trends and performance,https://www.sciencedirect.com/science/article/pii/S0176268018300223,March 2019,2019,Research Article
310,310,"Macroeconomic stabilization, monetary-fiscal interactions, and Europe's monetary union",https://www.sciencedirect.com/science/article/pii/S0176268017303877,March 2019,2019,Research Article
311,311,Does corruption hinder investment? Evidence from Russian regions,https://www.sciencedirect.com/science/article/pii/S0176268017304160,January 2019,2019,Research Article
312,312,European policy and markets: Did policy initiatives stem the sovereign debt crisis in the euro area?,https://www.sciencedirect.com/science/article/pii/S017626801730544X,March 2019,2019,Research Article
313,313,Positional concern and low demand for redistribution of the poor,https://www.sciencedirect.com/science/article/pii/S0176268018300880,January 2019,2019,Research Article
314,314,The impact of economic sanctions on international trade: How do threatened sanctions compare with imposed sanctions?,https://www.sciencedirect.com/science/article/pii/S017626801730616X,January 2019,2019,Research Article
315,315,Does corruption slow down innovation? Evidence from a cointegrated panel of U.S. states,https://www.sciencedirect.com/science/article/pii/S0176268018300235,January 2019,2019,Research Article
316,316,Dynamics of conflict,https://www.sciencedirect.com/science/article/pii/S0176268019304860,27 November 2019,2019,Research Article
318,318,Publisher's note,https://www.sciencedirect.com/science/article/pii/S0176268019304781,27 November 2019,2019,Research Article
321,321,Fiscal frameworks in Europe: Editorial introduction,https://www.sciencedirect.com/science/article/pii/S0176268019300667,March 2019,2019,Research Article
