,Unnamed: 0,Title,Url,Time,Year,Type
144,144,Believers vs. deniers: Climate change and environmental policy polarization,https://www.sciencedirect.com/science/article/pii/S0176268020300963,12 September 2020,2020,Research Article
145,145,Corruption and legislature size: Evidence from Brazil,https://www.sciencedirect.com/science/article/pii/S0176268020300884,6 September 2020,2020,Research Article
146,146,"Entrepreneurship, trust and corruption",https://www.sciencedirect.com/science/article/pii/S0176268020300859,4 September 2020,2020,Research Article
147,147,The political economy of fiscal procyclicality,https://www.sciencedirect.com/science/article/pii/S0176268020300781,4 September 2020,2020,Research Article
148,148,The political economy of the G20 agenda on financial regulation,https://www.sciencedirect.com/science/article/pii/S0176268020300896,30 August 2020,2020,Research Article
149,149,Health spending in Italy: The impact of immigrants,https://www.sciencedirect.com/science/article/pii/S017626802030080X,25 August 2020,2020,Research Article
150,150,Voting with your feet: Political competition and internal migration in the United States,https://www.sciencedirect.com/science/article/pii/S0176268020300793,23 August 2020,2020,Research Article
151,151,The probability of violating Arrow’s conditions,https://www.sciencedirect.com/science/article/pii/S0176268020300847,21 August 2020,2020,Research Article
152,152,The economic effects of political disintegration: Lessons from Serbia and Montenegro,https://www.sciencedirect.com/science/article/pii/S0176268020300860,21 August 2020,2020,Research Article
153,153,How do the factors determining terrorist groups’ longevity differ from those affecting their success?,https://www.sciencedirect.com/science/article/pii/S0176268020300835,20 August 2020,2020,Research Article
154,154,Reconsidering the modernization hypothesis: The role of diversified production and interest‐group competition,https://www.sciencedirect.com/science/article/pii/S017626802030077X,14 August 2020,2020,Research Article
155,155,Investment in trade facilitating infrastructure: A political-economy analysis,https://www.sciencedirect.com/science/article/pii/S0176268020300768,8 August 2020,2020,Research Article
156,156,"Microdynamics, granularity and populism: The Finnish case",https://www.sciencedirect.com/science/article/pii/S0176268020300744,6 August 2020,2020,Research Article
157,157,Perceptions of inequality,https://www.sciencedirect.com/science/article/pii/S0176268020300756,5 August 2020,2020,Research Article
158,158,Perception vs. experience: Explaining differences in corruption measures using microdata,https://www.sciencedirect.com/science/article/pii/S0176268020300732,26 July 2020,2020,Research Article
159,159,The effects of federal regulations on corruption in U.S. States,https://www.sciencedirect.com/science/article/pii/S0176268020300720,25 July 2020,2020,Research Article
160,160,The effect of public financing on candidate reemergence and success in elections,https://www.sciencedirect.com/science/article/pii/S0176268020300677,15 July 2020,2020,Research Article
161,161,Tax evasion and tax morale: A social network analysis,https://www.sciencedirect.com/science/article/pii/S0176268020300707,14 July 2020,2020,Research Article
162,162,Fiscal rules and budget forecast errors of Italian municipalities,https://www.sciencedirect.com/science/article/pii/S0176268020300690,11 July 2020,2020,Research Article
163,163,The effects of mafia infiltration on public procurement performance,https://www.sciencedirect.com/science/article/pii/S0176268020300719,9 July 2020,2020,Research Article
164,164,Fiscal consolidations and electoral outcomes in emerging economies: Does the policy mix matter? Macro and micro level evidence from Latin America,https://www.sciencedirect.com/science/article/pii/S0176268020300665,9 July 2020,2020,Research Article
165,165,Are Democracies Cleaner?,https://www.sciencedirect.com/science/article/pii/S0176268020300689,3 July 2020,2020,Research Article
166,166,"Modern slavery, corruption, and hysteresis",https://www.sciencedirect.com/science/article/pii/S0176268020300653,29 June 2020,2020,Research Article
167,167,arly state institutions and the persistence of linguistic diversity,https://www.sciencedirect.com/science/article/pii/S0176268020300628,23 June 2020,2020,Research Article
168,168,Race to burn the last ton of carbon and the risk of stranded assets,https://www.sciencedirect.com/science/article/pii/S017626802030063X,17 June 2020,2020,Research Article
169,169,"Gender, attractiveness, and judgment of impropriety: The case of accountants",https://www.sciencedirect.com/science/article/pii/S0176268020300641,17 June 2020,2020,Research Article
170,170,Mortgage market credit conditions and U.S. Presidential elections,https://www.sciencedirect.com/science/article/pii/S0176268020300574,12 June 2020,2020,Research Article
171,171,Political accountability and public service delivery in decentralized Indonesia: Incumbency advantage and the performance of second term mayors,https://www.sciencedirect.com/science/article/pii/S0176268020300586,4 June 2020,2020,Research Article
172,172,"On the political economy of minority rights. Three ways to manipulate a minority: Goals, rules, and border poles",https://www.sciencedirect.com/science/article/pii/S0176268020300422,4 June 2020,2020,Research Article
173,173,Teachers and politics,https://www.sciencedirect.com/science/article/pii/S0176268020300501,22 May 2020,2020,Research Article
174,174,Property rights revisited,https://www.sciencedirect.com/science/article/pii/S0176268020300434,19 May 2020,2020,Research Article
175,175,"Election systems, the “beauty premium” in politics, and the beauty of dissent",https://www.sciencedirect.com/science/article/pii/S0176268020300483,16 May 2020,2020,Research Article
176,176,Depression of the deprived or eroding enthusiasm of the elites: What has shifted the support for international trade?,https://www.sciencedirect.com/science/article/pii/S0176268020300495,16 May 2020,2020,Research Article
177,177,I (Could Have) Told You! Early warning indicators and crisis performance of the 12 “old” Euro-countries under the economic crisis 2008–09,https://www.sciencedirect.com/science/article/pii/S0176268020300471,7 May 2020,2020,Research Article
178,178,"Reelection, growth and public debt",https://www.sciencedirect.com/science/article/pii/S0176268020300379,6 May 2020,2020,Research Article
179,179,Female political representation and substantive effects on policies: A literature review,https://www.sciencedirect.com/science/article/pii/S0176268020300446,4 May 2020,2020,Research Article
180,180,Heterogeneity in preferences for redistribution and public spending: A cross-country analysis,https://www.sciencedirect.com/science/article/pii/S0176268020300380,1 May 2020,2020,Research Article
181,181,A political economy perspective on horizontal FDI in a dynamic Cournot-oligopoly with endogenous entry,https://www.sciencedirect.com/science/article/pii/S0176268020300458,1 May 2020,2020,Research Article
182,182,The institutions of international treaty organizations as evidence for social contract theory,https://www.sciencedirect.com/science/article/pii/S0176268020300392,25 April 2020,2020,Research Article
183,183,Staying dry on Spanish wine: The rejection of the 1905 Spanish-Italian trade agreement,https://www.sciencedirect.com/science/article/pii/S0176268020300409,25 April 2020,2020,Research Article
184,184,"Market competition, lobbying influence and environmental externalities",https://www.sciencedirect.com/science/article/pii/S0176268020300343,24 April 2020,2020,Research Article
185,185,Mass media and preferences for redistribution,https://www.sciencedirect.com/science/article/pii/S0176268020300355,23 April 2020,2020,Research Article
186,186,Sharing oil rents and political violence,https://www.sciencedirect.com/science/article/pii/S0176268020300306,23 April 2020,2020,Research Article
187,187,Encouraging skill development: Evidence from public-private partnerships in education in Russia’s regions,https://www.sciencedirect.com/science/article/pii/S0176268020300367,23 April 2020,2020,Research Article
188,188,When two tribes go to work: Board political diversity and firm performance,https://www.sciencedirect.com/science/article/pii/S0176268020300318,20 April 2020,2020,Research Article
189,189,The effectiveness of fiscal institutions: International financial flogging or domestic constraint?,https://www.sciencedirect.com/science/article/pii/S0176268020300276,18 April 2020,2020,Research Article
190,190,Chasing votes with the public budget,https://www.sciencedirect.com/science/article/pii/S0176268020300239,18 April 2020,2020,Research Article
191,191,Budget uncertainty in a monetary union,https://www.sciencedirect.com/science/article/pii/S017626802030032X,14 April 2020,2020,Research Article
192,192,Why biased agencies could be the best monitors,https://www.sciencedirect.com/science/article/pii/S0176268020300331,12 April 2020,2020,Research Article
193,193,The democratization process: An empirical appraisal of the role of political protest,https://www.sciencedirect.com/science/article/pii/S017626802030029X,11 April 2020,2020,Research Article
194,194,The supply of media slant across outlets and demand for slant within outlets: Evidence from US presidential campaign news,https://www.sciencedirect.com/science/article/pii/S0176268020300252,8 April 2020,2020,Research Article
195,195,The unintended composition effect of the subnational government fiscal rules: The case of Italian municipalities,https://www.sciencedirect.com/science/article/pii/S0176268020300227,29 March 2020,2020,Research Article
196,196,Destruction and settlement norms as determinants of conflict: An evolutionary perspective,https://www.sciencedirect.com/science/article/pii/S0176268020300203,29 March 2020,2020,Research Article
197,197,Terrorist training: Onsite or via the Internet?,https://www.sciencedirect.com/science/article/pii/S0176268020300264,28 March 2020,2020,Research Article
198,198,Information provision and preferences for education spending: Evidence from representative survey experiments in three countries,https://www.sciencedirect.com/science/article/pii/S0176268020300240,26 March 2020,2020,Research Article
199,199,Do fiscal rules cause better fiscal balances? A new instrumental variable strategy,https://www.sciencedirect.com/science/article/pii/S0176268020300215,24 March 2020,2020,Research Article
200,200,Decentralized advice,https://www.sciencedirect.com/science/article/pii/S0176268020300197,20 March 2020,2020,Research Article
201,201,"Romes without empires: Urban concentration, political competition, and economic development",https://www.sciencedirect.com/science/article/pii/S0176268020300185,15 March 2020,2020,Research Article
202,202,"Varieties of authoritarianism matter: Elite fragmentation, natural resources and economic growth",https://www.sciencedirect.com/science/article/pii/S0176268020300173,5 March 2020,2020,Research Article
203,203,General or central government? Empirical evidence on political cycles in budget composition using new data for OECD countries,https://www.sciencedirect.com/science/article/pii/S0176268020300082,3 March 2020,2020,Research Article
204,204,Do national political parties matter? Evidence from Italian municipalities,https://www.sciencedirect.com/science/article/pii/S0176268020300100,27 February 2020,2020,Research Article
205,205,Collective vs. individual lobbying,https://www.sciencedirect.com/science/article/pii/S0176268020300070,18 February 2020,2020,Research Article
206,206,The impact of local financial development on firm growth in Vietnam: Does the level of corruption matter?,https://www.sciencedirect.com/science/article/pii/S0176268020300069,7 February 2020,2020,Research Article
207,207,Passports for sale: The political economy of conflict and cooperation in a meta-club,https://www.sciencedirect.com/science/article/pii/S0176268020300033,1 February 2020,2020,Research Article
208,208,Liberalizing art. Evidence on the Impressionists at the end of the Paris Salon,https://www.sciencedirect.com/science/article/pii/S0176268020300057,1 February 2020,2020,Research Article
209,209,"Economic downturns, inequality, and democratic improvements",https://www.sciencedirect.com/science/article/pii/S0176268020300045,31 January 2020,2020,Research Article
210,210,European development banks and the political cycle,https://www.sciencedirect.com/science/article/pii/S0176268019305051,9 January 2020,2020,Research Article
211,211,Gender quotas and the selection of local politicians: Evidence from French municipal elections,https://www.sciencedirect.com/science/article/pii/S0176268019304951,28 December 2019,2019,Research Article
212,212,Intergovernmental transfers and political competition measured by pivotal probability - Evidence from Hungary,https://www.sciencedirect.com/science/article/pii/S017626801930494X,20 December 2019,2019,Research Article
213,213,"Immigration, ethnic diversity and voting: The role of individual income",https://www.sciencedirect.com/science/article/pii/S0176268019304938,10 December 2019,2019,Research Article
214,214,Population size and the size of government,https://www.sciencedirect.com/science/article/pii/S0176268019304859,26 November 2019,2019,Research Article
215,215,Does democracy cause growth? A meta-analysis (of 2000 regressions),https://www.sciencedirect.com/science/article/pii/S0176268019300552,14 November 2019,2019,Research Article
216,216,The effects of mega-events on perceived corruption,https://www.sciencedirect.com/science/article/pii/S0176268019304677,9 November 2019,2019,Research Article
217,217,Autocratic governors in public procurement,https://www.sciencedirect.com/science/article/pii/S0176268019304665,6 November 2019,2019,Research Article
218,218,"Empowering knowledge: Political leaders, education, and economic liberalization",https://www.sciencedirect.com/science/article/pii/S0176268019300795,31 October 2019,2019,Research Article
219,219,Fiscal discipline in EMU? Testing the effectiveness of the Excessive Deficit Procedure,https://www.sciencedirect.com/science/article/pii/S0176268018304531,24 October 2019,2019,Research Article
220,220,Towards a cashless economy: Economic and socio-political implications,https://www.sciencedirect.com/science/article/pii/S0176268019301843,1 October 2019,2019,Research Article
221,221,Legal pluralism in post-conflict Sierra Leone,https://www.sciencedirect.com/science/article/pii/S0176268018303793,26 September 2019,2019,Research Article
222,222,Simple Markovian equilibria in dynamic spatial legislative bargaining,https://www.sciencedirect.com/science/article/pii/S0176268018303082,21 September 2019,2019,Research Article
223,223,Is money where the fun ends? Material interests and individuals’ preference for direct democracy,https://www.sciencedirect.com/science/article/pii/S0176268018305524,19 September 2019,2019,Research Article
224,224,"Quality of judicial institutions, crimes, misdemeanors, and dishonesty",https://www.sciencedirect.com/science/article/pii/S0176268018305081,12 September 2019,2019,Research Article
225,225,"Parties, divided government, and infrastructure expenditures: Evidence from U.S. states",https://www.sciencedirect.com/science/article/pii/S0176268018300132,11 September 2019,2019,Research Article
231,231,"Arms production, national defense spending and arms trade: Examining supply and demand",https://www.sciencedirect.com/science/article/pii/S0176268019301314,7 September 2019,2019,Research Article
232,232,Partisan lobbyists in conflicts,https://www.sciencedirect.com/science/article/pii/S0176268018305482,24 August 2019,2019,Research Article
233,233,Demand of direct democracy,https://www.sciencedirect.com/science/article/pii/S0176268019301892,24 August 2019,2019,Research Article
234,234,Stability of revolutionary governments in the face of mass protest,https://www.sciencedirect.com/science/article/pii/S017626801930045X,23 August 2019,2019,Research Article
235,235,Corruption and economic growth: New empirical evidence,https://www.sciencedirect.com/science/article/pii/S0176268019301156,22 August 2019,2019,Research Article
236,236,Did rainfall shocks cause civil conflict in Sub-Saharan Africa? The implications of data revisions,https://www.sciencedirect.com/science/article/pii/S0176268018301514,25 July 2019,2019,Research Article
237,237,"Corruption, workforce selection and mismatch in the public sector",https://www.sciencedirect.com/science/article/pii/S0176268018303732,24 July 2019,2019,Research Article
238,238,WTO membership and corruption,https://www.sciencedirect.com/science/article/pii/S0176268018304622,22 July 2019,2019,Research Article
239,239,Electoral systems and immigration,https://www.sciencedirect.com/science/article/pii/S0176268018300569,20 July 2019,2019,Research Article
240,240,Does accrual accounting alter fiscal policy decisions? - Evidence from Germany,https://www.sciencedirect.com/science/article/pii/S0176268018305147,17 July 2019,2019,Research Article
241,241,Can money buy EU love?,https://www.sciencedirect.com/science/article/pii/S0176268018304555,5 July 2019,2019,Research Article
242,242,Entry in contests with incomplete information: Theory and experiments,https://www.sciencedirect.com/science/article/pii/S0176268017303890,4 July 2019,2019,Research Article
243,243,Costs of change and political polarization,https://www.sciencedirect.com/science/article/pii/S0176268018303331,2 July 2019,2019,Research Article
244,244,Protection for sale under monopolistic competition: Beyond the CES,https://www.sciencedirect.com/science/article/pii/S0176268019300096,20 June 2019,2019,Research Article
245,245,Overstrained citizens? The number of ballot propositions and the quality of the decision process in direct democracy,https://www.sciencedirect.com/science/article/pii/S0176268018303896,13 June 2019,2019,Research Article
246,246,Fiscal rules to tame the political budget cycle: Evidence from Italian municipalities,https://www.sciencedirect.com/science/article/pii/S0176268019300230,11 June 2019,2019,Research Article
247,247,The electoral migration cycle,https://www.sciencedirect.com/science/article/pii/S0176268018304877,8 June 2019,2019,Research Article
248,248,New evidence on the historical growth of government in Europe: The role of labor costs,https://www.sciencedirect.com/science/article/pii/S0176268018305159,7 June 2019,2019,Research Article
249,249,Corruption in space: A closer look at the world's subnations,https://www.sciencedirect.com/science/article/pii/S0176268018304415,27 May 2019,2019,Research Article
250,250,Legislators' behaviour and electoral rules: Evidence from an Italian reform,https://www.sciencedirect.com/science/article/pii/S0176268018303859,25 May 2019,2019,Research Article
251,251,“The winner takes it all” or a story of the optimal allocation of the European Cohesion Fund,https://www.sciencedirect.com/science/article/pii/S0176268018305123,23 May 2019,2019,Research Article
252,252,The growth-maximizing level of regulation: Evidence from a panel of international data,https://www.sciencedirect.com/science/article/pii/S0176268018303355,16 May 2019,2019,Research Article
253,253,The subversive nature of inequality: Subjective inequality perceptions and attitudes to social inequality,https://www.sciencedirect.com/science/article/pii/S0176268016301756,13 May 2019,2019,Research Article
254,254,Neighbors and friends: How do European political parties respond to globalization?,https://www.sciencedirect.com/science/article/pii/S0176268018303446,13 May 2019,2019,Research Article
255,255,Purely procedural preferences - Beyond procedural equity and reciprocity,https://www.sciencedirect.com/science/article/pii/S0176268018301265,7 May 2019,2019,Research Article
256,256,Evaluative voting or classical voting rules: Does it make a difference? Empirical evidence for consensus among voting rules,https://www.sciencedirect.com/science/article/pii/S0176268018304038,17 April 2019,2019,Research Article
257,257,Globalization and taxation: Theory and evidence,https://www.sciencedirect.com/science/article/pii/S0176268018303690,15 April 2019,2019,Research Article
258,258,Fiscal decentralization and government size: The role of democracy,https://www.sciencedirect.com/science/article/pii/S0176268018304725,11 April 2019,2019,Research Article
259,259,Employment shocks and anti-EU sentiment,https://www.sciencedirect.com/science/article/pii/S0176268018301460,5 April 2019,2019,Research Article
260,260,Voter turnout and government's legitimate mandate,https://www.sciencedirect.com/science/article/pii/S0176268018302465,20 March 2019,2019,Research Article
261,261,IMF conditionality and central bank independence,https://www.sciencedirect.com/science/article/pii/S0176268018304890,14 March 2019,2019,Research Article
262,262,Are voters rational?,https://www.sciencedirect.com/science/article/pii/S0176268018303860,7 March 2019,2019,Research Article
263,263,Cultural interaction and economic development: An overview,https://www.sciencedirect.com/science/article/pii/S0176268018303835,6 March 2019,2019,Research Article
264,264,Term limit extension and electoral participation. Evidence from a diff-in-discontinuities design at the local level in Italy,https://www.sciencedirect.com/science/article/pii/S0176268018304403,6 March 2019,2019,Research Article
265,265,The tug-of-war in the laboratory,https://www.sciencedirect.com/science/article/pii/S0176268017302859,1 March 2019,2019,Research Article
266,266,Partial decentralization as a way to prevent secessionist conflict,https://www.sciencedirect.com/science/article/pii/S0176268017305463,1 March 2019,2019,Research Article
267,267,"Bonus pay for teachers, spatial sorting, and student achievement",https://www.sciencedirect.com/science/article/pii/S0176268018301484,16 February 2019,2019,Research Article
268,268,"Crime, incentives and political effort: Evidence from India",https://www.sciencedirect.com/science/article/pii/S0176268017304366,13 February 2019,2019,Research Article
269,269,"Exit strategies, capital flight and speculative attacks: Europe's version of the trilemma",https://www.sciencedirect.com/science/article/pii/S0176268018302787,12 February 2019,2019,Research Article
270,270,Policy induced increases in private healthcare financing provide short-term relief of total healthcare expenditure growth: Evidence from OECD countries,https://www.sciencedirect.com/science/article/pii/S017626801830404X,11 February 2019,2019,Research Article
271,271,Effects of runoff voting rules on number of parties and candidates' political experience: Evidence from a law change in Peru,https://www.sciencedirect.com/science/article/pii/S0176268018301642,10 February 2019,2019,Research Article
272,272,"The geography of natural resources, ethnic inequality and civil conflicts",https://www.sciencedirect.com/science/article/pii/S0176268018300399,10 February 2019,2019,Research Article
273,273,"Wedges: Distribution, distortions, and market integration",https://www.sciencedirect.com/science/article/pii/S017626801830226X,8 February 2019,2019,Research Article
274,274,Bayesian forecasting of electoral outcomes with new parties’ competition,https://www.sciencedirect.com/science/article/pii/S0176268018302398,8 February 2019,2019,Research Article
275,275,Quantity-cum-quality contests,https://www.sciencedirect.com/science/article/pii/S0176268018303768,11 January 2019,2019,Research Article
276,276,The political economy of contributive pensions in developing countries,https://www.sciencedirect.com/science/article/pii/S0176268018302532,7 January 2019,2019,Research Article
277,277,International flows of people and institutional change,https://www.sciencedirect.com/science/article/pii/S0176268017302148,4 January 2019,2019,Research Article
278,278,Revisiting the redistribution hypothesis with perceived inequality and redistributive preferences,https://www.sciencedirect.com/science/article/pii/S0176268017305773,3 January 2019,2019,Research Article
279,279,Can media drive the electorate? The impact of media coverage on voting intentions,https://www.sciencedirect.com/science/article/pii/S0176268018301678,24 December 2018,2018,Research Article
280,280,Electoral fraud and voter turnout: An experimental study,https://www.sciencedirect.com/science/article/pii/S0176268018301496,18 December 2018,2018,Research Article
281,281,Happy partisans and extreme political views: The impact of national versus local representation on well-being,https://www.sciencedirect.com/science/article/pii/S0176268018302271,13 December 2018,2018,Research Article
282,282,"The impact of majority coalitions on local government spending, service delivery, and corruption in Indonesia",https://www.sciencedirect.com/science/article/pii/S0176268018302350,27 November 2018,2018,Research Article
283,283,"Political competition, tax salience and accountability. Theory and evidence from Italy",https://www.sciencedirect.com/science/article/pii/S0176268018301204,19 November 2018,2018,Research Article
284,284,"Complex ballot propositions, individual voting behavior, and status quo bias",https://www.sciencedirect.com/science/article/pii/S0176268018302799,5 November 2018,2018,Research Article
285,285,Quality of institutions and productivity of State-Invested Enterprises: International evidence from major telecom companies,https://www.sciencedirect.com/science/article/pii/S0176268017305931,3 November 2018,2018,Research Article
286,286,Relative age effects in political selection,https://www.sciencedirect.com/science/article/pii/S0176268017304305,24 October 2018,2018,Research Article
287,287,"Is it the economic policy, stupid? Economic policy, political parties & the gubernatorial incumbent advantage",https://www.sciencedirect.com/science/article/pii/S0176268018302362,15 October 2018,2018,Research Article
