,Unnamed: 0,Title,Url,Time,Year,Type
0,0,Recourse restrictions and judicial foreclosures: Effects of mortgage law on loan price and collateralization,https://www.sciencedirect.com/science/article/pii/S0144818823000200,Available online 9 June 2023,2023,Research Article
1,1,Law and inequality: A comparative approach to the distributive implications of legal systems,https://www.sciencedirect.com/science/article/pii/S0144818823000170,Available online 23 May 2023,2023,Research Article
2,2,Estimating the effect of U.S. concealed carry laws on homicide: A replication and sensitivity analysis,https://www.sciencedirect.com/science/article/pii/S0144818823000194,15 May 2023,2023,Research Article
3,3,"Variability in punishment, risk preferences and crime deterrence",https://www.sciencedirect.com/science/article/pii/S0144818823000182,12 May 2023,2023,Research Article
4,4,Which companies pay more (or less) in legal fees? An empirical study of India,https://www.sciencedirect.com/science/article/pii/S0144818823000169,15 April 2023,2023,Research Article
5,5,Advance disclosure of insider transactions: Empirical evidence from the Vietnamese stock market,https://www.sciencedirect.com/science/article/pii/S0144818823000157,12 March 2023,2023,Research Article
6,6,The effect of opioids on crime: Evidence from the introduction of OxyContin,https://www.sciencedirect.com/science/article/pii/S0144818823000145,28 February 2023,2023,Research Article
7,7,Counteracting offshore tax evasion: Evidence from the foreign account tax compliance act,https://www.sciencedirect.com/science/article/pii/S0144818823000042,27 January 2023,2023,Research Article
8,8,Judicial compliance in district courts,https://www.sciencedirect.com/science/article/pii/S0144818822000783,21 January 2023,2023,Research Article
9,9,Strengthening worker benefits or destroying jobs: Effect of the 2008 Labor Contract Law in China,https://www.sciencedirect.com/science/article/pii/S0144818822000771,28 December 2022,2022,Research Article
10,10,The effect of political influence on corporate valuation: Evidence from party-building reform in China,https://www.sciencedirect.com/science/article/pii/S014481882200076X,27 December 2022,2022,Research Article
11,11,The dominance of skill in online poker,https://www.sciencedirect.com/science/article/pii/S0144818822000758,14 December 2022,2022,Research Article
12,12,The Coase Theorem and the empty core: Inspecting the entrails after four decades,https://www.sciencedirect.com/science/article/pii/S0144818822000734,9 December 2022,2022,Research Article
13,13,Law enforcement with rent-seeking government under voting pressure,https://www.sciencedirect.com/science/article/pii/S0144818822000746,7 December 2022,2022,Research Article
14,14,Incentives for investments in defensive technology: An economic analysis of the Safety Act,https://www.sciencedirect.com/science/article/pii/S0144818822000722,24 November 2022,2022,Research Article
15,15,"A macrohistory of legal evolution and coevolution: Property, procedure, and contract in early-modern English caselaw",https://www.sciencedirect.com/science/article/pii/S0144818822000692,14 November 2022,2022,Research Article
16,16,How stock market reacts to environmental disasters and judicial decisions: A case study of Mariana’s dam collapse in Brazil,https://www.sciencedirect.com/science/article/pii/S0144818822000618,2 November 2022,2022,Research Article
17,17,District attorney compensation and performance,https://www.sciencedirect.com/science/article/pii/S0144818822000588,30 October 2022,2022,Research Article
20,20,Time to resolve insolvency and political elections,https://www.sciencedirect.com/science/article/pii/S0144818822000606,30 October 2022,2022,Research Article
21,21,Girls Just Wanna Have Funds? The effect of women-friendly legislation on female-led firms’ access to credit,https://www.sciencedirect.com/science/article/pii/S0144818822000576,17 October 2022,2022,Research Article
22,22,Spatial and temporal correlations of crime in Detroit: Evidence from spatial dynamic panel data models,https://www.sciencedirect.com/science/article/pii/S0144818822000564,14 October 2022,2022,Research Article
23,23,Do women drive corporate social responsibility? Evidence from gender diversity reforms around the world,https://www.sciencedirect.com/science/article/pii/S0144818822000539,30 September 2022,2022,Research Article
24,24,Citizens united and individual sovereignty: A fresh perspective,https://www.sciencedirect.com/science/article/pii/S0144818822000552,29 September 2022,2022,Research Article
25,25,Borrowers’ discouragement and creditor information,https://www.sciencedirect.com/science/article/pii/S0144818822000540,27 September 2022,2022,Research Article
26,26,Crime and the Mariel Boatlift,https://www.sciencedirect.com/science/article/pii/S0144818822000503,17 September 2022,2022,Research Article
27,27,Consent or coordination? assemblies in early medieval Europe,https://www.sciencedirect.com/science/article/pii/S0144818822000527,14 September 2022,2022,Research Article
28,28,"Is it the firm, the innovator, or the innovation? Determinants of perceived non-imitability leading to unprotected intellectual property",https://www.sciencedirect.com/science/article/pii/S0144818822000515,7 September 2022,2022,Research Article
29,29,The value of fiduciary duties: Evidence from ,https://www.sciencedirect.com/science/article/pii/S0144818822000497,23 August 2022,2022,Research Article
30,30,ON THE DECLINE IN STATE POPULATION DISTRIBUTION: A COASEAN ROLE FOR SECTION 111 OF THE AUSTRALIAN CONSTITUTION?,https://www.sciencedirect.com/science/article/pii/S0144818822000485,18 August 2022,2022,Research Article
31,31,Mandatory employee board representation: Good news for family firms?,https://www.sciencedirect.com/science/article/pii/S0144818822000400,26 July 2022,2022,Research Article
32,32,"An ounce of prevention, a pound of cure: The effects of college expansions on crime",https://www.sciencedirect.com/science/article/pii/S0144818822000370,26 June 2022,2022,Research Article
33,33,Lost in election. How different electoral systems translate the voting gender gap into gender representation bias,https://www.sciencedirect.com/science/article/pii/S0144818822000382,24 June 2022,2022,Research Article
34,34,A panel-based proxy for gun prevalence in US and Mexico,https://www.sciencedirect.com/science/article/pii/S0144818822000369,23 June 2022,2022,Research Article
35,35,"Prosecutors, judges and sentencing disparities: Evidence from traffic offenses in France",https://www.sciencedirect.com/science/article/pii/S0144818822000333,25 May 2022,2022,Research Article
36,36,The performance of corporate legal insider trading in the Korean market,https://www.sciencedirect.com/science/article/pii/S0144818822000321,23 May 2022,2022,Research Article
37,37,Seemingly irrelevant information? The impact of legal team size on third party perceptions,https://www.sciencedirect.com/science/article/pii/S0144818822000242,14 May 2022,2022,Research Article
38,38,Optimal fine reductions for self-reporting: The impact of loss aversion,https://www.sciencedirect.com/science/article/pii/S0144818822000230,5 April 2022,2022,Research Article
39,39,State versus federal wiretap orders: A look at the data,https://www.sciencedirect.com/science/article/pii/S0144818822000205,24 March 2022,2022,Research Article
40,40,Do specialized intellectual property courts show a pro-patent propensity? Evidence from China,https://www.sciencedirect.com/science/article/pii/S0144818822000217,23 March 2022,2022,Research Article
41,41,Focus vs. spread: Police box consolidation and its impact on crime in Korea,https://www.sciencedirect.com/science/article/pii/S0144818822000187,17 March 2022,2022,Research Article
42,42,Shining light on corporate political spending: Evidence from shareholder engagements,https://www.sciencedirect.com/science/article/pii/S0144818822000035,8 February 2022,2022,Research Article
43,43,Courts as monitoring agents: The case of China,https://www.sciencedirect.com/science/article/pii/S0144818822000023,24 January 2022,2022,Research Article
44,44,A model of competitive self-regulation,https://www.sciencedirect.com/science/article/pii/S0144818822000011,13 January 2022,2022,Research Article
45,45,Discovery in a screening model of final offer arbitration,https://www.sciencedirect.com/science/article/pii/S0144818821000673,17 December 2021,2021,Research Article
46,46,Litigation with adversarial efforts,https://www.sciencedirect.com/science/article/pii/S0144818821000661,6 December 2021,2021,Research Article
47,47,Loss aversion for the value of voting rights: WTA/WTP ratios for a ballot,https://www.sciencedirect.com/science/article/pii/S014481882100065X,29 November 2021,2021,Research Article
48,48,Affirmative action ,https://www.sciencedirect.com/science/article/pii/S0144818821000569,5 November 2021,2021,Research Article
49,49,Do correctional authorities treat all offenders equally? Evaluating the use of a risk assessment instrument,https://www.sciencedirect.com/science/article/pii/S0144818821000570,3 November 2021,2021,Research Article
50,50,The internet echo chamber and the misinformation of judges: The case of judges’ perception of public support for the death penalty in China,https://www.sciencedirect.com/science/article/pii/S0144818821000521,19 October 2021,2021,Research Article
53,53,Corrigendum to “The Priest-Klein hypotheses: Proofs and generality” [Int. Rev. Law Econ. 48 (2016) 59–76],https://www.sciencedirect.com/science/article/pii/S0144818822000345,28 June 2022,2022,Research Article
56,56,Accident avoidance and settlement bargaining: The role of reciprocity,https://www.sciencedirect.com/science/article/pii/S0144818821000557,20 October 2021,2021,Research Article
57,57,"Crime, credible enforcement, and multiple equilibria",https://www.sciencedirect.com/science/article/pii/S0144818821000545,16 October 2021,2021,Research Article
58,58,An economic theory of optimal enactment and enforcement of laws,https://www.sciencedirect.com/science/article/pii/S0144818821000533,15 October 2021,2021,Research Article
59,59,Openness effects on the rule of law: Size and patterns of trade,https://www.sciencedirect.com/science/article/pii/S014481882100051X,7 October 2021,2021,Research Article
60,60,Corporate legal insider trading in China: Performance and determinants,https://www.sciencedirect.com/science/article/pii/S014481882100048X,23 September 2021,2021,Research Article
61,61,Hospital multi-dimensional quality competition with medical malpractice,https://www.sciencedirect.com/science/article/pii/S0144818821000491,23 September 2021,2021,Research Article
62,62,Estimating cartel damages with model averaging approaches,https://www.sciencedirect.com/science/article/pii/S0144818821000430,22 September 2021,2021,Research Article
63,63,EU intermediary regulation and its impact on insurance agent quality: Evidence from Germany,https://www.sciencedirect.com/science/article/pii/S0144818821000454,17 September 2021,2021,Research Article
64,64,"Creditors’ holdup, releveraging and the setting of private appropriation in a control contract between shareholders",https://www.sciencedirect.com/science/article/pii/S0144818821000478,10 September 2021,2021,Research Article
65,65,The efficacy of measuring judicial ideal points: The mis-analogy of IRTs,https://www.sciencedirect.com/science/article/pii/S0144818821000442,28 August 2021,2021,Research Article
66,66,Detecting bid-rigging coalitions in different countries and auction formats,https://www.sciencedirect.com/science/article/pii/S0144818821000405,18 August 2021,2021,Research Article
67,67,Regulation and purchase diversity: Empirical evidence from the U.S. alcohol market,https://www.sciencedirect.com/science/article/pii/S0144818821000326,13 August 2021,2021,Research Article
68,68,Should the maximum duration of fixed-term contracts increase in recessions? Evidence from a law reform,https://www.sciencedirect.com/science/article/pii/S0144818821000338,13 August 2021,2021,Research Article
69,69,Collective bargaining power and corporate cash policy,https://www.sciencedirect.com/science/article/pii/S0144818821000314,4 August 2021,2021,Research Article
70,70,Judicial attitudes under shifting jurisprudence: Evidence from Brazil’s new drug law of 2006,https://www.sciencedirect.com/science/article/pii/S0144818821000302,24 July 2021,2021,Research Article
71,71,Could Chapter 11 redeem itself? Wealth and welfare effects of the redemption option,https://www.sciencedirect.com/science/article/pii/S0144818821000296,21 July 2021,2021,Research Article
72,72,Monetary financing and fiscal discipline,https://www.sciencedirect.com/science/article/pii/S0144818821000284,2 July 2021,2021,Research Article
73,73,Does voting on tax fund destination imply a direct democracy effect?,https://www.sciencedirect.com/science/article/pii/S0144818821000272,27 June 2021,2021,Research Article
74,74,Authorial control of the Supreme Court: Chief Justice Roberts and the Obamacare surprise,https://www.sciencedirect.com/science/article/pii/S0144818821000259,16 June 2021,2021,Research Article
75,75,Subrogation and its consequences for tort litigation,https://www.sciencedirect.com/science/article/pii/S0144818821000260,12 June 2021,2021,Research Article
76,76,Loyalty to the party or loyalty to the party leader: Evidence from the Spanish Constitutional Court,https://www.sciencedirect.com/science/article/pii/S0144818821000235,13 May 2021,2021,Research Article
77,77,Allocating supervisory responsibilities to central bankers: Does national culture matter?,https://www.sciencedirect.com/science/article/pii/S0144818821000156,12 May 2021,2021,Research Article
78,78,Should environment be a concern for competition policy when firms face environmental liability?,https://www.sciencedirect.com/science/article/pii/S0144818821000144,3 May 2021,2021,Research Article
79,79,Does regulation of defensive tactics with mandatory rules benefit shareholders? Evidence from event studies in China,https://www.sciencedirect.com/science/article/pii/S0144818821000120,6 April 2021,2021,Research Article
80,80,How has the Covid19 pandemic impacted the courts of law? Evidence from Brazil,https://www.sciencedirect.com/science/article/pii/S0144818821000132,31 March 2021,2021,Research Article
81,81,Regulated occupations in Italy: Extent and labour market effects,https://www.sciencedirect.com/science/article/pii/S0144818821000119,13 March 2021,2021,Research Article
82,82,Capital structure and the optimal payment methods in acquisitions,https://www.sciencedirect.com/science/article/pii/S0144818821000107,4 March 2021,2021,Research Article
83,83,"Discovery, disclosure, and confidence",https://www.sciencedirect.com/science/article/pii/S0144818821000077,10 February 2021,2021,Research Article
84,84,Law enforcement with motivated agents,https://www.sciencedirect.com/science/article/pii/S0144818821000065,10 February 2021,2021,Research Article
85,85,The CV effect: To what extent does the chance to reorganize depend on a bankruptcy judge’s profile?,https://www.sciencedirect.com/science/article/pii/S0144818821000089,3 February 2021,2021,Research Article
86,86,Public law enforcement under ambiguity,https://www.sciencedirect.com/science/article/pii/S0144818821000016,29 January 2021,2021,Research Article
87,87,Are arbitrators biased in ICSID arbitration? A dynamic perspective,https://www.sciencedirect.com/science/article/pii/S0144818821000041,28 January 2021,2021,Research Article
88,88,Does debt relief “irresistibly attract banks as honey attracts bees”? Evidence from low-income countries’ debt relief programs,https://www.sciencedirect.com/science/article/pii/S0144818821000028,28 January 2021,2021,Research Article
89,89,How does liability affect prices? Railroad sparks and timber,https://www.sciencedirect.com/science/article/pii/S014481882100003X,19 January 2021,2021,Research Article
90,90,The price of expungements,https://www.sciencedirect.com/science/article/pii/S0144818820301897,30 December 2020,2020,Research Article
91,91,The ineffectiveness of ‘observe and report’ patrols on crime,https://www.sciencedirect.com/science/article/pii/S014481882030185X,29 December 2020,2020,Research Article
92,92,Contracts as reference points: A replication,https://www.sciencedirect.com/science/article/pii/S0144818820301861,27 December 2020,2020,Research Article
93,93,Judicial institutions of property rights protection and foreign direct investment inflows,https://www.sciencedirect.com/science/article/pii/S0144818820301885,25 December 2020,2020,Research Article
94,94,Patent assertion entities and the courts: Injunctive or fee-based relief?,https://www.sciencedirect.com/science/article/pii/S0144818820301873,24 December 2020,2020,Research Article
95,95,Tailoring critical loss to the competitive process,https://www.sciencedirect.com/science/article/pii/S0144818820301824,19 December 2020,2020,Research Article
96,96,"Staggered boards, unequal voting rights, poison pills and innovation intensity: New evidence from the Asian markets",https://www.sciencedirect.com/science/article/pii/S0144818820301836,16 December 2020,2020,Research Article
97,97,Why choosing IFRS? Benefits of voluntary adoption by European private companies,https://www.sciencedirect.com/science/article/pii/S0144818820301812,28 November 2020,2020,Research Article
98,98,Do fee-shifting rules affect plaintiffs’ win rates? A theoretical and empirical analysis,https://www.sciencedirect.com/science/article/pii/S0144818820301800,26 November 2020,2020,Research Article
99,99,Creditor information registries and relationship lending,https://www.sciencedirect.com/science/article/pii/S0144818820301794,21 November 2020,2020,Research Article
100,100,Reputational economies of scale,https://www.sciencedirect.com/science/article/pii/S0144818820301782,20 November 2020,2020,Research Article
101,101,"Takeovers, shareholder litigation, and the free-riding problem",https://www.sciencedirect.com/science/article/pii/S0144818820301642,5 November 2020,2020,Research Article
102,102,Macroeconomic and policy implications of eurobonds,https://www.sciencedirect.com/science/article/pii/S0144818820301678,2 November 2020,2020,Research Article
103,103, An empirical approach,https://www.sciencedirect.com/science/article/pii/S0144818820301666,1 November 2020,2020,Research Article
104,104,Professional vs. non-professional labour judges: their impact on the quality of judicial decisions,https://www.sciencedirect.com/science/article/pii/S0144818820301617,29 October 2020,2020,Research Article
105,105,"The effect of information structure on farmland contractual choice: toward a revised theory of share tenancy with new evidence from Guangdong, China",https://www.sciencedirect.com/science/article/pii/S0144818820301629,27 October 2020,2020,Research Article
106,106,The law of attraction: How similarity between judges and lawyers helps win cases in the Hong Kong Court of Final Appeal,https://www.sciencedirect.com/science/article/pii/S0144818820301575,21 October 2020,2020,Research Article
107,107,Are Adjudication Panels Strategically Selected? The Case of Constitutional Court in Poland,https://www.sciencedirect.com/science/article/pii/S0144818820301630,20 October 2020,2020,Research Article
108,108,"The global financial crisis, the EMU sovereign debt crisis and international financial regulation: lessons from a systematic literature review",https://www.sciencedirect.com/science/article/pii/S0144818820301587,3 October 2020,2020,Research Article
112,112,Comments on “Contracting for sex in the Pacific War” by Mark Ramseyer,https://www.sciencedirect.com/science/article/pii/S0144818823000029,March 2021,2021,Research Article
114,114,IRLE response,https://www.sciencedirect.com/science/article/pii/S0144818823000030,March 2021,2021,Research Article
115,115,"Expression of concern: “Contracting for sex in the Pacific War” [International Review of Law and Economics, Volume 65, March 2021, 105971]",https://www.sciencedirect.com/science/article/pii/S0144818821000090,10 February 2021,2021,Research Article
116,116,Judicial arbitration of unfair dismissal cases: The role of peer effects,https://www.sciencedirect.com/science/article/pii/S0144818820301605,17 October 2020,2020,Research Article
117,117,Merchant hubs and spatial disparities in the private enforcement of international trade regimes,https://www.sciencedirect.com/science/article/pii/S0144818820301599,9 October 2020,2020,Research Article
118,118,Optimism and pessimism in bargaining and contests,https://www.sciencedirect.com/science/article/pii/S0144818820301484,28 August 2020,2020,Research Article
119,119,Reaching for mediocrity: Competition and stagnation in pharmaceutical innovation,https://www.sciencedirect.com/science/article/pii/S0144818820301472,3 August 2020,2020,Research Article
120,120,Solvency II and sovereign credit risk: Additional empirical evidence and some thoughts about implications for regulators and lawmakers,https://www.sciencedirect.com/science/article/pii/S0144818820301460,3 August 2020,2020,Research Article
121,121,Testing a fine is a price in the lab,https://www.sciencedirect.com/science/article/pii/S0144818820301447,26 July 2020,2020,Research Article
122,122,Bank funding and the recent political development in Italy: What about redenomination risk?,https://www.sciencedirect.com/science/article/pii/S0144818820301459,24 July 2020,2020,Research Article
123,123,The equilibrium compliance rate among regulated firms,https://www.sciencedirect.com/science/article/pii/S0144818819302996,8 July 2020,2020,Research Article
124,124,Deterrence and liability for intentional torts,https://www.sciencedirect.com/science/article/pii/S0144818820301393,4 July 2020,2020,Research Article
125,125,Is a fine still a price? Replication as robustness in empirical legal studies,https://www.sciencedirect.com/science/article/pii/S0144818819302741,1 July 2020,2020,Research Article
126,126,Burglary reduction and improved police performance through private alarm response,https://www.sciencedirect.com/science/article/pii/S0144818820301435,1 July 2020,2020,Research Article
127,127,Opting for the English rule: On the contractual re-allocation of legal fees,https://www.sciencedirect.com/science/article/pii/S0144818820301411,29 June 2020,2020,Research Article
128,128,Does gender diversity in panels of judges matter? Evidence from French child support cases,https://www.sciencedirect.com/science/article/pii/S0144818820301423,26 June 2020,2020,Research Article
129,129,Exploring dissent in the Supreme Court of Argentina,https://www.sciencedirect.com/science/article/pii/S0144818819302911,23 June 2020,2020,Research Article
130,130,"Comment on Brady, Evans & Wehrly, reputational penalties for environmental violations: A pure and scientific replication study",https://www.sciencedirect.com/science/article/pii/S014481882030140X,9 June 2020,2020,Research Article
131,131,"State Gun Control Laws, Gun Ownership and the Supply of Homicide Organ Donors",https://www.sciencedirect.com/science/article/pii/S0144818820301381,9 June 2020,2020,Research Article
132,132,Reputational cost of securities fraud in japan under a public-enforcement-centered sanction regime,https://www.sciencedirect.com/science/article/pii/S0144818820301289,9 June 2020,2020,Research Article
133,133,"The effects of macroeconomic, fiscal and monetary policy announcements on sovereign bond spreads",https://www.sciencedirect.com/science/article/pii/S014481882030137X,30 May 2020,2020,Research Article
134,134,Stated choices of environmental managers: The role of punishment,https://www.sciencedirect.com/science/article/pii/S0144818819300535,28 May 2020,2020,Research Article
135,135,Fee shifting and accuracy in adjudication,https://www.sciencedirect.com/science/article/pii/S0144818819303151,24 May 2020,2020,Research Article
136,136,Regulatory changes and long-run relationships of the EMU sovereign debt markets: Implications for future policy framework,https://www.sciencedirect.com/science/article/pii/S0144818819301991,23 May 2020,2020,Research Article
137,137,Knowledge in youth is wisdom in age: an empirical study of attorney experience in torts litigation,https://www.sciencedirect.com/science/article/pii/S0144818820301265,17 May 2020,2020,Research Article
138,138,Examining the impact of child access prevention laws on youth firearm suicides using the synthetic control method,https://www.sciencedirect.com/science/article/pii/S0144818820301277,17 May 2020,2020,Research Article
139,139,A model of corporate self-policing and self-reporting,https://www.sciencedirect.com/science/article/pii/S0144818819302534,4 May 2020,2020,Research Article
140,140,Spurred by legal tradition or contextual politics? Lessons about judicial dissent from Slovenia and Croatia,https://www.sciencedirect.com/science/article/pii/S0144818820300259,4 May 2020,2020,Research Article
141,141,Assessing the legal value added of collective bargaining agreements,https://www.sciencedirect.com/science/article/pii/S0144818819303011,19 March 2020,2020,Research Article
142,142,Text classification of ideological direction in judicial opinions,https://www.sciencedirect.com/science/article/pii/S0144818819303667,28 February 2020,2020,Research Article
143,143,Which prisoner reentry programs work? Replicating and extending analyses of three RCTs,https://www.sciencedirect.com/science/article/pii/S014481881930290X,19 February 2020,2020,Research Article
144,144,Disclosure and Discovery with fairness,https://www.sciencedirect.com/science/article/pii/S0144818819301693,6 February 2020,2020,Research Article
145,145,An experimental test of two policies to increase donations to public projects,https://www.sciencedirect.com/science/article/pii/S0144818819301115,3 February 2020,2020,Research Article
