,Unnamed: 0,Title,Url,Time,Year,Type
146,146,Disposition time and the utilization of prior judicial decisions: Evidence from a civil law country,https://www.sciencedirect.com/science/article/pii/S0144818819301401,2 February 2020,2020,Research Article
147,147,Market collusion with joint harm and liability sharing,https://www.sciencedirect.com/science/article/pii/S0144818819300481,28 January 2020,2020,Research Article
148,148,Beyond replication: A few comments on Spruk and Kovac and Martin-Quinn scores,https://www.sciencedirect.com/science/article/pii/S0144818820300193,23 January 2020,2020,Research Article
149,149,Limited liability and corporate efficiency,https://www.sciencedirect.com/science/article/pii/S014481881930170X,16 January 2020,2020,Research Article
150,150,Law or strategic calculus? Abstention in the Argentine Supreme Court,https://www.sciencedirect.com/science/article/pii/S0144818819300602,9 January 2020,2020,Research Article
151,151,Multi-court judging and judicial productivity in a career judiciary: Evidence from Nepal,https://www.sciencedirect.com/science/article/pii/S0144818819302042,7 January 2020,2020,Research Article
152,152,"Prison, semi-liberty and recidivism: Bounding causal effects in a survival model",https://www.sciencedirect.com/science/article/pii/S0144818819302418,27 December 2019,2019,Research Article
153,153,Incentives to take care under contributory and comparative fault: The role of strategic complementarity,https://www.sciencedirect.com/science/article/pii/S0144818819303473,20 December 2019,2019,Research Article
154,154,Empirical methodology for the evaluation of collusive behaviour in vertically-related markets: An application to the “yogurt cartel” in France,https://www.sciencedirect.com/science/article/pii/S0144818819300900,15 December 2019,2019,Research Article
155,155,Settlement implications of lawyer advertising,https://www.sciencedirect.com/science/article/pii/S0144818819302716,17 November 2019,2019,Research Article
156,156,Litigation and corporate risk taking: Evidence from Chinese listed firms,https://www.sciencedirect.com/science/article/pii/S0144818819300997,16 November 2019,2019,Research Article
157,157,Estimating Effects of Affirmative Action in Policing: A Replication and Extension,https://www.sciencedirect.com/science/article/pii/S0144818819302686,15 November 2019,2019,Research Article
158,158,Understanding public enforcement of securities law in China: An empirical analysis of the enforcement actions of the CSRC and its regional offices against informational misconduct,https://www.sciencedirect.com/science/article/pii/S0144818819302601,14 November 2019,2019,Research Article
159,159,Debt-to-equity conversion in bankruptcy reorganization and post-bankruptcy firm survival,https://www.sciencedirect.com/science/article/pii/S0144818819301176,13 November 2019,2019,Research Article
160,160,Measuring discourse by algorithm,https://www.sciencedirect.com/science/article/pii/S0144818819302571,13 November 2019,2019,Research Article
161,161,State gun laws and the movement of crime guns between states,https://www.sciencedirect.com/science/article/pii/S014481881930064X,8 November 2019,2019,Research Article
162,162,The performance of corporate legal insiders on the French stock market,https://www.sciencedirect.com/science/article/pii/S0144818819300948,5 November 2019,2019,Research Article
164,164,Publisher's Note,https://www.sciencedirect.com/science/article/pii/S0144818820301757,16 November 2020,2020,Research Article
165,165,Corrigendum to “The effect of conditional cash transfers on reporting violence against women to the police in Mexico” [Int. Rev. Law Econ. 56 (2018) 73–91],https://www.sciencedirect.com/science/article/pii/S0144818820301654,10 November 2020,2020,Research Article
169,169,Laws and norms: Experimental evidence with liability rules,https://www.sciencedirect.com/science/article/pii/S0144818819300225,21 October 2019,2019,Research Article
170,170,Quorum rules and shareholder voting,https://www.sciencedirect.com/science/article/pii/S0144818818301315,16 October 2019,2019,Research Article
171,171,Leniency Can Increase Deterrence,https://www.sciencedirect.com/science/article/pii/S0144818819301814,10 October 2019,2019,Research Article
172,172,Apportionment of liability by the stochastic Shapley value,https://www.sciencedirect.com/science/article/pii/S014481881930153X,10 October 2019,2019,Research Article
173,173,Replicating and extending Martin-Quinn scores,https://www.sciencedirect.com/science/article/pii/S0144818819302261,3 October 2019,2019,Research Article
174,174,The paradox of minority attorney satisfaction,https://www.sciencedirect.com/science/article/pii/S0144818819301632,27 September 2019,2019,Research Article
175,175,Are lawyers worth the cost? Legal counsel in environmental criminal court cases,https://www.sciencedirect.com/science/article/pii/S0144818819300274,7 September 2019,2019,Research Article
176,176,A microeconomic foundation for optimal money laundering policies,https://www.sciencedirect.com/science/article/pii/S0144818818302643,31 August 2019,2019,Research Article
177,177,Compliance effects of sovereign debt cuts,https://www.sciencedirect.com/science/article/pii/S0144818818302813,18 August 2019,2019,Research Article
178,178,Why consider the lighthouse a public good?,https://www.sciencedirect.com/science/article/pii/S0144818819300638,13 August 2019,2019,Research Article
179,179,What’s in a name? A taxonomy of replication,https://www.sciencedirect.com/science/article/pii/S0144818819302005,8 August 2019,2019,Research Article
180,180,Ownership and political control: Evidence from charter amendments,https://www.sciencedirect.com/science/article/pii/S0144818819300572,31 July 2019,2019,Research Article
181,181,The effect of a ban on late-night off-premise alcohol sales on violent crime: Evidence from Germany,https://www.sciencedirect.com/science/article/pii/S0144818819300699,8 July 2019,2019,Research Article
182,182,On esteem-based incentives,https://www.sciencedirect.com/science/article/pii/S0144818818302345,8 July 2019,2019,Research Article
183,183,Pretrial settlement and coercion: An experiment,https://www.sciencedirect.com/science/article/pii/S0144818818303363,7 July 2019,2019,Research Article
184,184,Trial by skype: A causality-oriented replication exploring the use of remote video adjudication in immigration removal proceedings,https://www.sciencedirect.com/science/article/pii/S0144818818303326,8 June 2019,2019,Research Article
185,185,A note on replication analysis,https://www.sciencedirect.com/science/article/pii/S0144818819301395,5 June 2019,2019,Research Article
186,186,Optimal non-prosecution agreements and the reputational effects of convictions,https://www.sciencedirect.com/science/article/pii/S0144818818302175,24 May 2019,2019,Research Article
187,187,Identifying the impact of labor market opportunities on criminal behavior,https://www.sciencedirect.com/science/article/pii/S0144818819300043,21 May 2019,2019,Research Article
188,188,Argumentation quantity and quality: A litigation success function,https://www.sciencedirect.com/science/article/pii/S0144818819300122,11 May 2019,2019,Research Article
189,189,Electoral competition and corruption: Evidence from municipality audits in Greece,https://www.sciencedirect.com/science/article/pii/S0144818818302990,2 May 2019,2019,Research Article
190,190,? Publicly assigned but privately enforced property rights,https://www.sciencedirect.com/science/article/pii/S0144818818300942,24 April 2019,2019,Research Article
191,191,The voting rights of ex-felons and election outcomes in the United States,https://www.sciencedirect.com/science/article/pii/S0144818818300644,8 April 2019,2019,Research Article
192,192,The optimal adjustment to liability when litigation is costly: A note,https://www.sciencedirect.com/science/article/pii/S0144818818302904,4 April 2019,2019,Research Article
193,193,Physicians with multiple paid medical malpractice claims: Are they outliers or just unlucky?,https://www.sciencedirect.com/science/article/pii/S0144818818302448,1 April 2019,2019,Research Article
194,194,Development status and decision-making in investment treaty arbitration,https://www.sciencedirect.com/science/article/pii/S0144818818302436,1 April 2019,2019,Research Article
195,195,The role of judicial review in developing evidentiary standards: The example of market analysis in Russian competition law enforcement,https://www.sciencedirect.com/science/article/pii/S0144818818302928,28 March 2019,2019,Research Article
196,196,Strategic behavior in environmental contests with asymmetric ability and reimbursement,https://www.sciencedirect.com/science/article/pii/S0144818818301261,23 March 2019,2019,Research Article
197,197,Do criminal justice reforms reduce crime and perceived risk of crime? A quasi-experimental approach in Peru,https://www.sciencedirect.com/science/article/pii/S0144818818301832,22 March 2019,2019,Research Article
198,198,Biased judgements of fairness in bargaining: A replication in the laboratory,https://www.sciencedirect.com/science/article/pii/S0144818818302758,15 February 2019,2019,Research Article
199,199,On the role of emotions in experimental litigation contests,https://www.sciencedirect.com/science/article/pii/S014481881830139X,March 2019,2019,Research Article
200,200,Salience and the severity versus the certainty of punishment,https://www.sciencedirect.com/science/article/pii/S0144818819300067,March 2019,2019,Research Article
201,201,Malice in pretrial negotiations,https://www.sciencedirect.com/science/article/pii/S0144818818301807,4 January 2019,2019,Research Article
202,202,The stickiness of norms,https://www.sciencedirect.com/science/article/pii/S0144818818303405,30 December 2018,2018,Research Article
203,203,We’ll See You in . . . Court! The lack of arbitration clauses in international commercial contracts,https://www.sciencedirect.com/science/article/pii/S0144818818302308,21 December 2018,2018,Research Article
204,204,Fiscal rules and structural reforms,https://www.sciencedirect.com/science/article/pii/S0144818818301613,21 December 2018,2018,Research Article
205,205,"Replication of mismatch research: Ayres, Brooks and Ho",https://www.sciencedirect.com/science/article/pii/S0144818818302357,21 December 2018,2018,Research Article
206,206,"Friends with benefits: Case significance, amicus curiae, and agenda setting on the U.S. Supreme Court",https://www.sciencedirect.com/science/article/pii/S014481881830245X,19 December 2018,2018,Research Article
207,207,Does the Supreme Court really not apply ,https://www.sciencedirect.com/science/article/pii/S0144818818302497,March 2019,2019,Research Article
208,208,"“Replication of mismatch research: Ayers, Brooks, and Ho” (Comment)",https://www.sciencedirect.com/science/article/pii/S0144818818302631,19 December 2018,2018,Research Article
209,209,Reputational penalties for environmental violations: A pure and scientific replication study,https://www.sciencedirect.com/science/article/pii/S0144818818302291,March 2019,2019,Research Article
210,210,A replication study worth replicating: A comment on Salmanowitz and Spamann,https://www.sciencedirect.com/science/article/pii/S0144818818302886,14 December 2018,2018,Research Article
211,211,Identity errors and the standard of proof,https://www.sciencedirect.com/science/article/pii/S0144818818303260,March 2019,2019,Research Article
212,212,Understanding risky behaviors during adolescence: A model of self-discovery through experimentation,https://www.sciencedirect.com/science/article/pii/S0144818818300887,March 2019,2019,Research Article
213,213,How to test an insider trading law and its effectiveness: Price movements and comparative empirical data from Taiwan,https://www.sciencedirect.com/science/article/pii/S0144818818301856,March 2019,2019,Research Article
214,214,Can malpractice pressure compel a physician to relocate?,https://www.sciencedirect.com/science/article/pii/S0144818818301790,March 2019,2019,Research Article
215,215,An empirical comparison of insider trading enforcement in Canada and the United States,https://www.sciencedirect.com/science/article/pii/S0144818818301844,March 2019,2019,Research Article
216,216,Using the synthetic control method to determine the effects of concealed carry laws on state-level murder rates,https://www.sciencedirect.com/science/article/pii/S0144818818301935,March 2019,2019,Research Article
