,Unnamed: 0,Title,Url,Time,Year,Type
143,143,Expansion of public transfers in China: Who are the beneficiaries?,https://www.sciencedirect.com/science/article/pii/S2212828X18300604,26 February 2019,2019,Research Article
144,144,Population change and the regional distribution of physicians,https://www.sciencedirect.com/science/article/pii/S2212828X18300525,4 April 2019,2019,Research Article
145,145,Long-run improvements in human health: Steady but unequal,https://www.sciencedirect.com/science/article/pii/S2212828X18300732,6 February 2019,2019,Research Article
146,146,Labor supply and fiscal effects of partial retirement – The role of entry age and the timing of pension benefits,https://www.sciencedirect.com/science/article/pii/S2212828X18300537,14 January 2019,2019,Research Article
147,147,Determinants of health-care costs in the oldest-old in Germany,https://www.sciencedirect.com/science/article/pii/S2212828X18301282,15 May 2019,2019,Research Article
148,148,Economic effects of demographic dividend in Brazilian regions,https://www.sciencedirect.com/science/article/pii/S2212828X18301075,4 April 2019,2019,Research Article
149,149,Is there a connection between welfare regimes and inter-age reallocation systems?,https://www.sciencedirect.com/science/article/pii/S2212828X19300891,8 August 2019,2019,Research Article
150,150,Fiscal sustainability in Japan: What to tackle?,https://www.sciencedirect.com/science/article/pii/S2212828X19300921,26 August 2019,2019,Research Article
151,151,How does population ageing impact on personal income taxes and social security contributions?,https://www.sciencedirect.com/science/article/pii/S2212828X18300586,21 December 2018,2018,Research Article
152,152,Mortality in midlife for subgroups in Germany,https://www.sciencedirect.com/science/article/pii/S2212828X18300550,13 December 2018,2018,Research Article
153,153,"Perspective piece on “Changes in the morbidity prevalence and morbidity-free life expectancy of the elderly population in China from 2000 to 2010” by Bei Lu, Xiaoting Liu, Jonathan Lim and Mingxu Yang",https://www.sciencedirect.com/science/article/pii/S2212828X18301038,May 2019,2019,Research Article
154,154,"Perspective piece on “Transfers in an Aging European Union” by Fanny A. Kluge, Joshua R. Goldstein and Tobias C. Vogt",https://www.sciencedirect.com/science/article/pii/S2212828X18300987,May 2019,2019,Research Article
155,155,Perspective piece on “The distribution of pension wealth in Europe” by Javier Olivera,https://www.sciencedirect.com/science/article/pii/S2212828X18300975,May 2019,2019,Research Article
156,156,"The relationship between lifetime out-of-pocket medical expenditures, dementia, and socioeconomic status in the U.S",https://www.sciencedirect.com/science/article/pii/S2212828X18300690,30 November 2018,2018,Research Article
157,157,The policy challenges of financing longevity—A perspective from Japan,https://www.sciencedirect.com/science/article/pii/S2212828X18300951,May 2019,2019,Research Article
158,158,"Perspective piece on “Organizing old age pensions for India’s unorganized workers: A case study of a sector-driven approach”, by Narayana Muttur Ranganathan",https://www.sciencedirect.com/science/article/pii/S2212828X18300999,May 2019,2019,Research Article
159,159,"Perspective piece on “Access to long term care after a wealth shock: Evidence from the housing bubble and burst” by Joan Costa Font, Richard Frank, and Katherine Swartz",https://www.sciencedirect.com/science/article/pii/S2212828X18301026,May 2019,2019,Research Article
160,160,"Perspective piece on “One size fits all? Drawdown structures in Australia and The Netherlands,” by Jennifer Alonso García and Michael Sherris",https://www.sciencedirect.com/science/article/pii/S2212828X18300963,May 2019,2019,Research Article
161,161,Perspectives on “Cognitive decline and household financial decisions at older ages” by Marco Angrisani and Jinkook Lee,https://www.sciencedirect.com/science/article/pii/S2212828X18301014,May 2019,2019,Research Article
162,162,"Perspective piece on “Trends in health and retirement in Latin America: Are older workers healthy enough to extend their working lives?” by Laeticia De Souza, Bernardo Queiroz, and Vegard Skirbekk",https://www.sciencedirect.com/science/article/pii/S2212828X18301002,May 2019,2019,Research Article
163,163,Health disparities and the socioeconomic gradient in elderly life-cycle consumption,https://www.sciencedirect.com/science/article/pii/S2212828X18300562,13 November 2018,2018,Research Article
164,164,"I shouldn’t eat this donut: Self-control, body weight, and health in a life cycle model",https://www.sciencedirect.com/science/article/pii/S2212828X18300707,2 November 2018,2018,Research Article
165,165,One size fits all? Drawdown structures in Australia and The Netherlands,https://www.sciencedirect.com/science/article/pii/S2212828X17300488,May 2019,2019,Research Article
166,166,Access to long term care after a wealth shock: Evidence from the housing bubble and burst,https://www.sciencedirect.com/science/article/pii/S2212828X1730052X,May 2019,2019,Research Article
167,167,Transfers in an aging European Union,https://www.sciencedirect.com/science/article/pii/S2212828X17300543,May 2019,2019,Research Article
168,168,The distribution of pension wealth in Europe,https://www.sciencedirect.com/science/article/pii/S2212828X17300579,May 2019,2019,Research Article
169,169,Changes in the morbidity prevalence and morbidity-free life expectancy of the elderly population in China from 2000 to 2010,https://www.sciencedirect.com/science/article/pii/S2212828X17300622,May 2019,2019,Research Article
170,170,Organizing old age pensions for India’s unorganized workers: A case study of a sector-driven approach,https://www.sciencedirect.com/science/article/pii/S2212828X17300567,May 2019,2019,Research Article
171,171,Trends in health and retirement in Latin America: Are older workers healthy enough to extend their working lives?,https://www.sciencedirect.com/science/article/pii/S2212828X17300555,May 2019,2019,Research Article
172,172,Cognitive decline and household financial decisions at older ages,https://www.sciencedirect.com/science/article/pii/S2212828X17300506,May 2019,2019,Research Article
175,175,The economics of ageing and inequality: Introduction to the special issue,https://www.sciencedirect.com/science/article/pii/S2212828X19300386,14 March 2019,2019,Research Article
176,176,Publisher's note,https://www.sciencedirect.com/science/article/pii/S2212828X19301112,18 November 2019,2019,Research Article
177,177,"Financing longevity: The economics of pensions, health, and long-term care: Introduction to the special issue",https://www.sciencedirect.com/science/article/pii/S2212828X18300926,May 2019,2019,Research Article
178,178,Interview with Professor Olivia S. Mitchell,https://www.sciencedirect.com/science/article/pii/S2212828X18300665,May 2019,2019,Research Article
