,Unnamed: 0,Title,Url,Time,Year,Type
139,139,Aspirations and financial decisions: Experimental evidence from the Philippines,https://www.sciencedirect.com/science/article/pii/S0304387822000244,22 February 2022,2022,Research Article
140,140,Persuasive agenda-setting: Rodrigo Duterte’s inauguration speech and drugs in the Philippines,https://www.sciencedirect.com/science/article/pii/S0304387822000220,22 February 2022,2022,Research Article
141,141,Large multiproduct exporters across rich and poor countries: Theory and evidence,https://www.sciencedirect.com/science/article/pii/S0304387822000165,12 February 2022,2022,Research Article
142,142,Pay for performance schemes and manufacturing worker productivity: Evidence from a kinked design in China,https://www.sciencedirect.com/science/article/pii/S0304387822000207,12 February 2022,2022,Research Article
143,143,Heterogenous teacher effects of two incentive schemes: Evidence from a low-income country,https://www.sciencedirect.com/science/article/pii/S0304387822000049,11 February 2022,2022,Research Article
144,144,Measuring honesty and explaining adulteration in naturally occurring markets,https://www.sciencedirect.com/science/article/pii/S0304387822000037,5 February 2022,2022,Research Article
145,145,Disbursing emergency relief through utilities: Evidence from Ghana,https://www.sciencedirect.com/science/article/pii/S0304387822000086,5 February 2022,2022,Research Article
146,146,Disrupted academic careers: The returns to time off after high school,https://www.sciencedirect.com/science/article/pii/S0304387822000074,5 February 2022,2022,Research Article
147,147,Refugees and foreign direct investment: Quasi-experimental evidence from US resettlements,https://www.sciencedirect.com/science/article/pii/S0304387822000025,3 February 2022,2022,Research Article
148,148,The effect of air pollution on migration: Evidence from China,https://www.sciencedirect.com/science/article/pii/S0304387822000153,2 February 2022,2022,Research Article
149,149,"Linguistic diversity, official language choice and human capital",https://www.sciencedirect.com/science/article/pii/S0304387821001644,2 February 2022,2022,Research Article
150,150,"Trade, productivity, and the spatial organization of agriculture: Evidence from Brazil",https://www.sciencedirect.com/science/article/pii/S030438782100167X,31 January 2022,2022,Research Article
151,151,Can virtual replace in-person coaching? Experimental evidence on teacher professional development and student learning,https://www.sciencedirect.com/science/article/pii/S0304387821001668,19 January 2022,2022,Research Article
152,152,Agricultural trade and depletion of groundwater,https://www.sciencedirect.com/science/article/pii/S0304387821001577,7 January 2022,2022,Research Article
153,153,"Refugee inflows, surplus farm labor, and crop marketization in rural Africa",https://www.sciencedirect.com/science/article/pii/S0304387821001607,7 January 2022,2022,Research Article
154,154,Restricted access: How the internet can be used to promote reading and learning,https://www.sciencedirect.com/science/article/pii/S0304387821001632,6 January 2022,2022,Research Article
155,155,Impacts of industrial and entrepreneurial jobs on youth: 5-year experimental evidence on factory job offers and cash grants in Ethiopia,https://www.sciencedirect.com/science/article/pii/S0304387821001619,4 January 2022,2022,Research Article
156,156,Import competition and vertical integration: Evidence from India,https://www.sciencedirect.com/science/article/pii/S0304387821001474,25 December 2021,2021,Research Article
157,157,When do refugees return home? Evidence from Syrian displacement in Mashreq,https://www.sciencedirect.com/science/article/pii/S0304387821001589,22 December 2021,2021,Research Article
158,158,Trans-boundary air pollution spillovers: Physical transport and economic costs by distance,https://www.sciencedirect.com/science/article/pii/S0304387821001620,22 December 2021,2021,Research Article
159,159,The impact of cash transfers on Syrian refugees in Lebanon: Evidence from a multidimensional regression discontinuity design,https://www.sciencedirect.com/science/article/pii/S0304387821001590,16 December 2021,2021,Research Article
160,160,Unpacking a multi-faceted program to build sustainable income for the very poor,https://www.sciencedirect.com/science/article/pii/S0304387821001401,8 December 2021,2021,Research Article
161,161,"Intranational trade costs, product scope and productivity: Evidence from India's Golden Quadrilateral project",https://www.sciencedirect.com/science/article/pii/S0304387821001486,30 November 2021,2021,Research Article
162,162,"Hot Days, the ability to Work and climate resilience: Evidence from a representative sample of 42,152 Indian households",https://www.sciencedirect.com/science/article/pii/S0304387821001437,27 November 2021,2021,Research Article
163,163,Social protection amidst social upheaval: Examining the impact of a multi-faceted program for ultra-poor households in Yemen,https://www.sciencedirect.com/science/article/pii/S0304387821001395,24 November 2021,2021,Research Article
164,164,The joint effects of information and financing constraints on technology adoption: Evidence from a field experiment in rural Tanzania,https://www.sciencedirect.com/science/article/pii/S030438782100081X,23 November 2021,2021,Research Article
165,165,"Productivity, non-compliance and the minimum wage",https://www.sciencedirect.com/science/article/pii/S0304387821001383,13 November 2021,2021,Research Article
166,166,Direct vs indirect management training: Experimental evidence from schools in Mexico,https://www.sciencedirect.com/science/article/pii/S0304387821001371,10 November 2021,2021,Research Article
167,167,Impact of financial development on outsourcing and aggregate productivity,https://www.sciencedirect.com/science/article/pii/S0304387821001322,9 November 2021,2021,Research Article
168,168,"Liquidity crises, liquidity lines and sovereign risk",https://www.sciencedirect.com/science/article/pii/S0304387821001334,6 November 2021,2021,Research Article
169,169,Small firms and the pandemic: Evidence from Latin America,https://www.sciencedirect.com/science/article/pii/S0304387821001358,6 November 2021,2021,Research Article
170,170,Groups in conflict: Private and public prizes,https://www.sciencedirect.com/science/article/pii/S0304387821001231,1 November 2021,2021,Research Article
171,171,Information and behavioral responses during a pandemic: Evidence from delays in Covid-19 death reports,https://www.sciencedirect.com/science/article/pii/S0304387821001346,30 October 2021,2021,Research Article
172,172,Network adoption subsidies: A digital evaluation of a rural mobile phone program in Rwanda,https://www.sciencedirect.com/science/article/pii/S0304387821001255,29 October 2021,2021,Research Article
173,173,Under pressure: Women’s leadership during the COVID-19 crisis,https://www.sciencedirect.com/science/article/pii/S0304387821001243,27 October 2021,2021,Research Article
174,174,Leverage and productivity,https://www.sciencedirect.com/science/article/pii/S0304387821001188,27 October 2021,2021,Research Article
175,175,"Neighborhood violence, poverty, and psychological well-being",https://www.sciencedirect.com/science/article/pii/S0304387821001218,19 October 2021,2021,Research Article
176,176,Big fish in thin markets: Competing with the middlemen to increase market access in the Amazon,https://www.sciencedirect.com/science/article/pii/S030438782100122X,16 October 2021,2021,Research Article
177,177,Risk management in border inspection,https://www.sciencedirect.com/science/article/pii/S0304387821001152,15 October 2021,2021,Research Article
178,178,Welfare effects of an in-kind transfer program: Evidence from Mexico,https://www.sciencedirect.com/science/article/pii/S030438782100119X,14 October 2021,2021,Research Article
179,179,Saving for dowry: Evidence from rural India,https://www.sciencedirect.com/science/article/pii/S0304387821001176,13 October 2021,2021,Research Article
180,180,Cheap talk and coordination in the lab and in the field: Collective commercialization in Senegal,https://www.sciencedirect.com/science/article/pii/S0304387821001164,8 October 2021,2021,Research Article
182,182,Intellectual property regimes and wage inequality,https://www.sciencedirect.com/science/article/pii/S0304387821000833,19 July 2021,2021,Research Article
186,186,"Corrigendum to “The Lazarus drug: the impact of antiretroviral therapy on economic growth”, [J. Dev. Econ., 143 (2020) 102409]",https://www.sciencedirect.com/science/article/pii/S0304387822000219,14 February 2022,2022,Research Article
189,189,Texts don’t nudge: An adaptive trial to prevent the spread of COVID-19 in India,https://www.sciencedirect.com/science/article/pii/S0304387821001140,25 September 2021,2021,Research Article
190,190,Religion and abortion: The role of politician identity,https://www.sciencedirect.com/science/article/pii/S0304387821001139,23 September 2021,2021,Research Article
191,191,Weather and population size effects on water and sewer treatment costs: Evidence from Brazil,https://www.sciencedirect.com/science/article/pii/S0304387821001115,15 September 2021,2021,Research Article
192,192,Environmental effects of development programs: Experimental evidence from West African dryland forests,https://www.sciencedirect.com/science/article/pii/S0304387821001085,9 September 2021,2021,Research Article
193,193,IMF programs and economic growth: A meta-analysis,https://www.sciencedirect.com/science/article/pii/S0304387821001103,28 August 2021,2021,Research Article
194,194,"The housing quality, income, and human capital effects of subsidized homes in urban India",https://www.sciencedirect.com/science/article/pii/S0304387821001061,28 August 2021,2021,Research Article
195,195,Children on the move: Progressive redistribution of humanitarian cash transfers among refugees,https://www.sciencedirect.com/science/article/pii/S030438782100105X,28 August 2021,2021,Research Article
196,196,Seeking the treated: The impact of mobile extension on farmer information exchange in India,https://www.sciencedirect.com/science/article/pii/S0304387821000870,26 August 2021,2021,Research Article
197,197,"Keeping it in the family: Female inheritance, inmarriage, and the status of women",https://www.sciencedirect.com/science/article/pii/S0304387821000882,19 August 2021,2021,Research Article
198,198,Standards and political connections: Evidence from Tunisia,https://www.sciencedirect.com/science/article/pii/S0304387821001036,17 August 2021,2021,Research Article
199,199,Collective action in games as in life: Experimental evidence from canal cleaning in Haiti,https://www.sciencedirect.com/science/article/pii/S0304387821000948,14 August 2021,2021,Research Article
200,200,Mass persuasion and the ideological origins of the Chinese Cultural Revolution,https://www.sciencedirect.com/science/article/pii/S0304387821001048,13 August 2021,2021,Research Article
201,201,Borrower leakage from costly screening: Evidence from SME lending in Peru,https://www.sciencedirect.com/science/article/pii/S0304387821000924,13 August 2021,2021,Research Article
202,202,Can community service grants foster social and economic integration for youth? A randomized trial in Kazakhstan,https://www.sciencedirect.com/science/article/pii/S0304387821000912,11 August 2021,2021,Research Article
203,203,"Distance, trade, and income — The 1967 to 1975 closing of the Suez canal as a natural experiment",https://www.sciencedirect.com/science/article/pii/S0304387821000821,24 July 2021,2021,Research Article
204,204,"Trade liberalization, roads and firm productivity",https://www.sciencedirect.com/science/article/pii/S0304387821000869,24 July 2021,2021,Research Article
205,205,Reconciling the conflicting narratives on poverty in China,https://www.sciencedirect.com/science/article/pii/S0304387821000857,22 July 2021,2021,Research Article
206,206,Fintech and household resilience to shocks: Evidence from digital loans in Kenya,https://www.sciencedirect.com/science/article/pii/S0304387821000742,16 July 2021,2021,Research Article
207,207,On the market failure of “missing pioneers”,https://www.sciencedirect.com/science/article/pii/S0304387821000808,7 July 2021,2021,Research Article
208,208,What you import matters for productivity growth: Experience from Chinese manufacturing firms,https://www.sciencedirect.com/science/article/pii/S0304387821000559,29 June 2021,2021,Research Article
209,209,Segregation and internal mobility of Syrian refugees in Turkey: Evidence from mobile phone data,https://www.sciencedirect.com/science/article/pii/S0304387821000791,24 June 2021,2021,Research Article
210,210,"Story of the hurricane: Government, NGOs, and the difference in disaster relief targeting",https://www.sciencedirect.com/science/article/pii/S030438782100078X,24 June 2021,2021,Research Article
211,211,(Mis)information and anxiety: Evidence from a randomized Covid-19 information campaign,https://www.sciencedirect.com/science/article/pii/S0304387821000766,21 June 2021,2021,Research Article
212,212,Industrialization from scratch: The “Construction of Third Front” and local economic development in China's hinterland,https://www.sciencedirect.com/science/article/pii/S0304387821000754,16 June 2021,2021,Research Article
213,213,A structural estimation of the return to infrastructure investment in China,https://www.sciencedirect.com/science/article/pii/S0304387821000511,10 June 2021,2021,Research Article
214,214,The new era of unconditional convergence,https://www.sciencedirect.com/science/article/pii/S030438782100064X,2 June 2021,2021,Research Article
215,215,Refugee camps and deforestation in Sub-Saharan Africa,https://www.sciencedirect.com/science/article/pii/S0304387821000602,27 May 2021,2021,Research Article
216,216,Greening through finance?,https://www.sciencedirect.com/science/article/pii/S0304387821000614,26 May 2021,2021,Research Article
217,217,The effect of teacher strikes on parents,https://www.sciencedirect.com/science/article/pii/S0304387821000572,21 May 2021,2021,Research Article
218,218,Rural road infrastructure & agricultural production: Evidence from India,https://www.sciencedirect.com/science/article/pii/S0304387821000638,21 May 2021,2021,Research Article
219,219,The long road to health: Healthcare utilization impacts of a road pavement policy in rural India,https://www.sciencedirect.com/science/article/pii/S0304387821000468,29 April 2021,2021,Research Article
220,220,Last corrupt deed before retirement? Evidence from a lower middle-income country,https://www.sciencedirect.com/science/article/pii/S0304387821000523,22 April 2021,2021,Research Article
221,221,High-skilled services and development in China,https://www.sciencedirect.com/science/article/pii/S030438782100050X,21 April 2021,2021,Research Article
222,222,Input quality and skills are complementary and increase output quality: Causal evidence from Ecuador’s trade liberalization,https://www.sciencedirect.com/science/article/pii/S030438782100047X,20 April 2021,2021,Research Article
223,223,Lost in transition? The persistence of dictatorship mayors,https://www.sciencedirect.com/science/article/pii/S0304387821000481,17 April 2021,2021,Research Article
224,224,The political economy of health epidemics: Evidence from the Ebola outbreak,https://www.sciencedirect.com/science/article/pii/S0304387821000304,17 April 2021,2021,Research Article
225,225,Doing business in China: Parental background and government intervention determine who owns busines,https://www.sciencedirect.com/science/article/pii/S0304387821000493,14 April 2021,2021,Research Article
226,226,"Information, get-out-the-vote messages, and peer influence: Causal effects on political behavior in Mozambique",https://www.sciencedirect.com/science/article/pii/S0304387821000444,2 April 2021,2021,Research Article
227,227,Colonialism and female empowerment: A two-sided legacy,https://www.sciencedirect.com/science/article/pii/S0304387821000456,1 April 2021,2021,Research Article
228,228,"The long-term consequences of China's “Later, Longer, Fewer” campaign in old age",https://www.sciencedirect.com/science/article/pii/S0304387821000432,30 March 2021,2021,Research Article
229,229,"Measuring the unmeasured: Aggregating, anchoring, and adjusting to estimate small business performance",https://www.sciencedirect.com/science/article/pii/S0304387821000341,27 March 2021,2021,Research Article
230,230,"Digital adoption, automation, and labor markets in developing countries",https://www.sciencedirect.com/science/article/pii/S0304387821000353,20 March 2021,2021,Research Article
231,231,Welfare rationales for conditionality of cash transfers,https://www.sciencedirect.com/science/article/pii/S0304387821000365,18 March 2021,2021,Research Article
232,232,Contingent determinants,https://www.sciencedirect.com/science/article/pii/S030438782100033X,12 March 2021,2021,Research Article
233,233,Give me your tired and your poor: Impact of a large-scale amnesty program for undocumented refugees,https://www.sciencedirect.com/science/article/pii/S0304387821000316,4 March 2021,2021,Research Article
234,234,Import competition and firm innovation: Evidence from China,https://www.sciencedirect.com/science/article/pii/S0304387821000298,25 February 2021,2021,Research Article
235,235,Discrimination from below: Experimental evidence from Ethiopia,https://www.sciencedirect.com/science/article/pii/S0304387821000328,22 February 2021,2021,Research Article
236,236,How productive is public investment? Evidence from formal and informal production in India,https://www.sciencedirect.com/science/article/pii/S030438782100002X,18 February 2021,2021,Research Article
237,237,Endogenous weights and multidimensional poverty: A cautionary tale,https://www.sciencedirect.com/science/article/pii/S0304387821000286,17 February 2021,2021,Research Article
238,238,How do households adjust to tariff liberalization? Evidence from China's WTO accession,https://www.sciencedirect.com/science/article/pii/S0304387821000055,16 February 2021,2021,Research Article
239,239,Can information influence the social insurance participation decision of China's rural migrants?,https://www.sciencedirect.com/science/article/pii/S0304387821000249,13 February 2021,2021,Research Article
240,240,Partisanship and local fiscal policy: Evidence from Brazilian cities,https://www.sciencedirect.com/science/article/pii/S030438782100016X,11 February 2021,2021,Research Article
241,241,The “miseries” of sex imbalance: Evidence using subjective well-being data,https://www.sciencedirect.com/science/article/pii/S0304387821000134,9 February 2021,2021,Research Article
242,242,Brothers or invaders? How crisis-driven migrants shape voting behavior,https://www.sciencedirect.com/science/article/pii/S0304387821000158,6 February 2021,2021,Research Article
243,243,"The costs of “blue sky”: Environmental regulation, technology upgrading, and labor demand in China",https://www.sciencedirect.com/science/article/pii/S0304387820301851,6 February 2021,2021,Research Article
244,244,Does legal representation increase investment? Evidence from a field experiment in Kenya,https://www.sciencedirect.com/science/article/pii/S0304387820301875,1 February 2021,2021,Research Article
245,245,Does insecure land tenure deter investment? Evidence from a randomized controlled trial,https://www.sciencedirect.com/science/article/pii/S0304387821000110,1 February 2021,2021,Research Article
246,246,The effect of refugees on native adolescents’ test scores: Quasi-experimental evidence from PISA,https://www.sciencedirect.com/science/article/pii/S0304387821000122,30 January 2021,2021,Research Article
247,247,Funding and financing infrastructure: The joint-use of public and private finance,https://www.sciencedirect.com/science/article/pii/S0304387821000067,30 January 2021,2021,Research Article
248,248,Numeracy development in Africa: New evidence from a long-term perspective (1730–1970),https://www.sciencedirect.com/science/article/pii/S0304387821000079,23 January 2021,2021,Research Article
249,249,The globalization of refugee flows,https://www.sciencedirect.com/science/article/pii/S0304387820301802,22 January 2021,2021,Research Article
250,250,Exploitation of labor? Classical monopsony power and labor's share,https://www.sciencedirect.com/science/article/pii/S0304387821000043,21 January 2021,2021,Research Article
251,251,The long-term causal effect of U.S. bombing missions on economic development: Evidence from the Ho Chi Minh Trail and Xieng Khouang Province in Lao P.D.R,https://www.sciencedirect.com/science/article/pii/S0304387820301863,19 January 2021,2021,Research Article
252,252,"Need-based financing policies, college decision-making, and labor market behavior: Evidence from Jamaica",https://www.sciencedirect.com/science/article/pii/S0304387820301929,12 January 2021,2021,Research Article
253,253,Do corporate income tax cuts decrease labor share? Regression discontinuity evidence from China,https://www.sciencedirect.com/science/article/pii/S0304387821000018,11 January 2021,2021,Research Article
254,254,The Effects of Chess Instruction on Academic and Non-cognitive Outcomes: Field Experimental Evidence from a Developing Country,https://www.sciencedirect.com/science/article/pii/S0304387820301905,9 January 2021,2021,Research Article
255,255,Boosting pension enrollment and household consumption by example: A field experiment on information provision,https://www.sciencedirect.com/science/article/pii/S0304387820301978,7 January 2021,2021,Research Article
256,256,Supply variabilities in public workfares,https://www.sciencedirect.com/science/article/pii/S0304387820301838,7 January 2021,2021,Research Article
257,257,Female employment and intimate partner violence: Evidence from Syrian Refugee inflows to Turkey,https://www.sciencedirect.com/science/article/pii/S0304387820301826,7 January 2021,2021,Research Article
258,258,Local Governance Quality and the Environmental Cost of Forced Migration,https://www.sciencedirect.com/science/article/pii/S0304387820301784,7 January 2021,2021,Research Article
259,259,The labor market effects of an educational expansion,https://www.sciencedirect.com/science/article/pii/S0304387820301942,7 January 2021,2021,Research Article
260,260,Place-based preferential tax policy and industrial development: Evidence from India’s program on industrially backward districts,https://www.sciencedirect.com/science/article/pii/S0304387820301966,7 January 2021,2021,Research Article
261,261,A gravity analysis of refugee mobility using mobile phone data,https://www.sciencedirect.com/science/article/pii/S0304387820301930,7 January 2021,2021,Research Article
262,262,Neighborhood quality and opposition to immigration: Evidence from German refugee shelters,https://www.sciencedirect.com/science/article/pii/S0304387820301796,7 January 2021,2021,Research Article
263,263,Contract employment as a worker discipline device,https://www.sciencedirect.com/science/article/pii/S0304387820301760,6 January 2021,2021,Research Article
264,264,Divorce laws and intimate partner violence: Evidence from Mexico,https://www.sciencedirect.com/science/article/pii/S030438782030198X,5 January 2021,2021,Research Article
265,265,Empowering refugees through cash and agriculture: A regression discontinuity design,https://www.sciencedirect.com/science/article/pii/S0304387820301899,4 January 2021,2021,Research Article
266,266,Land grabs and labor in Cambodia,https://www.sciencedirect.com/science/article/pii/S0304387820301917,1 January 2021,2021,Research Article
267,267,"Which night lights data should we use in economics, and where?",https://www.sciencedirect.com/science/article/pii/S0304387820301772,1 January 2021,2021,Research Article
268,268,Gender gaps in labor informality: The motherhood effect,https://www.sciencedirect.com/science/article/pii/S0304387820301747,31 December 2020,2020,Research Article
269,269,"Resources, conflict, and economic development in Africa",https://www.sciencedirect.com/science/article/pii/S0304387820301735,24 December 2020,2020,Research Article
270,270,Say it like Goethe: Language learning facilities abroad and the self-selection of immigrants,https://www.sciencedirect.com/science/article/pii/S0304387820301723,15 December 2020,2020,Research Article
271,271,"Foreign demand, developing country exports, and CO",https://www.sciencedirect.com/science/article/pii/S0304387820301620,9 December 2020,2020,Research Article
272,272,Endogenous gender power: The two facets of empowerment,https://www.sciencedirect.com/science/article/pii/S0304387820301711,9 December 2020,2020,Research Article
273,273,Historical instruments and contemporary endogenous regressors,https://www.sciencedirect.com/science/article/pii/S0304387820301619,3 December 2020,2020,Research Article
274,274,Entrepreneurship education and teacher training in Rwanda,https://www.sciencedirect.com/science/article/pii/S0304387820301589,27 November 2020,2020,Research Article
275,275,Here waits the bride? The effect of Ethiopia's child marriage law,https://www.sciencedirect.com/science/article/pii/S0304387820301553,17 November 2020,2020,Research Article
276,276,Training the disadvantaged youth and labor market outcomes: Evidence from Bangladesh,https://www.sciencedirect.com/science/article/pii/S0304387820301607,16 November 2020,2020,Research Article
277,277,Labour market reform and firm-level employment adjustment: Evidence from the hukou reform in China,https://www.sciencedirect.com/science/article/pii/S0304387820301590,12 November 2020,2020,Research Article
278,278,The value of redistribution: Natural resources and the formation of human capital under weak institutions,https://www.sciencedirect.com/science/article/pii/S0304387820301565,12 November 2020,2020,Research Article
