,Unnamed: 0,Title,Url,Time,Year,Type
571,571,Evolutionary stability of behavioural rules in bargaining,https://www.sciencedirect.com/science/article/pii/S0167268121001244,24 May 2021,2021,Research Article
572,572,"Understanding the gains to capitalists from colonization: Lessons from Robert E. Lucas, Jr., Karl Marx and Edward Gibbon Wakefield",https://www.sciencedirect.com/science/article/pii/S0167268121001773,21 May 2021,2021,Research Article
573,573,Employment contracts and stress: Experimental evidence,https://www.sciencedirect.com/science/article/pii/S0167268121001566,21 May 2021,2021,Research Article
574,574,Does unilateral divorce impact women’s labor supply? Evidence from Mexico,https://www.sciencedirect.com/science/article/pii/S016726812100175X,21 May 2021,2021,Research Article
575,575,Testing the efficiency of inflation and exchange rate forecast revisions in a changing economic environment,https://www.sciencedirect.com/science/article/pii/S0167268121001840,19 May 2021,2021,Research Article
576,576,Birth and migration of scientists: Does religiosity matter? Evidence from 19th-century France,https://www.sciencedirect.com/science/article/pii/S0167268121001724,18 May 2021,2021,Research Article
577,577,"Group size, signaling and the effect of democracy",https://www.sciencedirect.com/science/article/pii/S0167268121001694,17 May 2021,2021,Research Article
578,578,The impact of parental migration on social identity - A framed field experiment with left-behind children in China,https://www.sciencedirect.com/science/article/pii/S0167268121001463,16 May 2021,2021,Research Article
579,579,Test-bedding the new reporting standards for loan loss reserves,https://www.sciencedirect.com/science/article/pii/S0167268121001748,14 May 2021,2021,Research Article
580,580,Cooperation in a fragmented society: Experimental evidence on Syrian refugees and natives in Lebanon,https://www.sciencedirect.com/science/article/pii/S0167268121001797,12 May 2021,2021,Research Article
581,581,Peer effects in public support for Pigouvian taxation,https://www.sciencedirect.com/science/article/pii/S0167268121001608,12 May 2021,2021,Research Article
582,582,Convergence and divergence in dynamic voting with inequality,https://www.sciencedirect.com/science/article/pii/S0167268121001542,12 May 2021,2021,Research Article
583,583,"Self-serving, altruistic and spiteful lying in the schoolyard",https://www.sciencedirect.com/science/article/pii/S0167268121001712,12 May 2021,2021,Research Article
584,584,The impact of public health messaging and personal experience on the acceptance of mask wearing during the COVID-19 pandemic,https://www.sciencedirect.com/science/article/pii/S0167268121001475,11 May 2021,2021,Research Article
585,585,Hiring from a pool of workers,https://www.sciencedirect.com/science/article/pii/S0167268121001049,11 May 2021,2021,Research Article
586,586,Can autocracy promote literacy? Evidence from a cultural alignment success story,https://www.sciencedirect.com/science/article/pii/S0167268121000755,11 May 2021,2021,Research Article
587,587,A partially exclusive rent-seeking contest,https://www.sciencedirect.com/science/article/pii/S0167268121001591,10 May 2021,2021,Research Article
588,588,Managing expectations: How selective information affects cooperation and punishment in social dilemma games,https://www.sciencedirect.com/science/article/pii/S0167268121001761,10 May 2021,2021,Research Article
589,589,International outsourcing and trade union (de-)centralisation,https://www.sciencedirect.com/science/article/pii/S0167268121001554,10 May 2021,2021,Research Article
590,590,"Institutions, attitudes and LGBT: Evidence from the gold rush",https://www.sciencedirect.com/science/article/pii/S0167268121001621,10 May 2021,2021,Research Article
591,591,Inclusive cognitive hierarchy,https://www.sciencedirect.com/science/article/pii/S0167268121001578,9 May 2021,2021,Research Article
592,592,Regulatory capture in public procurement: Evidence from revolving door bureaucrats in Japan,https://www.sciencedirect.com/science/article/pii/S0167268121001311,9 May 2021,2021,Research Article
593,593,Gender differences in face-to-face deceptive behavior,https://www.sciencedirect.com/science/article/pii/S0167268121001268,8 May 2021,2021,Research Article
594,594,What kind of teachers are schools looking for? Evidence from a randomized field experiment,https://www.sciencedirect.com/science/article/pii/S0167268121001232,8 May 2021,2021,Research Article
595,595,Perceptions of the threat to national security and the stock market,https://www.sciencedirect.com/science/article/pii/S0167268121001517,6 May 2021,2021,Research Article
596,596,Form of government and voters’ preferences for public spending,https://www.sciencedirect.com/science/article/pii/S0167268121001402,6 May 2021,2021,Research Article
597,597,Risk preferences and personality traits in children and adolescents,https://www.sciencedirect.com/science/article/pii/S0167268121001529,6 May 2021,2021,Research Article
598,598,"Cartels in the European Union, antitrust action, and public attention",https://www.sciencedirect.com/science/article/pii/S0167268121001499,6 May 2021,2021,Research Article
599,599,"Culture, institutions and the industrialization process",https://www.sciencedirect.com/science/article/pii/S016726812100161X,4 May 2021,2021,Research Article
600,600,"Unconditional cash transfers, child labour and education: theory and evidence",https://www.sciencedirect.com/science/article/pii/S0167268121001530,4 May 2021,2021,Research Article
601,601,(Un)bounded rationality of decision deliberation,https://www.sciencedirect.com/science/article/pii/S0167268121001347,1 May 2021,2021,Research Article
602,602,The share of satisfied individuals: A headcount measure of aggregate subjective well-being,https://www.sciencedirect.com/science/article/pii/S0167268121001360,1 May 2021,2021,Research Article
603,603,Evaluating the sunk cost effect,https://www.sciencedirect.com/science/article/pii/S0167268121001293,28 April 2021,2021,Research Article
604,604,Do humans rationally discount biased signals? Evidence from the Crawford-Sobel Game,https://www.sciencedirect.com/science/article/pii/S0167268121001323,24 April 2021,2021,Research Article
605,605,Experiments on the fly,https://www.sciencedirect.com/science/article/pii/S0167268121001414,24 April 2021,2021,Research Article
606,606,"State, religiosity and church participation",https://www.sciencedirect.com/science/article/pii/S0167268121001384,22 April 2021,2021,Research Article
607,607,The ratchet effect in social dilemmas,https://www.sciencedirect.com/science/article/pii/S0167268121001220,21 April 2021,2021,Research Article
608,608,Tenancy and clientelism,https://www.sciencedirect.com/science/article/pii/S0167268121001001,20 April 2021,2021,Research Article
609,609,Inequality and giving,https://www.sciencedirect.com/science/article/pii/S016726812100130X,19 April 2021,2021,Research Article
610,610,Scapegoating in evaluation decisions,https://www.sciencedirect.com/science/article/pii/S0167268121001256,18 April 2021,2021,Research Article
611,611,R&D productivity and the nexus between product substitutability and innovation: Theory and experimental evidence,https://www.sciencedirect.com/science/article/pii/S016726812100127X,18 April 2021,2021,Research Article
612,612,The impact of gender role norms on mothers’ labor supply,https://www.sciencedirect.com/science/article/pii/S0167268121001335,17 April 2021,2021,Research Article
613,613,Knowledge exchange and productivity spill-overs in Bangladeshi garment factories,https://www.sciencedirect.com/science/article/pii/S0167268121000998,16 April 2021,2021,Research Article
614,614,Promotion of (interaction) abstinence increases infection prevalence,https://www.sciencedirect.com/science/article/pii/S0167268121001074,14 April 2021,2021,Research Article
615,615,Products liability with temptation bias,https://www.sciencedirect.com/science/article/pii/S0167268121001281,12 April 2021,2021,Research Article
616,616,Does appointing team leaders and shaping leadership styles increase effort? Evidence from a field experiment,https://www.sciencedirect.com/science/article/pii/S0167268121000780,11 April 2021,2021,Research Article
617,617,Corporate culture and banking,https://www.sciencedirect.com/science/article/pii/S0167268121000743,11 April 2021,2021,Research Article
618,618,Comovement and return predictability in asset markets: An experiment with two Lucas trees,https://www.sciencedirect.com/science/article/pii/S0167268121001062,7 April 2021,2021,Research Article
619,619,Dissolving partnerships under risk: An experimental investigation,https://www.sciencedirect.com/science/article/pii/S0167268121001207,3 April 2021,2021,Research Article
620,620,Political beliefs affect compliance with government mandates,https://www.sciencedirect.com/science/article/pii/S016726812100113X,2 April 2021,2021,Research Article
621,621,"Average income, income inequality and export unit values",https://www.sciencedirect.com/science/article/pii/S0167268121000913,1 April 2021,2021,Research Article
622,622,Political institutions and policy responses during a crisis,https://www.sciencedirect.com/science/article/pii/S0167268121001128,1 April 2021,2021,Research Article
623,623,Kenji or Kenneth? Pearl Harbor and Japanese-American assimilation,https://www.sciencedirect.com/science/article/pii/S0167268121001086,31 March 2021,2021,Research Article
624,624,Does reliable electrification reduce gender differences? Evidence from India,https://www.sciencedirect.com/science/article/pii/S0167268121001098,27 March 2021,2021,Research Article
625,625,Pool punishment in public goods games: How do sanctioners’ incentives affect us?,https://www.sciencedirect.com/science/article/pii/S0167268121000986,26 March 2021,2021,Research Article
626,626,Non-monotone social learning,https://www.sciencedirect.com/science/article/pii/S0167268121001037,26 March 2021,2021,Research Article
627,627,Immigration and crime: The role of self-selection and institutions,https://www.sciencedirect.com/science/article/pii/S0167268121001050,26 March 2021,2021,Research Article
628,628,"Effect of conformism on firm selection, product quality and home bias",https://www.sciencedirect.com/science/article/pii/S0167268121000810,24 March 2021,2021,Research Article
629,629,Because I (don’t) deserve it: Entitlement and lying behavior,https://www.sciencedirect.com/science/article/pii/S0167268121001013,23 March 2021,2021,Research Article
630,630,Fiscal federalism and income inequality: An empirical analysis for Switzerland,https://www.sciencedirect.com/science/article/pii/S0167268121000950,23 March 2021,2021,Research Article
631,631,Do bystanders react to bribery?,https://www.sciencedirect.com/science/article/pii/S0167268121001025,22 March 2021,2021,Research Article
632,632,Earning responsibility increases risk taking among representative decision makers,https://www.sciencedirect.com/science/article/pii/S0167268121000883,19 March 2021,2021,Research Article
633,633,Wide framing disposition effect: An empirical study,https://www.sciencedirect.com/science/article/pii/S0167268121000925,19 March 2021,2021,Research Article
634,634,The Binary Lottery Procedure does not induce risk neutrality in the Holt & Laury and Eckel & Grossman tasks,https://www.sciencedirect.com/science/article/pii/S0167268121000937,19 March 2021,2021,Research Article
635,635,Seasonal scarcity and sharing norms,https://www.sciencedirect.com/science/article/pii/S0167268121000834,18 March 2021,2021,Research Article
636,636,What do consumers learn from regulator ratings? Evidence from restaurant hygiene quality disclosures,https://www.sciencedirect.com/science/article/pii/S0167268121000858,16 March 2021,2021,Research Article
637,637,Favoring your in-group can harm both them and you: Ethnicity and public goods provision in China,https://www.sciencedirect.com/science/article/pii/S0167268121000809,15 March 2021,2021,Research Article
638,638,"Intellectual property rights, multinational firms and technology transfers",https://www.sciencedirect.com/science/article/pii/S0167268121000603,14 March 2021,2021,Research Article
639,639,Deliberation and epistemic democracy,https://www.sciencedirect.com/science/article/pii/S0167268121000846,13 March 2021,2021,Research Article
640,640,Employment structure in China from 1990 to 2015,https://www.sciencedirect.com/science/article/pii/S016726812100086X,13 March 2021,2021,Research Article
641,641,Trust and reputation under asymmetric information,https://www.sciencedirect.com/science/article/pii/S0167268121000871,10 March 2021,2021,Research Article
642,642,"Inequality and competitive effort: The roles of asymmetric resources, opportunity and outcomes",https://www.sciencedirect.com/science/article/pii/S0167268121000779,10 March 2021,2021,Research Article
643,643,Where do I stand? Assessing researchers’ beliefs about their productivity,https://www.sciencedirect.com/science/article/pii/S0167268121000895,10 March 2021,2021,Research Article
644,644,Alphabetic norm and research output,https://www.sciencedirect.com/science/article/pii/S0167268121000792,9 March 2021,2021,Research Article
645,645,Unemployment and intimate partner violence: A Cultural approach,https://www.sciencedirect.com/science/article/pii/S0167268121000615,6 March 2021,2021,Research Article
646,646,Learning in speculative bubbles: Theory and experiment,https://www.sciencedirect.com/science/article/pii/S0167268121000202,5 March 2021,2021,Research Article
647,647,Diversity and the timing of preference in hiring decisions,https://www.sciencedirect.com/science/article/pii/S0167268120304169,4 March 2021,2021,Research Article
648,648,Investment and uncertainty: Are large firms different from small ones?,https://www.sciencedirect.com/science/article/pii/S0167268121000226,4 March 2021,2021,Research Article
649,649,Intergovernmental communication under decentralization,https://www.sciencedirect.com/science/article/pii/S0167268121000627,3 March 2021,2021,Research Article
650,650,Nepotism vs. Specific Skills: The effect of professional liberalization on returns to parental background of Italian lawyers,https://www.sciencedirect.com/science/article/pii/S0167268121000640,2 March 2021,2021,Research Article
651,651,"Wages, hires, and labor market concentration",https://www.sciencedirect.com/science/article/pii/S0167268121000548,1 March 2021,2021,Research Article
652,652,"Adolescent time and risk preferences: Measurement, determinants and field consequences",https://www.sciencedirect.com/science/article/pii/S0167268120304820,27 February 2021,2021,Research Article
653,653,Warcraft: The legitimacy building of usurpers,https://www.sciencedirect.com/science/article/pii/S0167268121000500,26 February 2021,2021,Research Article
654,654,Christian missions and anti-gay attitudes in Africa,https://www.sciencedirect.com/science/article/pii/S0167268121000585,24 February 2021,2021,Research Article
655,655,"Trade normalization, export quality, and in-migration of skilled workers: Evidence from China",https://www.sciencedirect.com/science/article/pii/S016726812030487X,24 February 2021,2021,Research Article
656,656,Regional shocks and the formation of interconnected markets: A network approach,https://www.sciencedirect.com/science/article/pii/S016726812100038X,24 February 2021,2021,Research Article
657,657,Peer monitoring and Islamic microfinance,https://www.sciencedirect.com/science/article/pii/S0167268121000561,21 February 2021,2021,Research Article
658,658,"Free riding in the monastery: Club goods, the cistercian order and agricultural investment in Ancien Regime France",https://www.sciencedirect.com/science/article/pii/S0167268121000524,21 February 2021,2021,Research Article
659,659,How long is forever in the laboratory? Three implementations of an infinite-horizon monetary economy,https://www.sciencedirect.com/science/article/pii/S0167268120304807,20 February 2021,2021,Research Article
660,660,Equal and unequal profit sharing in highly interdependent work groups: A laboratory experiment,https://www.sciencedirect.com/science/article/pii/S0167268121000378,16 February 2021,2021,Research Article
661,661,"Inequality aversion, self-interest and social connectedness",https://www.sciencedirect.com/science/article/pii/S0167268120304881,15 February 2021,2021,Research Article
662,662,"The impact of corruption, economic freedom, regulation and transparency on bank profitability and bank stability: Evidence from the Eurozone area",https://www.sciencedirect.com/science/article/pii/S0167268120302936,12 February 2021,2021,Research Article
663,663,Incentive spillovers in the workplace: Evidence from two field experiments,https://www.sciencedirect.com/science/article/pii/S0167268121000512,12 February 2021,2021,Research Article
664,664,European depositors’ behavior and crisis sentiment,https://www.sciencedirect.com/science/article/pii/S016726812100041X,11 February 2021,2021,Research Article
665,665,Inequality in personality over the life cycle,https://www.sciencedirect.com/science/article/pii/S0167268121000317,11 February 2021,2021,Research Article
666,666,Income tax evasion and audits under common and idiosyncratic shocks,https://www.sciencedirect.com/science/article/pii/S0167268121000354,11 February 2021,2021,Research Article
667,667,When a boundedly rational monopolist meets consumers with reference dependent preferences,https://www.sciencedirect.com/science/article/pii/S0167268121000391,10 February 2021,2021,Research Article
668,668,Measurement and effects of euro/dollar exchange rate uncertainty,https://www.sciencedirect.com/science/article/pii/S0167268120302122,9 February 2021,2021,Research Article
669,669,The lottery player’s fallacy: Why labels predict strategic choices,https://www.sciencedirect.com/science/article/pii/S0167268121000214,7 February 2021,2021,Research Article
670,670,Immigration and institutional change: Did mass immigration cause peronism in argentina?,https://www.sciencedirect.com/science/article/pii/S0167268121000408,6 February 2021,2021,Research Article
671,671,Leverage and asset prices: An experiment,https://www.sciencedirect.com/science/article/pii/S0167268121000160,5 February 2021,2021,Research Article
672,672,Native-immigrant differences in the effect of children on the gender pay gap,https://www.sciencedirect.com/science/article/pii/S0167268121000263,5 February 2021,2021,Research Article
673,673,How did rising labor costs erode China’s global advantage?,https://www.sciencedirect.com/science/article/pii/S0167268121000329,5 February 2021,2021,Research Article
674,674,Predicting bankruptcy of local government: A machine learning approach,https://www.sciencedirect.com/science/article/pii/S0167268121000251,5 February 2021,2021,Research Article
675,675,Fighting alone versus fighting for a team: An experiment on multiple pairwise contests,https://www.sciencedirect.com/science/article/pii/S0167268121000330,4 February 2021,2021,Research Article
676,676,Trade liberalization and gender gaps in local labor market outcomes: Dimensions of adjustment in the United States,https://www.sciencedirect.com/science/article/pii/S0167268120304790,3 February 2021,2021,Research Article
677,677,Knowing who you actually are: The effect of feedback on short- and longer-term outcomes,https://www.sciencedirect.com/science/article/pii/S016726812100024X,3 February 2021,2021,Research Article
678,678,"Heterogeneous expectations, housing bubbles and tax policy",https://www.sciencedirect.com/science/article/pii/S0167268121000068,3 February 2021,2021,Research Article
679,679,"Stress may increase choice of sooner outcomes, but not temporal discounting",https://www.sciencedirect.com/science/article/pii/S0167268120304832,3 February 2021,2021,Research Article
680,680,Determinants of the community mobility during the COVID-19 epidemic: The role of government regulations and information,https://www.sciencedirect.com/science/article/pii/S0167268121000366,1 February 2021,2021,Research Article
681,681,Spreading of an infectious disease between different locations,https://www.sciencedirect.com/science/article/pii/S0167268121000159,30 January 2021,2021,Research Article
682,682,Early-Life exposure to rainfall shocks and gender gaps in employment: Findings from Vietnam,https://www.sciencedirect.com/science/article/pii/S0167268121000275,30 January 2021,2021,Research Article
683,683,Does education improve financial behaviors? Quasi-experimental evidence from Britain,https://www.sciencedirect.com/science/article/pii/S0167268121000032,29 January 2021,2021,Research Article
684,684,"Industrial clusters, networks and resilience to the Covid-19 shock in China",https://www.sciencedirect.com/science/article/pii/S0167268121000287,26 January 2021,2021,Research Article
685,685,Job quality and workplace gender diversity in Europe,https://www.sciencedirect.com/science/article/pii/S0167268121000238,25 January 2021,2021,Research Article
686,686,Great expectations: Reservation wages and minimum wage reform,https://www.sciencedirect.com/science/article/pii/S0167268121000172,23 January 2021,2021,Research Article
687,687,"Policy conflict, coordination, and leadership in a monetary union under imperfect instrument substitutability",https://www.sciencedirect.com/science/article/pii/S0167268121000020,23 January 2021,2021,Research Article
688,688,Career lotto? Labor supply in a superstar market,https://www.sciencedirect.com/science/article/pii/S0167268120304856,23 January 2021,2021,Research Article
689,689,Should central banks communicate uncertainty in their projections?,https://www.sciencedirect.com/science/article/pii/S0167268120304157,22 January 2021,2021,Research Article
690,690,Individualism and financial inclusion,https://www.sciencedirect.com/science/article/pii/S0167268121000196,21 January 2021,2021,Research Article
691,691,Self-serving behavior of the rich causes contagion effects among the poor,https://www.sciencedirect.com/science/article/pii/S0167268121000056,21 January 2021,2021,Research Article
692,692,Behavioral effects of tax withholding on tax compliance: Implications for information initiatives,https://www.sciencedirect.com/science/article/pii/S0167268121000019,21 January 2021,2021,Research Article
693,693,On the monetary exchange with multiple equilibrium money holdings distributions: An experimental approach,https://www.sciencedirect.com/science/article/pii/S016726812030473X,16 January 2021,2021,Research Article
694,694,Socially optimal mistakes? debiasing COVID-19 mortality risk perceptions and prosocial behavior,https://www.sciencedirect.com/science/article/pii/S0167268121000184,16 January 2021,2021,Research Article
695,695,How political conflicts distort bilateral trade: Firm-level evidence from China,https://www.sciencedirect.com/science/article/pii/S0167268121000081,16 January 2021,2021,Research Article
696,696,How do sellers benefit from ,https://www.sciencedirect.com/science/article/pii/S0167268120304741,15 January 2021,2021,Research Article
697,697,Born in the family: Preferences for boys and the gender gap in math,https://www.sciencedirect.com/science/article/pii/S0167268120304716,14 January 2021,2021,Research Article
698,698,The decade after tomorrow: Estimation of discount rates from realistic temporal decisions over long time horizons,https://www.sciencedirect.com/science/article/pii/S0167268120304686,14 January 2021,2021,Research Article
699,699,Nudging at scale: Experimental evidence from FAFSA completion campaigns,https://www.sciencedirect.com/science/article/pii/S0167268120304819,14 January 2021,2021,Research Article
700,700,The formation of input–output architecture: Evidence from the European Union,https://www.sciencedirect.com/science/article/pii/S0167268121000044,13 January 2021,2021,Research Article
701,701,Capital constraints and asset bubbles: An experimental study,https://www.sciencedirect.com/science/article/pii/S016726812030398X,9 January 2021,2021,Research Article
702,702,Compromising to share the revenues from broadcasting sports leagues,https://www.sciencedirect.com/science/article/pii/S0167268120304704,7 January 2021,2021,Research Article
703,703,"Competition, collaboration and organization design",https://www.sciencedirect.com/science/article/pii/S0167268120304698,6 January 2021,2021,Research Article
704,704,The paradox of innovation,https://www.sciencedirect.com/science/article/pii/S0167268120304297,2 January 2021,2021,Research Article
705,705,Contractarianisms and markets,https://www.sciencedirect.com/science/article/pii/S0167268120304248,4 January 2021,2021,Research Article
706,706,The aspirational income hypothesis: On the limits of the relative income hypothesis,https://www.sciencedirect.com/science/article/pii/S0167268120304509,31 December 2020,2020,Research Article
707,707,"The Brexit policy shock: Were UK services exports affected, and when?",https://www.sciencedirect.com/science/article/pii/S0167268120304844,31 December 2020,2020,Research Article
708,708,"Political dynasties, term limits and female political representation: Evidence from the Philippines",https://www.sciencedirect.com/science/article/pii/S0167268120304480,30 December 2020,2020,Research Article
709,709,Online cheating amid COVID-19,https://www.sciencedirect.com/science/article/pii/S0167268120304510,28 December 2020,2020,Research Article
710,710,Are reference points merely lagged beliefs over probabilities?,https://www.sciencedirect.com/science/article/pii/S0167268120304121,28 December 2020,2020,Research Article
711,711,On the benefits of time-inconsistent preferences,https://www.sciencedirect.com/science/article/pii/S0167268120304443,25 December 2020,2020,Research Article
712,712,Human capital investment and firms’ industrial emissions: Evidence and mechanism,https://www.sciencedirect.com/science/article/pii/S0167268120304492,25 December 2020,2020,Research Article
