,Unnamed: 0,Title,Url,Time,Year,Type
167,167,A unified characterization of the randomized strategy-proof rules,https://www.sciencedirect.com/science/article/pii/S0022053120301241,1 November 2020,2020,Research Article
168,168,Would you prefer your retirement income to depend on your life expectancy?,https://www.sciencedirect.com/science/article/pii/S0022053120301198,28 October 2020,2020,Research Article
169,169,Information aggregation with runoff voting,https://www.sciencedirect.com/science/article/pii/S002205312030123X,28 October 2020,2020,Research Article
170,170,Pareto efficient combinatorial auctions: Dichotomous preferences without quasilinearity,https://www.sciencedirect.com/science/article/pii/S0022053120301216,28 October 2020,2020,Research Article
171,171,Rational quantitative trading in efficient markets,https://www.sciencedirect.com/science/article/pii/S0022053120301204,22 October 2020,2020,Research Article
175,175,Corrigendum on “Multiproduct equilibrium price dispersion” [J. Econ. Theory 67 (1) (1995) 83–105],https://www.sciencedirect.com/science/article/pii/S0022053121001216,29 June 2021,2021,Research Article
181,181,Editorial Announcement,https://www.sciencedirect.com/science/article/pii/S0022053120301721,January 2021,2021,Research Article
182,182,Community enforcement using modal actions,https://www.sciencedirect.com/science/article/pii/S0022053118301248,27 November 2019,2019,Research Article
183,183,Risk apportionment: The dual story,https://www.sciencedirect.com/science/article/pii/S0022053119301218,22 November 2019,2019,Research Article
184,184,Obvious manipulations,https://www.sciencedirect.com/science/article/pii/S002205311830629X,11 November 2019,2019,Research Article
185,185,Social norms in networks,https://www.sciencedirect.com/science/article/pii/S0022053119301206,7 November 2019,2019,Research Article
186,186,Dominance of truthtelling and the lattice structure of Nash equilibria,https://www.sciencedirect.com/science/article/pii/S0022053118304319,28 October 2019,2019,Research Article
187,187,Uniform price auctions with a last accepted bid pricing rule,https://www.sciencedirect.com/science/article/pii/S0022053119301048,25 October 2019,2019,Research Article
188,188,More apples vs. better apples: Distribution and innovation-driven growth,https://www.sciencedirect.com/science/article/pii/S0022053119301140,25 October 2019,2019,Research Article
189,189,"Evolution of preferences in structured populations: Genes, guns, and culture",https://www.sciencedirect.com/science/article/pii/S0022053118305337,25 October 2019,2019,Research Article
190,190,All or nothing: State capacity and optimal public goods provision,https://www.sciencedirect.com/science/article/pii/S002205311930105X,24 October 2019,2019,Research Article
191,191,Stability for best experienced payoff dynamics,https://www.sciencedirect.com/science/article/pii/S0022053119301073,24 October 2019,2019,Research Article
192,192,Targeted search in matching markets,https://www.sciencedirect.com/science/article/pii/S0022053119301061,24 October 2019,2019,Research Article
193,193,Do coalitions matter in designing institutions?,https://www.sciencedirect.com/science/article/pii/S0022053119301036,22 October 2019,2019,Research Article
194,194,Motivational goal bracketing: An experiment,https://www.sciencedirect.com/science/article/pii/S0022053119301000,22 October 2019,2019,Research Article
195,195,Competitive real options under private information,https://www.sciencedirect.com/science/article/pii/S0022053119300973,27 September 2019,2019,Research Article
197,197,In Memoriam – William (Bill) Sandholm,https://www.sciencedirect.com/science/article/pii/S0022053120301393,24 November 2020,2020,Research Article
200,200,Corrigendum to “An impossibility theorem for wealth in heterogeneous-agent models with limited heterogeneity” [Journal of Economic Theory 182 (2019) 1–24],https://www.sciencedirect.com/science/article/pii/S0022053120300648,28 April 2020,2020,Research Article
201,201,Articles celebrating the 50th anniversary of the Journal of Economic Theory,https://www.sciencedirect.com/science/article/pii/S0022053120300594,20 April 2020,2020,Research Article
203,203,Foreword,https://www.sciencedirect.com/science/article/pii/S0022053120300260,25 February 2020,2020,Research Article
206,206,Dynamic information acquisition and time-varying uncertainty,https://www.sciencedirect.com/science/article/pii/S0022053118304721,15 October 2019,2019,Research Article
207,207,Efficiency and stability under substitutable priorities with ties,https://www.sciencedirect.com/science/article/pii/S0022053119301012,10 October 2019,2019,Research Article
208,208,"Top trading cycles, consistency, and acyclic priorities for house allocation with existing tenants",https://www.sciencedirect.com/science/article/pii/S0022053119300997,10 October 2019,2019,Research Article
209,209,The industry supply function and the long-run competitive equilibrium with heterogeneous firms,https://www.sciencedirect.com/science/article/pii/S0022053119300985,7 October 2019,2019,Research Article
210,210,Fuel for economic growth?,https://www.sciencedirect.com/science/article/pii/S002205311930095X,27 September 2019,2019,Research Article
211,211,"Social pressure, transparency, and voting in committees",https://www.sciencedirect.com/science/article/pii/S0022053118304563,25 September 2019,2019,Research Article
212,212,Matching with partners and projects,https://www.sciencedirect.com/science/article/pii/S002205311830214X,23 September 2019,2019,Research Article
213,213,Optimal crowdfunding design,https://www.sciencedirect.com/science/article/pii/S0022053119300870,5 September 2019,2019,Research Article
214,214,Persuasion with limited communication capacity,https://www.sciencedirect.com/science/article/pii/S0022053118305064,5 September 2019,2019,Research Article
215,215,An ascending auction with multi-dimensional signals,https://www.sciencedirect.com/science/article/pii/S0022053119300869,2 September 2019,2019,Research Article
216,216,Information and Inequality,https://www.sciencedirect.com/science/article/pii/S002205311830317X,26 August 2019,2019,Research Article
217,217,Optimal equity auctions with two-dimensional types,https://www.sciencedirect.com/science/article/pii/S0022053118303053,23 August 2019,2019,Research Article
218,218,Learning in crowded markets,https://www.sciencedirect.com/science/article/pii/S0022053118303995,23 August 2019,2019,Research Article
219,219,Investment under uncertainty with financial constraints,https://www.sciencedirect.com/science/article/pii/S002205311830173X,12 August 2019,2019,Research Article
220,220,Private and common value auctions with ambiguity over correlation,https://www.sciencedirect.com/science/article/pii/S0022053118301765,12 August 2019,2019,Research Article
221,221,Optimal contracting in networks,https://www.sciencedirect.com/science/article/pii/S002205311930081X,9 August 2019,2019,Research Article
222,222,A contraction for sovereign debt models,https://www.sciencedirect.com/science/article/pii/S0022053119300857,8 August 2019,2019,Research Article
223,223,Monotone comparative statics in games with non-monotonic best-replies: Contests and Cournot oligopoly,https://www.sciencedirect.com/science/article/pii/S0022053119300845,7 August 2019,2019,Research Article
224,224,Competition and cooperation in a two-sided matching market with replication,https://www.sciencedirect.com/science/article/pii/S0022053118305726,6 August 2019,2019,Research Article
225,225,Strategic uncertainty and equilibrium selection in discontinuous games,https://www.sciencedirect.com/science/article/pii/S0022053119300821,6 August 2019,2019,Research Article
226,226,"Controls, belief updating, and bias in medical RCTs",https://www.sciencedirect.com/science/article/pii/S0022053119300808,6 August 2019,2019,Research Article
227,227,On monotone approximate and exact equilibria of an asymmetric first-price auction with affiliated private information,https://www.sciencedirect.com/science/article/pii/S0022053118306501,5 August 2019,2019,Research Article
228,228,Is ambiguity aversion bad for innovation?,https://www.sciencedirect.com/science/article/pii/S0022053119300791,2 August 2019,2019,Research Article
229,229,Try before you buy: A theory of dynamic information acquisition,https://www.sciencedirect.com/science/article/pii/S002205311930078X,2 August 2019,2019,Research Article
230,230,"Asset shortages, liquidity and speculative bubbles",https://www.sciencedirect.com/science/article/pii/S0022053119300778,1 August 2019,2019,Research Article
231,231,Capital immobility and the reach for yield,https://www.sciencedirect.com/science/article/pii/S0022053119300766,31 July 2019,2019,Research Article
232,232,Learning and self-confirming long-run biases,https://www.sciencedirect.com/science/article/pii/S0022053119300754,30 July 2019,2019,Research Article
233,233,Selling multiple correlated goods: Revenue maximization and menu-size complexity,https://www.sciencedirect.com/science/article/pii/S0022053119300717,29 July 2019,2019,Research Article
234,234,Tail expectation and imperfect competition in limit order book markets,https://www.sciencedirect.com/science/article/pii/S0022053119300730,23 July 2019,2019,Research Article
235,235,"Endogenous second moments: A unified approach to fluctuations in risk, dispersion, and uncertainty",https://www.sciencedirect.com/science/article/pii/S0022053119300729,19 July 2019,2019,Research Article
236,236,Constrained efficiency with adverse selection and directed search,https://www.sciencedirect.com/science/article/pii/S0022053119300705,12 July 2019,2019,Research Article
237,237,Intermediation in markets for goods and markets for assets,https://www.sciencedirect.com/science/article/pii/S0022053119300663,11 July 2019,2019,Research Article
238,238,"Endogenous discounting, wariness, and efficient capital taxation",https://www.sciencedirect.com/science/article/pii/S0022053119300699,10 July 2019,2019,Research Article
239,239,Revealed preference and identification,https://www.sciencedirect.com/science/article/pii/S0022053119300687,10 July 2019,2019,Research Article
240,240,On the consensus effect,https://www.sciencedirect.com/science/article/pii/S0022053119300675,10 July 2019,2019,Research Article
241,241,Constrained implementation,https://www.sciencedirect.com/science/article/pii/S0022053118302588,9 July 2019,2019,Research Article
242,242,Verifiability and group formation in markets,https://www.sciencedirect.com/science/article/pii/S0022053119300651,27 June 2019,2019,Research Article
243,243,Self-confirming price dispersion in monetary economies,https://www.sciencedirect.com/science/article/pii/S0022053118303922,19 June 2019,2019,Research Article
244,244,A theory of sticky rents: Search and bargaining with incomplete information,https://www.sciencedirect.com/science/article/pii/S0022053119300638,18 June 2019,2019,Research Article
245,245,Generalized entropy and model uncertainty,https://www.sciencedirect.com/science/article/pii/S002205311930064X,14 June 2019,2019,Research Article
246,246,Private communication in competing mechanism games,https://www.sciencedirect.com/science/article/pii/S0022053118304800,12 June 2019,2019,Research Article
247,247,Leverage dynamics and credit quality,https://www.sciencedirect.com/science/article/pii/S0022053118301182,12 June 2019,2019,Research Article
248,248,Mechanism design with ambiguous transfers: An analysis in finite dimensional naive type spaces,https://www.sciencedirect.com/science/article/pii/S0022053119300559,5 June 2019,2019,Research Article
249,249,Majority rule in the absence of a majority,https://www.sciencedirect.com/science/article/pii/S0022053119300535,4 June 2019,2019,Research Article
250,250,Strategic real options,https://www.sciencedirect.com/science/article/pii/S0022053118302576,31 May 2019,2019,Research Article
251,251,Asynchronous games with transfers: Uniqueness and optimality,https://www.sciencedirect.com/science/article/pii/S0022053119300523,30 May 2019,2019,Research Article
252,252,Subjective contingencies and limited Bayesian updating,https://www.sciencedirect.com/science/article/pii/S0022053119300547,27 May 2019,2019,Research Article
253,253,Learning to believe in simple equilibria in a complex OLG economy - evidence from the lab,https://www.sciencedirect.com/science/article/pii/S0022053119300481,23 May 2019,2019,Research Article
254,254,Information aggregation in a financial market with general signal structure,https://www.sciencedirect.com/science/article/pii/S0022053119300511,22 May 2019,2019,Research Article
255,255,Information acquisition and use by networked players,https://www.sciencedirect.com/science/article/pii/S0022053119300493,17 May 2019,2019,Research Article
256,256,Efficient mechanisms with information acquisition,https://www.sciencedirect.com/science/article/pii/S002205311930047X,7 May 2019,2019,Research Article
257,257,Efficient investments in the implementation problem,https://www.sciencedirect.com/science/article/pii/S0022053119300468,3 May 2019,2019,Research Article
258,258,Private Bayesian persuasion,https://www.sciencedirect.com/science/article/pii/S0022053118302217,30 April 2019,2019,Research Article
259,259,Public goods with ambiguity in large economies,https://www.sciencedirect.com/science/article/pii/S0022053118305374,30 April 2019,2019,Research Article
260,260,No trade and yes trade theorems for heterogeneous priors,https://www.sciencedirect.com/science/article/pii/S0022053118304071,26 April 2019,2019,Research Article
261,261,Market selection with idiosyncratic uncertainty,https://www.sciencedirect.com/science/article/pii/S0022053119300444,23 April 2019,2019,Research Article
262,262,"Savings, asset scarcity, and monetary policy",https://www.sciencedirect.com/science/article/pii/S002205311830156X,18 April 2019,2019,Research Article
263,263,An impossibility theorem for wealth in heterogeneous-agent models with limited heterogeneity,https://www.sciencedirect.com/science/article/pii/S0022053119300353,12 April 2019,2019,Research Article
264,264,The feedback effect in two-sided markets with bilateral investments,https://www.sciencedirect.com/science/article/pii/S0022053119300365,12 April 2019,2019,Research Article
265,265,Random mechanism design on multidimensional domains,https://www.sciencedirect.com/science/article/pii/S0022053119300377,11 April 2019,2019,Research Article
266,266,Reputation building through costly adjustment,https://www.sciencedirect.com/science/article/pii/S0022053119300341,May 2019,2019,Research Article
267,267,Evolutionary implementation in a public goods game,https://www.sciencedirect.com/science/article/pii/S0022053118303181,May 2019,2019,Research Article
268,268,"The economics of green consumption, cultural transmission and sustainable technological change",https://www.sciencedirect.com/science/article/pii/S0022053119300298,May 2019,2019,Research Article
269,269,Directed attention and nonparametric learning,https://www.sciencedirect.com/science/article/pii/S0022053119300286,May 2019,2019,Research Article
270,270,Too good to be truthful: Why competent advisers are fired,https://www.sciencedirect.com/science/article/pii/S0022053119300304,May 2019,2019,Research Article
271,271,The cyclical behavior of the Beveridge Curve in the housing market,https://www.sciencedirect.com/science/article/pii/S0022053119300274,May 2019,2019,Research Article
272,272,Robust incentives for information acquisition,https://www.sciencedirect.com/science/article/pii/S0022053119300250,May 2019,2019,Research Article
273,273,Rational status quo,https://www.sciencedirect.com/science/article/pii/S0022053119300249,May 2019,2019,Research Article
274,274,What you get is what you see: Cooperation in repeated games with observable payoffs,https://www.sciencedirect.com/science/article/pii/S0022053119300225,May 2019,2019,Research Article
275,275,A powerful tool for analyzing concave/convex utility and weighting functions,https://www.sciencedirect.com/science/article/pii/S0022053119300237,May 2019,2019,Research Article
276,276,Strategy-proof Pareto-improvement,https://www.sciencedirect.com/science/article/pii/S0022053119300080,May 2019,2019,Research Article
277,277,The power and limits of sequential communication in coordination games,https://www.sciencedirect.com/science/article/pii/S0022053119300201,May 2019,2019,Research Article
278,278,Recursive utility and parameter uncertainty,https://www.sciencedirect.com/science/article/pii/S0022053118302874,May 2019,2019,Research Article
279,279,Frictional asset markets and the liquidity channel of monetary policy,https://www.sciencedirect.com/science/article/pii/S0022053119300134,May 2019,2019,Research Article
280,280,Evolved attitudes to idiosyncratic and aggregate risk in age-structured populations,https://www.sciencedirect.com/science/article/pii/S0022053119300109,May 2019,2019,Research Article
281,281,Survival in speculative markets,https://www.sciencedirect.com/science/article/pii/S0022053119300122,May 2019,2019,Research Article
282,282,Optimal learning before choice,https://www.sciencedirect.com/science/article/pii/S0022053119300092,March 2019,2019,Research Article
283,283,Unique monetary equilibrium with inflation in a stationary Bewley–Aiyagari model,https://www.sciencedirect.com/science/article/pii/S0022053119300079,March 2019,2019,Research Article
284,284,Repeated implementation: A practical characterization,https://www.sciencedirect.com/science/article/pii/S0022053119300067,March 2019,2019,Research Article
285,285,Axiomatic characterization of committee scoring rules,https://www.sciencedirect.com/science/article/pii/S0022053119300043,March 2019,2019,Research Article
286,286,Communication under language barriers,https://www.sciencedirect.com/science/article/pii/S002205311930002X,March 2019,2019,Research Article
287,287,Implementation in undominated strategies by bounded mechanisms: The Pareto correspondence and a generalization,https://www.sciencedirect.com/science/article/pii/S0022053119300031,March 2019,2019,Research Article
288,288,Pivotal persuasion,https://www.sciencedirect.com/science/article/pii/S0022053119300018,March 2019,2019,Research Article
289,289,Inattention and belief polarization,https://www.sciencedirect.com/science/article/pii/S0022053118303867,March 2019,2019,Research Article
290,290,Efficient and fair assignment mechanisms are strongly group manipulable,https://www.sciencedirect.com/science/article/pii/S0022053118306999,March 2019,2019,Research Article
291,291,Necessary and sufficient conditions for peace: Implementability versus security,https://www.sciencedirect.com/science/article/pii/S0022053118307002,March 2019,2019,Research Article
292,292,Opportunistic conformism,https://www.sciencedirect.com/science/article/pii/S0022053118306975,March 2019,2019,Research Article
293,293,Matching with single-peaked preferences,https://www.sciencedirect.com/science/article/pii/S0022053118306987,March 2019,2019,Research Article
294,294,Using cheap talk to polarize or unify a group of decision makers,https://www.sciencedirect.com/science/article/pii/S0022053118306835,March 2019,2019,Research Article
295,295,On the equivalence of robustness to canonical and general elaborations,https://www.sciencedirect.com/science/article/pii/S0022053118306823,March 2019,2019,Research Article
296,296,Pure-strategy equilibria in Bayesian games,https://www.sciencedirect.com/science/article/pii/S0022053118301716,March 2019,2019,Research Article
297,297,Bayesian updating rules and AGM belief revision,https://www.sciencedirect.com/science/article/pii/S002205311830680X,January 2019,2019,Research Article
298,298,"Two-sided allocation problems, decomposability, and the impossibility of efficient trade",https://www.sciencedirect.com/science/article/pii/S0022053118306793,January 2019,2019,Research Article
299,299,Experimentation with reputation concerns – Dynamic signalling with changing types,https://www.sciencedirect.com/science/article/pii/S0022053118306781,January 2019,2019,Research Article
300,300,The informational content of prices when policy makers react to financial markets,https://www.sciencedirect.com/science/article/pii/S0022053118306768,January 2019,2019,Research Article
301,301,Optimal climate policies in a dynamic multi-country equilibrium model,https://www.sciencedirect.com/science/article/pii/S0022053118302394,January 2019,2019,Research Article
302,302,Ambiguous persuasion,https://www.sciencedirect.com/science/article/pii/S0022053118306653,January 2019,2019,Research Article
303,303,Communicating subjective evaluations,https://www.sciencedirect.com/science/article/pii/S0022053118306744,January 2019,2019,Research Article
304,304,Stability in games with continua of equilibria,https://www.sciencedirect.com/science/article/pii/S0022053118306732,January 2019,2019,Research Article
305,305,School choice with vouchers,https://www.sciencedirect.com/science/article/pii/S0022053118306756,January 2019,2019,Research Article
306,306,All-pay auctions with affiliated binary signals,https://www.sciencedirect.com/science/article/pii/S0022053118301534,January 2019,2019,Research Article
307,307,Inference of preference heterogeneity from choice data,https://www.sciencedirect.com/science/article/pii/S0022053118306112,January 2019,2019,Research Article
308,308,An experimental study of estimation and bidding in common-value auctions with public information,https://www.sciencedirect.com/science/article/pii/S0022053118306665,January 2019,2019,Research Article
309,309,Robust consumption and portfolio policies when asset prices can jump,https://www.sciencedirect.com/science/article/pii/S002205311830591X,January 2019,2019,Research Article
311,311,Introducing article numbering to ,https://www.sciencedirect.com/science/article/pii/S0022053119301152,29 October 2019,2019,Research Article
312,312,Corrigendum to “Dual random utility maximisation” [J. Econ. Theory 177 (2018) 162–182],https://www.sciencedirect.com/science/article/pii/S0022053119300961,15 October 2019,2019,Research Article
313,313,Corrigendum to “Multilateral matching” [J. Econ. Theory 156 (2015) 175–206],https://www.sciencedirect.com/science/article/pii/S0022053119300833,6 September 2019,2019,Research Article
317,317,"Corrigendum to “Limited asset markets participation, monetary policy and (inverted) aggregate demand logic” [J. Econ. Theory 140 (1) (2008) 162–196]",https://www.sciencedirect.com/science/article/pii/S002205311930033X,May 2019,2019,Research Article
