,Unnamed: 0,Title,Url,Time,Year,Type
1004,1004,Conditional cooperation and the effect of punishment,https://www.sciencedirect.com/science/article/pii/S0167268120301013,24 April 2020,2020,Research Article
1005,1005,Firms’ social responsibility and workers’ motivation at the industry equilibrium,https://www.sciencedirect.com/science/article/pii/S0167268120300846,22 April 2020,2020,Research Article
1006,1006,How the income of others affects the life satisfaction of materialists,https://www.sciencedirect.com/science/article/pii/S0167268120300883,19 April 2020,2020,Research Article
1007,1007,Is the negative interest rate policy effective?,https://www.sciencedirect.com/science/article/pii/S0167268120300974,19 April 2020,2020,Research Article
1008,1008,Managerial ability as a tool for prudential regulation,https://www.sciencedirect.com/science/article/pii/S0167268120300895,17 April 2020,2020,Research Article
1009,1009,Ethnic diversity and citizens’ support for local public good provision: Evidence from California parcel tax elections,https://www.sciencedirect.com/science/article/pii/S0167268120300780,17 April 2020,2020,Research Article
1010,1010,The evolution of taking roles,https://www.sciencedirect.com/science/article/pii/S0167268120300809,16 April 2020,2020,Research Article
1011,1011,"Financial supervision structure, decentralized decision-making and financing constraints",https://www.sciencedirect.com/science/article/pii/S0167268120300706,16 April 2020,2020,Research Article
1012,1012,Important factors determining Fintech loan default: Evidence from a lendingclub consumer platform,https://www.sciencedirect.com/science/article/pii/S0167268120300822,15 April 2020,2020,Research Article
1013,1013,Norms in the lab: Inexperienced versus experienced participants,https://www.sciencedirect.com/science/article/pii/S016726812030069X,13 April 2020,2020,Research Article
1014,1014,Was de Montesquieu (only half) right? Evidence for a stronger work ethic in cold climates,https://www.sciencedirect.com/science/article/pii/S0167268120300767,13 April 2020,2020,Research Article
1015,1015,Effects of the FDA's sodium reduction strategy in the U.S. market for chip products,https://www.sciencedirect.com/science/article/pii/S016726812030072X,12 April 2020,2020,Research Article
1016,1016,Optimal insurance in the presence of multiple policyholders,https://www.sciencedirect.com/science/article/pii/S0167268120300500,9 April 2020,2020,Research Article
1017,1017,Financial crime spillovers. Does one gain to be avenged?,https://www.sciencedirect.com/science/article/pii/S0167268120300743,7 April 2020,2020,Research Article
1018,1018,Crime and durable goods,https://www.sciencedirect.com/science/article/pii/S0167268120300433,6 April 2020,2020,Research Article
1019,1019,Own experience bias in evaluating the efforts of others,https://www.sciencedirect.com/science/article/pii/S0167268120300810,6 April 2020,2020,Research Article
1020,1020,Past performance and entry in procurement: An experimental investigation,https://www.sciencedirect.com/science/article/pii/S0167268120300639,6 April 2020,2020,Research Article
1021,1021,Culture and colonial legacy: Evidence from public goods games,https://www.sciencedirect.com/science/article/pii/S0167268120300718,5 April 2020,2020,Research Article
1022,1022,Multidirectional conditional convergence in European banking,https://www.sciencedirect.com/science/article/pii/S0167268120300792,4 April 2020,2020,Research Article
1023,1023,Cream skimming: Theory and evidence from hospital transfers and capacity utilization,https://www.sciencedirect.com/science/article/pii/S0167268120300901,4 April 2020,2020,Research Article
1024,1024,Bracelets of pride and guilt? An experimental test of self-signaling,https://www.sciencedirect.com/science/article/pii/S0167268120300391,21 April 2020,2020,Research Article
1025,1025,Female and male role models and competitiveness,https://www.sciencedirect.com/science/article/pii/S0167268120300688,1 April 2020,2020,Research Article
1026,1026,Balancing the desire for privacy against the desire to hedge risk,https://www.sciencedirect.com/science/article/pii/S0167268120300731,31 March 2020,2020,Research Article
1027,1027,Social preferences and coordination: An experiment,https://www.sciencedirect.com/science/article/pii/S0167268120300615,30 March 2020,2020,Research Article
1028,1028,Daily weather only has small effects on wellbeing in the US,https://www.sciencedirect.com/science/article/pii/S0167268120300755,30 March 2020,2020,Research Article
1029,1029,Revealed preferences in a sequential prisoners’ dilemma: A horse-race between six utility functions,https://www.sciencedirect.com/science/article/pii/S0167268120300627,30 March 2020,2020,Research Article
1030,1030,Does transparency come at the cost of charitable services? Evidence from investigating British charities,https://www.sciencedirect.com/science/article/pii/S0167268120300640,19 March 2020,2020,Research Article
1031,1031,Characterizing ambiguity attitudes using model uncertainty,https://www.sciencedirect.com/science/article/pii/S0167268120300524,19 March 2020,2020,Research Article
1032,1032,"Mandatory disclosure, letter-grade systems, and corruption: The case of Los Angeles County restaurant inspections",https://www.sciencedirect.com/science/article/pii/S0167268120300664,18 March 2020,2020,Research Article
1033,1033,Do health risk assessments change eating habits at the workplace?,https://www.sciencedirect.com/science/article/pii/S0167268120300421,13 March 2020,2020,Research Article
1034,1034,Requiem for a Nudge: Framing effects in nudging honesty,https://www.sciencedirect.com/science/article/pii/S0167268120300597,13 March 2020,2020,Research Article
1035,1035,"Prosocial managers, employee motivation, and the creation of shareholder value",https://www.sciencedirect.com/science/article/pii/S0167268120300652,12 March 2020,2020,Research Article
1036,1036,Blameable and imperfect: A study of risk-taking and accountability,https://www.sciencedirect.com/science/article/pii/S0167268120300457,10 March 2020,2020,Research Article
1037,1037,Loan contract structure and adverse selection: Survey evidence from Uganda,https://www.sciencedirect.com/science/article/pii/S0167268120300512,9 March 2020,2020,Research Article
1038,1038,Value and patience: The value premium in a dividend-growth model with hyperbolic discounting,https://www.sciencedirect.com/science/article/pii/S0167268120300378,8 March 2020,2020,Research Article
1039,1039,Parallel imports and repair services,https://www.sciencedirect.com/science/article/pii/S0167268120300305,3 March 2020,2020,Research Article
1040,1040,Losing money on the margin,https://www.sciencedirect.com/science/article/pii/S0167268120300366,3 March 2020,2020,Research Article
1041,1041,Games as frames,https://www.sciencedirect.com/science/article/pii/S0167268120300032,28 February 2020,2020,Research Article
1042,1042,Assessing the unidimensionality of political opinions. An indirect test of the persuasion bias,https://www.sciencedirect.com/science/article/pii/S0167268119303464,27 February 2020,2020,Research Article
1043,1043,The role of incentives in dynamic favour exchange: An experimental investigation,https://www.sciencedirect.com/science/article/pii/S0167268120300469,27 February 2020,2020,Research Article
1044,1044,"Relativity, mobility, and optimal nonlinear income taxation in an open economy",https://www.sciencedirect.com/science/article/pii/S0167268120300470,27 February 2020,2020,Research Article
1045,1045,Field comparisons of incentive-compatible preference elicitation techniques,https://www.sciencedirect.com/science/article/pii/S0167268120300275,25 February 2020,2020,Research Article
1046,1046,The completion effect in charitable crowdfunding,https://www.sciencedirect.com/science/article/pii/S0167268120300342,20 February 2020,2020,Research Article
1047,1047,Repeated partnerships with multiple equilibria and imperfect monitoring: An experimental study,https://www.sciencedirect.com/science/article/pii/S016726812030038X,20 February 2020,2020,Research Article
1048,1048,Contests with money and time: Experimental evidence on overbidding in all-pay auctions,https://www.sciencedirect.com/science/article/pii/S0167268120300068,19 February 2020,2020,Research Article
1049,1049,Improving non-academic student outcomes using online and text-message coaching,https://www.sciencedirect.com/science/article/pii/S016726812030010X,18 February 2020,2020,Research Article
1050,1050,"Home production, market substitutes, and the labor supply of mothers",https://www.sciencedirect.com/science/article/pii/S0167268120300081,18 February 2020,2020,Research Article
1051,1051,"Effects of experience, choice architecture, and cognitive reflection in strategyproof mechanisms",https://www.sciencedirect.com/science/article/pii/S0167268120300123,18 February 2020,2020,Research Article
1052,1052,Does increased teacher accountability decrease leniency in grading?,https://www.sciencedirect.com/science/article/pii/S0167268119304007,18 February 2020,2020,Research Article
1053,1053,"The Riksbank, emergency finance, policy experimentation, and Sweden’s reversal of fortune",https://www.sciencedirect.com/science/article/pii/S0167268120300019,15 February 2020,2020,Research Article
1054,1054,Children's heterogeneity in cooperation and parental background: An experimental study,https://www.sciencedirect.com/science/article/pii/S0167268120300111,14 February 2020,2020,Research Article
1055,1055,"My reference point, not yours",https://www.sciencedirect.com/science/article/pii/S0167268120300299,14 February 2020,2020,Research Article
1056,1056,Animal Spirits and Fiscal Policy,https://www.sciencedirect.com/science/article/pii/S0167268120300159,12 February 2020,2020,Research Article
1057,1057,Voluntary disclosure of information and cooperation in simultaneous-move economic interactions,https://www.sciencedirect.com/science/article/pii/S0167268120300287,12 February 2020,2020,Research Article
1058,1058,"Animal spirits, risk premia and monetary policy at the zero lower bound",https://www.sciencedirect.com/science/article/pii/S0167268120300160,12 February 2020,2020,Research Article
1059,1059,Negligible senescence: An economic life cycle model for the future,https://www.sciencedirect.com/science/article/pii/S0167268119304160,12 February 2020,2020,Research Article
1060,1060,An analytical solution for network models with heterogeneous and interacting agents,https://www.sciencedirect.com/science/article/pii/S0167268120300172,12 February 2020,2020,Research Article
1061,1061,Splash with a teammate: Peer effects in high-stakes tournaments,https://www.sciencedirect.com/science/article/pii/S0167268120300135,12 February 2020,2020,Research Article
1062,1062,Introduction to special issue “Understanding Cognition and Decision Making by Children.” Studying decision-making in children: Challenges and opportunities,https://www.sciencedirect.com/science/article/pii/S0167268120300202,10 February 2020,2020,Research Article
1063,1063,"Expropriations, property confiscations and new offshore entities: Evidence from the Panama Papers",https://www.sciencedirect.com/science/article/pii/S0167268120300020,6 February 2020,2020,Research Article
1064,1064,Dynamic Consistency and Regret,https://www.sciencedirect.com/science/article/pii/S0167268119302884,6 February 2020,2020,Research Article
1065,1065,Night watchers and terrorists,https://www.sciencedirect.com/science/article/pii/S0167268119304135,4 February 2020,2020,Research Article
1066,1066,Bargaining with a partially-incentivized agent,https://www.sciencedirect.com/science/article/pii/S0167268120300184,4 February 2020,2020,Research Article
1067,1067,“Give less but give smart”: Experimental evidence on the effects of public information about quality on giving,https://www.sciencedirect.com/science/article/pii/S0167268120300056,3 February 2020,2020,Research Article
1068,1068,Does trust in the government matter for whistleblowing on tax evaders? Survey and experimental evidence,https://www.sciencedirect.com/science/article/pii/S0167268120300147,3 February 2020,2020,Research Article
1069,1069,Does it pay to bet on your favourite to win? Evidence on experienced utility from the 2018 FIFA World Cup experiment,https://www.sciencedirect.com/science/article/pii/S016726812030007X,3 February 2020,2020,Research Article
1070,1070,Experimental public choice: An introduction to the special issue,https://www.sciencedirect.com/science/article/pii/S0167268119303841,30 January 2020,2020,Research Article
1071,1071,The effects of feedback on lying behavior: Experimental evidence,https://www.sciencedirect.com/science/article/pii/S0167268119304020,28 January 2020,2020,Research Article
1072,1072,Market impact and performance of arbitrageurs of financial bubbles in an agent-based model,https://www.sciencedirect.com/science/article/pii/S0167268120300044,28 January 2020,2020,Research Article
1073,1073,An early warning system for predicting systemic banking crises in the Eurozone: A logit regression approach,https://www.sciencedirect.com/science/article/pii/S0167268119304159,21 January 2020,2020,Research Article
1074,1074,Clever little lies: Math performance and cheating in primary schools in Congo,https://www.sciencedirect.com/science/article/pii/S0167268119304044,20 January 2020,2020,Research Article
1075,1075,Voter heterogeneity and political corruption,https://www.sciencedirect.com/science/article/pii/S0167268119303877,20 January 2020,2020,Research Article
1076,1076,"Public debt, positional concerns, and wealth inequality",https://www.sciencedirect.com/science/article/pii/S0167268119303786,19 January 2020,2020,Research Article
1077,1077,Professional identity and the gender gap in risk-taking. Evidence from field experiments with scientists,https://www.sciencedirect.com/science/article/pii/S0167268119304032,18 January 2020,2020,Research Article
1078,1078,Expectations of reciprocity when competitors share information: Experimental evidence,https://www.sciencedirect.com/science/article/pii/S0167268119303890,16 January 2020,2020,Research Article
1079,1079,"History dependence, cohort attachment, and job referrals in networks of close relationships",https://www.sciencedirect.com/science/article/pii/S0167268119303725,14 January 2020,2020,Research Article
1080,1080,Blood donations and incentives: Evidence from a field experiment,https://www.sciencedirect.com/science/article/pii/S0167268119303646,14 January 2020,2020,Research Article
1081,1081,Don’t blame the messenger. The Delivery method of a message matters,https://www.sciencedirect.com/science/article/pii/S0167268119303919,11 January 2020,2020,Research Article
1082,1082,International diversification and corporate cash holding behavior: What happens during economic downturns?,https://www.sciencedirect.com/science/article/pii/S0167268119303993,10 January 2020,2020,Research Article
1083,1083,Institutional inequality and individual preferences for honesty and generosity,https://www.sciencedirect.com/science/article/pii/S016726811930397X,10 January 2020,2020,Research Article
1084,1084,State capacity and economic development: Causal mechanism or correlative filter?,https://www.sciencedirect.com/science/article/pii/S0167268119303981,10 January 2020,2020,Research Article
1085,1085,"Sleep, health, and human capital: Evidence from daylight saving time",https://www.sciencedirect.com/science/article/pii/S0167268119303865,10 January 2020,2020,Research Article
1086,1086,Monetary policy and herd behavior: International evidence,https://www.sciencedirect.com/science/article/pii/S0167268119304019,10 January 2020,2020,Research Article
1087,1087,The evolutionary anthropology of war,https://www.sciencedirect.com/science/article/pii/S016726811730255X,23 September 2017,2017,Research Article
1089,1089,"War and conflict in economics: Theories, applications, and recent trends",https://www.sciencedirect.com/science/article/pii/S0167268117302044,28 July 2017,2017,Research Article
1091,1091,The logic of animal intergroup conflict: A review,https://www.sciencedirect.com/science/article/pii/S0167268117301257,3 May 2017,2017,Research Article
1092,1092,Behavioral coordination as an individual best-response to punishing role models,https://www.sciencedirect.com/science/article/pii/S0167268117300811,20 April 2017,2017,Research Article
1093,1093,The swing voters’ blessing,https://www.sciencedirect.com/science/article/pii/S0167268117300914,4 April 2017,2017,Research Article
1094,1094,Communicating on electoral platforms,https://www.sciencedirect.com/science/article/pii/S0167268117300653,12 March 2017,2017,Research Article
1095,1095,Choosing the rules: Preferences over voting systems for assemblies of representatives,https://www.sciencedirect.com/science/article/pii/S016726811730029X,14 February 2017,2017,Research Article
1097,1097,Time and punishment: Blame and concession in political standoffs,https://www.sciencedirect.com/science/article/pii/S0167268117300033,25 January 2017,2017,Research Article
1098,1098,Ignorance and bias in collective decisions,https://www.sciencedirect.com/science/article/pii/S0167268116302931,27 December 2016,2016,Research Article
1099,1099,Conflicted voters: A spatial voting model with multiple party identifications,https://www.sciencedirect.com/science/article/pii/S0167268116302852,7 December 2016,2016,Research Article
1100,1100,Are risks over multiple attributes traded off? A case study of aid,https://www.sciencedirect.com/science/article/pii/S0167268119301775,13 June 2019,2019,Research Article
1101,1101,Peer punishment of acts of omission versus acts of commission in give and take social dilemmas,https://www.sciencedirect.com/science/article/pii/S0167268119301568,5 June 2019,2019,Research Article
1102,1102,Incentivizing self-control effort,https://www.sciencedirect.com/science/article/pii/S0167268119301829,4 June 2019,2019,Research Article
1103,1103,Can households see into the future? Survey evidence from the Netherlands,https://www.sciencedirect.com/science/article/pii/S0167268119301714,4 June 2019,2019,Research Article
1104,1104,Risk aversion and job mobility,https://www.sciencedirect.com/science/article/pii/S0167268119300150,4 June 2019,2019,Research Article
1105,1105,How group identification distorts beliefs,https://www.sciencedirect.com/science/article/pii/S0167268119301799,4 June 2019,2019,Research Article
1106,1106,"Overconfidence, subjective perception and pricing behavior",https://www.sciencedirect.com/science/article/pii/S0167268119301817,4 June 2019,2019,Research Article
1107,1107,Targeted search with horizontal differentiation in the marriage market,https://www.sciencedirect.com/science/article/pii/S0167268119301751,4 June 2019,2019,Research Article
1108,1108,Gifts and goals: Behavioral nudges to improve child food choice at school,https://www.sciencedirect.com/science/article/pii/S0167268119301477,3 June 2019,2019,Research Article
1109,1109,Bipartite conflict networks with returns to scale technology,https://www.sciencedirect.com/science/article/pii/S0167268119301404,31 May 2019,2019,Research Article
1110,1110,Beyond the average: Ethnic capital heterogeneity and intergenerational transmission of education,https://www.sciencedirect.com/science/article/pii/S0167268119301076,31 May 2019,2019,Research Article
1111,1111,Estimating parametric loss aversion with prospect theory: Recognising and dealing with size dependence,https://www.sciencedirect.com/science/article/pii/S0167268119301209,31 May 2019,2019,Research Article
1112,1112,Experience wears the trousers: Exploring gender and attitude to financial risk,https://www.sciencedirect.com/science/article/pii/S0167268119301374,31 May 2019,2019,Research Article
1113,1113,Anchoring in project duration estimation,https://www.sciencedirect.com/science/article/pii/S0167268119301180,31 May 2019,2019,Research Article
1114,1114,Search and resale frictions in a two-sided online platform: A case of multi-use assets,https://www.sciencedirect.com/science/article/pii/S0167268119301167,31 May 2019,2019,Research Article
1115,1115,"Asymmetric reference-dependent reciprocity, downward wage rigidity, and the employment contract",https://www.sciencedirect.com/science/article/pii/S0167268119301453,24 May 2019,2019,Research Article
1116,1116,Ambiguity in criminal punishment,https://www.sciencedirect.com/science/article/pii/S0167268119301532,23 May 2019,2019,Research Article
1117,1117,Minority advantage and disadvantage in competition and coordination,https://www.sciencedirect.com/science/article/pii/S0167268119301696,23 May 2019,2019,Research Article
1118,1118,Tipping points and business-as-usual in a global commons,https://www.sciencedirect.com/science/article/pii/S0167268119301544,23 May 2019,2019,Research Article
1119,1119,The effects of status mobility and group identity on trust,https://www.sciencedirect.com/science/article/pii/S0167268119301702,23 May 2019,2019,Research Article
1120,1120,"Occupation-induced status, social norms, and economic growth",https://www.sciencedirect.com/science/article/pii/S0167268119301386,22 May 2019,2019,Research Article
1121,1121,Optimal information censorship,https://www.sciencedirect.com/science/article/pii/S0167268119301556,22 May 2019,2019,Research Article
1122,1122,Self-control problems and the folk theorem,https://www.sciencedirect.com/science/article/pii/S016726811930143X,21 May 2019,2019,Research Article
1123,1123,Financial attention and the disposition effect,https://www.sciencedirect.com/science/article/pii/S0167268119301222,16 May 2019,2019,Research Article
1124,1124,The role of ignorance in the emergence of redistribution,https://www.sciencedirect.com/science/article/pii/S0167268119301246,16 May 2019,2019,Research Article
1125,1125,Gender inequality in new media: Evidence from Wikipedia,https://www.sciencedirect.com/science/article/pii/S0167268119301234,16 May 2019,2019,Research Article
1126,1126,Market frictions in entrepreneurial innovation: Theory and evidence,https://www.sciencedirect.com/science/article/pii/S0167268119301398,16 May 2019,2019,Research Article
1127,1127,Collective risk-taking in the commons,https://www.sciencedirect.com/science/article/pii/S0167268119301143,16 May 2019,2019,Research Article
1128,1128,Unintended triadic closure in social networks: The strategic formation of research collaborations between French inventors,https://www.sciencedirect.com/science/article/pii/S0167268118302841,16 May 2019,2019,Research Article
1129,1129,Disentangling the fiscal effects of local constitutions,https://www.sciencedirect.com/science/article/pii/S0167268119301520,15 May 2019,2019,Research Article
1130,1130,"I might be a liar, but I am not a thief: An experimental distinction between the moral costs of lying and stealing",https://www.sciencedirect.com/science/article/pii/S0167268119301489,15 May 2019,2019,Research Article
1131,1131,Interest rate changes and borrower search behavior,https://www.sciencedirect.com/science/article/pii/S0167268119300915,15 May 2019,2019,Research Article
1132,1132,Electoral cycle bias in the media coverage of corruption news,https://www.sciencedirect.com/science/article/pii/S0167268119301441,15 May 2019,2019,Research Article
1133,1133,Price-setting with quadratic adjustment costs: Experimental evidence,https://www.sciencedirect.com/science/article/pii/S0167268119301490,15 May 2019,2019,Research Article
1134,1134,Heterogeneity in peer effects in random dormitory assignment in a developing country,https://www.sciencedirect.com/science/article/pii/S0167268119301362,15 May 2019,2019,Research Article
1135,1135,From broken windows to broken bonds: Militarized police and social fragmentation,https://www.sciencedirect.com/science/article/pii/S0167268119301155,15 May 2019,2019,Research Article
1136,1136,Social interactions in voting behavior: Evidence from india,https://www.sciencedirect.com/science/article/pii/S0167268119301350,15 May 2019,2019,Research Article
1137,1137,Choice set dependent performance and post-decision dissonance,https://www.sciencedirect.com/science/article/pii/S016726811930126X,14 May 2019,2019,Research Article
1138,1138,Large price movements in housing markets,https://www.sciencedirect.com/science/article/pii/S0167268119301519,14 May 2019,2019,Research Article
1139,1139,Best-of-five contest: An experiment on gender differences,https://www.sciencedirect.com/science/article/pii/S0167268119301179,9 May 2019,2019,Research Article
1140,1140,The common enemy effect under strategic network formation and disruption,https://www.sciencedirect.com/science/article/pii/S0167268119300824,30 April 2019,2019,Research Article
1141,1141,Competition and the role of group identity,https://www.sciencedirect.com/science/article/pii/S0167268119301258,29 April 2019,2019,Research Article
1142,1142,Risk preference dynamics around life events,https://www.sciencedirect.com/science/article/pii/S0167268119301210,28 April 2019,2019,Research Article
1143,1143,Adherence to cultural norms and economic incentives: Evidence from fertility timing decisions,https://www.sciencedirect.com/science/article/pii/S0167268119301064,28 April 2019,2019,Research Article
1144,1144,Strategic feedback in teams: Theory and experimental evidence,https://www.sciencedirect.com/science/article/pii/S0167268119301088,28 April 2019,2019,Research Article
1145,1145,Helping under a combination of team and tournament incentives,https://www.sciencedirect.com/science/article/pii/S0167268119300848,28 April 2019,2019,Research Article
1146,1146,Public interest or regulatory capture: Theory and evidence from China’s airfare deregulation,https://www.sciencedirect.com/science/article/pii/S0167268119300903,May 2019,2019,Research Article
1147,1147,Was Brexit triggered by the old and unhappy? Or by financial feelings?,https://www.sciencedirect.com/science/article/pii/S0167268119301015,May 2019,2019,Research Article
