,Unnamed: 0,Title,Url,Time,Year,Type
0,0,"The Bielefeld School of economics, Post Keynesian economics, and dynamic complexity",https://www.sciencedirect.com/science/article/pii/S0167268123001762,13 June 2023,2023,Research Article
1,1,International capital markets with interdependent preferences: Theory and empirical evidence,https://www.sciencedirect.com/science/article/pii/S0167268123001981,10 June 2023,2023,Research Article
2,2,Moment set selection for the SMM using simple machine learning,https://www.sciencedirect.com/science/article/pii/S0167268123001944,7 June 2023,2023,Research Article
3,3,"Physics, Biology and Human Faculties: A Structural Stepwise Approach to Modeling Human Behavior",https://www.sciencedirect.com/science/article/pii/S016726812300183X,7 June 2023,2023,Research Article
4,4,"Caste, courts and business",https://www.sciencedirect.com/science/article/pii/S0167268123001907,7 June 2023,2023,Research Article
5,5,“O Youth and Beauty:” Children's looks and children's cognitive development,https://www.sciencedirect.com/science/article/pii/S0167268123001567,7 June 2023,2023,Research Article
6,6,Reply and counter-reply: On cybersocialism,https://www.sciencedirect.com/science/article/pii/S0167268123000999,6 June 2023,2023,Research Article
7,7,Designing an incentive mechanism for information security policy compliance: An experiment,https://www.sciencedirect.com/science/article/pii/S0167268123001865,2 June 2023,2023,Research Article
8,8,Food demand and cash transfers: A collective household approach with Homescan data,https://www.sciencedirect.com/science/article/pii/S0167268123001464,2 June 2023,2023,Research Article
9,9,How Does the Beauty of Wives Affect Post-marriage Family Outcomes? Helen's Face in Chinese Households,https://www.sciencedirect.com/science/article/pii/S0167268123001919,2 June 2023,2023,Research Article
10,10,The effect of language training on immigrants’ integration: Does the duration of training matter?,https://www.sciencedirect.com/science/article/pii/S0167268123001816,2 June 2023,2023,Research Article
11,11,Do economists replicate?,https://www.sciencedirect.com/science/article/pii/S0167268123001555,2 June 2023,2023,Research Article
12,12,Can environmental monitoring power transition curb corporate greenwashing behavior?,https://www.sciencedirect.com/science/article/pii/S0167268123001877,2 June 2023,2023,Research Article
13,13,The right person for the right job: workers’ prosociality as a screening device,https://www.sciencedirect.com/science/article/pii/S0167268123001178,1 June 2023,2023,Research Article
14,14,Quality communication via cheap-talk messages in experimental auctions,https://www.sciencedirect.com/science/article/pii/S0167268123001476,1 June 2023,2023,Research Article
15,15,The dynamics of leverage and the belief distribution of wealth,https://www.sciencedirect.com/science/article/pii/S0167268123001774,31 May 2023,2023,Research Article
16,16,"The epidemic effect: Epidemics, institutions and human capital development",https://www.sciencedirect.com/science/article/pii/S0167268123001579,31 May 2023,2023,Research Article
17,17,Do immigrants affect crime? Evidence for Germany,https://www.sciencedirect.com/science/article/pii/S0167268123001713,30 May 2023,2023,Research Article
18,18,No evidence of biased updating in beliefs about absolute performance: A replication and generalization of Grossman and Owens (2012),https://www.sciencedirect.com/science/article/pii/S0167268123001543,26 May 2023,2023,Research Article
19,19,Classical and Keynesian models of inequality and stagnation,https://www.sciencedirect.com/science/article/pii/S0167268123001683,20 May 2023,2023,Research Article
20,20,"Sponsor, institutional investor, and quotation behavior: Theory and evidence from China",https://www.sciencedirect.com/science/article/pii/S0167268123001142,19 May 2023,2023,Research Article
21,21,"Safety first, loss probability, and the cross section of expected stock returns",https://www.sciencedirect.com/science/article/pii/S0167268123001324,18 May 2023,2023,Research Article
22,22,Clash of norms judicial leniency on defendant birthdays,https://www.sciencedirect.com/science/article/pii/S0167268123001488,18 May 2023,2023,Research Article
23,23,Individualism reduces borrower discouragement,https://www.sciencedirect.com/science/article/pii/S0167268123001658,18 May 2023,2023,Research Article
24,24,Coordinating donations via an intermediary: The destructive effect of a sunk overhead cost,https://www.sciencedirect.com/science/article/pii/S0167268123001506,17 May 2023,2023,Research Article
25,25,Do women shy away from risky skill games?,https://www.sciencedirect.com/science/article/pii/S0167268123001257,16 May 2023,2023,Research Article
26,26,The gender gap among top business executives,https://www.sciencedirect.com/science/article/pii/S016726812300121X,16 May 2023,2023,Research Article
27,27,Random network consideration: Theory and experiment,https://www.sciencedirect.com/science/article/pii/S0167268123000604,16 May 2023,2023,Research Article
28,28,Anti-herding by hedge funds and its implications for expected returns,https://www.sciencedirect.com/science/article/pii/S0167268123001385,12 May 2023,2023,Research Article
29,29,Female labor market conditions and gender gaps in aspirations,https://www.sciencedirect.com/science/article/pii/S0167268123001415,12 May 2023,2023,Research Article
30,30,Reference-dependent self-control: Menu effects and behavioral choices,https://www.sciencedirect.com/science/article/pii/S0167268123001373,9 May 2023,2023,Research Article
31,31,Disease and democracy: Political regimes and countries responsiveness to COVID-19,https://www.sciencedirect.com/science/article/pii/S0167268123001440,8 May 2023,2023,Research Article
32,32,Public investment as downward benefit distribution: Theory and evidence from China’s public–private partnership programs,https://www.sciencedirect.com/science/article/pii/S0167268123000987,8 May 2023,2023,Research Article
33,33,Adaptive utility,https://www.sciencedirect.com/science/article/pii/S0167268123001348,5 May 2023,2023,Research Article
34,34,The endogenous formation of common pool resource coalitions,https://www.sciencedirect.com/science/article/pii/S0167268123001397,5 May 2023,2023,Research Article
35,35,A new institutional perspective on business associations: Filling a gap between firms and states in the dynamic analysis of Richard Day,https://www.sciencedirect.com/science/article/pii/S0167268123001191,4 May 2023,2023,Research Article
36,36,"To mitigate or to adapt: How to deal with optimism, pessimism and strategic ambiguity?",https://www.sciencedirect.com/science/article/pii/S0167268123001154,3 May 2023,2023,Research Article
37,37,Sharing norms and negotiations across cultures: Experimental interactions within and between Egypt and Germany,https://www.sciencedirect.com/science/article/pii/S016726812300135X,2 May 2023,2023,Research Article
38,38,Discrimination with inaccurate beliefs and confirmation bias,https://www.sciencedirect.com/science/article/pii/S0167268123001221,1 May 2023,2023,Research Article
39,39,Cohort crowding in education and employment: Evidence from China's compulsory education law,https://www.sciencedirect.com/science/article/pii/S0167268123001361,1 May 2023,2023,Research Article
40,40,Sentiment-driven business cycle dynamics: An elementary macroeconomic model with animal spirits,https://www.sciencedirect.com/science/article/pii/S0167268123001166,1 May 2023,2023,Research Article
41,41,Mountains of evidence: The effects of abnormal air pollution on crime,https://www.sciencedirect.com/science/article/pii/S0167268123001130,27 April 2023,2023,Research Article
42,42,Polycentricity and adaptation: A multilevel selectionist approach,https://www.sciencedirect.com/science/article/pii/S0167268123001099,26 April 2023,2023,Research Article
43,43,The effect of cognitive load on economic decision-making: a replication attempt,https://www.sciencedirect.com/science/article/pii/S0167268123000938,25 April 2023,2023,Research Article
44,44,Famous after death: The effect of a writer's death on book sales,https://www.sciencedirect.com/science/article/pii/S016726812300118X,24 April 2023,2023,Research Article
45,45,Investor trade allocation patterns in stock markets,https://www.sciencedirect.com/science/article/pii/S0167268123001087,24 April 2023,2023,Research Article
46,46,Educated politicians and government efficiency: Evidence from Norwegian local government,https://www.sciencedirect.com/science/article/pii/S0167268123001117,24 April 2023,2023,Research Article
47,47,"Hollywood, Wall Street, and Mistrusting Individual Investors",https://www.sciencedirect.com/science/article/pii/S0167268123001038,21 April 2023,2023,Research Article
48,48,When does introducing verifiable communication choices improve welfare?,https://www.sciencedirect.com/science/article/pii/S016726812300104X,21 April 2023,2023,Research Article
49,49,A conjoined intellectual journey: Richard H. Day and the journal he founded,https://www.sciencedirect.com/science/article/pii/S0167268123000781,17 April 2023,2023,Research Article
50,50,The impact of Covid-19 containment lockdowns on MSMEs in India and resilience of exporting firms,https://www.sciencedirect.com/science/article/pii/S0167268123001051,17 April 2023,2023,Research Article
51,51,(Loan) price and (loan officer) prejudice,https://www.sciencedirect.com/science/article/pii/S0167268123001129,15 April 2023,2023,Research Article
52,52,Does relative performance information lower group morale?,https://www.sciencedirect.com/science/article/pii/S0167268123000707,6 April 2023,2023,Research Article
53,53,The intrinsic value of decision rights: A replication and an extension to team decision making,https://www.sciencedirect.com/science/article/pii/S0167268123000926,6 April 2023,2023,Research Article
54,54,Misreporting in teams with individual decision making: The impact of information and communication,https://www.sciencedirect.com/science/article/pii/S0167268123001014,6 April 2023,2023,Research Article
55,55,Determinants of individual sustainable investment behavior - A framed field experiment,https://www.sciencedirect.com/science/article/pii/S0167268123000896,5 April 2023,2023,Research Article
56,56,Bandwagons in costly elections: The role of loss aversion,https://www.sciencedirect.com/science/article/pii/S016726812300077X,5 April 2023,2023,Research Article
57,57,The demand for interns,https://www.sciencedirect.com/science/article/pii/S0167268123000689,4 April 2023,2023,Research Article
58,58,The morality of illicit markets: “Greasing the wheels” or “greasing the palm”?,https://www.sciencedirect.com/science/article/pii/S0167268123000975,4 April 2023,2023,Research Article
59,59,Collective bargaining in a shrinking group game: The role of information and communication,https://www.sciencedirect.com/science/article/pii/S0167268123000756,4 April 2023,2023,Research Article
60,60,Pirate and chill: The effect of netflix on illegal streaming,https://www.sciencedirect.com/science/article/pii/S0167268123000793,30 March 2023,2023,Research Article
61,61,Gender wage and longevity gaps and the design of retirement systems,https://www.sciencedirect.com/science/article/pii/S0167268123000744,29 March 2023,2023,Research Article
62,62,No going back: COVID-19 disease threat perception and male migrants' willingness to return to work in India,https://www.sciencedirect.com/science/article/pii/S0167268123000902,27 March 2023,2023,Research Article
63,63,All geared towards success? Cultural origins of gender gaps in student achievement,https://www.sciencedirect.com/science/article/pii/S0167268123000732,23 March 2023,2023,Research Article
64,64,"Policy initiatives, self-sorting, and labor market effects of tertiary education for adult workers",https://www.sciencedirect.com/science/article/pii/S0167268123000690,23 March 2023,2023,Research Article
65,65,Semivariance below the maximum: Assessing the performance of economic and financial prospects,https://www.sciencedirect.com/science/article/pii/S0167268123000677,17 March 2023,2023,Research Article
66,66,Disclosure Policies in All-Pay Auctions with Bid Caps,https://www.sciencedirect.com/science/article/pii/S0167268122003547,15 March 2023,2023,Research Article
67,67,Main street business initiatives and crime in small towns,https://www.sciencedirect.com/science/article/pii/S0167268123000501,13 March 2023,2023,Research Article
68,68,Reputational effects on third-party agents: A study of the market for fine and rare wines,https://www.sciencedirect.com/science/article/pii/S016726812300046X,13 March 2023,2023,Research Article
69,69,Does additional demand for charitable aid increase giving? Evidence from Hurricane Sandy,https://www.sciencedirect.com/science/article/pii/S0167268123000185,12 March 2023,2023,Research Article
70,70,Household indebtedness and the macroeconomic effects of tax changes,https://www.sciencedirect.com/science/article/pii/S0167268123000641,11 March 2023,2023,Research Article
71,71,A note on salience of own preferences and the consensus effect,https://www.sciencedirect.com/science/article/pii/S0167268123000495,10 March 2023,2023,Research Article
72,72,Risking the future? Measuring risk attitudes towards delayed consequences,https://www.sciencedirect.com/science/article/pii/S0167268123000483,5 March 2023,2023,Research Article
73,73,On the Interpretation of Giving in Dictator Games When the Recipient is a Charity,https://www.sciencedirect.com/science/article/pii/S0167268123000252,1 March 2023,2023,Research Article
74,74,Financial transfers from parents to adult children,https://www.sciencedirect.com/science/article/pii/S0167268123000380,1 March 2023,2023,Research Article
75,75,Cooperation in indefinite games: Evidence from red queen games,https://www.sciencedirect.com/science/article/pii/S0167268123000355,28 February 2023,2023,Research Article
76,76,The 30 Years' War and Violent Crime in the Late 19th Century,https://www.sciencedirect.com/science/article/pii/S0167268123000446,26 February 2023,2023,Research Article
77,77,Reputation and information aggregation,https://www.sciencedirect.com/science/article/pii/S0167268123000343,26 February 2023,2023,Research Article
78,78,Anti-sweatshop activism and the safety-employment tradeoff: Evidence from Bangladesh's Rana Plaza disaster,https://www.sciencedirect.com/science/article/pii/S0167268123000410,26 February 2023,2023,Research Article
79,79,Cash payments and the penny policy debate,https://www.sciencedirect.com/science/article/pii/S0167268123000240,24 February 2023,2023,Research Article
80,80,Where have all the children gone? An empirical study of child abandonment and abduction in China,https://www.sciencedirect.com/science/article/pii/S0167268123000392,24 February 2023,2023,Research Article
81,81,Unawareness and risk taking: The role of context,https://www.sciencedirect.com/science/article/pii/S0167268123000276,18 February 2023,2023,Research Article
82,82,Temporary work contracts and female labor market outcomes,https://www.sciencedirect.com/science/article/pii/S0167268123000379,17 February 2023,2023,Research Article
83,83,The Role of Institutions on the Nexus between Inequality and Public Education,https://www.sciencedirect.com/science/article/pii/S0167268122004541,10 February 2023,2023,Research Article
84,84,The persuasive power of the fourth estate: Estimating the effect of newspaper endorsements: 1960–1980,https://www.sciencedirect.com/science/article/pii/S0167268123000239,8 February 2023,2023,Research Article
85,85,Honesty nudges: Effect varies with content but not with timing,https://www.sciencedirect.com/science/article/pii/S0167268123000112,7 February 2023,2023,Research Article
86,86,Clan culture and patterns of industrial specialization in China,https://www.sciencedirect.com/science/article/pii/S0167268123000264,7 February 2023,2023,Research Article
87,87,Peer learning in teams and work performance: Evidence from a randomized field experiment,https://www.sciencedirect.com/science/article/pii/S016726812300015X,6 February 2023,2023,Research Article
88,88,Precaution with multiple instruments: The importance of substitution effects,https://www.sciencedirect.com/science/article/pii/S0167268123000069,3 February 2023,2023,Research Article
89,89,Effects of perceived productivity on study effort: Evidence from a field experiment,https://www.sciencedirect.com/science/article/pii/S0167268123000227,2 February 2023,2023,Research Article
90,90,When do tax amnesties work?,https://www.sciencedirect.com/science/article/pii/S016726812200467X,1 February 2023,2023,Research Article
91,91,"The incubated revolution: Education, cohort effects, and the linguistic wage gap in Quebec during the 20th century",https://www.sciencedirect.com/science/article/pii/S0167268122004668,31 January 2023,2023,Research Article
92,92,Loss-averse tax manipulation and tax-preferred savings,https://www.sciencedirect.com/science/article/pii/S0167268123000148,30 January 2023,2023,Research Article
93,93,Do Audits Improve Future Tax Compliance in the Absence of Penalties? Evidence from Random Audits in Norway,https://www.sciencedirect.com/science/article/pii/S016726812300001X,30 January 2023,2023,Research Article
94,94,Effects of information quality on signaling through sovereign debt issuance,https://www.sciencedirect.com/science/article/pii/S0167268122004255,30 January 2023,2023,Research Article
95,95,"Gentrification, gun violence, and drug markets",https://www.sciencedirect.com/science/article/pii/S0167268123000173,27 January 2023,2023,Research Article
96,96,Demand for information by gender: An experimental study,https://www.sciencedirect.com/science/article/pii/S0167268122004553,25 January 2023,2023,Research Article
97,97,Noisy Identity and Cooperation,https://www.sciencedirect.com/science/article/pii/S0167268123000057,25 January 2023,2023,Research Article
98,98,Expected subjective value theory (ESVT): A representation of decision under risk and certainty,https://www.sciencedirect.com/science/article/pii/S0167268122004565,24 January 2023,2023,Research Article
99,99,How to reward honesty?,https://www.sciencedirect.com/science/article/pii/S0167268123000094,24 January 2023,2023,Research Article
100,100,Revealed Bayesian expected utility with limited data,https://www.sciencedirect.com/science/article/pii/S0167268123000021,23 January 2023,2023,Research Article
101,101,Rational Altruism,https://www.sciencedirect.com/science/article/pii/S0167268123000033,20 January 2023,2023,Research Article
102,102,Are short-term cultural shocks persistent? Taliban rule and long-run human capital accumulation,https://www.sciencedirect.com/science/article/pii/S0167268123000045,20 January 2023,2023,Research Article
103,103,Time pressure and regret in sequential search,https://www.sciencedirect.com/science/article/pii/S0167268122004681,13 January 2023,2023,Research Article
104,104,Who promotes gender-sensitive policies?,https://www.sciencedirect.com/science/article/pii/S0167268122004425,11 January 2023,2023,Research Article
105,105,Persistence of incumbents and female access to political positions,https://www.sciencedirect.com/science/article/pii/S0167268122004644,6 January 2023,2023,Research Article
106,106,Hidden inefficiency: Strategic inflation of project schedules,https://www.sciencedirect.com/science/article/pii/S0167268122004632,2 January 2023,2023,Research Article
107,107,Arbitrage bots in experimental asset markets,https://www.sciencedirect.com/science/article/pii/S0167268122004474,28 December 2022,2022,Research Article
108,108,Economic Calculation in Light of Advances in Big Data and Artificial Intelligence,https://www.sciencedirect.com/science/article/pii/S0167268122004528,26 December 2022,2022,Research Article
109,109,"Borrowing to keep up (with the Joneses): Inequality, debt, and conspicuous consumption",https://www.sciencedirect.com/science/article/pii/S0167268122004462,26 December 2022,2022,Research Article
110,110,Intellectual property reform in the laboratory,https://www.sciencedirect.com/science/article/pii/S0167268122004486,23 December 2022,2022,Research Article
111,111,"Big Data, Quantum Computing, and the Economic Calculation Debate: Will Roasted Cyberpigeons Fly into the Mouths of Comrades?",https://www.sciencedirect.com/science/article/pii/S0167268122003699,20 December 2022,2022,Research Article
112,112,An examination of peer effects using high school competition realignments,https://www.sciencedirect.com/science/article/pii/S0167268122004498,19 December 2022,2022,Research Article
113,113,Coordination and free-riding problems in the provision of multiple public goods,https://www.sciencedirect.com/science/article/pii/S0167268122004279,19 December 2022,2022,Research Article
114,114,"Trust, social protection, and compliance: Moral hazard in Latin America during the COVID-19 pandemic",https://www.sciencedirect.com/science/article/pii/S016726812200453X,19 December 2022,2022,Research Article
115,115,"Fanning the flames: Rainfall shocks, inter‐ethnic income inequality, and conflict intensification in Mandate Palestine",https://www.sciencedirect.com/science/article/pii/S0167268122004413,18 December 2022,2022,Research Article
116,116,Hidden drivers of violence diffusion: Evidence from illegal oil siphoning in Mexico,https://www.sciencedirect.com/science/article/pii/S0167268122004449,16 December 2022,2022,Research Article
117,117,How to counteract biased self-assessments? An experimental investigation of reactions to social information,https://www.sciencedirect.com/science/article/pii/S0167268122004450,16 December 2022,2022,Research Article
118,118,Risk preferences and training investments,https://www.sciencedirect.com/science/article/pii/S0167268122004346,15 December 2022,2022,Research Article
119,119,Temptation in consumption and optimal taxation,https://www.sciencedirect.com/science/article/pii/S0167268122003894,15 December 2022,2022,Research Article
120,120,How morality and efficiency shape public support for minimum wages,https://www.sciencedirect.com/science/article/pii/S0167268122004267,13 December 2022,2022,Research Article
121,121,Anti-social behaviour and economic decision-making: Panel experimental evidence in the wake of COVID-19,https://www.sciencedirect.com/science/article/pii/S0167268122004504,13 December 2022,2022,Research Article
122,122,The causes and consequences of medical crowdfunding,https://www.sciencedirect.com/science/article/pii/S0167268122004218,13 December 2022,2022,Research Article
123,123,Do pension benefits accelerate cognitive decline in late adulthood? Evidence from rural China,https://www.sciencedirect.com/science/article/pii/S0167268122004358,12 December 2022,2022,Research Article
124,124,The (alleged) environmental and social benefits of dynamic pricing,https://www.sciencedirect.com/science/article/pii/S0167268122004140,12 December 2022,2022,Research Article
125,125,Reputation and market structure in experimental platforms,https://www.sciencedirect.com/science/article/pii/S016726812200436X,9 December 2022,2022,Research Article
126,126,Intermittent incentives to encourage exercising in the long run,https://www.sciencedirect.com/science/article/pii/S016726812200419X,9 December 2022,2022,Research Article
127,127,Losing insurance and psychiatric hospitalizations,https://www.sciencedirect.com/science/article/pii/S016726812200405X,9 December 2022,2022,Research Article
128,128,The humanizing effect of market interaction,https://www.sciencedirect.com/science/article/pii/S0167268122004383,8 December 2022,2022,Research Article
129,129,Input-output planning and information,https://www.sciencedirect.com/science/article/pii/S0167268122004000,1 December 2022,2022,Research Article
130,130,The importance of social skills in recovery from graduating in a recession,https://www.sciencedirect.com/science/article/pii/S0167268122004188,1 December 2022,2022,Research Article
131,131,Do Deadlines Affect Project Completion? Experimental Evidence from Israeli Vocational Colleges,https://www.sciencedirect.com/science/article/pii/S0167268122003924,29 November 2022,2022,Research Article
132,132,Labor cost and corporate tax avoidance,https://www.sciencedirect.com/science/article/pii/S0167268122004176,28 November 2022,2022,Research Article
133,133,From equality to polarization: Changes in urban China’s gender earnings gap from 1988 to 2016,https://www.sciencedirect.com/science/article/pii/S0167268122004139,26 November 2022,2022,Research Article
134,134,Does public policy affect attitudes? Evidence from age-based health insurance coverage policies in the United States,https://www.sciencedirect.com/science/article/pii/S0167268122004103,26 November 2022,2022,Research Article
135,135,Stability in matching with externalities: Pairs competition and oligopolistic joint ventures,https://www.sciencedirect.com/science/article/pii/S016726812200422X,25 November 2022,2022,Research Article
136,136,"Informal care, older people, and COVID-19: Evidence from the UK",https://www.sciencedirect.com/science/article/pii/S0167268122004231,24 November 2022,2022,Research Article
137,137,Local rationality,https://www.sciencedirect.com/science/article/pii/S0167268122004097,24 November 2022,2022,Research Article
138,138,Household debt in the times of populism,https://www.sciencedirect.com/science/article/pii/S0167268122004164,24 November 2022,2022,Research Article
139,139,Bilateral information disclosure in adverse selection markets with nonexclusive competition,https://www.sciencedirect.com/science/article/pii/S0167268122003663,23 November 2022,2022,Research Article
140,140,Boosting taxes for boasting about houses? Status concerns in the housing market,https://www.sciencedirect.com/science/article/pii/S0167268122003948,18 November 2022,2022,Research Article
