,Unnamed: 0,Title,Url,Time,Year,Type
279,279,"Sex, lies, and measurement: Consistency tests for indirect response survey methods",https://www.sciencedirect.com/science/article/pii/S0304387820301577,11 November 2020,2020,Research Article
280,280,Misperceived quality: Fertilizer in Tanzania,https://www.sciencedirect.com/science/article/pii/S0304387820301541,24 October 2020,2020,Research Article
281,281,Designing unemployment insurance for developing countries,https://www.sciencedirect.com/science/article/pii/S0304387820301401,22 October 2020,2020,Research Article
282,282,An age profile perspective on two puzzles in global child health: The Indian Enigma & economic growth,https://www.sciencedirect.com/science/article/pii/S0304387820301449,16 October 2020,2020,Research Article
283,283,"Things fall apart? Missions, institutions, and interpersonal trust",https://www.sciencedirect.com/science/article/pii/S0304387820301437,15 October 2020,2020,Research Article
284,284,Targeting humanitarian aid using administrative data: Model design and validation,https://www.sciencedirect.com/science/article/pii/S0304387820301395,15 October 2020,2020,Research Article
285,285,Public health insurance and pharmaceutical innovation: Evidence from China,https://www.sciencedirect.com/science/article/pii/S030438782030153X,12 October 2020,2020,Research Article
286,286,Informal institutions and comparative advantage of South-based MNEs: Theory and evidence,https://www.sciencedirect.com/science/article/pii/S0304387820301413,29 September 2020,2020,Research Article
287,287,Is a refugee crisis a housing crisis? Only if housing supply is unresponsive,https://www.sciencedirect.com/science/article/pii/S0304387820301383,25 September 2020,2020,Research Article
288,288,How much can we remedy very low learning levels in rural parts of low-income countries? Impact and generalizability of a multi-pronged para-teacher intervention from a cluster-randomized trial in the Gambia,https://www.sciencedirect.com/science/article/pii/S0304387820301140,19 September 2020,2020,Research Article
289,289,Conflict and risky health behavior: Evidence from Mexico's drug war,https://www.sciencedirect.com/science/article/pii/S0304387820301371,10 September 2020,2020,Research Article
290,290,Response and adaptation of agriculture to climate change: Evidence from China,https://www.sciencedirect.com/science/article/pii/S0304387820301322,22 August 2020,2020,Research Article
296,296,Corrigendum to “The legacy effect of unexploded bombs on educational attainment in Laos” [J. Dev. Econ. 147 (2020) 102527],https://www.sciencedirect.com/science/article/pii/S0304387821000109,28 January 2021,2021,Research Article
298,298,Does trade cause capital to flow? Evidence from historical rainfall,https://www.sciencedirect.com/science/article/pii/S0304387820301127,29 August 2020,2020,Research Article
299,299,Labor market impacts and responses: The economic consequences of a marine environmental disaster,https://www.sciencedirect.com/science/article/pii/S0304387820301139,29 August 2020,2020,Research Article
300,300,The unintended impacts of agricultural fires: Human capital in China,https://www.sciencedirect.com/science/article/pii/S0304387820301358,29 August 2020,2020,Research Article
301,301,"Marriage squeeze, marriage age and the household savings rate in China",https://www.sciencedirect.com/science/article/pii/S0304387820301334,29 August 2020,2020,Research Article
302,302,China's rising IQ (Innovation Quotient) and growth: Firm-level evidence,https://www.sciencedirect.com/science/article/pii/S030438782030136X,28 August 2020,2020,Research Article
303,303,Election cycles in public credit: Credit provision and default rates in Pakistan,https://www.sciencedirect.com/science/article/pii/S0304387820301036,24 August 2020,2020,Research Article
304,304,The shrinking advantage of market potential,https://www.sciencedirect.com/science/article/pii/S0304387820301048,24 August 2020,2020,Research Article
305,305,"Cooking that kills: Cleaner energy access, indoor air pollution, and health",https://www.sciencedirect.com/science/article/pii/S0304387820301231,23 August 2020,2020,Research Article
306,306,Informing and inquiring: Experimental evidence on reducing traffic violations,https://www.sciencedirect.com/science/article/pii/S0304387820301097,22 August 2020,2020,Research Article
307,307,Tractor vs. animal: Rural reforms and technology adoption in China,https://www.sciencedirect.com/science/article/pii/S0304387820301115,19 August 2020,2020,Research Article
308,308,Gender-targeted job ads in the recruitment process: Facts from a Chinese job board,https://www.sciencedirect.com/science/article/pii/S0304387820301061,15 August 2020,2020,Research Article
309,309,Land reform and human capital development: Evidence from Peru,https://www.sciencedirect.com/science/article/pii/S0304387820301152,14 August 2020,2020,Research Article
310,310,Preparing for genocide: Quasi-experimental evidence from Rwanda,https://www.sciencedirect.com/science/article/pii/S0304387820301085,14 August 2020,2020,Research Article
311,311,: A theory of blackmail as a system of governance,https://www.sciencedirect.com/science/article/pii/S0304387820301103,13 August 2020,2020,Research Article
312,312,Distorted quality signals in school markets,https://www.sciencedirect.com/science/article/pii/S0304387820301073,11 August 2020,2020,Research Article
313,313,Land and labor allocation under communal tenure: Theory and evidence from China,https://www.sciencedirect.com/science/article/pii/S0304387820301012,6 August 2020,2020,Research Article
314,314,On the economic effects of Indigenous institutions: Evidence from Mexico,https://www.sciencedirect.com/science/article/pii/S030438782030105X,6 August 2020,2020,Research Article
315,315,The legacy effect of unexploded bombs on educational attainment in Laos,https://www.sciencedirect.com/science/article/pii/S0304387820301024,5 August 2020,2020,Research Article
316,316,Mandarins make markets: Leadership rotations and inter-provincial trade in China,https://www.sciencedirect.com/science/article/pii/S0304387820300997,2 August 2020,2020,Research Article
317,317,Land division: A lab-in-the-field bargaining experiment,https://www.sciencedirect.com/science/article/pii/S0304387820301000,16 July 2020,2020,Research Article
318,318,The effects of rural electrification in India: An instrumental variable approach at the household level,https://www.sciencedirect.com/science/article/pii/S030438782030095X,7 July 2020,2020,Research Article
319,319,How information about foreign aid affects public spending decisions: Evidence from a field experiment in Malawi,https://www.sciencedirect.com/science/article/pii/S0304387820300973,3 July 2020,2020,Research Article
320,320,Data and policy decisions: Experimental evidence from Pakistan,https://www.sciencedirect.com/science/article/pii/S0304387820300985,2 July 2020,2020,Research Article
321,321,Competition and the racial wage gap: Evidence from Brazil,https://www.sciencedirect.com/science/article/pii/S0304387820300948,30 June 2020,2020,Research Article
322,322,The value of discretion: Price-caps and public service delivery,https://www.sciencedirect.com/science/article/pii/S0304387820300961,26 June 2020,2020,Research Article
323,323,The effects of elite public colleges on primary and secondary schooling markets in India,https://www.sciencedirect.com/science/article/pii/S0304387820300870,23 June 2020,2020,Research Article
324,324,"Grain exports and the causes of China's Great Famine, 1959–1961: County-level evidence",https://www.sciencedirect.com/science/article/pii/S0304387820300882,12 June 2020,2020,Research Article
325,325,"Crop choice, trade costs, and agricultural productivity",https://www.sciencedirect.com/science/article/pii/S0304387820300924,11 June 2020,2020,Research Article
326,326,Time horizon of government and public goods investment: Evidence from Japan,https://www.sciencedirect.com/science/article/pii/S0304387820300936,11 June 2020,2020,Research Article
327,327,National or sub-national parties: Does party geographic scope matter?,https://www.sciencedirect.com/science/article/pii/S0304387820300912,3 June 2020,2020,Research Article
328,328,The impact of ethnic segregation on schooling outcomes in Mandate Palestine,https://www.sciencedirect.com/science/article/pii/S0304387820300894,3 June 2020,2020,Research Article
329,329,Stigma or cushion? IMF programs and sovereign creditworthiness,https://www.sciencedirect.com/science/article/pii/S0304387820300821,19 May 2020,2020,Research Article
330,330,Controlling tuberculosis? Evidence from the first community-wide health experiment,https://www.sciencedirect.com/science/article/pii/S0304387820300857,16 May 2020,2020,Research Article
331,331,"Frontiers, warfare and economic geography: The case of Spain",https://www.sciencedirect.com/science/article/pii/S0304387820300869,14 May 2020,2020,Research Article
332,332,Does informality facilitate inflation stability?,https://www.sciencedirect.com/science/article/pii/S0304387820300808,11 May 2020,2020,Research Article
333,333,Fiscal capacity in “post”-conflict states: Evidence from trade on Congo river,https://www.sciencedirect.com/science/article/pii/S030438782030081X,7 May 2020,2020,Research Article
334,334,"Who wins, who loses? Understanding the spatially differentiated effects of the belt and road initiative",https://www.sciencedirect.com/science/article/pii/S0304387820300717,6 May 2020,2020,Research Article
335,335,Credit lines in microcredit: Short-term evidence from a randomized controlled trial in India,https://www.sciencedirect.com/science/article/pii/S0304387820300729,30 April 2020,2020,Research Article
336,336,A Framework to Assess Debt Sustainability under the Belt and Road Initiative,https://www.sciencedirect.com/science/article/pii/S0304387820300705,29 April 2020,2020,Research Article
337,337,Markups and misallocation with evidence from exchange rate shocks,https://www.sciencedirect.com/science/article/pii/S0304387820300699,28 April 2020,2020,Research Article
338,338,Blessing or burden? Impacts of refugees on businesses and the informal economy,https://www.sciencedirect.com/science/article/pii/S0304387820300651,25 April 2020,2020,Research Article
339,339,The short term impact of a productive asset transfer in families with child labor: Experimental evidence from the Philippines,https://www.sciencedirect.com/science/article/pii/S0304387820300614,25 April 2020,2020,Research Article
340,340,"Tax competition between developed, emerging, and developing countries – Same same but different?",https://www.sciencedirect.com/science/article/pii/S0304387820300663,24 April 2020,2020,Research Article
341,341,Demand for insurance and within-kin-group marriages: Evidence from a West-African country,https://www.sciencedirect.com/science/article/pii/S030438782030064X,21 April 2020,2020,Research Article
342,342,Measuring ethnic stratification and its effect on trust in Africa,https://www.sciencedirect.com/science/article/pii/S030438782030050X,21 April 2020,2020,Research Article
343,343,The cross-spousal effect of education on health,https://www.sciencedirect.com/science/article/pii/S0304387820300687,20 April 2020,2020,Research Article
344,344,Effects of temporary corporate income tax cuts: Evidence from Vietnam,https://www.sciencedirect.com/science/article/pii/S0304387820300511,20 April 2020,2020,Research Article
345,345,Who marries whom in a surging housing market?,https://www.sciencedirect.com/science/article/pii/S0304387820300675,20 April 2020,2020,Research Article
346,346,The effects of fuel standards on air pollution: Evidence from China,https://www.sciencedirect.com/science/article/pii/S0304387820300638,17 April 2020,2020,Research Article
347,347,Costs and benefits of rural-urban migration: Evidence from India,https://www.sciencedirect.com/science/article/pii/S0304387820300481,14 April 2020,2020,Research Article
348,348,"Geographic connectivity and cross-border investment: The Belts, Roads and Skies",https://www.sciencedirect.com/science/article/pii/S0304387820300444,11 April 2020,2020,Research Article
349,349,"Returns to work, child labor and schooling: The income vs. price effects",https://www.sciencedirect.com/science/article/pii/S0304387820300419,9 April 2020,2020,Research Article
350,350,"Institutions, implementation, and program effectiveness: Evidence from a randomized evaluation of computer-assisted learning in rural China",https://www.sciencedirect.com/science/article/pii/S0304387820300626,9 April 2020,2020,Research Article
351,351,"Expressways, GDP, and the environment: The case of China",https://www.sciencedirect.com/science/article/pii/S0304387820300602,8 April 2020,2020,Research Article
352,352,Earnings inequality and China's preferential lending policy,https://www.sciencedirect.com/science/article/pii/S0304387820300523,6 April 2020,2020,Research Article
353,353,Tax evasion and financial development under asymmetric information in credit markets,https://www.sciencedirect.com/science/article/pii/S0304387820300389,6 April 2020,2020,Research Article
354,354,Exposure of belt and road economies to China trade shocks,https://www.sciencedirect.com/science/article/pii/S0304387820300493,29 March 2020,2020,Research Article
355,355,Are spousal labor supplies substitutes? evidence from the workweek reduction policy in China,https://www.sciencedirect.com/science/article/pii/S030438782030047X,28 March 2020,2020,Research Article
356,356,Export price shocks and rural labor markets: The role of labor market distortions,https://www.sciencedirect.com/science/article/pii/S0304387820300390,25 March 2020,2020,Research Article
357,357,"Land use restrictions, misallocation in agriculture, and aggregate productivity in Vietnam",https://www.sciencedirect.com/science/article/pii/S0304387820300407,23 March 2020,2020,Research Article
358,358,Mining and human capital accumulation: Evidence from the Colombian gold rush,https://www.sciencedirect.com/science/article/pii/S0304387820300468,20 March 2020,2020,Research Article
359,359,"Straw burning, PM",https://www.sciencedirect.com/science/article/pii/S0304387820300432,20 March 2020,2020,Research Article
360,360,Trade effects of the New Silk Road: A gravity analysis,https://www.sciencedirect.com/science/article/pii/S0304387820300420,20 March 2020,2020,Research Article
361,361,"Two and a half million Syrian refugees, tasks and capital intensity",https://www.sciencedirect.com/science/article/pii/S0304387820300456,20 March 2020,2020,Research Article
362,362,The effect of air pollution on body weight and obesity: Evidence from China,https://www.sciencedirect.com/science/article/pii/S0304387820300365,19 March 2020,2020,Research Article
363,363,Banker my neighbour: Matching and financial intermediation in savings groups,https://www.sciencedirect.com/science/article/pii/S0304387820300353,19 March 2020,2020,Research Article
364,364,Production efficiency and self-enforcement in value-added tax: Evidence from state-level reform in India,https://www.sciencedirect.com/science/article/pii/S0304387820300377,17 March 2020,2020,Research Article
365,365,Changing the climate for banking: The economic effects of credit in a climate-vulnerable area,https://www.sciencedirect.com/science/article/pii/S0304387820300341,10 March 2020,2020,Research Article
366,366,"Trade policy changes, tax evasion and Benford's law",https://www.sciencedirect.com/science/article/pii/S0304387820300316,6 March 2020,2020,Research Article
367,367,Panel data and experimental design,https://www.sciencedirect.com/science/article/pii/S030438782030033X,4 March 2020,2020,Research Article
368,368,"Holding on? Ethnic divisions, political institutions and the duration of economic declines",https://www.sciencedirect.com/science/article/pii/S0304387820300328,26 February 2020,2020,Research Article
369,369,The long-run influence of institutions governing trade: Evidence from smuggling ports in colonial Mexico,https://www.sciencedirect.com/science/article/pii/S0304387820300286,20 February 2020,2020,Research Article
370,370,On the road: Access to transportation infrastructure and economic growth in China,https://www.sciencedirect.com/science/article/pii/S0304387820300171,15 February 2020,2020,Research Article
371,371,Extractive resource policy and civil conflict: Evidence from mining reform in the Philippines,https://www.sciencedirect.com/science/article/pii/S0304387820300183,14 February 2020,2020,Research Article
372,372,Using social connections and financial incentives to solve coordination failure: A quasi-field experiment in India's manufacturing sector,https://www.sciencedirect.com/science/article/pii/S0304387820300201,6 February 2020,2020,Research Article
373,373,Buy as you need: Nutrition and food storage imperfections,https://www.sciencedirect.com/science/article/pii/S0304387820300195,5 February 2020,2020,Research Article
374,374,The Belt and Road Initiative: Reshaping economic geography in Central Asia?,https://www.sciencedirect.com/science/article/pii/S030438782030016X,22 January 2020,2020,Research Article
375,375,Can referral improve targeting? Evidence from an agricultural training experiment,https://www.sciencedirect.com/science/article/pii/S0304387818314913,21 January 2020,2020,Research Article
376,376,Decentralized delivery of financial education: Experimental evidence from Rwanda,https://www.sciencedirect.com/science/article/pii/S030438781831277X,8 January 2020,2020,Research Article
377,377,Trade and agricultural technology adoption: Evidence from Africa,https://www.sciencedirect.com/science/article/pii/S0304387819301956,7 January 2020,2020,Research Article
378,378,Services development and comparative advantage in manufacturing,https://www.sciencedirect.com/science/article/pii/S0304387819300288,7 January 2020,2020,Research Article
379,379,When financial incentives backfire: Evidence from a community health worker experiment in Uganda,https://www.sciencedirect.com/science/article/pii/S0304387819307801,30 December 2019,2019,Research Article
380,380,Experimental identification of asymmetric information: Evidence on crop insurance in the Philippines,https://www.sciencedirect.com/science/article/pii/S0304387818313452,28 December 2019,2019,Research Article
381,381,Hard to get: The scarcity of women and the competition for high-income men in urban China,https://www.sciencedirect.com/science/article/pii/S0304387819302822,28 December 2019,2019,Research Article
382,382,"Land quality, land rights, and indigenous poverty",https://www.sciencedirect.com/science/article/pii/S0304387818315402,27 December 2019,2019,Research Article
383,383,"The long reach of cotton in the US South: Tenant farming, mechanization, and low-skill manufacturing",https://www.sciencedirect.com/science/article/pii/S0304387819305152,24 December 2019,2019,Research Article
384,384,Land titles and violent conflict in rural Mexico,https://www.sciencedirect.com/science/article/pii/S0304387818314974,23 December 2019,2019,Research Article
385,385,Fertility and rural electrification in Bangladesh,https://www.sciencedirect.com/science/article/pii/S0304387818310435,20 December 2019,2019,Research Article
386,386,Following the poppy trail: Origins and consequences of Mexican drug cartels,https://www.sciencedirect.com/science/article/pii/S0304387819303098,20 December 2019,2019,Research Article
387,387,Economic and psychological effects of health insurance and cash transfers: Evidence from a randomized experiment in Kenya,https://www.sciencedirect.com/science/article/pii/S0304387818310289,18 December 2019,2019,Research Article
388,388,Implementation and effects of India's national school-based iron supplementation program,https://www.sciencedirect.com/science/article/pii/S0304387818314317,18 December 2019,2019,Research Article
389,389,"Rural transformation, inequality, and the origins of microfinance",https://www.sciencedirect.com/science/article/pii/S0304387819302998,16 December 2019,2019,Research Article
390,390,Aiming high and falling low: The SADA-Northern Ghana Millennium Village Project,https://www.sciencedirect.com/science/article/pii/S0304387819300173,11 December 2019,2019,Research Article
391,391,Cash-plus: Poverty impacts of alternative transfer-based approaches,https://www.sciencedirect.com/science/article/pii/S0304387818305522,27 November 2019,2019,Research Article
392,392,Healthcare at the beginning of life and child survival: Evidence from a cash transfer experiment in Nigeria,https://www.sciencedirect.com/science/article/pii/S0304387819307011,22 November 2019,2019,Research Article
393,393,How public information affects asymmetrically informed lenders: Evidence from a credit registry reform,https://www.sciencedirect.com/science/article/pii/S0304387818310630,20 November 2019,2019,Research Article
394,394,Early-life deprivation and health outcomes in adulthood: Evidence from childhood hunger episodes of middle-aged and elderly Chinese,https://www.sciencedirect.com/science/article/pii/S0304387819303001,16 November 2019,2019,Research Article
395,395,The price of gold: Dowry and death in India,https://www.sciencedirect.com/science/article/pii/S0304387818306114,14 November 2019,2019,Research Article
396,396,The gold digger and the machine. Evidence on the distributive effect of the artisanal and industrial gold rushes in Burkina Faso,https://www.sciencedirect.com/science/article/pii/S0304387819300586,14 November 2019,2019,Research Article
397,397,Reprint of: The long-term impact of international migration on economic decision-making: Evidence from a migration lottery and lab-in-the-field experiments,https://www.sciencedirect.com/science/article/pii/S030438781931329X,14 November 2019,2019,Research Article
398,398,Common transport infrastructure: A quantitative model and estimates from the Belt and Road Initiative,https://www.sciencedirect.com/science/article/pii/S0304387819307345,13 November 2019,2019,Research Article
399,399,Short- and long-run impacts of rural electrification: Evidence from the historical rollout of the U.S. power grid,https://www.sciencedirect.com/science/article/pii/S0304387819304547,9 November 2019,2019,Research Article
400,400,"Violence, psychological stress and educational performance during the “war on drugs” in Mexico",https://www.sciencedirect.com/science/article/pii/S0304387818303572,26 October 2019,2019,Research Article
401,401,Failure of frequent assessment: An evaluation of India’s continuous and comprehensive evaluation program,https://www.sciencedirect.com/science/article/pii/S0304387818315748,19 October 2019,2019,Research Article
402,402,"Mass media, information and demand for environmental quality: Evidence from the “Under the Dome”",https://www.sciencedirect.com/science/article/pii/S0304387818315827,12 October 2019,2019,Research Article
403,403,"Can large, untargeted conditional cash transfers increase urban high school graduation rates? Evidence from Mexico City's Prepa Sí",https://www.sciencedirect.com/science/article/pii/S0304387818312896,9 October 2019,2019,Research Article
404,404,How effective is energy-efficient housing? Evidence from a field trial in Mexico,https://www.sciencedirect.com/science/article/pii/S0304387818312756,25 September 2019,2019,Research Article
405,405,"Technology adoption, capital deepening, and international productivity differences",https://www.sciencedirect.com/science/article/pii/S0304387818314184,24 September 2019,2019,Research Article
406,406,The effect of marital endowments on domestic violence in India,https://www.sciencedirect.com/science/article/pii/S0304387818316225,23 September 2019,2019,Research Article
407,407,The early bird catches the worm? School entry cutoff and the timing of births,https://www.sciencedirect.com/science/article/pii/S0304387818312082,18 September 2019,2019,Research Article
408,408,The geography of linguistic diversity and the provision of public goods,https://www.sciencedirect.com/science/article/pii/S0304387818301172,12 September 2019,2019,Research Article
409,409,Gender gaps in technology diffusion,https://www.sciencedirect.com/science/article/pii/S030438781930197X,6 September 2019,2019,Research Article
410,410,Close to the edge: High productivity at plot peripheries and the inverse size-productivity relationship,https://www.sciencedirect.com/science/article/pii/S0304387818308642,15 August 2019,2019,Research Article
411,411,"Heat, infant mortality, and adaptation: Evidence from India",https://www.sciencedirect.com/science/article/pii/S0304387818307041,13 August 2019,2019,Research Article
412,412,Searching for a better life: Predicting international migration with online search keywords,https://www.sciencedirect.com/science/article/pii/S0304387819304900,9 May 2019,2019,Research Article
414,414,Geography of skills and global inequality,https://www.sciencedirect.com/science/article/pii/S0304387819302780,1 March 2019,2019,Research Article
415,415,Migration and co-residence choices: Evidence from Mexico,https://www.sciencedirect.com/science/article/pii/S0304387819301270,4 February 2019,2019,Research Article
416,416,Unequal migration and urbanisation gains in China,https://www.sciencedirect.com/science/article/pii/S0304387819301142,29 January 2019,2019,Research Article
417,417,Taking the skill bias out of global migration,https://www.sciencedirect.com/science/article/pii/S0304387818317334,27 December 2018,2018,Research Article
419,419,Improving learning outcomes through information provision: Experimental evidence from Indian villages,https://www.sciencedirect.com/science/article/pii/S0304387818300269,13 August 2018,2018,Research Article
420,420,Women's inheritance rights reform and the preference for sons in India,https://www.sciencedirect.com/science/article/pii/S0304387818300294,10 August 2018,2018,Research Article
