,Unnamed: 0,Title,Url,Time,Year,Type
0,0,Measures of vertical inequality in assessments,https://www.sciencedirect.com/science/article/pii/S1051137723000372,Available online 8 June 2023,2023,Research Article
1,1,Can Landlords Siphon Housing Allowances? New Theory and Evidence on Housing Allowance Algorithms from a Natural Experiment 15900,https://www.sciencedirect.com/science/article/pii/S1051137723000359,Available online 5 June 2023,2023,Research Article
2,2,When Do Property Taxes Matter? Tax Salience and Heterogeneous Policy Effects,https://www.sciencedirect.com/science/article/pii/S1051137723000384,Available online 5 June 2023,2023,Research Article
3,3,"Credit supply, homeownership and mortgage debt",https://www.sciencedirect.com/science/article/pii/S1051137723000347,Available online 2 June 2023,2023,Research Article
4,4,Does homeownership hinder labor market activity? Evidence from housing privatization and restitution,https://www.sciencedirect.com/science/article/pii/S1051137723000360,1 June 2023,2023,Research Article
5,5,Unequal treatment in the rental housing markets of four Chinese megacities,https://www.sciencedirect.com/science/article/pii/S1051137723000323,11 May 2023,2023,Research Article
6,6,Pay for elite private schools or pay for higher housing prices? Evidence from an exogenous policy shock,https://www.sciencedirect.com/science/article/pii/S1051137723000219,30 March 2023,2023,Research Article
7,7,Housing Affordability and School Quality in the United States,https://www.sciencedirect.com/science/article/pii/S1051137723000207,22 March 2023,2023,Research Article
8,8,Redevelopment values in multi-family properties: Evidence from ,https://www.sciencedirect.com/science/article/pii/S1051137723000190,6 March 2023,2023,Research Article
9,9,The sharing economy and housing markets in selected European cities,https://www.sciencedirect.com/science/article/pii/S1051137723000013,26 January 2023,2023,Research Article
10,10,Aggregate-level inferences from individual-level data: The case of permanent supportive housing and housing first,https://www.sciencedirect.com/science/article/pii/S1051137722000857,10 January 2023,2023,Research Article
11,11,Single borrowers versus coborrowers in the pandemic: Mortgage forbearance take-up and performance,https://www.sciencedirect.com/science/article/pii/S105113772200081X,28 December 2022,2022,Research Article
12,12,Stuck at home: Housing demand during the COVID-19 pandemic,https://www.sciencedirect.com/science/article/pii/S1051137722000808,26 December 2022,2022,Research Article
13,13,Web-scraping housing prices in real-time: The Covid-19 crisis in the UK,https://www.sciencedirect.com/science/article/pii/S105113772200078X,14 December 2022,2022,Research Article
14,14,Demons of density do higher-density environments put people at greater risk of contagious disease?,https://www.sciencedirect.com/science/article/pii/S1051137722000778,10 December 2022,2022,Research Article
15,15,The geography of US homeownership tax expenditures,https://www.sciencedirect.com/science/article/pii/S1051137722000602,30 November 2022,2022,Research Article
16,16,Housing discrimination in the low-income context: Evidence from a correspondence experiment,https://www.sciencedirect.com/science/article/pii/S1051137722000614,22 November 2022,2022,Research Article
20,20,COVID-19’s Impacts on Housing Markets: Introduction,https://www.sciencedirect.com/science/article/pii/S1051137722000833,13 December 2022,2022,Research Article
21,21,Practitioner's panel paper on land valuation guidance,https://www.sciencedirect.com/science/article/pii/S1051137722000523,9 November 2022,2022,Research Article
22,22,A matching method for land valuation,https://www.sciencedirect.com/science/article/pii/S105113772200050X,9 November 2022,2022,Research Article
23,23,"Bowling alone, buying alone: The decline of co-borrowers in the US mortgage market",https://www.sciencedirect.com/science/article/pii/S1051137722000481,9 November 2022,2022,Research Article
24,24,The impact of a home purchase restrictions (HPR) policy on the distressed property market in Beijing,https://www.sciencedirect.com/science/article/pii/S1051137722000493,6 November 2022,2022,Research Article
25,25,Special issue on land valuation: Introduction,https://www.sciencedirect.com/science/article/pii/S1051137722000535,31 October 2022,2022,Research Article
26,26,A statistical learning approach to land valuation: Optimizing the use of external information,https://www.sciencedirect.com/science/article/pii/S1051137722000456,31 October 2022,2022,Research Article
27,27,Estimating land values using residential sales data,https://www.sciencedirect.com/science/article/pii/S1051137722000419,29 October 2022,2022,Research Article
28,28,Discrimination against the atypical type of tenants in the Tokyo private rental housing market: Evidence from moving-in inspection and rent arrear records,https://www.sciencedirect.com/science/article/pii/S1051137722000511,27 October 2022,2022,Research Article
29,29,Price dispersion and time-on-market in the housing market,https://www.sciencedirect.com/science/article/pii/S105113772200047X,20 October 2022,2022,Research Article
30,30,Land value estimation using teardowns,https://www.sciencedirect.com/science/article/pii/S1051137722000468,13 October 2022,2022,Research Article
31,31,"Hedonic, residual, and matching methods for residential land valuation",https://www.sciencedirect.com/science/article/pii/S1051137722000420,23 September 2022,2022,Research Article
32,32,Assessing evidence for inattention to the costs of homeownership,https://www.sciencedirect.com/science/article/pii/S105113772200033X,6 September 2022,2022,Research Article
33,33,Adverse selection in the market for mortgage servicing rights,https://www.sciencedirect.com/science/article/pii/S1051137722000316,28 August 2022,2022,Research Article
34,34,Early effects of COVID-19 pandemic-related state policies on housing market activity in the United States,https://www.sciencedirect.com/science/article/pii/S1051137722000304,15 August 2022,2022,Research Article
35,35,Negative externalities of long-term vacant homes: Evidence from Japan,https://www.sciencedirect.com/science/article/pii/S1051137722000298,25 July 2022,2022,Research Article
36,36,Can Public Housing Trigger Industrialization?,https://www.sciencedirect.com/science/article/pii/S1051137722000274,23 June 2022,2022,Research Article
37,37,Building underwater: Effects of community-scale flood management on housing development,https://www.sciencedirect.com/science/article/pii/S1051137722000286,22 June 2022,2022,Research Article
38,38,The heterogeneous effects of interactions between parent's education and MSA level college share on children's school enrollment,https://www.sciencedirect.com/science/article/pii/S1051137722000171,10 May 2022,2022,Research Article
39,39,A spatiotemporal equilibrium model of migration and housing interlinkages,https://www.sciencedirect.com/science/article/pii/S1051137722000146,30 April 2022,2022,Research Article
40,40,What is the impact of macroprudential regulations on the Swedish housing market?,https://www.sciencedirect.com/science/article/pii/S1051137722000158,29 April 2022,2022,Research Article
41,41,Somebody that I want to know: The non-monotonic effect of personality information on ethnic and gender discrimination in the market for shared housing,https://www.sciencedirect.com/science/article/pii/S105113772200016X,27 April 2022,2022,Research Article
42,42,Macroeconomic shocks and ripple effects in the Greater Paris Metropolis,https://www.sciencedirect.com/science/article/pii/S1051137721000760,5 March 2022,2022,Research Article
43,43,Regulation versus taxation: Efficiency of zoning and tax instruments as anti-congestion policies,https://www.sciencedirect.com/science/article/pii/S1051137722000122,27 February 2022,2022,Research Article
44,44,"Household production, home improvement, and housing investment among older Americans",https://www.sciencedirect.com/science/article/pii/S1051137722000110,26 February 2022,2022,Research Article
45,45,Loss aversion in housing appraisal: Evidence from Italian homeowners,https://www.sciencedirect.com/science/article/pii/S105113772200002X,12 February 2022,2022,Research Article
46,46,"Is There Discrimination in Property Taxation? Evidence from Atlanta, Georgia, 2010-2016",https://www.sciencedirect.com/science/article/pii/S1051137722000018,12 February 2022,2022,Research Article
47,47,Destination homeownership and labor force participation: Evidence from rural-to-urban migrants in China,https://www.sciencedirect.com/science/article/pii/S1051137722000031,20 January 2022,2022,Research Article
48,48,How does ethnic discrimination on the housing market differ across neighborhoods and real estate agencies?,https://www.sciencedirect.com/science/article/pii/S1051137721000747,27 November 2021,2021,Research Article
50,50,Note to special issue: Land values,https://www.sciencedirect.com/science/article/pii/S1051137722000742,7 December 2022,2022,Research Article
52,52,"Nevertheless, they persist: Cross-country differences in homeownership behavior",https://www.sciencedirect.com/science/article/pii/S1051137721000590,29 October 2021,2021,Research Article
53,53,"Regional housing wealth, relative housing wealth and labor market behavior",https://www.sciencedirect.com/science/article/pii/S1051137721000656,20 October 2021,2021,Research Article
54,54,The impact of the minimum housing scale constraint on life-cycle risky asset and housing investment,https://www.sciencedirect.com/science/article/pii/S1051137721000644,9 October 2021,2021,Research Article
55,55,The effect of housing loan subsidies on affordability: Evidence from Croatia,https://www.sciencedirect.com/science/article/pii/S1051137721000632,2 October 2021,2021,Research Article
56,56,Foreign buyer taxes and house prices in Canada: A tale of two cities,https://www.sciencedirect.com/science/article/pii/S1051137721000620,24 September 2021,2021,Research Article
57,57,The long-run effects of minimum lot size zoning on housing redevelopment,https://www.sciencedirect.com/science/article/pii/S1051137721000619,20 September 2021,2021,Research Article
58,58,The local employment effect of house prices: Evidence from U.S. States,https://www.sciencedirect.com/science/article/pii/S1051137721000607,11 September 2021,2021,Research Article
62,62,The interaction of actual and fundamental house prices: A general model with an application to Sweden,https://www.sciencedirect.com/science/article/pii/S1051137721000425,23 August 2021,2021,Research Article
63,63,The Global Financial Crisis and transition out of homeownership in Korea,https://www.sciencedirect.com/science/article/pii/S1051137721000589,8 August 2021,2021,Research Article
64,64,"Neighbourhood, school zoning and the housing market: Evidence from New South Wales",https://www.sciencedirect.com/science/article/pii/S1051137721000401,4 August 2021,2021,Research Article
65,65,Local house-price vulnerability: Evidence from the U.S. and Canada,https://www.sciencedirect.com/science/article/pii/S1051137721000413,4 August 2021,2021,Research Article
66,66,Effects of regulating the brokerage commission in the rental market: Evidence from Buenos Aires,https://www.sciencedirect.com/science/article/pii/S1051137721000437,2 August 2021,2021,Research Article
67,67,The intergenerational impact of house prices on education: evidence from China,https://www.sciencedirect.com/science/article/pii/S1051137721000383,21 July 2021,2021,Research Article
68,68,Not in my neighborhood: the effects of single-family rentals on home values,https://www.sciencedirect.com/science/article/pii/S1051137721000395,14 July 2021,2021,Research Article
69,69,"Housing wealth, fertility intentions and fertility",https://www.sciencedirect.com/science/article/pii/S1051137721000371,25 June 2021,2021,Research Article
70,70,Migration and Housing special issue: Introduction from Editors Kyle Mangum and Raven Molloy,https://www.sciencedirect.com/science/article/pii/S1051137721000346,19 June 2021,2021,Research Article
71,71,Spillover effects of company news across real estate markets and causal impact analysis,https://www.sciencedirect.com/science/article/pii/S1051137721000358,17 June 2021,2021,Research Article
72,72,Quantifying Return Spillovers in Global Real Estate Markets,https://www.sciencedirect.com/science/article/pii/S1051137721000334,19 May 2021,2021,Research Article
73,73,Single-family rentals and neighborhood racial integration,https://www.sciencedirect.com/science/article/pii/S1051137721000322,15 May 2021,2021,Research Article
74,74,Childhood Housing Tenure and Young Adult Educational Outcomes: Evidence from Sibling Comparisons in Norway,https://www.sciencedirect.com/science/article/pii/S1051137721000243,12 May 2021,2021,Research Article
75,75,Residential mobility and persistent neighborhood deprivation,https://www.sciencedirect.com/science/article/pii/S1051137721000231,11 May 2021,2021,Research Article
76,76,"Price regulation, inflation, and nominal rigidity in housing rents",https://www.sciencedirect.com/science/article/pii/S1051137721000218,5 May 2021,2021,Research Article
77,77,Long-term care facilities and migration of elderly households in an aged society: Empirical analysis based on micro data,https://www.sciencedirect.com/science/article/pii/S105113772100022X,27 April 2021,2021,Research Article
78,78,Unexpected housing wealth appreciation and stock market participation,https://www.sciencedirect.com/science/article/pii/S1051137721000206,16 April 2021,2021,Research Article
79,79,The effect of the housing crisis on the finances of central cities,https://www.sciencedirect.com/science/article/pii/S105113772100019X,2 April 2021,2021,Research Article
80,80,The illusion of a hedonic price function: Nonparametric interpretable segmentation for hedonic inference,https://www.sciencedirect.com/science/article/pii/S1051137721000164,8 March 2021,2021,Research Article
81,81,Do long-distance moves discourage homeownership? Evidence from England,https://www.sciencedirect.com/science/article/pii/S1051137721000188,3 March 2021,2021,Research Article
82,82,Housing price appreciation and economic integration in a transition economy: Evidence from Kazakhstan,https://www.sciencedirect.com/science/article/pii/S1051137721000176,24 February 2021,2021,Research Article
83,83,Migration choices of the boomerang generation: Does returning home dampen labor market adjustment?,https://www.sciencedirect.com/science/article/pii/S1051137721000139,20 February 2021,2021,Research Article
84,84,Migration shocks and housing: Short-run impact of the Syrian refugee crisis in Jordan,https://www.sciencedirect.com/science/article/pii/S1051137721000140,19 February 2021,2021,Research Article
85,85,Housing rent rigidity under downward pressure: Unit-level longitudinal evidence from Tokyo,https://www.sciencedirect.com/science/article/pii/S1051137721000152,9 February 2021,2021,Research Article
86,86,Banking deregulation and homeownership,https://www.sciencedirect.com/science/article/pii/S1051137721000024,5 February 2021,2021,Research Article
87,87,Is the behavior of sellers with expected gains and losses relevant to cycles in house prices?,https://www.sciencedirect.com/science/article/pii/S1051137721000036,4 February 2021,2021,Research Article
88,88,Pitfalls in the cointegration analysis of housing prices with the macroeconomy: Evidence from OECD countries,https://www.sciencedirect.com/science/article/pii/S1051137721000012,14 January 2021,2021,Research Article
89,89,Land leverage and the housing market: Evidence from Germany,https://www.sciencedirect.com/science/article/pii/S1051137720300826,5 January 2021,2021,Research Article
90,90,Housing careers and the Great Recession,https://www.sciencedirect.com/science/article/pii/S1051137720300814,26 December 2020,2020,Research Article
91,91,Homophobia and the home search: Rental market discrimination against same-sex couples in rural and urban housing markets,https://www.sciencedirect.com/science/article/pii/S1051137720300802,19 December 2020,2020,Research Article
92,92,"Spatial distributions of job accessibility, housing rents, and poverty: The case of Nairobi",https://www.sciencedirect.com/science/article/pii/S1051137720300796,9 December 2020,2020,Research Article
93,93,The price of access to jobs: Bid-function envelopes for commuting costs,https://www.sciencedirect.com/science/article/pii/S1051137720300784,9 December 2020,2020,Research Article
94,94,"Job loss risk, expected mobility, and home ownership",https://www.sciencedirect.com/science/article/pii/S1051137720300693,19 November 2020,2020,Research Article
95,95,Measuring aggregate housing wealth: New insights from machine learning ,https://www.sciencedirect.com/science/article/pii/S105113772030070X,22 October 2020,2020,Research Article
96,96,"Voluntary, forced, and induced renter mobility: The influence of state policies",https://www.sciencedirect.com/science/article/pii/S1051137720300267,30 May 2020,2020,Research Article
101,101,When education policy and housing policy interact: Can they correct for the externalities?,https://www.sciencedirect.com/science/article/pii/S1051137720300681,15 October 2020,2020,Research Article
102,102,Religiosity and discrimination against same-sex couples: The case of Portugal's rental market,https://www.sciencedirect.com/science/article/pii/S1051137720300656,3 September 2020,2020,Research Article
103,103,"Elite school designation and housing prices-quasi-experimental evidence from Beijing, China",https://www.sciencedirect.com/science/article/pii/S1051137720300668,2 September 2020,2020,Research Article
104,104,"Homeownership, mobility, and unemployment: Evidence from housing privatization",https://www.sciencedirect.com/science/article/pii/S1051137720300644,8 August 2020,2020,Research Article
105,105,Stratified zoning in central cities,https://www.sciencedirect.com/science/article/pii/S1051137720300528,31 July 2020,2020,Research Article
106,106,House price index based on online listing information: The case of China,https://www.sciencedirect.com/science/article/pii/S1051137720300516,22 July 2020,2020,Research Article
107,107,Property tax limits and female labor supply: Evidence from the housing boom and bust,https://www.sciencedirect.com/science/article/pii/S1051137720300504,17 July 2020,2020,Research Article
108,108,Asylum seekers and house prices: Evidence from the United Kingdom,https://www.sciencedirect.com/science/article/pii/S1051137720300486,10 July 2020,2020,Research Article
109,109,Jump bids in real estate auctions,https://www.sciencedirect.com/science/article/pii/S1051137720300498,6 July 2020,2020,Research Article
110,110,The effect of combat exposure on veteran homelessness,https://www.sciencedirect.com/science/article/pii/S1051137720300474,6 July 2020,2020,Research Article
111,111,The role of imputed rents in intergenerational income mobility in three countries,https://www.sciencedirect.com/science/article/pii/S1051137720300462,3 July 2020,2020,Research Article
112,112,Developers’ perspectives on timing to build: Evidence from microdata of land acquisition and development,https://www.sciencedirect.com/science/article/pii/S1051137720300450,20 June 2020,2020,Research Article
113,113,Time is money: How landbanking constrains housing supply,https://www.sciencedirect.com/science/article/pii/S1051137720300449,18 June 2020,2020,Research Article
114,114,Does the room sharing business model disrupt housing markets? Empirical evidence of Airbnb in Taiwan,https://www.sciencedirect.com/science/article/pii/S1051137720300425,14 June 2020,2020,Research Article
115,115,Housing market shocks in italy: A GVAR approach,https://www.sciencedirect.com/science/article/pii/S1051137720300437,12 June 2020,2020,Research Article
116,116,How effective is macroprudential policy? Evidence from lending restriction measures in EU countries,https://www.sciencedirect.com/science/article/pii/S1051137720300309,28 May 2020,2020,Research Article
117,117,Is Housing the Business Cycle? A Multiresolution Analysis for OECD Countries,https://www.sciencedirect.com/science/article/pii/S1051137720300280,28 May 2020,2020,Research Article
118,118,On the price gap between single family houses and apartments,https://www.sciencedirect.com/science/article/pii/S1051137720300231,7 May 2020,2020,Research Article
119,119,Momentum and Reversion to Fundamentals: Are They Captured by Subjective Expectations of House Prices?,https://www.sciencedirect.com/science/article/pii/S1051137720300243,7 May 2020,2020,Research Article
120,120,Expectations and the housing boom and bust. An open economy view,https://www.sciencedirect.com/science/article/pii/S1051137720300279,4 May 2020,2020,Research Article
121,121,Sexual orientation and homeownership in Canada,https://www.sciencedirect.com/science/article/pii/S1051137720300255,30 April 2020,2020,Research Article
122,122,Housing demand and household saving rates in china: Evidence from a housing reform,https://www.sciencedirect.com/science/article/pii/S1051137720300292,25 April 2020,2020,Research Article
123,123,"Agglomeration, housing affordability, and new firm formation: The role of subway network",https://www.sciencedirect.com/science/article/pii/S1051137719301093,3 March 2020,2020,Research Article
124,124,The Impact of Federal Housing Policy on Housing Demand and Homeownership: Evidence from a Quasi-Experiment,https://www.sciencedirect.com/science/article/pii/S1051137719300075,31 January 2020,2020,Research Article
125,125,"Housing supply elasticity, gasoline prices, and residential property values",https://www.sciencedirect.com/science/article/pii/S1051137719301019,3 January 2020,2020,Research Article
126,126,There goes the neighborhood does tipping exist amongst income groups?,https://www.sciencedirect.com/science/article/pii/S1051137718300135,23 December 2019,2019,Research Article
127,127,The accuracy of self-reported dwelling valuation,https://www.sciencedirect.com/science/article/pii/S1051137717300463,22 November 2019,2019,Research Article
129,129,Homeownership and wealth accumulation for low-income households,https://www.sciencedirect.com/science/article/pii/S105113771730205X,13 March 2019,2019,Research Article
130,130,Home equity conversion mortgages: The secondary market investor experience,https://www.sciencedirect.com/science/article/pii/S1051137717302619,8 March 2019,2019,Research Article
131,131,Cohort insights into recovery of Millennial homeownership after the Great Recession,https://www.sciencedirect.com/science/article/pii/S1051137718300445,29 January 2019,2019,Research Article
133,133,"Debt, inequality and house prices: Explaining the dynamics of household borrowing prior to the great recession",https://www.sciencedirect.com/science/article/pii/S1051137717302693,4 October 2018,2018,Research Article
134,134,The role of parental financial assistance in the transition to homeownership by young adults,https://www.sciencedirect.com/science/article/pii/S1051137717302358,7 August 2018,2018,Research Article
135,135,Negative home equity reduces household mobility: Evidence from administrative data,https://www.sciencedirect.com/science/article/pii/S1051137717302528,5 July 2018,2018,Research Article
138,138,Special issue: Life cycle consumption,https://www.sciencedirect.com/science/article/pii/S1051137720300152,29 February 2020,2020,Research Article
139,139,The effects of conventional and unconventional monetary policy on house prices in the Scandinavian countries,https://www.sciencedirect.com/science/article/pii/S1051137718301438,4 November 2019,2019,Research Article
140,140,The effect of asylum seeker reception centers on nearby house prices: Evidence from The Netherlands,https://www.sciencedirect.com/science/article/pii/S1051137718302651,19 October 2019,2019,Research Article
141,141,Do housing allowances increase rents? Evidence from a discrete policy change,https://www.sciencedirect.com/science/article/pii/S1051137718302602,7 October 2019,2019,Research Article
142,142,Welfare effects of floor area ratio regulation on landowners and residents with different levels of income,https://www.sciencedirect.com/science/article/pii/S1051137717302486,4 October 2019,2019,Research Article
143,143,Mortgage characteristics and the racial incidence of default,https://www.sciencedirect.com/science/article/pii/S1051137718303188,19 September 2019,2019,Research Article
144,144,Zoning ordinances and the housing market in developing countries: Evidence from Brazilian municipalities,https://www.sciencedirect.com/science/article/pii/S1051137718302080,16 September 2019,2019,Research Article
145,145,Cross-regional connectedness in the Korean housing market,https://www.sciencedirect.com/science/article/pii/S1051137718300585,14 September 2019,2019,Research Article
146,146,The effect of land lease on house prices,https://www.sciencedirect.com/science/article/pii/S1051137719300853,9 September 2019,2019,Research Article
147,147,The impact of host race and gender on prices on Airbnb,https://www.sciencedirect.com/science/article/pii/S1051137718301815,12 August 2019,2019,Research Article
148,148,The impact of host race and gender on prices on Airbnb,https://www.sciencedirect.com/science/article/pii/S1051137718301815,12 August 2019,2019,Research Article
149,149,Has falling crime invited gentrification?,https://www.sciencedirect.com/science/article/pii/S1051137719300658,16 July 2019,2019,Research Article
150,150,Who benefits from using property taxes to finance a labor tax wedge reduction?,https://www.sciencedirect.com/science/article/pii/S1051137718302845,4 July 2019,2019,Research Article
151,151,Taxation and housing markets with search frictions,https://www.sciencedirect.com/science/article/pii/S1051137718300330,6 May 2019,2019,Research Article
