,Unnamed: 0,Title,Url,Time,Year,Type
152,152,Natural expectations and home equity extraction,https://www.sciencedirect.com/science/article/pii/S1051137718300160,6 May 2019,2019,Research Article
153,153,Do house prices ride the wave of immigration?,https://www.sciencedirect.com/science/article/pii/S1051137718302481,23 April 2019,2019,Research Article
154,154,Are housing characteristics experienced by children associated with their outcomes as young adults?,https://www.sciencedirect.com/science/article/pii/S1051137717301304,23 April 2019,2019,Research Article
155,155,The impact of leasehold status on apartment price,https://www.sciencedirect.com/science/article/pii/S1051137718300639,5 April 2019,2019,Research Article
156,156,The effects of the demolition of the family housing on child schooling in Cameroon,https://www.sciencedirect.com/science/article/pii/S1051137717300244,3 April 2019,2019,Research Article
157,157,Interest-only-mortgages and housing market fluctuations in Denmark,https://www.sciencedirect.com/science/article/pii/S1051137717300529,29 March 2019,2019,Research Article
158,158,Environmental risk and differentiated housing values: Evidence from the north of France,https://www.sciencedirect.com/science/article/pii/S1051137718300883,25 March 2019,2019,Research Article
159,159,Traffic noise in Georgia: Sound levels and inequality,https://www.sciencedirect.com/science/article/pii/S1051137718300366,22 March 2019,2019,Research Article
160,160,Zoned out? The determinants of manufactured housing rents: Evidence from North Carolina,https://www.sciencedirect.com/science/article/pii/S1051137718301554,20 March 2019,2019,Research Article
161,161,"Slums in Brazil: Where are they located, who lives in them, and do they ‘squeeze’ the formal housing market?",https://www.sciencedirect.com/science/article/pii/S1051137718302171,5 March 2019,2019,Research Article
162,162,Loan-to-value ratio restrictions and house prices: Micro evidence from New Zealand,https://www.sciencedirect.com/science/article/pii/S1051137718300901,28 February 2019,2019,Research Article
163,163,Homelessness research: A guide for economists (and friends),https://www.sciencedirect.com/science/article/pii/S1051137718302109,16 January 2019,2019,Research Article
164,164,The effect of housing assistance on student achievement: Evidence from Wisconsin,https://www.sciencedirect.com/science/article/pii/S1051137717303248,12 January 2019,2019,Research Article
165,165,Do market rents reflect user costs?,https://www.sciencedirect.com/science/article/pii/S105113771830007X,11 January 2019,2019,Research Article
166,166,Reverse mortgages and senior property tax relief,https://www.sciencedirect.com/science/article/pii/S1051137718300949,7 December 2018,2018,Research Article
167,167,The perception of homeownership utility: Short-term and long-term effects,https://www.sciencedirect.com/science/article/pii/S1051137716302169,22 November 2018,2018,Research Article
168,168,The impact of housing consumption value on the spatial distribution of welfare,https://www.sciencedirect.com/science/article/pii/S1051137718301293,March 2019,2019,Research Article
169,169,Neighbors and networks: The role of social interactions on the residential choices of housing choice voucher holders,https://www.sciencedirect.com/science/article/pii/S1051137718300779,March 2019,2019,Research Article
170,170,Proximity to a water supply reservoir and dams: Is there spatial heterogeneity in the effects on housing prices?,https://www.sciencedirect.com/science/article/pii/S1051137718300974,March 2019,2019,Research Article
171,171,"The influence of house, seller, and locational factors on the probability of sale",https://www.sciencedirect.com/science/article/pii/S1051137718300640,March 2019,2019,Research Article
172,172,Listing strategies and housing busts: Cutting loss or cutting list price?,https://www.sciencedirect.com/science/article/pii/S1051137718300731,March 2019,2019,Research Article
173,173,The effects of the BP Deepwater Horizon oil spill on housing markets,https://www.sciencedirect.com/science/article/pii/S1051137718300895,March 2019,2019,Research Article
174,174,The deconcentration of minority students attending bad schools: The role of housing affordability within school attendance zones containing good schools,https://www.sciencedirect.com/science/article/pii/S1051137718300718,March 2019,2019,Research Article
175,175,Spatio-temporal effects of an urban development announcement and its cancellation on house prices: A quasi-natural experiment,https://www.sciencedirect.com/science/article/pii/S1051137718300688,March 2019,2019,Research Article
176,176,Understanding real estate price dynamics: The case of housing prices in five major cities of China,https://www.sciencedirect.com/science/article/pii/S1051137718300780,March 2019,2019,Research Article
177,177,Property heterogeneity and convergence club formation among local house prices,https://www.sciencedirect.com/science/article/pii/S1051137718300524,March 2019,2019,Research Article
178,178,Housing price and intergenerational co-residence in urban China,https://www.sciencedirect.com/science/article/pii/S1051137717302723,29 August 2018,2018,Research Article
179,179,Housing appreciation patterns in low-income neighborhoods: Exploring gentrification in Chicago,https://www.sciencedirect.com/science/article/pii/S1051137717301547,25 August 2018,2018,Research Article
180,180,A mixed logit model analysis of residential choices of the young-elderly in the Montreal metropolitan area,https://www.sciencedirect.com/science/article/pii/S1051137717301535,22 August 2018,2018,Research Article
181,181,Function Follows Form,https://www.sciencedirect.com/science/article/pii/S1051137717302759,18 August 2018,2018,Research Article
182,182,Singapore's cooling measures and its housing market,https://www.sciencedirect.com/science/article/pii/S1051137717303029,2 July 2018,2018,Research Article
183,183,Provision of local public goods in mixed income communities,https://www.sciencedirect.com/science/article/pii/S1051137717302541,27 March 2018,2018,Research Article
184,184,Does housing unaffordability crowd out elites in Chinese superstar cities?,https://www.sciencedirect.com/science/article/pii/S1051137717301079,24 March 2018,2018,Research Article
185,185,Housing affordability and inequality:A consumption-adjusted approach,https://www.sciencedirect.com/science/article/pii/S105113771730270X,1 March 2018,2018,Research Article
188,188,Publisher's note,https://www.sciencedirect.com/science/article/pii/S1051137719301718,16 September 2019,2019,Research Article
189,189,Superstar cities and the globalization pressures on affordability,https://www.sciencedirect.com/science/article/pii/S1051137719301469,14 August 2019,2019,Research Article
192,192,Introduction to Special Issue on Spatial Issues Affecting Housing Markets,https://www.sciencedirect.com/science/article/pii/S1051137718303206,March 2019,2019,Research Article
